標題,真實新聞連結,標題_情感極性,標題_主觀性,全文_情感極性,全文_主觀性
Intel Releases Professional Single-Slot A60 GPU - Tom's Hardware,https://www.tomshardware.com/news/intel-arc-a60-pro-single-slot-gpu,0.1,0.1,0.18124825443373832,0.46141571242377677
Fractal Terra Mini-ITX Case Review - PC Perspective,https://pcper.com/2023/06/fractal-terra-mini-itx-case-review/,0.0,0.0,0.19277474673883516,0.4856197087136311
Build high-performance ML models using PyTorch 2.0 on AWS – Part 1 - AWS Blog,https://aws.amazon.com/blogs/machine-learning/part-1-build-high-performance-ml-models-using-pytorch-2-0-on-aws/,0.0,0.0,0.07692949160340465,0.4104772374699908
Intel Reveals Fastest Arc Pro Workstation GPUs Yet - CRN,https://www.crn.com/news/components-peripherals/intel-reveals-fastest-arc-pro-workstation-gpus-yet,0.0,0.0,0.10238455988455987,0.3405574055574056
Linux 6.5 VirtIO GPU DRM Driver Adding Sync Object uAPI For Vulkan - Phoronix,https://www.phoronix.com/news/Linux-6.5-VirtIO-Sync-Objects,0.0,0.0,0.17,0.5050000000000001
"Intel Expands ProViz Offerings with Arc Pro A60, Arc Pro A60M Graphics Cards - AnandTech",https://www.anandtech.com/show/18899/intel-expands-proviz-offerings-with-arc-pro-a60-arc-pro-a60m,0.0,0.0,0.08333333333333333,0.19444444444444445
Intel Announces Intel Arc Pro A60 and Pro A60M GPUs - Techzine Europe,https://www.techzine.eu/news/devices/107051/intel-announces-intel-arc-pro-a60-and-pro-a60m-gpus/,0.0,0.0,0.12791447913788342,0.40543213878320267
Demon-Themed GPU Giveaways - Trend Hunter,https://www.trendhunter.com/trends/diablo-iv-rtx-4080,0.0,0.0,0.18333333333333338,0.5275641025641026
"Intel Launches Arc Pro A60 Graphics Card: ACM-G12 GPU, 12 GB VRAM, All In A 130W Single-Slot Design For $130 - Wccftech",https://wccftech.com/intel-arc-pro-a60-graphics-card-acm-g12-gpu-12-gb-vram-130w-single-slot-130-usd/,0.0,0.0,0.07740460814231305,0.42052819675770514
Android security update fixes Mali GPU bug exploited as zero-day - BleepingComputer,https://www.bleepingcomputer.com/news/security/android-security-update-fixes-mali-gpu-bug-exploited-as-zero-day/,0.0,0.0,0.025581709956709952,0.446393398268398
New Intel Arc Pro A60 12GB 130W Single Width GPU Released - ServeTheHome,https://www.servethehome.com/new-intel-arc-pro-a60-12gb-130w-single-width-gpu-released/,0.032467532467532464,0.3344155844155844,0.09003643578643579,0.4919852092352093
Apple introduces M2 Ultra - Apple Newsroom,https://www.apple.com/nz/newsroom/2023/06/apple-introduces-m2-ultra/,0.0,0.0,0.2524241054304345,0.559471751876815
Asus ROG Zephyrus M16 review: Impressive performance and a gorgeous display - PCWorld,https://www.pcworld.com/article/1934779/asus-rog-zephyrus-m16-review-impressive-performance-and-a-gorgeous-display.html,0.85,0.95,0.25530317727539953,0.5004538105926998
GPD working on compact external GPU dock for laptops and handheld consoles - TechSpot,https://www.techspot.com/news/98959-gpd-working-compact-external-gpu-dock-laptops-handheld.html,0.0,0.1,0.18927510398098632,0.48322793763970234
Intel introduces 2 new GPUs with Dolby Vision support - The Statesman,https://www.thestatesman.com/technology/intel-introduces-2-new-gpus-with-dolby-vision-support-1503188088.html,0.13636363636363635,0.45454545454545453,0.23555958747135217,0.42688629997453525
2023 Father’s Day gift guide: show your appreciation with great tech from ASUS - ASUS Edge Up,https://edgeup.asus.com/2023/2023-fathers-day-gift-guide-show-your-appreciation-with-great-tech-from-asus/,0.8,0.75,0.2949955027533502,0.5609635108289818
ASUS ROG Strix RTX 4090 OC Review: Good Overkill - GameRant,https://gamerant.com/asus-rog-strix-rtx-4090-oc-edition-review/,0.7,0.6000000000000001,0.18585865332924142,0.4735216939922824
NVIDIA RTX 4090 has no trouble running Amnesia: The Bunker at 8K/Max Settings - DSOGaming,https://www.dsogaming.com/articles/nvidia-rtx-4090-has-no-trouble-running-amnesia-the-bunker-at-8k-max-settings/,0.1,0.2,0.09637254901960784,0.4754411764705883
AMD is now bundling Resident Evil 4 Remake with Radeon RX 6000 and 7000 GPUs - KitGuru,https://www.kitguru.net/gaming/joao-silva/amd-is-now-bundling-resident-evil-4-remake-with-radeon-rx-6000-and-7000-gpus/,-1.0,1.0,0.009212662337662334,0.5729707792207793
New 15-inch MacBook Air vs 13-inch MacBook Air M2: Compared - AppleInsider,https://appleinsider.com/inside/macbook-air/vs/new-15-inch-macbook-air-vs-13-inch-macbook-air-m2-compared,0.13636363636363635,0.45454545454545453,0.1325117150890347,0.44922699007750544
Resident Evil 4 Remake is now free with new Radeon GPUs and laptops - PCWorld,https://www.pcworld.com/article/1945633/resident-evil-4-remake-is-now-free-with-new-radeon-gpus-and-laptops.html,-0.15454545454545454,0.7515151515151515,0.08773964131106987,0.4890847247990106
"No GPU required / A library 'GGML' that runs chat AI on a real home PC with 16 GB of memory is under intense development, and a demo that runs voice recognition AI on Raspberry Pi has already appeared - GIGAZINE（ギガジン）",https://gigazine.net/gsc_news/en/20230607-ggml/,0.2,0.65,0.14256759906759905,0.5022167832167831
What is 'solid-state active cooling' that is card-sized but can cool the CPU and GPU more thoroughly and quietly than conventional fans? - GIGAZINE（ギガジン）,https://gigazine.net/gsc_news/en/20230607-solid-state-active-cooling/,0.11476190476190476,0.48809523809523814,0.029509454980166227,0.4393491097465992
"GPU engages reporters, editors on crime, court reporting - The Point",https://thepoint.gm/africa/gambia/national-news/gpu-engages-reporters-editors-on-crime-court-reporting,0.0,0.0,0.06581213924963933,0.3980301527176528
Intel introduces Arc Pro A60 and Pro A60M GPUs - FoneArena,https://www.fonearena.com/blog/395519/intel-arc-pro-a60-pro-a60m-price-features.html,0.0,0.0,0.2450045568466621,0.45710583276372757
Mac Studio M2 Malaysia: Here’s the official pricing - SoyaCincau.com,https://soyacincau.com/2023/06/06/apple-mac-studio-m2-max-m2-ultra-malaysia-launch-pricing/,0.0,0.0,0.112987012987013,0.32190476190476186
The BEST Graphics Cards For 4K - Tech4Gamers,https://tech4gamers.com/best-graphics-cards-for-4k/,1.0,0.3,0.3534046708940778,0.5017267760488104
How to get Resident Evil 4 for free with AMD graphics cards - Dexerto,https://www.dexerto.com/tech/how-to-get-resident-evil-4-for-free-with-amd-graphics-cards-2169302/,-0.3,0.9,-0.11679239200515797,0.5643799699118847
AMD Radeon RX 7800M XT Benchmark Leaks Out: As Fast as the NVIDIA RTX 4070 - Hardware Times,https://hardwaretimes.com/amd-radeon-rx-7800m-xt-benchmark-leaks-out-as-fast-as-the-nvidia-rtx-4070/,0.2,0.6,0.04404761904761904,0.6492063492063491
Intel Announces Arc Pro A60 and A60M WorkStation GPUs - eTeknix,https://www.eteknix.com/intel-announces-arc-pro-a60-and-a60m-workstation-gpus/,0.0,0.0,0.2578947368421053,0.43309716599190295
