標題,真實新聞連結,標題_情感極性,標題_主觀性,全文_情感極性,全文_主觀性
The five best AMD GPUs of all time: Looking back at 20 years of Radeon GPUs - Tom's Hardware,https://www.tomshardware.com/features/best-amd-gpus-of-all-time,0.5,0.15,0.17437376780416558,0.46489666898757886
"Nvidia teases its most powerful GPU ever — no, it's not the newly-announced H200, but the 2024-bound B100 Blackwell AI powerhouse - TechRadar",https://www.techradar.com/pro/nvidia-teases-its-most-powerful-gpu-ever-no-its-not-the-newly-announced-h200-but-the-2024-bound-b100-blackwell-ai-powerhouse,0.4,0.75,0.24432492311280202,0.48741866999442734
How To Choose The Right Graphics Card - TheGamer,https://www.thegamer.com/how-to-choose-the-right-graphics-card/,0.2857142857142857,0.5357142857142857,0.19250829436412265,0.5172599452354055
"NVIDIA GeForce RTX 50 “Blackwell” GPUs Utilize TSMC 3nm Process, DisplayPort 2.1 Support - Wccftech",https://wccftech.com/nvidia-geforce-rtx-50-blackwell-gpus-tsmc-3nm-process-displayport-2-1/,0.0,0.0,0.16391544848066594,0.4596645544471629
Gaming at 540Hz: Asus ROG Swift Pro PG248QP Review - TechSpot,https://www.techspot.com/review/2763-asus-rog-swift-pro-pg248qp/,0.0,0.0,0.17604719609892028,0.4831811298535438
"The US government banned Nvidia's fastest gaming GPU from China — chipmaker pulls RTX 4090 listings due to AI concerns, but leaves RTX 6000 Ada - Tom's Hardware",https://www.tomshardware.com/news/nvidia-removes-rtx4090-listings-in-china-but-rtx6000-remains,-0.125,0.375,0.19382118756593547,0.4583000169764875
SK Hynix and Nvidia reportedly working on a radical GPU redesign that 3D-stacks HBM memory directly on top of the processing cores - Tom's Hardware,https://www.tomshardware.com/news/sk-hynix-plans-to-stack-hbm4-directly-on-logic-processors,0.5,0.5,0.1264555293191657,0.4711547947002492
"Nvidia RTX 5000 graphics cards to offer DisplayPort 2.1 and PCIe 5.0 support, built on TSMC 3nm node - TechSpot",https://www.techspot.com/news/100894-nvidia-geforce-rtx-5000-graphics-cards-expected-feature.html,0.0,0.0,0.165485585016835,0.5003551136363635
Handbrake Adds AV1 Support For NVIDIA RTX 40 “Ada” & AMD RX 7000 “RDNA 3” GPUs - Wccftech,https://wccftech.com/handbrake-adds-av1-support-for-nvidia-rtx-40-ada-amd-rx-7000-rdna-3-gpus/,0.0,0.0,0.09803755641521603,0.4582911178655855
HandBrake AV1 video transcoding gets hardware speed boost on both AMD and Nvidia GPUs - Tom's Hardware,https://www.tomshardware.com/news/handbrake-adds-av1-hardware-transcoding-on-amd-nvidia,0.0,0.0,0.26628691249226966,0.46397649969078525
"Intel Arc GPU performance momentum continues — 2.7X boost in AI-driven Stable Diffusion, largely thanks to Microsoft's Olive - Tom's Hardware",https://www.tomshardware.com/news/intel-arc-gpus-boosted-by-microsoft-olive-in-ai,0.2,0.2,0.2176847041847042,0.5376421356421356
AMD's last-gen Navi 22 GPU is still competitive against Nvidia's latest Ada Lovelace GPU — RX 6750 GRE beats RTX 4060 in a new review - Tom's Hardware,https://www.tomshardware.com/news/amd-last-gen-navi-22-gpu-ada-lovelace-rx-6750-gre-beats-rtx-4060,0.3181818181818182,0.6772727272727272,0.18294011544011546,0.4898818662818661
