標題,真實新聞連結,標題_情感極性,標題_主觀性,全文_情感極性,全文_主觀性
The five worst Nvidia GPUs of all time: Infamous and envious graphics cards - Tom's Hardware,https://www.tomshardware.com/pc-components/gpus/the-five-worst-nvidia-gpus-of-all-time-infamous-and-envious-graphics-cards,-0.75,1.0,0.1068078803179352,0.4882094845029032
The best graphics cards 2024: GPUs for every budget - PCWorld,https://www.pcworld.com/article/416006/the-best-graphics-cards-for-pc-gaming.html,1.0,0.3,0.20363813094227848,0.47409774813000616
"[News] Nvidia vs. AMD, the Expensive Duel as Two Major Buyers Opt for AMD’s Latest AI GPU - TrendForce",https://www.trendforce.com/news/2023/12/18/news-nvidia-vs-amd-the-expensive-duel-as-two-major-buyers-opt-for-amds-latest-ai-gpu/,0.020833333333333332,0.7000000000000001,0.06548795407491058,0.505413608131
GPU Fans Not Spinning? 8 Methods to Fix It! - Beebom,https://beebom.com/fix-gpu-fans-not-spinning/,0.0,0.0,0.151683202925439,0.4592912953161402
Best GPUs for Stable Diffusion - XDA Developers,https://www.xda-developers.com/best-gpus-for-stable-diffusion/,1.0,0.3,0.2776252259872948,0.5262159360435222
Every Nvidia RTX 40 Super series GPU release date may fall in January - PCGamesN,https://www.pcgamesn.com/nvidia/rtx-40-super-series-january-release,0.3333333333333333,0.6666666666666666,0.23185858585858585,0.46052525252525256
AMD Radeon Pro W7700 workstation GPU launches - Develop3D,https://develop3d.com/workstations/amd-radeon-pro-w7700-workstation-gpu-launches/,0.0,0.0,0.11971266233766234,0.4452029220779221
"Non-tech Chinese firms tout orders of Nvidia chips, winning stock boosts - South China Morning Post",https://www.scmp.com/tech/article/3245507/chinese-non-tech-firms-have-also-been-scrambling-buy-nvidia-gpus-landscape-designer-reveals-order,0.25,0.375,0.034663865546218496,0.4090336134453782
5 best graphics cards for Intel Core i7-13700 - Sportskeeda,https://www.sportskeeda.com/gaming-tech/best-graphics-cards-intel-core-i7-13700,1.0,0.3,0.3290322509032185,0.4726647259550488
"Great, now GPUs are cracking - Digital Trends",https://www.digitaltrends.com/computing/nvidia-rtx-4090-cracked-pcb/,0.4,0.375,0.04821388488055155,0.5109439061820014
"Intel Brings Huge Improvements To Xe Kernel GPU Driver For Linux 6.8, Arrow Lake & Lunar Lake Gain Additional Support - Wccftech",https://wccftech.com/intel-huge-improvements-xe-kernel-gpu-driver-linux-6-8-arrow-lake-lunar-lake-support/,0.4000000000000001,0.9,0.0678215723670269,0.4496927315109135
What’s New in Inventor 2024.2 - ENGINEERING.com,https://www.engineering.com/whats-new-in-inventor-2024-2/,0.13636363636363635,0.45454545454545453,0.058560752310752376,0.5308266058266058
How to Check Your GPU Temperature - Beebom,https://beebom.com/how-check-graphics-card-temperature/,0.0,0.0,0.16883080351434782,0.47649990305053586
"Today's heavy GPUs continue to be plagued with cracking around PCIe slots — 19 damaged Nvidia RTX 4090s, most with cracked PCBs, arrive at NorthridgeFix repair - Tom's Hardware",https://www.tomshardware.com/pc-components/gpus/todays-heavy-gpus-continue-to-be-plagued-with-cracking-around-pcie-slots-19-damaged-nvidia-rtx-4090s-most-with-cracked-pcbs-arrive-at-northbridgefix-repair,0.15,0.5,0.08914258612228156,0.47109875178403116
Best thermal paste for GPUs - XDA Developers,https://www.xda-developers.com/best-thermal-paste-for-gpu/,1.0,0.3,0.37217441077441066,0.4941694305694305
"Nvidia's cut-down model of its fastest gaming GPU launches Dec 28 - Sanctions-compliant Nvidia GeForce RTX 4090D is significantly slower than standard version, for impacted countries like China - Tom's Hardware",https://www.tomshardware.com/pc-components/gpus/nvidias-cut-down-model-of-its-fastest-gaming-gpu-launches-dec-28-sanctions-compliant-nvidia-geforce-rtx-4090d-is-significantly-slower-than-standard-version-for-impacted-countries-like-china,0.1875,0.4375,0.1333483817769532,0.5539908266336836
Is an Intel Arc GPU worth your attention in 2023? - XDA Developers,https://www.xda-developers.com/intel-arc-worth-attention/,0.3,0.1,0.24487116800066439,0.4756043995972052
Nvidia Tegra Xavier rides into the sunset as support for ARM- and Volta-based chip is pulled - Tom's Hardware,https://www.tomshardware.com/pc-components/gpus/nvidia-tegra-xavier-rides-into-the-sunset-as-support-for-arm-and-volta-based-chip-is-pulled,0.0,0.0,0.13028138528138528,0.5278912137245471
Are Today's GPUs Too Heavy? Popular Repair Shop Details PCB Cracks In RTX 4090 Cards - Hot Hardware,https://hothardware.com/news/are-todays-gpus-too-heavy-popular-pc-repair-shop-details-pcb-cracks,0.21666666666666665,0.75,0.11557786442774337,0.4962438288104148
KTH Breaks New Ground in Science Using AMD EPYC™ CPUs and AMD Instinct™ GPUs - 3BL Media,https://www.3blmedia.com/news/kth-breaks-new-ground-science-using-amd-epyctm-cpus-and-amd-instinct-gpus,0.13636363636363635,0.45454545454545453,0.277950234047795,0.4049334811529937
Intel set to supercharge XeSS with a DLSS 3 rival that aims to tackle the worst thing about Nvidia’s frame generation - TechRadar,https://www.techradar.com/computing/gpu/intel-set-to-supercharge-xess-with-a-dlss-3-rival-that-aims-to-tackle-the-worst-thing-about-nvidias-frame-generation,-1.0,1.0,0.14349766939695,0.5567449936154971
NVIDIA GeForce RTX 4090 D China-Exclusive GPU Rumored To Launch On 28th December - Wccftech,https://wccftech.com/nvidia-geforce-rtx-4090-d-china-exclusive-gpu-launch-28th-december-rumor/,0.0,0.0,0.1026311014334967,0.49315395183658667
"Lenovo Legion Pro 5 Laptop With Intel Core i9-14900HX CPU, RTX 4070 GPU, 32 GB Memory & 1 TB SSD Listed For $1800 US - Wccftech",https://wccftech.com/lenovo-legion-pro-5-laptop-intel-core-i9-14900hx-cpu-rtx-4070-gpu-listed-1800-usd/,0.0,0.0,0.10878282828282827,0.40693939393939416
NVIDIA GeForce RTX 4090 GPUs Listed As RTX 4090 SUPER By European Retailer - Wccftech,https://wccftech.com/nvidia-geforce-rtx-4090-gpus-listed-as-rtx-4090-super-by-european-retailer/,0.16666666666666666,0.3333333333333333,0.13015177593490856,0.5163495139398752
Best Warzone 3 settings for Nvidia RTX 3080 and RTX 3080 Ti - Sportskeeda,https://www.sportskeeda.com/gaming-tech/best-warzone-3-settings-nvidia-rtx-3080-rtx-3080-ti,1.0,0.3,0.35421312097080027,0.4643079256731136
AMD says its MI300X AI accelerator is faster than Nvidia's H100 - TechSpot,https://www.techspot.com/news/101238-amd-mi300x-ai-accelerator-faster-than-nvidia-h100.html,0.0,0.0,0.15754831973581973,0.531775203962704
How to Enable Performance Overlay on Steam Deck - Beebom,https://beebom.com/how-enable-performance-overlay-fps-counter-steam-deck/,0.0,0.0,0.15558847402597403,0.47667884199134186
"Chinese chip companies are turning to Malaysia for their high-end chip, GPU needs - Firstpost",https://www.firstpost.com/tech/chinese-chip-companies-are-turning-to-malaysia-for-their-high-end-chip-gpu-needs-13517152.html,0.0,0.0,0.10960009935419779,0.46121874482530206
GPU Battle: NVIDIA vs AMD - AIM,https://analyticsindiamag.com/global-tech/gpu-battle-nvidia-vs-amd/,0.0,0.0,0.062337662337662345,0.31493506493506496
GPU Rankings of 2023: Comprehensive Analysis - KillerStartups,https://www.killerstartups.com/gpu-rankings-of-2023-comprehensive-analysis/,0.0,0.0,0.046111111111111124,0.29555555555555557
"Intel Gaudi 3 AI Accelerator Reportedly Built On TSMC 5nm Node, Faster Than NVIDIA H100 - Wccftech",https://wccftech.com/intel-gaudi-3-ai-accelerator-tsmc-5nm-node-faster-than-nvidia-h100/,0.0,0.0,0.11820998636067127,0.45189764573326235
Nvidia GeForce RTX 4070 Super: everything we know - TechRadar,https://www.techradar.com/computing/gpu/nvidia-geforce-rtx-4070-super,0.3333333333333333,0.6666666666666666,0.14906731665581233,0.5077997469590387
"Small Models, Own GPU Infra: Sridhar Vembu Reveals Zoho's AI Strategy - Swarajya",https://swarajyamag.com/news-brief/small-models-own-gpu-infra-sridhar-vembu-reveals-zohos-ai-strategy,0.175,0.7,0.13888163620539612,0.4675152306353352
Former BBC Presenter Essau Williams Excuses Himself from GPU 2023 Awards - Voice Gambia Newspaper,https://www.voicegambia.com/2023/12/18/former-bbc-presenter-essau-williams-excuses-himself-from-gpu-2023-awards/,0.0,0.0,0.10348484848484843,0.3608225108225109
Reuters: Chinese companies looking at Malaysia for GPU chip assembly - SoyaCincau.com,https://www.voicegambia.com/2023/12/18/former-bbc-presenter-essau-williams-excuses-himself-from-gpu-2023-awards/,0.0,0.0,0.08530303030303024,0.3554545454545455
GPU awards excellence in journalism - The Point,https://thepoint.gm/africa/gambia/headlines/gpu-awards-excellence-in-journalism,0.0,0.0,0.016204322638146165,0.37115084670231735
GPU prexy hails Point - The Point,https://thepoint.gm/africa/gambia/headlines/gpu-prexy-hails-point,0.0,0.0,0.14871428571428574,0.4090952380952381
"nubia Red Magic 9 Pro review: Synthetic benchmarks, sustained and gaming performance - GSMArena.com",https://www.gsmarena.com/nubia_red_magic_9_pro-review-2647p5.php,0.25,0.5,0.2175583451366858,0.4856474621129003
NVIDIA Launches China-Exclusive RTX 4090 D GPU Earlier Than Anticipated - EconoTimes,https://econotimes.com/NVIDIA-Launches-China-Exclusive-RTX-4090-D-GPU-Earlier-Than-Anticipated-1668176,0.0,0.5,0.05942760942760941,0.4247895622895623
Adobe After Effects crashing on Windows computer - The Windows Club,https://www.thewindowsclub.com/adobe-after-effects-crashing-on-windows-computer,0.0,0.0,0.10507795344751866,0.4414635485287659
What is Resizable BAR & Should You Enable it? (Guide) - Appuals,https://appuals.com/what-is-resizable-bar/,0.0,0.0,0.1503382034632035,0.47943167943167925
How to Fix “DirectX Error” in Baldur’s Gate 3 - Appuals,https://appuals.com/directx-error-baldurs-gate-3/,0.0,0.0,0.001438588007736944,0.4135423382763807
