標題,真實新聞連結,標題_情感極性,標題_主觀性,全文_情感極性,全文_主觀性
Here's how AI is driving the rise of GPU cloud specialists - Fierce Network,https://www.fierce-network.com/data-center/heres-how-ai-driving-rise-gpu-cloud-specialists,0.0,0.0,0.01487399505256648,0.4332761286332716
Why Does 4K Gaming Require so Much VRAM? - Tom's Hardware,https://www.tomshardware.com/news/why-does-4k-gaming-require-so-much-vram,0.2,0.2,0.07667007965325276,0.5004250162230932
Best NVIDIA 30 Series Graphics Cards 2023 - MUO - MakeUseOf,https://www.makeuseof.com/best-30-series-graphics-cards/,1.0,0.3,0.36909983887562364,0.5391398287810842
AMD Radeon RX 7600 8 GB Graphics Card To Reportedly Cost €349 In France - Wccftech,https://wccftech.com/amd-radeon-rx-7600-8-gb-graphics-card-to-reportedly-cost-349-euros-in-france/,0.0,0.0,0.11381955442931056,0.4587761763981273
PC with Nvidia L4 GPU for industrial edge AI - Electronics Weekly,https://www.electronicsweekly.com/news/products/bus-systems-sbcs/pc-with-nvidia-l4-gpu-for-industrial-edge-ai-2023-05/,0.0,0.0,0.13186813186813182,0.40329670329670336
Cycles is coming to Modo - CG Channel,https://www.cgchannel.com/2023/05/cycles-is-coming-to-modo/,0.0,0.0,0.15923872875092387,0.39739467849223953
Industrial edge solution with NVIDIA L4 GPU for industrial AI applications - Electropages,https://www.electropages.com/2023/05/industrial-edge-solution-nvidia-l4-gpu-industrial-ai-applications,0.0,0.0,0.25022134460731,0.449424655915884
Asus Unveils Two Slimmer GeForce RTX 4090 Video Cards: ROG Strix LC and TUF OG - AnandTech,https://www.anandtech.com/show/18860/asus-unveils-two-new-geforce-rtx-4090-gpus,0.0,0.0,0.08333333333333333,0.19444444444444445
NVIDIA Is Giving Away A Custom Diablo IV GeForce RTX 4080 GPU For Free - Wccftech,https://wccftech.com/nvidia-is-giving-away-a-custom-diablo-iv-geforce-rtx-4080-gpu-for-free/,0.4,0.8,0.08329027603221159,0.5281548200903043
Grab this AsRock RX 6950 XT model for £590 from Overclockers - Eurogamer,https://www.eurogamer.net/digitalfoundry-2023-grab-this-asrock-rx-6950-xt-model-for-590-from-overclockers,0.0,0.0,0.2539957264957265,0.6020634920634921
Nvidia Reportedly Prepping RTX 4060 with 16GB of VRAM - Tom's Hardware,https://www.tomshardware.com/news/nvidia-reportedly-preps-geforce-rtx-4060-16gb-model,0.0,0.0,0.1304635828089436,0.5369723747043333
Asus Formally Unveils ROG Ally Portable Console: Eight Zen 4 Cores and RDNA 3 GPU in Your Hands - AnandTech,https://www.anandtech.com/show/18861/asus-rog-ally-portable-console-eight-zen-4-cores-and-rdna-3-gpu-in-your-hand,0.0,0.0,0.08333333333333333,0.19444444444444445
NVIDIA To End GeForce RTX 3060 Ti Production To Make Room For RTX 4060 Ti GPU - Wccftech,https://wccftech.com/nvidia-end-geforce-rtx-3060-ti-production-to-make-room-for-rtx-4060-ti-gpu/,0.0,0.0,0.07970690511674125,0.4281970761478957
"NVIDIA’s Top GPUs Are In Big Demand For AI, Places Additional Orders At TSMC - Wccftech",https://wccftech.com/nvidias-top-gpus-are-in-big-demand-for-ai-places-additional-orders-at-tsmc/,0.25,0.3,0.13240432731660803,0.4477269773760999
"MSI Bravo gaming laptops: AMD Ryzen 7000, GeForce RTX 40 series GPUs starting at RM4,699 - SoyaCincau.com",https://soyacincau.com/2023/05/12/msi-bravo-gaming-laptops-amd-ryzen-7000-geforce-rtx-40-series-gpus-starting-at-rm4699/,0.0,0.1,0.09415584415584416,0.2849206349206349
"AMD Radeon RX 7600M XT Gaming Performance: As Fast as the RTX 4060, Slower in Ray-Tracing - Hardware Times",https://hardwaretimes.com/amd-radeon-rx-7600m-xt-gaming-performance-as-fast-as-the-rtx-4060-slower-in-ray-tracing/,0.2,0.6,0.042592177937005524,0.48652783997611576
