標題,真實新聞連結,標題_情感極性,標題_主觀性,全文_情感極性,全文_主觀性
The five worst Nvidia GPUs of all time: Infamous and envious graphics cards - Tom's Hardware,https://www.tomshardware.com/pc-components/gpus/the-five-worst-nvidia-gpus-of-all-time-infamous-and-envious-graphics-cards,-0.75,1.0,0.1068078803179352,0.4882094845029032
Which GPU is in the Xbox Series S and how to build an equivalent gaming PC in 2024 - Sportskeeda,https://www.sportskeeda.com/gaming-tech/which-gpu-xbox-series-s-build-equivalent-gaming-pc-2022,0.0,0.0,0.28362784471218194,0.4326681083307593
Best thermal paste for GPUs - XDA Developers,https://www.xda-developers.com/best-thermal-paste-for-gpu/,1.0,0.3,0.3816936096848886,0.4863874291083592
"Intel Brings Huge Improvements To Xe Kernel GPU Driver For Linux 6.8, Arrow Lake & Lunar Lake Gain Additional Support - Wccftech",https://wccftech.com/intel-huge-improvements-xe-kernel-gpu-driver-linux-6-8-arrow-lake-lunar-lake-support/,0.4000000000000001,0.9,0.0678215723670269,0.4496927315109135
PS5 APU-powered mining GPU hits eBay for $500 — a PS5 chip with two less CPU cores and half the memory that consumes around 90W - Yahoo,https://www.yahoo.com/tech/ps5-apu-powered-mining-gpu-170901635.html,-0.16666666666666666,0.11666666666666667,0.15222609368950832,0.45423776765240187
"Today's heavy GPUs continue to be plagued with cracking around PCIe slots — 19 damaged Nvidia RTX 4090s, most with cracked PCBs, arrive at NorthridgeFix repair - Tom's Hardware",https://www.tomshardware.com/pc-components/gpus/todays-heavy-gpus-continue-to-be-plagued-with-cracking-around-pcie-slots-19-damaged-nvidia-rtx-4090s-most-with-cracked-pcbs-arrive-at-northbridgefix-repair,0.15,0.5,0.08914258612228156,0.47109875178403116
Best GPUs for deep learning in 2025 - XDA Developers,https://www.xda-developers.com/best-gpus-for-deep-learning/,0.5,0.35,0.23573719876853386,0.48334845218360295
Here’s how to get the best performance in Adobe Premiere Pro - Digital Trends,https://www.digitaltrends.com/computing/adobe-premiere-pro-performance-guide/,0.5,0.15,0.1433527901680767,0.4395499228301775
5 best graphics cards for Intel Core i7-13700 - Sportskeeda,https://www.sportskeeda.com/gaming-tech/best-graphics-cards-intel-core-i7-13700,1.0,0.3,0.3290322509032185,0.4726647259550488
"Small Models, Own GPU Infra: Sridhar Vembu Reveals Zoho's AI Strategy - Swarajya",https://swarajyamag.com/news-brief/small-models-own-gpu-infra-sridhar-vembu-reveals-zohos-ai-strategy,0.175,0.7,0.13888163620539612,0.4675152306353352
NVIDIA GeForce RTX 4090 GPUs Listed As RTX 4090 SUPER By European Retailer - Wccftech,https://wccftech.com/nvidia-geforce-rtx-4090-gpus-listed-as-rtx-4090-super-by-european-retailer/,0.16666666666666666,0.3333333333333333,0.13015177593490856,0.5163495139398752
