標題,真實新聞連結,標題_情感極性,標題_主觀性,全文_情感極性,全文_主觀性
"From Elon Musk to Chinese tech titans, everyone wants Nvidia's GPU chips. There might not be enough to go around. - Business Insider",https://www.businessinsider.com/elon-musk-tesla-twitter-china-tech-giants-nvidia-gpu-chips-2023-8,0.06666666666666667,0.19999999999999998,0.08886164855552611,0.4235621521335806
AMD Radeon RX 7600 review: a GPU with nothing new - Rock Paper Shotgun,https://www.rockpapershotgun.com/amd-radeon-rx-7600-review,0.13636363636363635,0.45454545454545453,0.12424790069368387,0.4913154348997722
NVIDIA Announces a New NVIDIA H100 144GB HBM3e Model and an Anticipated Business Model Shift - ServeTheHome,https://www.servethehome.com/nvidia-announces-a-new-nvidia-h100-144gb-hbm3e-model-and-an-anticipated-business-model-shift/,0.13636363636363635,0.45454545454545453,0.17872418768970497,0.523143752798925
Starfield Limited Edition GPU and CPU Unveiled by Bethesda and AMD - GameRant,https://gamerant.com/starfield-gpu-cpu-limited-edition-amd/,-0.07142857142857142,0.14285714285714285,0.15079512987012988,0.48225043290043274
Overwatch 2: Invasion Ultimate GeForce RTX 40 Series Bundle Now Available - NVIDIA Daily News Report,https://www.nvidia.com/en-gb/geforce/news/overwatch-2-invasion-ultimate-bundle-geforce-rtx-40-series/,0.13333333333333333,0.4666666666666666,0.10465953446028152,0.4602388299399508
AMD Presented Starfield-Themed Radeon RX 7900 XTX GPU - 80.lv,https://80.lv/articles/amd-presented-starfield-themed-radeon-rx-7900-xtx-gpu/,0.0,0.0,0.15642633228840128,0.513662486938349
"NVIDIA GeForce RTX 50 GPUs Rumored To Feature Blackwell Architecture: GB202, GB203, GB205, GB206 & GB207 SKUs - Wccftech",https://wccftech.com/nvidia-geforce-rtx-50-gpus-feature-blackwell-architecture-gb202-gb203-gb205-gb206-gb207-skus/,0.0,0.0,0.08745883492458839,0.4758083773152265
AMD is giving away 500 limited edition Starfield GPUs and CPUs - PCGamesN,https://www.pcgamesn.com/amd/starfield-limted-edition-gpu-cpu,-0.07142857142857142,0.14285714285714285,0.1609929944607364,0.4629788670111251
Leak Suggests Next-Gen GeForce Blackwell RTX 50 Series May Shake Up Mainstream GPUs - Hot Hardware,https://hothardware.com/news/geforce-blackwell-codenames-leak,0.25,0.8500000000000001,0.06972407373120205,0.39240011742048414
"AMD and Bethesda announce limited-edition Starfield-themed CPU and GPU, but you can't buy them - Club386",https://www.club386.com/amd-and-bethesda-announce-limited-edition-starfield-themed-cpu-and-gpu-but-you-cant-buy-them/,0.0,0.0,0.05620085696616309,0.45950172276702883
Atlas Fallen PC Performance Analysis - DSOGaming,https://www.dsogaming.com/pc-performance-analyses/atlas-fallen-pc-performance-analysis/,0.0,0.0,0.1305427408412483,0.47989371325192215
Apple MacBook Air M2 15-inch laptop review - Space.com,https://www.space.com/macbook-air-m2-15-inch-laptop-review,0.0,0.0,0.27226382320312953,0.4889339530090975
Intel's Arc Alchemist GPUs Have Hidden Security Flaws - Tom's Hardware,https://www.tomshardware.com/news/intel-discloses-hidden-security-flaw-in-latest-arc-alchemist-gpus,-0.16666666666666666,0.3333333333333333,0.13922520132197552,0.5447248987571566
"Initial Benchmarks Of The ""NVK"" Open-Source NVIDIA Vulkan Driver - Phoronix",https://www.phoronix.com/review/nvk-vulkan-performance,0.0,0.0,0.12779478458049884,0.3676643990929706
Bethesda and AMD announce limited edition Starfield GPU and CPU at Quakecon - Rock Paper Shotgun,https://www.rockpapershotgun.com/bethesda-and-amd-announce-limited-edition-starfield-gpu-and-cpu-at-quakecon,-0.07142857142857142,0.14285714285714285,0.07553485162180816,0.43709454796411323
Buy an Nvidia GeForce RTX 40 GPU and get Overwatch 2 Invasion free - PCGamesN,https://www.pcgamesn.com/nvidia/geforce-rtx-40-gpu-overwatch-2-invasion-bundle,0.4,0.8,0.25599993440902535,0.5874180112816476
Apple A17 Bionic’s Predicted GPU Metal Scores Show It Is Faster Than The M1 By 17 Percent - Wccftech,https://wccftech.com/apple-a17-bionic-predicted-scores-faster-than-m1/,0.0,0.0,0.10501316422369061,0.5016358235656481
Inside the hunt for AI chips - The Verge,https://www.theverge.com/2023/8/11/23828874/inside-the-hunt-for-ai-chips-command-line,0.0,0.0,0.11416603839356652,0.3680323110098393
AMD rolls out limited edition Starfield 7800X3D CPUs and 7900 XTX GPUs but you can't buy one - PC Gamer,https://www.pcgamer.com/amd-rolls-out-limited-edition-starfield-7800x3d-cpus-and-7900-xtx-gpus-but-you-cant-buy-one/,-0.07142857142857142,0.14285714285714285,0.16217216481815025,0.47480803867665167
A17 Bionic chip to feature only on iPhone 15 Pro models and will come with more GPU cores - HardwareZone,https://www.hardwarezone.com.sg/tech-news-a17-bionic-more-gpu-cores-only-iphone-15-pro,0.25,0.75,0.14785426132175358,0.5991522924959455
Do I need a GPU for Stable Diffusion? - PC Guide - For The Latest PC Hardware & Tech News,https://www.pcguide.com/apps/gpu-or-stable-diffusion/,0.5,0.9,0.3166320346320346,0.5478290043290045
GPU not showing up in Task Manager in Windows 11 - The Windows Club,https://www.thewindowsclub.com/gpu-not-showing-up-in-task-manager-in-windows,0.0,0.0,0.06847826086956521,0.44384057971014496
