標題,真實新聞連結,標題_情感極性,標題_主觀性,全文_情感極性,全文_主觀性
"We could be witnessing the death of the graphics card in real time right now, and I couldn’t be happier about it - TechRadar",https://www.techradar.com/computing/gpu/were-witnessing-the-death-of-the-graphics-card-in-real-time-right-now-and-i-couldnt-be-happier-about-it,0.24285714285714285,0.41785714285714287,0.12393551314005859,0.5107796047947564
Intel’s Falcon Shores Future Looks Bleak as It Concedes AI Training to GPU Rivals - HPCwire,https://www.hpcwire.com/2024/09/17/intels-falcon-shores-future-looks-bleak-as-it-concedes-ai-training-to-gpu-rivals/,-0.5,0.5625,0.04943680223285487,0.4464413875598087
How Cerebras is breaking the GPU bottleneck on AI inference - VentureBeat,https://venturebeat.com/ai/how-cerebras-is-breaking-the-gpu-bottleneck-on-ai-inference/,0.0,0.0,0.1826712361712362,0.48009371492704817
Challengers Are Coming for Nvidia’s Crown - IEEE Spectrum,https://spectrum.ieee.org/nvidia-ai,0.0,0.0,0.16643197142090957,0.4598334642250572
Lenovo launches GPU-as-a-Service offering - DatacenterDynamics,https://www.datacenterdynamics.com/en/news/lenovo-launches-gpu-as-a-service-offering/,0.0,0.0,0.19184478715728717,0.5164502164502164
Larry Ellison and Elon Musk 'begged' Nvidia’s Jensen Huang for more GPUs over a fancy sushi dinner - Fortune,https://fortune.com/2024/09/16/larry-ellison-elon-musk-begged-nvidias-jensen-huang-more-gpus-fancy-sushi-dinner/,0.5,0.5,0.18878968253968256,0.3628373015873016
"When Building a PC on a Budget, Avoid These 5 GPUs - MUO - MakeUseOf",https://www.makeuseof.com/when-building-a-pc-on-a-budget-avoid-these-gpus/,0.0,0.0,0.2201412681278453,0.47649768203459486
Nvidia is in vogue — just ask the designer behind these viral GPU purses - Business Insider,https://www.businessinsider.com/gpu-purses-nvidia-designer-2024-9,-0.4,0.7,0.130187074829932,0.553202947845805
NVIDIA GeForce RTX 4090 & 4090D To Be Discontinued Next Month In Preparation For Next-Gen RTX 5090 & 5090D GPUs - Wccftech,https://wccftech.com/nvidia-geforce-rtx-4090-4090d-discontinued-next-month-in-preparation-for-next-gen-rtx-5090-5090d-gpus/,0.0,0.0,0.08318787878787887,0.426277056277056
Analyst Says Advanced Micro Devices (AMD) GPUs are ‘Competitive’ With Nvidia’s - Yahoo Finance,https://finance.yahoo.com/news/analyst-says-advanced-micro-devices-162329760.html,0.4,0.6,0.18294243891701523,0.4594009098246388
NVIDIA Ampere GPU XMC graphics card for AI-accelerated video capture and processing introduced by Eizo - Military & Aerospace Electronics,https://www.militaryaerospace.com/computers/article/55139935/eizo-rugged-solutions-graphics-card-xmc-nvidia-ampere-gpu,-0.1,0.1,0.12197267704747129,0.45457132404818545
How to use MSI Afterburner to overclock and monitor your PC - XDA Developers,https://www.xda-developers.com/msi-afterburner-guide/,0.0,0.0,0.20884211239915942,0.4815757285220373
PRODUCT OF THE WEEK: WOLF Advanced Technology’s WOLF-153L HPEC module with NVIDIA Ada RTX5000 GPU - Military Embedded Systems,https://militaryembedded.com/radar-ew/signal-processing/product-of-the-week-wolf-advanced-technologys-wolf-153l-hpec-module-with-nvidia-ada-rtx5000-gpu,0.15000000000000002,0.35,0.110578475787778,0.4130991644014904
"AMD is set to finally join Nvidia with FSR 4, using AI to power frame generation, though no word on upscaling yet - PC Gamer",https://www.pcgamer.com/hardware/graphics-cards/amd-is-set-to-finally-join-nvidia-with-fsr-4-using-ai-to-power-frame-generation-though-no-word-on-upscaling-yet/,0.0,1.0,0.15543290043290048,0.44606119106119113
China seeks a homegrown alternative to Nvidia — these are some of the companies to watch - CNBC,https://www.cnbc.com/2024/09/17/chinese-companies-aiming-to-compete-with-nvidia-on-ai-chips.html,0.0,0.0,0.0592022912544085,0.4594442720989955
AMD Publishes RDNA 3.5 ISA Documentation - Phoronix,https://www.phoronix.com/news/AMD-RDNA-3.5-ISA-Documentation,0.0,0.0,0.14295454545454545,0.4456818181818183
Elon Musk And Oracle's Larry Ellison 'Begged' Jensen Huang For Nvidia GPUs At A Dinner: 'Please Take Our Money' - Yahoo Finance,https://finance.yahoo.com/news/elon-musk-oracles-larry-ellison-145148218.html,0.0,0.0,0.14905303030303033,0.4844205948372615
"AMD Krackan Point 8-Core “CPU & GPU” APUs Reserved For Ryzen AI 7 APUs, Strix 8-Core CPUs Only In “PRO” Flavors With 12 GPU Cores - Wccftech",https://wccftech.com/amd-krackan-point-8-core-cpu-gpu-apus-ryzen-ai-7-apus-strix-8-core-cpus-pro-flavors/,0.0,1.0,0.11394925074925079,0.5446660006660005
"AMD Adrenalin 24.20.11.01 Drivers For Radeon GPUs Now Available: God of War Ragnarok & Frostpunk 2 Support, New HYPR-Tune & Radeon Boost Titles - Wccftech",https://wccftech.com/amd-adrenalin-24-20-11-01-drivers-radeon-gpus-god-of-war-ragnarok-frostpunk-2-support-new-hypr-tune-radeon-boost-titles/,0.2681818181818182,0.42727272727272725,0.12020069391392925,0.5415218360071297
"As Chinese AI and GPU demand heats up, a Hong Kong data centre turns to liquid cooling - South China Morning Post",https://www.scmp.com/tech/tech-trends/article/3278538/chinese-ai-and-gpu-demand-heats-hong-kong-data-centre-turns-liquid-cooling,0.0,0.0,0.07858168147641832,0.3833111187058556
Idea Raised For Reducing The Size Of The AMDGPU Driver With Its Massive Header Files - Phoronix,https://www.phoronix.com/news/AMDGPU-Headers-Repo-Idea,0.0,1.0,0.09926839826839824,0.41283982683982684
Report claims renting slower Nvidia AI GPUs is cheaper in China than in the US — but that's thanks to some rather surprising underhand strategies - TechRadar,https://www.techradar.com/pro/report-claims-that-renting-slower-nvidia-ai-gpus-is-cheaper-in-china-than-in-the-us-but-that-s-thanks-to-some-rather-surprising-underhand-strategy,0.44999999999999996,0.35,0.14730803177405116,0.4174946412810488
Larry Ellison says he and Elon Musk 'begged' Jensen Huang for GPUs over dinner - Business Insider,https://www.businessinsider.com/larry-ellison-elon-musk-jensen-huang-gpus-dinner-oracle-nvidia-2024-9,0.0,0.0,0.24009920634920637,0.3028075396825396
AMD has reportedly already snatched the PS6 contract from Intel - PCGamesN,https://www.pcgamesn.com/amd/playstation-6-chip-contract,0.0,0.0,0.07548305353183399,0.46019366812049733
"AMD Says Its Expanding ROCm To Radeon GPUs & APUs, Opens Design Centers In Serbia That Will Also Work on Next-Gen UDNA Architecture - Wccftech",https://wccftech.com/amd-expanding-rocm-radeon-gpus-apus-design-centers-serbia-next-gen-udna-architecture/,0.0,0.0,0.10805004220098569,0.47127692014484435
Elon Musk And Oracle's Larry Ellison 'Begged' Jensen Huang For Nvidia GPUs At A Dinner: 'Please Take Our Money' - Benzinga,https://www.benzinga.com/markets/equities/24/09/40893386/elon-musk-and-oracles-larry-ellison-begged-jensen-huang-for-nvidia-gpus-at-a-dinner-please-take-,0.0,0.0,0.19310948021885538,0.47641124789562295
AMD fixes frustrating Space Marine 2 crashes with new update - PCGamesN,https://www.pcgamesn.com/warhammer-40k-space-marine-2/amd-driver-crash-update,-0.13181818181818183,0.6772727272727272,0.025701597253321398,0.48984549932825794
Lenovo Begins AI Server Manufacturing and Unveils Infrastructure R&D Lab in India - Lenovo StoryHub,https://news.lenovo.com/pressroom/press-releases/ai-server-manufacturing-infrastructure-rd-lab-india/,0.0,0.0,0.1148816620537932,0.36625789511035406
It’s happening: AMD is going to use AI in FSR 4 to drive much better battery life for PC gaming handhelds - TechRadar,https://www.techradar.com/computing/gpu/its-happening-amd-is-going-to-use-ai-in-fsr-4-to-drive-much-better-battery-life-for-pc-gaming-handhelds,0.5,0.5,0.2010123435123435,0.49718105280605257
(Why) Handheld PC Gamers Can Ignore a Game's Minimum System Requirements - How-To Geek,https://www.howtogeek.com/why-handheld-pc-gamers-can-ignore-a-games-minimum-system-requirements/,-0.4,0.4,0.1531904206904207,0.44315101565101556
ASICs vs. quantum rigs: The future of cryptocurrency mining - Cointelegraph,https://cointelegraph.com/learn/articles/asics-vs-quantum-rigs-evolution-in-mining-hardware,0.0,0.125,0.0938666423534503,0.5187707848856326
Lenovo Begins AI GPU Manufacturing in India and Unveils New R&D Lab - AIM,https://analyticsindiamag.com/ai-news-updates/lenovo-begins-ai-gpu-manufacturing-in-india-and-unveils-new-rd-lab/,0.13636363636363635,0.45454545454545453,0.0896694214876033,0.3685950413223141
Elon Musk & Larry Ellison 'begged' Jensen Huang to allot them NVIDIA GPUs at private dinner - Firstpost,https://www.firstpost.com/tech/elon-musk-larry-ellison-begged-jensen-huang-to-allot-them-nvidia-gpus-at-private-dinner-13816295.html,0.0,0.375,0.0507708628005658,0.5545803866100896
"Final Fantasy XVI and God of War Ragnarok drop for PC this week — AMD has preview drivers, Nvidia shows benchmarks - Tom's Hardware",https://www.tomshardware.com/pc-components/gpu-drivers/final-fantasy-xvi-and-god-of-war-ragnarok-drop-for-pc-this-week-amd-has-preview-drivers-nvidia-shows-benchmarks,0.0,1.0,0.07656957881790094,0.458454027329866
AMD’s new AI frame gen tech could revolutionize the Steam Deck 2 - PCGamesN,https://www.pcgamesn.com/amd/fsr4-frame-generation,0.13636363636363635,0.45454545454545453,0.13636363636363633,0.44265310960226206
I turned my old PC into an AI image generation server - here's how I did it - XDA Developers,https://www.xda-developers.com/turn-pc-into-ai-image-generator/,0.1,0.2,0.17151310546832937,0.5319379832439532
RedMagic Titan 16 Pro gaming laptop review - PC Gamer,https://www.pcgamer.com/hardware/gaming-laptops/redmagic-titan-16-pro-review/,0.0,0.0,0.1279476870029196,0.5477533642068529
Nvidia GPUs could be made 'somewhere else' if China attacks Taiwan: Jensen Huang - Taiwan News,https://www.taiwannews.com.tw/news/5936859,0.0,0.0,0.048412698412698414,0.29285714285714287
"xAI cluster is now the most powerful AI training system in the world — but questions remain over storage capacity, power usage and why it's actually called Colossus - TechRadar",https://www.techradar.com/pro/xai-cluster-is-now-the-most-powerful-ai-training-system-in-the-world-but-questions-remain-over-storage-capacity-power-usage-and-why-it-s-actually-called-colossus,0.26666666666666666,0.5333333333333333,0.20268298059964737,0.46782186948853605
Lenovo launches new Infrastructure R&D lab in Bengaluru - The New Indian Express,https://www.newindianexpress.com/business/2024/Sep/17/lenovo-launches-new-infrastructure-rd-lab-in-bengaluru,0.13636363636363635,0.45454545454545453,0.10166644579909885,0.3459581235091439
Best GPU for Intel i7: top graphics cards for Intel i7 processors - WePC - PC Tech & PC Gaming News,https://www.wepc.com/gpu/guide/best-for-intel-i7/,0.75,0.4,0.25267166494512294,0.49180705561938426
Best GPU for Ryzen 9 5900X & 5950X: our top graphics cards for the 5900X and 5950X - WePC - PC Tech & PC Gaming News,https://www.wepc.com/gpu/guide/best-for-ryzen-9-5900x-5950x/,0.75,0.4,0.2892232978324026,0.534757616681544
"Jensen Huang would be so happy. This $66,000 purse is not made from fine leather, but nVidia GPUs - Luxurylaunches",https://luxurylaunches.com/fashion/nvidia-graphics-card-purse.php,0.6083333333333334,0.75,0.13067129629629629,0.4957175925925927
Best GPU for Ryzen 7 7700X – top graphics cards to pair with the 7700X - WePC - PC Tech & PC Gaming News,https://www.wepc.com/gpu/guide/best-for-ryzen-7-7700x/,0.75,0.4,0.2880727177234528,0.559642367598101
Best GPU for Samsung Odyssey G9 2024: top graphics cards for super ultrawide displays - WePC - PC Tech & PC Gaming News,https://www.wepc.com/gpu/guide/best-gpu-for-samsung-odyssey-g9/,0.611111111111111,0.48888888888888893,0.31628272450174566,0.5279480844437329
Best GPU for CS2 2024: our top graphics cards for Counter Strike 2 - WePC - PC Tech & PC Gaming News,https://www.wepc.com/gpu/guide/best-for-cs2/,0.75,0.4,0.26340089768956954,0.4678455839765893
"PS5 Pro performance estimate makes it look like an ""underclocked 7800 XT"" - PC Guide - For The Latest PC Hardware & Tech News",https://www.pcguide.com/news/ps5-pro-performance-estimate-makes-it-look-like-an-underclocked-7800-xt/,0.5,0.9,0.13586666666666666,0.5532166666666666
PS5 Pro might not perform as well as AMD’s RX 7800 XT and it all comes down to memory - PC Guide - For The Latest PC Hardware & Tech News,https://www.pcguide.com/news/ps5-pro-might-not-perform-as-well-as-amds-rx-7800-xt-and-it-all-comes-down-to-memory/,0.17222222222222222,0.5944444444444444,0.21804343434343437,0.5134540404040403
Best gaming PC build under $300 - WePC - PC Tech & PC Gaming News,https://www.wepc.com/builds/best-gaming-pc-under-300/,1.0,0.3,0.2608032190032192,0.4664750454673528
