標題,真實新聞連結,標題_情感極性,標題_主觀性,全文_情感極性,全文_主觀性
Arm reportedly spooling up major new GPU architecture to take on Nvidia - PC Gamer,https://www.pcgamer.com/hardware/graphics-cards/arm-reportedly-spooling-up-major-new-gpu-architecture-to-take-on-nvidia/,0.09943181818181818,0.4772727272727273,0.15528987053634946,0.4905854317826148
Arm reportedly developing gaming GPU in Israel to compete with Nvidia and Intel - Tom's Hardware,https://www.tomshardware.com/pc-components/gpus/arm-reportedly-developing-gaming-gpu-in-israel-to-compete-with-nvidia-and-intel,0.0,0.0,0.23436501494537212,0.5177411873840445
MinIO DataPOD takes aim at GPU Direct parallel filers - Blocks and Files,https://blocksandfiles.com/2024/08/15/65195/,0.05,0.2,0.07707998732037195,0.40718846858269936
Best GPUs for AMD Ryzen 9 9950X in 2024 - XDA Developers,https://www.xda-developers.com/best-gpus-for-amd-ryzen-9-9950x/,1.0,0.3,0.3402632250591433,0.5248751852833485
ASUS Teases Ultimate Radeon GPU For Warhammer 40000: Space Marine 2 Fans - Hot Hardware,https://hothardware.com/news/asus-teases-ultimate-radeon-gpu-for-warhammer-40000-space-marine-2,0.125,0.925,0.15528643055816965,0.4342718070978946
ASUS and AMD reveal Limited Edition Radeon RX 7000 Space Marine 2 GPU - DLCompare Blog,https://www.dlcompare.com/gaming-news/asus-and-amd-reveal-limited-edition-radeon-rx-7000-space-marine-2-gpu-44749,-0.07142857142857142,0.14285714285714285,0.15619496602468727,0.2808481765912104
NVLink and NVSwitch are Nvidia’s secret weapon in the AI wars - SiliconANGLE News,https://siliconangle.com/2024/08/16/nvlink-nvswitch-nvidias-secret-weapon-ai-wars/,-0.4,0.7,0.15354363479122402,0.48622645729926306
GIGABYTE Introduces New G593 Servers Supporting NVIDIA HGX H200 for Enhanced AI and Scientific Workloads - HPCwire,https://www.hpcwire.com/off-the-wire/gigabyte-introduces-new-g593-servers-supporting-nvidia-hgx-h200-for-enhanced-ai-and-scientific-workloads/,0.19318181818181818,0.3522727272727273,0.20177719443676892,0.43801280280003685
Updated Gafgyt botnet exploits GPU for cryptomining - SC Media,https://www.scworld.com/brief/updated-gafgyt-botnet-exploits-gpu-for-cryptomining,0.0,0.0,0.1375,0.43083333333333335
"Nvidia Blackwell GPU delay is manageable, say sources - DIGITIMES",https://www.digitimes.com/news/a20240814PD217/blackwell-supply-chain-nvidia-gpu-2024.html,0.0,0.0,0.0998295454545454,0.3917929292929289
Prediction: Nvidia Stock Is Going to Soar After Aug. 28 - Yahoo Finance,https://finance.yahoo.com/news/prediction-nvidia-stock-going-soar-090000126.html,0.0,0.0,0.15014399635452266,0.4439037395353184
How to Buy the Right Graphics Card: A GPU Guide for 2024 - Tom's Hardware,"https://www.tomshardware.com/reviews/gpu-buying-guide,5844.html",0.2857142857142857,0.5357142857142857,0.18362667688724685,0.473852095106691
150 NVIDIA RTX A6000 GPUs Power the IMAX on Steroids - YMCinema Magazine,https://ymcinema.com/2024/08/16/150-nvidia-rtx-a6000-gpus-power-the-imax-on-steroids/,0.0,0.0,0.1824145283642491,0.464781897184132
Corsair’s new AIO CPU cooler thinks its an Nvidia GPU - PCGamesN,https://www.pcgamesn.com/corsair/icue-link-titan-rx-rgb,0.13636363636363635,0.45454545454545453,0.21164053426248555,0.45946380178087487
The Only NVIDIA GeForce RTX 4090 SUPER In The World: Teclab Details The Building of The Fastest Custom “Ada” GPU With 26 Gbps G6X Memory - Wccftech,https://wccftech.com/nvidia-geforce-rtx-4090-super-teclab-details-building-fastest-custom-ada-gpu-26-gbps-g6x/,0.16666666666666666,0.8333333333333333,0.17371768834731802,0.5344977107940071
This Stackable Mini PC Lets You Pair Intel’s Core Ultra CPUs With Intel Arc & NVIDIA RTX GPUs In A Compact Form Factor - Wccftech,https://wccftech.com/stackable-mini-pc-lets-you-pair-intel-core-ultra-cpus-arc-nvidia-rtx-gpus-compact-form-factor/,0.0,0.0,0.16743862677406984,0.4544335762690194
Gemelo AI taps Oracle Cloud Infrastructure to power enterprise avatar innovation - Oracle,https://www.oracle.com/customers/1482178940785-gemelo-ai-taps-oracle-cloud-infrastructure-to-power-enterprise-avatar-innovation/,0.0,0.0,0.30744588744588747,0.6711688311688311
"New Geekbench AI benchmark can test the performance of CPUs, GPUs, and NPUs - Ars Technica",https://arstechnica.com/gadgets/2024/08/geekbench-ml-becomes-geekbench-ai-a-cross-platform-performance-test-for-npus-and-more/,0.13636363636363635,0.45454545454545453,0.17283780049737502,0.407635626784563
Long-Term Bull Put Spread Provides Opportunities for NVDA Bulls - TradingView,https://www.tradingview.com/news/barchart:5b1e88cb0094b:0-long-term-bull-put-spread-provides-opportunities-for-nvda-bulls/,0.0,0.0,0.04832093253968253,0.42534264346764344
Innovate faster with GPU-accelerated AI - Tech Monitor,https://www.techmonitor.ai/whitepapers/innovate-faster-with-gpu-accelerated-ai,0.0,0.0,-0.012483434932414526,0.19395706334481852
"Adobe Answers Your Questions on AI, Controversies, and Photography - PetaPixel",https://petapixel.com/2024/08/15/adobe-answers-your-questions-on-ai-controversies-and-photography/,0.0,0.0,0.11322226338782629,0.4389021758227056
Geekbench AI Cross-Platform Benchmark Preview: Measuring AI Throughput - Hot Hardware,https://hothardware.com/news/geekbench-ai-benchmark,0.25,0.8500000000000001,0.15190124132895222,0.44105252177541354
Nvidia details Black Myth: Wukong’s ray-tracing effects and performance on RTX 40 GPUs - KitGuru,https://www.kitguru.net/gaming/matthew-wilson/nvidia-details-black-myth-wukongs-ray-tracing-effects-and-performance-on-rtx-40-gpus/,-0.16666666666666666,0.43333333333333335,0.07991543340380551,0.4913201785294808
Crypto mining 101: How to start mining cryptocurrency - Cointelegraph,https://cointelegraph.com/learn/articles/what-are-the-different-ways-to-mine-cryptocurrency,0.0,0.0,0.13399104703633127,0.48067650624775654
How we test graphics cards at GamesRadar+ - Gamesradar,https://www.gamesradar.com/how-we-test-graphics-cards-at-gamesradar/,0.0,0.0,0.2178533359437882,0.49821763942366953
120 FPS in Wuthering Waves Not Available: How to Fix and Enable - Beebom,https://beebom.com/120-fps-wuthering-waves-not-available-fixes/,-0.2,0.4,0.08285984848484848,0.5183522727272727
Krutrim AI Cloud Free for All Until Diwali 2025! Don't Miss Out - YourStory,https://yourstory.com/2024/08/krutrim-ai-cloud-free-access-diwali-2025,0.5,0.8,0.1453499889940568,0.5070584782449189
"""The world's most powerful CPU"" is AMD's Ryzen 9 9950X, and it's now available to buy alongside its 9900X sibling - Windows Central",https://www.windowscentral.com/hardware/cpu-gpu-components/amd-ryzen-9-9900x-ryzen-9-9950x-launch-announcement,0.30000000000000004,0.5375,0.28238262415091686,0.44434677788336296
Lenovo LOQ 15IAX9I Review: Bargain Basement Budget Gamer Keeps It Casual - CNET,https://www.cnet.com/tech/computing/lenovo-loq-15iax9i-review-bargain-basement-budget-gamer-keeps-it-casual/,-0.5000000000000001,0.8666666666666667,0.4185645354773164,0.39712595710436105
Black Myth: Wukong system requirements and Benchmark Tool — Does your PC have the minimum specs? - Windows Central,https://www.windowscentral.com/gaming/black-myth-wukong-system-requirements-does-your-pc-have-the-minimum-specs,-0.08333333333333333,0.3416666666666667,0.14213715760222312,0.47210016257396176
[News] 3D DRAM with Built-in AI Processing – a New Tech Potentially Replace Existing HBM - TrendForce,https://www.trendforce.com/news/2024/08/16/news-3d-dram-with-built-in-ai-processing-a-new-tech-potentially-replace-existing-hbm/,0.06818181818181818,0.7272727272727273,0.046705266955266986,0.41669480519480534
This Powerful CyberPowerPC Gaming PC Can Handle Up to 4K Gaming for Under $1500 - IGN,https://www.ign.com/articles/cyberpowerpc-gaming-pc-amd-ryzen-7800x3d-cpu-and-rtx-4070-super-gpu-for-under-1500,0.3,1.0,0.2524001623376623,0.5134499458874459
Akash Network (AKT): A Decentralized AI Compute Supercloud - Bybit Learn,https://learn.bybit.com/web3/what-is-akash-network-akt/,0.0,0.0,0.3127906976744187,0.7379844961240309
What Is Render Network (RENDER): The Future of 3D Rendering - Bybit Learn,https://learn.bybit.com/altcoins/what-is-render-network-rndr/,0.0,0.125,0.28673469387755113,0.6450680272108843
Best GPU for Ryzen 9 9950X – our top Nvidia and AMD picks - PC Guide - For The Latest PC Hardware & Tech News,https://www.pcguide.com/gpu/guide/best-for-ryzen-9-9950x/,0.6666666666666666,0.5666666666666668,0.24269212512633567,0.5217708607182293
"ASUS and AMD team up for a Warhammer 40,000: Space Marine 2 promo - UnGeek.ph",https://www.ungeek.ph/2024/08/asus-and-amd-team-up-for-a-warhammer-40000-space-marine-2-promo/,0.0,0.0,0.23713135822510822,0.5814968885281384
Google Chrome Helper Renderer High Memory or CPU Usage - The Windows Club,https://www.thewindowsclub.com/google-chrome-helper-renderer-high-memory-or-cpu-usage,0.16,0.5399999999999999,0.07302259887005651,0.49675141242937837
