標題,真實新聞連結,標題_情感極性,標題_主觀性,全文_情感極性,全文_主觀性
Nvidia suggests some graphics card issues are down to Intel CPUs - PCGamesN,https://www.pcgamesn.com/nvidia/gpu-intel-raptor-lake-issues,-0.15555555555555559,0.2888888888888889,0.093533215755438,0.39657554379776605
AWS Hedges Its Bets With Nvidia GPUs And Homegrown AI Chips - The Next Platform,https://www.nextplatform.com/2024/04/12/aws-hedges-its-bets-with-nvidia-gpus-and-homegrown-ai-chips/,0.0,0.0,0.15378186910629657,0.48430401235744736
"NVIDIA’s AI GPU Shortage Is Finally Over As Supply Steadies, Delivery Times Down To 8-12 Weeks - Wccftech",https://wccftech.com/nvidias-ai-gpu-shortage-finally-over-supply-steadies-delivery-times-down-8-12-weeks/,-0.07777777777777779,0.6444444444444445,0.07177089215132702,0.5211309523809524
Dell shaves months off lead times for GPU-powered AI servers - The Register,https://www.theregister.com/2024/04/11/dell_ai_server_lead_times/,0.0,0.0,0.09996068277713849,0.4256003068661297
"Save $550 on Apple’s 14-inch M2 Pro MacBook Pro with 19-core GPU at $1,949 - 9to5Toys",https://9to5toys.com/2024/04/11/save-550-on-apples-14-inch-m2-pro-macbook-pro-with-19-core-gpu-at-1949/,0.0,0.0,0.2341273849607183,0.4612682379349047
Nvidia's RTX 5080 and 5090 GPUs might arrive later in 2024 — and it's honestly way too soon - TechRadar,https://www.techradar.com/computing/gpu/nvidias-rtx-5080-and-5090-gpus-might-be-here-later-in-2024-and-its-honestly-too-soon,0.3,0.45,0.21079290544166576,0.5218365518778741
Engineer creates CPU from scratch in two weeks — begins work on GPUs - Tom's Hardware,https://www.tomshardware.com/pc-components/cpus/engineer-creates-cpu-from-scratch-in-two-weeks-begins-work-on-gpus,0.0,0.0,0.12230041486291489,0.4822955627705629
Best GPUs for AMD Ryzen 5 8500G in 2024 - XDA Developers,https://www.xda-developers.com/best-gpu-amd-ryzen-5-8500g/,1.0,0.3,0.3083628353755472,0.4602683921539854
The Intel Core Ultra 7 155H Review: Meteor Lake Marks A Fresh Start To Mobile CPUs - AnandTech,https://www.anandtech.com/show/21282/intel-core-ultra-7-115h-review-meteor-lake-makes-makes-fresh-start-to-mobile-cpus/8,0.3,0.5,0.08333333333333333,0.19444444444444445
How Intel's 'AI everywhere' strategy could challenge Nvidia's dominance - Computerworld,https://www.computerworld.com/article/2088930/how-intels-ai-everywhere-strategy-could-challenge-nvidias-dominance.html,0.0,0.0,0.11497879671349057,0.4473007038313161
RTX 4090s continue to melt — GPU repair facility claims it works on 200 flagship Nvidia cards per month - Yahoo,https://www.yahoo.com/tech/rtx-4090s-continue-melt-gpu-185229838.html,0.0,0.0,0.0012723762723762717,0.4544021294021294
Exploring the impact of Generative AI: identifying the winners - Yole Group,https://www.yolegroup.com/press-release/exploring-the-impact-of-generative-ai-identifying-the-winners/,0.0,0.0,0.12559684684684674,0.42822481572481597
AI has a hardware crisis: Here’s how decentralized cloud can fix it - Cointelegraph,https://cointelegraph.com/news/ai-has-a-hardware-crisis-heres-how-decentralized-cloud-can-fix-it,0.0,0.0,0.06857036406216734,0.5897895820026966
"NVIDIA GeForce RTX 4090 RMA in China Becomes a Huge Issue, Full Refunds Offered To Affectees - Wccftech",https://wccftech.com/nvidia-geforce-rtx-4090-rma-china-huge-issue-full-refunds-offered-to-affectees/,0.375,0.7250000000000001,0.04848484848484845,0.4921747463732196
"AMD Strix Point APUs With RDNA 3+ iGPU Should Match RX 6400 With 12 CUs, RTX 3050 With 16 CUs - Wccftech",https://wccftech.com/amd-strix-point-apus-rdna-3-igpu-match-rx-6400-with-12-cus-rtx-3050-with-16-cus/,0.0,0.0,0.19066787668350182,0.4947640091390091
The Intel Core Ultra 7 155H Review: Meteor Lake Marks A Fresh Start To Mobile CPUs - AnandTech,https://www.anandtech.com/show/21282/intel-core-ultra-7-115h-review-meteor-lake-makes-makes-fresh-start-to-mobile-cpus,0.3,0.5,0.08333333333333333,0.19444444444444445
Nvidia advises crash-prone gamers to look to Intel for assistance - TechSpot,https://www.techspot.com/news/102611-nvidia-advises-crash-prone-cpu-owners-look-intel.html,0.0,0.0,0.16955703211517165,0.5192580287929123
Asus Vivobook Pro 15 OLED (N6506) Review: A high-quality all-rounder for a reasonable price - ITPro,https://www.itpro.com/hardware/laptops/asus-vivobook-pro-15-oled-n6506-review-a-high-quality-all-rounder-for-a-reasonable-price,0.2,0.6,0.18003341340231588,0.4705900688065323
PC Repair Shop Shows Melted GeForce RTX 4090 GPUs That Arrive Daily - Hot Hardware,https://hothardware.com/news/pc-repair-shop-shows-melted-geforce-rtx-4090-gpus-that-arrive,0.125,0.42500000000000004,0.1958650341484128,0.49372943133161135
Nvidia rumoured to be sticking to its regular programming with the RTX 5080 and RTX 5090 launching in Q4 this year - PC Gamer,https://www.pcgamer.com/hardware/graphics-cards/nvidia-rumoured-to-be-sticking-to-its-regular-programming-with-the-rtx-5080-and-rtx-5090-launching-in-q4-this-year/,0.0,0.07692307692307693,0.1217893799748638,0.4630519211970822
AMD To Refresh Instinct MI300 Series With MI350 AI Accelerator Using 4nm Node This Year - Wccftech,https://wccftech.com/amd-refresh-instinct-mi300-series-mi350-ai-accelerator-4nm-node-late-2024/,0.0,0.0,0.14517849300458002,0.5115095049877656
Meta's new silicon shows a growing trend for AI hyperscalers - TechTarget,https://www.techtarget.com/searchenterpriseai/news/366580592/Metas-new-silicon-shows-a-growing-trend-for-AI-hyperscalers,0.13636363636363635,0.45454545454545453,0.10713713094665478,0.40032524794429547
MESA RADV Vulkan Driver For AMD Radeon GPUs Gets Vulkan Video H.264 & H.265 Encode Support - Wccftech,https://wccftech.com/mesa-radv-vulkan-driver-amd-radeon-gpus-vulkan-video-h264-h265-encode-support/,0.0,0.0,0.16650386650386662,0.5512413512413511
COD: The Best Gaming PCs You Can Build For MW3 & Warzone - GameRant,https://gamerant.com/cod-best-gaming-pc-mw3-warzone/,1.0,0.3,0.23906731716255528,0.475186513662705
Nvidia RTX 4070 vs AMD RX 7700 XT: Which is the better gaming GPU? - Sportskeeda,https://www.sportskeeda.com/gaming-tech/nvidia-rtx-4070-vs-amd-rx-7700-xt-which-better-gaming-gpu,0.5,0.5,0.3343949044585984,0.44306440198159985
The Best 2-in-1 gaming laptops for 2024 - Digital Trends,https://www.digitaltrends.com/computing/best-2-in-1-gaming-laptops/,0.5,0.15,0.2135456135859362,0.578752773510838
"Nanotronics promises modular, shippable chip fab facilities powered by Nvidia GPUs and AI - Tom's Hardware",https://www.tomshardware.com/tech-industry/manufacturing/nanotronics-promises-modular-shippable-chip-fab-facilities-powered-by-nvidia-gpus-and-ai,0.0,0.0,0.133760900934814,0.45321208984252453
Is RTX 4070 a good 1440p gaming graphics card? - Sportskeeda,https://www.sportskeeda.com/gaming-tech/is-rtx-4070-good-1440p-gaming-graphics-card,0.7,0.6000000000000001,0.3868595387840674,0.5278574423480084
How to fix DaVinci Resolve no OpenCL capable GPU found error - PC Guide - For The Latest PC Hardware & Tech News,https://www.pcguide.com/software/how-to/fix-davinci-resolve-could-not-find-any-opencl-capable-gpus/,0.35,0.65,0.1984183723504112,0.4605821740287758
Nvidia DLSS 3.7 drives a further nail in the coffin of native performance - PC Guide - For The Latest PC Hardware & Tech News,https://www.pcguide.com/gpu/how-dlss-3-7-drives-the-nail-into-native-performance/,0.25,0.7,0.12683452350119018,0.4847368086058561
PC Crashes While Gaming: Why and How to Fix For Good - WindowsReport.com,https://windowsreport.com/games-crash-windows-10/,0.7,0.6000000000000001,0.06629193147278252,0.4964199134199138
