標題,真實新聞連結,標題_情感極性,標題_主觀性,全文_情感極性,全文_主觀性
ZTE’ s GPU Server Solution: Driving Digital Economy - ZTE,https://www.zte.com.cn/global/about/magazine/zte-technologies/2024/3-en/special-topic--intelligent-computing/2.html,0.0,0.0,0.1408355050746356,0.3530453423388209
Hugging Face to make $10M worth of old Nvidia GPUs freely available to AI devs - The Register,https://www.theregister.com/2024/05/17/hugging_face_nvidia_zerogpu/,0.26666666666666666,0.23333333333333336,0.13166043861798576,0.3832302131830433
A match made in heaven for gamers on RTX 30-series GPUs: AMD's frame generation and Nvidia's DLSS together at last - PC Gamer,https://www.pcgamer.com/hardware/a-match-made-in-heaven-for-gamers-on-rtx-30-series-gpus-amds-frame-generation-and-nvidias-dlss-together-at-last/,0.0,0.06666666666666667,0.20568174087816943,0.4831931045145329
Hugging Face is sharing $10 million worth of compute to help beat the big AI companies - The Verge,https://www.theverge.com/2024/5/16/24156755/hugging-face-celement-delangue-free-shared-gpus-ai,0.15,0.1,0.1055887445887446,0.4648495034377387
5 compelling reasons to splurge on a high-end graphics card instead of picking budget options - XDA Developers,https://www.xda-developers.com/reasons-splurge-high-end-graphics-card-instead-budget-options/,0.3,0.6,0.2303322751322751,0.48712627865961194
"MESA RADV Vulkan Driver Gets AMD’s RDNA 4 “GFX12” GPU Support, Fueled By Valve’s Engineers - Wccftech",https://wccftech.com/mesa-radv-vulkan-driver-amd-rdna-4-gfx12-gpu-support-fueled-valves-engineers/,0.0,0.0,0.15973676860773647,0.5085183633570727
Rafay’s PaaS Now Supports GPU Workloads for AI/ML in the Cloud - The New Stack,https://thenewstack.io/rafays-paas-now-supports-gpu-workloads-for-ai-ml-in-the-cloud/,0.13636363636363635,0.45454545454545453,0.13619480042879328,0.33790373611257846
Intel's 1500W TDP for Falcon Shores AI processor confirmed — next-gen AI chip consumes more power than Nvidia's B200 - Tom's Hardware,https://www.tomshardware.com/pc-components/gpus/intels-1500w-tdp-for-falcon-shores-ai-processor-confirmed-consumes-more-power-than-nvidias-b200,0.45,0.75,0.10374253790349683,0.510050233252288
This new Nvidia graphics card could change GPU cooling forever - PCGamesN,https://www.pcgamesn.com/gaming-hardware/palit-hybrid-gpu-cooler,0.13636363636363635,0.45454545454545453,0.07357319551197102,0.48118502812380354
The NVIDIA GeForce RTX 4080 SUPER GPU Is Actually Discounted (Below MSRP) at Dell - IGN,https://www.ign.com/articles/best-gpu-deals-2024-pny-nvidia-geforce-rtx-4080-super-graphics-card,0.16666666666666666,0.3833333333333333,0.14913019079685766,0.5015786520172483
Acer Swift X 14 (2024) review: A fast GPU still can’t outrun rivals - PCWorld,https://www.pcworld.com/article/2330200/acer-swift-x-14-review-2.html,0.2,0.6,0.18174854219163925,0.5239567314940453
"Hugging Face launches ZeroGPU project to expand AI training access, gives away $10 million worth of compute - DatacenterDynamics",https://www.datacenterdynamics.com/en/news/hugging-face-launches-zerogpu-project-to-democratize-ai-gives-away-10-million-worth-of-compute/,0.3,0.1,0.09363737038155644,0.35764874660223495
"Intel’s Next-Gen Falcon Shores GPU To Feature TDP Up To 1500W, No Air-Cooled Variant Planned - Wccftech",https://wccftech.com/intel-falcon-shores-gpu-1500w-tdp-no-air-cooled-variant-planned/,0.0,0.0,0.15953915132486562,0.4738375909804477
Sony's Ghost of Tsushima has actual g-g-g-ghosts when it comes to Intel's Arc GPUs - PC Gamer,https://www.pcgamer.com/hardware/graphics-cards/sonys-ghost-of-tsushima-has-actual-g-g-g-ghosts-when-it-comes-to-intels-arc-gpus/,0.0,0.1,0.14844287731384506,0.5029969239243428
"Intel Battlemage “BMG-G21” GPU With Xe2 Graphics Architecture Spotted, Lunar Lake Xe2-LPG Receives Further Support - Wccftech",https://wccftech.com/intel-battlemage-bmg-g21-gpu-xe2-graphics-architecture-lunar-lake-xe2-lpg-support/,0.0,0.5,0.08667112299465238,0.43306977336389124
"AMD Strix Halo Render Reveals Powerful Ryzen APU Design: 16 Zen 5 Cores, 40 RDNA 3+ GPU Cores, 64 MB L3 Cache - Wccftech",https://wccftech.com/amd-strix-halo-render-powerful-ryzen-apu-design-16-zen-5-cores-40-rdna-3-gpu-cores-64-mb-cache/,0.3,1.0,0.1543837388664976,0.5551848534607154
AI infrastructure startup CoreWeave raises $7.5 billion in debt deal led by Blackstone - CNBC,https://www.cnbc.com/2024/05/17/ai-startup-coreweave-raises-7point5-billion-in-debt-blackstone-leads.html,0.0,0.0,-0.03170527986115717,0.41512019685784696
Ghost of Tsushima just revolutionized gaming on older Nvidia RTX GPUs - PCGamesN,https://www.pcgamesn.com/ghost-of-tsushima/mix-nvidia-dlss-amd-fsr,0.16666666666666666,0.3333333333333333,0.04242424242424243,0.549915824915825
This is the graphics card you need to play Frostpunk 2 - PCGamesN,https://www.pcgamesn.com/frostpunk-2/sapphire-amd-rx-7700-xt,0.0,0.0,0.2630772005772006,0.5562229437229438
"NVIDIA GeForce RTX 4090 GPU Gets Over 80 FPS Natively At 4K In Ghost of Tsushima, Over 200 FPS With DLSS 3 “RTX ON” Enabled - Wccftech",https://wccftech.com/nvidia-geforce-rtx-4090-gpu-80-fps-native-4k-ghost-of-tsushima-over-200-fps-dlss-3-rtx-on/,0.0,0.0,0.09133183070373156,0.474562651306453
"Google Announces Sixth-generation AI Chip, a TPU Called Trillium - HPCwire",https://www.hpcwire.com/2024/05/17/google-announces-sixth-generation-ai-chip-a-tpu-called-trillium/,0.0,0.0,0.14522418058132347,0.4152427334570191
"Govt ready to fund 50% cost of creating 10,000 GPU capacity in India: Meity secy S Krishnan - The Economic Times",https://economictimes.indiatimes.com/tech/technology/govt-ready-to-fund-50-cost-of-creating-10000-gpu-capacity-in-india-meity-secy-s-krishnan/articleshow/110211836.cms?from=mdr,0.2,0.35,-0.005237012987012982,0.5003528138528138
Rumor: AMD RDNA5 Details Leaked - GameRant,https://gamerant.com/amd-rdna5-leaks-rumors/,0.0,0.0,0.17229126237746933,0.48696198437577726
"FOSS Weekly #24.20: Linux Kernel 6.9, SnowflakeOS, Nvidia GPU Handling and More - It's FOSS",https://itsfoss.com/newsletter/foss-weekly-24-20/,0.5,0.5,0.18810207336523127,0.5329216981848562
The Best Mini ITX Cases - IGN,https://www.ign.com/articles/the-best-mini-itx-pc-cases,1.0,0.3,0.20605172676693256,0.4932544331384527
M4 vs. M3: How Does the New Apple Silicon Compare With Its Predecessor - How-To Geek,https://www.howtogeek.com/m4-vs-m3-how-does-the-new-apple-silicon-compare-with-its-predecessor/,0.13636363636363635,0.45454545454545453,0.2423226376797806,0.49260212576539125
"AMD’s new Ryzen CPU should really worry Intel, if this leak is right - PCGamesN",https://www.pcgamesn.com/amd/ryzen-strix-halo-diagram,0.20735930735930733,0.3967532467532468,0.10788004266265136,0.4994149570236525
Sapphire RX 7700 XT GPUs get a grungy Frostpunk 2 makeover - Club386,https://www.club386.com/time-to-dig-for-oil-with-sapphires-rx-7700-xt-frostpunk-2-edition/,0.0,0.0,0.12321543704522431,0.45546651929630666
AMD FreeSync vs. Nvidia G-Sync: Which Adaptive Sync tech is best for gaming? - XDA Developers,https://www.xda-developers.com/freesync-vs-g-sync/,1.0,0.3,0.23234352759862958,0.4963725692297117
XFX Launches Radeon RX 7900 GRE & RX 7800 XT Phoenix Nirvana GPUs In White Colors - Wccftech,https://wccftech.com/xfx-radeon-rx-7900-gre-rx-7800-xt-phoenix-nirvana-gpus-white-colors/,0.0,0.0,0.1682856130224552,0.42352767440486716
"Govt will acquire 10,000 GPUs within 18 months to bolster AI development, computational power: Amitabh Kant - Business Today",https://www.businesstoday.in/technology/news/story/govt-will-acquire-10000-gpus-within-18-months-to-bolster-ai-development-computational-power-amitabh-kant-429776-2024-05-16,0.0,0.0,0.08342048657469221,0.36047322355733585
How to maximize your PC performance without a hardware upgrade - XDA Developers,https://www.xda-developers.com/how-to-maximize-your-pc-performance-without-a-hardware-upgrade/,0.0,0.0,0.20173694618139068,0.44458072791406117
Best Ghost of Tsushima PC graphics settings for Nvidia RTX 3060 and RTX 3060 Ti - Sportskeeda,https://www.sportskeeda.com/gaming-tech/best-ghost-tsushima-pc-graphics-settings-nvidia-rtx-3060-rtx-3060-ti,1.0,0.3,0.3435183894696088,0.4559241192411927
Best Ghost of Tsushima PC graphics settings for Nvidia GTX 1650 and GTX 1650 Super - Sportskeeda,https://www.sportskeeda.com/gaming-tech/best-ghost-tsushima-pc-graphics-settings-nvidia-gtx-1650-gtx-1650-super,0.6666666666666666,0.4833333333333333,0.3188201230546504,0.4669562070213543
"GPU, Int’l IDEA commence training on gender equality - The Point",https://thepoint.gm/africa/gambia/headlines/gpu-intl-idea-commence-training-on-gender-equality,0.0,0.0,0.09592423176167018,0.33840605207600266
"Infinix GT Book with Intel Core i9 and RTX 4060 GPU to launch in India on May 21: Expected specs, price and more | Mint - Mint",https://www.livemint.com/technology/gadgets/infinix-gt-book-to-feature-13th-gen-intel-core-i9-processor-and-nvidia-rtx-4060-gpu-priced-under-rs-65000-11715954436954.html,0.2,0.45,0.13432542170473205,0.42296148678907325
"India to acquire 10,000 GPUs to boost computational power and AI development: Amitabh Kant - CNBCTV18",https://www.cnbctv18.com/technology/india-to-aquire-10000-graphics-processing-units-data-computation-ai-development-amitabh-kant-19412608.htm,0.0,0.0,0.02280586477015048,0.3647675736961451
"Managers, editors trained on preventing sexual harassment - The Point",https://thepoint.gm/africa/gambia/national-news/managers-editors-trained-on-preventing-sexual-harassment,0.5,0.8333333333333334,0.20170000000000005,0.4588999999999995
AMD Radeon RX 7800 XT review – is it worth it? - PC Guide - For The Latest PC Hardware & Tech News,https://www.pcguide.com/gpu/review/amd-radeon-rx-7800-xt/,0.4,0.5,0.15899562590187594,0.530105654761905
Nvidia RTX 4060 Ti review – is it worth it? - PC Guide - For The Latest PC Hardware & Tech News,https://www.pcguide.com/gpu/review/nvidia-rtx-4060-ti/,0.4,0.5,0.2042773109243697,0.5244324229691876
XDefiant PC Requirements and Accessibility Features Outlined - MP1st,https://mp1st.com/news/xdefiant-pc-requirements-and-accessibility-features-outlined,0.0,0.0,-0.01750000000000001,0.41125
