標題,真實新聞連結,標題_情感極性,標題_主觀性,全文_情感極性,全文_主觀性
Beyond ‘Data-Driven’: How Energy-Efficient Computing for AI Is Propelling Innovation and Savings Across Industries - NVIDIA Blog,https://blogs.nvidia.com/blog/energy-efficient-ai-industries/,0.0,0.0,0.15869782358314466,0.41870894396123765
Should I Buy an eGPU? 5 Aspects to Consider - How-To Geek,https://www.howtogeek.com/should-i-buy-an-egpu-5-aspects-to-consider/,0.0,0.0,0.1174384113693324,0.42432895686185157
AMD's RX 7900 XT GPU hits its lowest ever price at $699 and that's right where it ought to be - PC Gamer,https://www.pcgamer.com/amds-rx-7900-xt-gpu-hits-its-lowest-ever-price-at-dollar699-and-thats-right-where-it-ought-to-be/,0.2857142857142857,0.5357142857142857,0.2016059209607597,0.5343866080156402
See Disney’s Moana island data set ray traced on a single AMD GPU - CG Channel,https://www.cgchannel.com/2024/02/see-disneys-moana-island-data-set-ray-traced-on-an-amd-gpu/,-0.07142857142857142,0.21428571428571427,0.1814511575381141,0.47755975908149806
Zephyr teams up with Valkyrie for its first liquid cooled GPU — a silver and black RTX 4080 Super with 280mm AiO - Tom's Hardware,https://www.tomshardware.com/pc-components/gpus/zephyr-teams-up-with-valkyrie-for-its-first-liquid-cooled-gpu-a-silver-and-black-rtx-4080-super-with-280mm-aio,0.13888888888888887,0.4777777777777777,0.1969098883572568,0.4745314992025517
Huawei Pushes For Ascend AI GPU Productions Instead of Smartphone SOCs As It Battles NVIDIA In China - Wccftech,https://wccftech.com/huawei-pushes-ascend-ai-gpu-productions-smartphone-socs-battles-nvidia-in-china/,0.0,0.0,0.15803117884042747,0.45630082826614593
AMD’s MI300X AI Accelerator Is Shipping - CDOTrends,https://www.cdotrends.com/story/3792/amds-mi300x-ai-accelerator-shipping,0.0,0.0,0.18295365940102792,0.29932881446039417
TEKKEN 8 Benchmarks & PC Performance Analysis - DSOGaming,https://www.dsogaming.com/pc-performance-analyses/tekken-8-benchmarks-pc-performance-analysis/,0.0,0.0,0.12754310344827588,0.48545977011494246
Island from Disney's Moana Ray Traced on Single AMD GPU - 80.lv,https://80.lv/articles/island-from-disney-s-moana-ray-traced-on-single-amd-gpu/,-0.07142857142857142,0.21428571428571427,0.24054621848739496,0.517857142857143
Apple M2 Max GPU vs Nvidia V100 (Part 2): Big Models and Energy Efficiency - Towards Data Science,https://towardsdatascience.com/apple-m2-max-gpu-vs-nvidia-v100-part-2-big-models-and-energy-efficiency-3377000472d2/,0.0,0.1,0.1099432068173018,0.4246388524644681
AI's most popular chipmaker Nvidia is trying to use AI to design chips faster - Business Insider,https://www.businessinsider.com/nvidia-uses-ai-to-produce-its-ai-chips-faster-2024-2,0.55,0.7,0.14823570046974305,0.5150207239568941
"HP Spectre x360 with Intel Core Ultra 7 processor, Nvidia RTX 4050 GPU launched in India: All the details - The Times of India",https://timesofindia.indiatimes.com/gadgets-news/hp-spectre-x360-with-intel-core-ultra-7-processor-nvidia-rtx-4050-gpu-launched-in-india/articleshow/107455892.cms,0.0,0.0,0.16529980750302686,0.43192226954802454
The best GPUs if you’re upgrading from a GTX 1650 - Yahoo,https://www.yahoo.com/tech/best-gpus-upgrading-gtx-1650-183814367.html,1.0,0.3,0.09119132703843452,0.4513515295540088
Nvidia GeForce RTX 4070 Ti Super review: “My new go-to mid-range GPU” - Gamesradar,https://www.gamesradar.com/nvidia-geforce-rtx-4070-ti-super-review/,0.23484848484848483,0.5606060606060606,0.19729053976650135,0.5391045866526643
Qumulo CTO discusses the future of data storage - Blocks and Files,https://blocksandfiles.com/2024/02/07/qumulo-cto-interview/,0.0,0.125,0.10840589569160994,0.48777537938252263
"ZEPHYR Unveils Its Limited Edition GeForce RTX 4080 SUPER VALKYRIE GPU: 240mm AIO Cooler, Premium PCB & Design - Wccftech",https://wccftech.com/zephyr-unveils-limited-edition-geforce-rtx-4080-super-valkyrie-gpu-240mm-aio-cooler/,0.13095238095238093,0.40476190476190477,0.17088013896931106,0.5283053464582126
"AMD Radeon RX 7900 XT 20 GB GPU Now Avaialble For $699, $100 US Cheaper Than NVIDIA’s RTX 4070 TI SUPER 16 GB - Wccftech",https://wccftech.com/amd-radeon-rx-7900-xt-20-gb-gpu-avaialble-699-us-cheaper-than-rtx-4070-ti-super/,0.3333333333333333,0.6666666666666666,0.15812829668761874,0.5154354277235631
Best AMD Radeon RX 7900 XT GPUs in 2024 - XDA Developers,https://www.xda-developers.com/best-amd-radeon-rx-7900-xt-gpus/,1.0,0.3,0.3088086795001688,0.47280563998649094
"You Can Pair Intel Arc And NVIDIA GPUs For A 70% Speed Boost, But There's A Catch - Hot Hardware",https://hothardware.com/news/intel-nv-gpus-combine-speed,0.25,0.8500000000000001,0.08851236581057206,0.3833672568089609
Black Market GeForce RTX 4090 GPUs Plucked From Prebuilts Are Going Gangbusters In China - Hot Hardware,https://hothardware.com/news/black-market-geforce-rtx-4090-gpus-plucked-from-prebuilts-are-doing-gangbusters,0.04166666666666667,0.6416666666666667,0.14867099567099548,0.510801524562394
Nvidia GeForce RTX 4080 Super vs. RTX 4080 - XDA Developers,https://www.xda-developers.com/nvidia-geforce-rtx-4080-super-vs-rtx-4080/,0.3333333333333333,0.6666666666666666,0.2824855699855699,0.5325450554173959
"AMD Radeon RX 7900 XT hits $699, its lowest price yet - PCWorld",https://www.pcworld.com/article/2229667/amd-radeon-rx-7900-xt-hits-699-lowest-price-yet.html,0.0,0.0,0.15607915893630178,0.416338899196042
Blackmagic Design DaVinci Resolve 18.6.5 Update - Newsshooter,https://www.newsshooter.com/2024/02/06/blackmagic-design-davinci-resolve-18-6-5-update/,0.0,0.0,0.135009435009435,0.36596958596958606
NVIDIA DGX H100 – The gold standard for AI infrastructure - KTH,https://intra.kth.se/en/eecs/nyheter/resurs-for-larare-nvidia-dgx-h100-1.1314290,0.0,0.0,0.2128787878787879,0.44090909090909086
Free New Elden Ring DLSS 3.5 Mod Improves Performance for NVIDIA RTX GPU Users - Wccftech,https://wccftech.com/free-new-elden-ring-dlss-3-5-mod/,0.24545454545454545,0.5515151515151516,0.09493230174081248,0.47237987780540946
"Your current PC probably doesn’t have an AI processor, but your next one might - Ars Technica",https://arstechnica.com/ai/2024/02/your-current-pc-probably-doesnt-have-an-ai-processor-but-your-next-one-might/,0.0,0.2,0.11469936405777116,0.39967088958239394
Mod to add HDR to non-HDR games on RTX GPUs is built out of hidden settings in Nvidia's latest drivers - PC Gamer,https://www.pcgamer.com/mod-to-add-hdr-to-non-hdr-games-on-rtx-gpus-is-built-out-of-hidden-settings-in-nvidias-latest-drivers/,0.17777777777777778,0.5444444444444444,0.23222309299895508,0.4924690252276457
Xbox One GPU equivalent – what graphics card is in the Xbox One? - Video Gamer,https://www.videogamer.com/tech/xbox-one-gpu-equivalent/,0.0,0.0,0.175084879406308,0.4860870439084727
Best RTX 2060 Graphics Card For 2019 - PC Guide - For The Latest PC Hardware & Tech News,https://www.pcguide.com/gpu/guide/best-rtx-2060/,0.75,0.6,0.2493549818917466,0.47963742956390004
RTX 3050 6GB vs GTX 1650 – which budget GPU is better? - Video Gamer,https://www.videogamer.com/tech/gpu/rtx-3050-6gb-vs-gtx-1650/,0.5,0.5,0.25030979766381223,0.5004712137011406
Baldur’s Gate 3: Should you choose DirectX 11 or Vulkan? - Dexerto,https://www.dexerto.com/tech/baldurs-gate-3-should-you-choose-directx-11-or-vulkan-2236685/,0.0,0.0,0.11135327933715028,0.4542451007773588
Best RTX 4080 gaming laptop in 2025 – our top picks - PC Guide - For The Latest PC Hardware & Tech News,https://www.pcguide.com/laptop/guide/best-rtx-4080-gaming-laptop/,0.6666666666666666,0.5666666666666668,0.3645199765512264,0.5382420183982684
Best RTX 4070 gaming laptop - PC Guide - For The Latest PC Hardware & Tech News,https://www.pcguide.com/gpu/guide/best-rtx-4070-gaming-laptop/,0.75,0.6,0.39158964412211156,0.5560301062573789
"RTX 3050 6GB vs RTX 4060 – a generation of difference, plus more - WePC - PC Tech & PC Gaming News",https://www.wepc.com/gpu/compare/rtx-3050-6gb-vs-rtx-4060/,0.5,0.5,0.03668831168831169,0.41071428571428575
