標題,真實新聞連結,標題_情感極性,標題_主觀性,全文_情感極性,全文_主觀性
Intel CEO sees 'less need for discrete graphics' and now we're really worried about its upcoming Battlemage gaming GPU and the rest of Intel's graphics roadmap - PC Gamer,https://www.pcgamer.com/hardware/graphics-cards/intel-ceo-sees-less-need-for-discrete-graphics-and-now-were-really-worried-about-its-upcoming-battlemage-gaming-gpu-and-the-rest-of-intels-graphics-roadmap/,0.016666666666666677,0.13333333333333333,0.13285987649341696,0.4686745001030717
New Nvidia GeForce RTX 5090 gaming GPU could be coming sooner than expected - PCGamesN,https://www.pcgamesn.com/nvidia/geforce-rtx-5000-soon,0.018181818181818174,0.42727272727272725,0.1562573789846517,0.44759452668543576
NVIDIA GeForce RTX 50 “Blackwell” Gaming GPUs Reportedly Launching “Soon” - Wccftech,https://wccftech.com/nvidia-geforce-rtx-50-blackwell-gaming-gpus-reportedly-launching-soon/,0.0,0.0,0.04536013631758305,0.4259471615854592
"AMD Launches New CPUs, GPUs And More Across Datacenter, AI And PC - Forbes",https://www.forbes.com/sites/patrickmoorhead/2024/11/06/amd-launches-new-cpus-gpus-and-more-across-datacenter-ai-and-pc/,0.3181818181818182,0.4772727272727273,0.2060417803485031,0.46303374380055046
Stop buying these 10 popular GPUs for gaming - XDA Developers,https://www.xda-developers.com/dont-buy-these-gpus-for-gaming/,0.6,0.9,0.14167890378283943,0.48283378127169674
Nvidia GeForce RTX 50-series reportedly launching 'soon' — but all indicators continue to point to a January 2025 reveal - Tom's Hardware,https://www.tomshardware.com/pc-components/gpus/nvidia-geforce-rtx-50-series-reportedly-launching-soon-but-all-indicators-continue-to-point-to-a-january-2025-reveal,0.0,0.0,0.14286876703543366,0.5077988883544438
Rackspace Expands Spot Platform with On-Demand NVIDIA GPU-as-a-Service for AI Workloads - HPCwire,https://www.hpcwire.com/off-the-wire/rackspace-expands-spot-platform-with-on-demand-nvidia-gpu-as-a-service-for-ai-workloads/,0.0,0.0,0.1379662004662005,0.4955710955710955
Two-Phase Liquid Cooling - The Future of High-End GPUs - IDTechEx,https://www.idtechex.com/en/research-article/two-phase-liquid-cooling-the-future-of-high-end-gpus/31999,0.0,0.125,0.05098057292501737,0.427014657153546
Nvidia’s RTX 5000 series announcement could be closer than you think as reliable leaker suggests reveal is coming soon - TechRadar,https://www.techradar.com/computing/gpu/nvidias-rtx-5000-series-announcement-could-be-closer-than-you-think-as-reliable-leaker-suggests-reveal-is-coming-soon,0.0,0.0,0.12870806277056276,0.46580018939393925
"Over $10,000 of equipment stolen from Friend Center lab - The Daily Princetonian",https://www.dailyprincetonian.com/article/2024/11/princeton-news-broadfocus-equipment-stolen-friend-center-computer-science-gpus-lab-heist,-0.05,0.05,0.02088514109347443,0.4611122134038799
SKT to open Nvidia GPU-based AI data center - The Korea Herald,https://www.koreaherald.com/article/3848423,-0.05,0.3,0.06741397021058038,0.4817000513610681
Open-Source PowerVR Driver Being Extended For The Imagination BXS-4-64 MC1 GPU - Phoronix,https://www.phoronix.com/news/PVR-Imagination-BXS-4-64-MC1,0.0,0.0,0.1748803827751196,0.4241626794258374
Rackspace Technology launches GPU as a Service offering - DatacenterDynamics,https://www.datacenterdynamics.com/en/news/rackspace-technology-launches-gpu-as-a-service-offering/,0.0,0.0,0.07477886977886974,0.3953890253890254
Early PlayStation 5 Pro shipments reveal some big upgrades over the original but that AMD GPU isn't quite what I was expecting - PC Gamer,https://www.pcgamer.com/hardware/early-playstation-5-pro-shipments-reveal-some-big-upgrades-over-the-original-but-that-amd-gpu-isnt-quite-what-i-was-expecting/,0.15833333333333333,0.3833333333333333,0.15352674327534668,0.4259419305089697
Best GPUs for AMD Ryzen 7 9800X3D in 2024 - XDA Developers,https://www.xda-developers.com/best-gpus-for-amd-ryzen-7-9800x3d/,1.0,0.3,0.35156416968916965,0.5073219891969891
"xAI’s Colossus supercomputer cluster uses 100,000 Nvidia Hopper GPUs — and it was all made possible using Nvidia’s Spectrum-X Ethernet networking platform - TechRadar",https://www.techradar.com/pro/xais-colossus-supercomputer-cluster-uses-100-000-nvidia-hopper-gpus-and-it-was-all-made-possible-using-nvidias-spectrum-x-ethernet-networking-platform,0.0,1.0,0.16085897376219957,0.5442497168303618
eGPUs: Are external graphics cards worth the investment for laptop users? - XDA Developers,https://www.xda-developers.com/egpus-are-external-graphics-cards-worth-the-investment-for-laptop-users/,0.15,0.1,0.16532838585233797,0.44000649051547264
AMD ROCm 6.2.4 Released With Radeon PRO V710 Support & Documentation Updates - Phoronix,https://www.phoronix.com/news/AMD-ROCm-6.2.4-Released,0.0,0.0,0.05852272727272727,0.4042424242424243
Leaked PS5 Pro Manual Confirms 16.7 TFLOPS GPU and 16GB VRAM - Yahoo,https://www.yahoo.com/tech/leaked-ps5-pro-manual-confirms-212212902.html,0.0,0.0,0.18319079685746356,0.4304960718294052
Nvidia tells users to urgently update their GPU drivers to fix eight ‘highly severe’ vulnerabilities - Video Games Chronicle,https://www.videogameschronicle.com/news/nvidia-tells-users-to-urgently-update-their-gpu-drivers-to-fix-eight-highly-severe-vulnerabilities/,0.16,0.5399999999999999,0.02740786240786241,0.33159169659169657
"M4 Ultra GPU Is Estimated To Beat The RTX 4090 Across OpenGL And Vulkan APIs, But Its Advantage Could Only Be Witnessed In One Benchmark - Wccftech",https://wccftech.com/m4-ultra-performance-against-rtx-4090/,0.0,1.0,0.067478376580173,0.5257732154738141
"These 2 Stocks Are Nvidia's Most Serious Competitors, But Are They Even Close? - The Motley Fool",https://www.fool.com/investing/2024/11/06/these-2-stocks-are-nvidias-most-serious-competitor/,0.25555555555555554,0.6888888888888888,0.28240852162805097,0.5132374812168118
"Nvidia is now the world’s most valuable company, thanks to AI and RTX GPUs - PCGamesN",https://www.pcgamesn.com/nvidia/most-valuable-company,0.35,0.35,0.12465851698806246,0.3526916896235078
Bit Digital finalises GPU supply contract with cloud gaming company Boosteroid | NASDAQ:BTBT - Proactive Investors USA,https://www.proactiveinvestors.com/companies/news/1059900/bit-digital-finalises-gpu-supply-contract-with-cloud-gaming-company-boosteroid-1059900.html,0.0,0.0,0.09841764418377322,0.37810361681329424
AMD Ryzen 7 9800X3D Review: Devastating Gaming Performance - Tom's Hardware,https://www.tomshardware.com/pc-components/cpus/amd-ryzen-7-9800x3d-review-devastating-gaming-performance/2,-1.0,1.0,0.10401190323330153,0.4801025922053466
Chinese AI chip start-up Biren teams with compute start-up for performance gains - South China Morning Post,https://www.scmp.com/tech/tech-war/article/3285451/chinese-ai-chip-start-biren-sees-performance-boost-teaming-tencent-backed-firm,0.0,0.0,0.1349624060150376,0.37211779448621557
"Huawei’s Kirin 9100 Said To Be Mass Produced On An Improved Lithography, But Will Not Be 5nm; CPU Cluster Reveals One Cortex-X1, But Same Kirin 9000S GPU - Wccftech",https://wccftech.com/huawei-kirin-9100-improved-lithography-and-cpu-cores-but-same-gpu/,0.0,0.125,0.16597673160173168,0.4954163137587049
BullSequana eXascale Interconnect V3: Intelligent Network Management Accelerates GPU Performance in AI-HPC - insideHPC,https://insidehpc.com/2024/11/bullsequana-exascale-interconnect-v3-intelligent-network-management-accelerates-gpu-performance-in-ai-hpc/,0.8,0.9,0.10678366678366669,0.43799580816822264
"Nvidia is making a new PC CPU to take on Intel, AMD, and Apple, says report - PCGamesN",https://www.pcgamesn.com/nvidia/pc-arm-cpu-rumor,0.13636363636363635,0.45454545454545453,0.10145402437069106,0.4920123857623856
"Here's what Nvidia, Intel, and AMD need to focus on in 2025 - XDA Developers",https://www.xda-developers.com/intel-amd-nvidia-focus-in-2025/,0.0,0.0,0.15605964562133398,0.5078996364385974
Mesa 24.3 Delivers Big Performance Win For Aging AMD Navi 10 GPUs - Phoronix,https://www.phoronix.com/news/Mesa-24.3-NGG-Culling-RDNA1,0.4,0.25,0.09321428571428572,0.4428571428571428
Urgent security warning: NVIDIA urges GeForce users to update drivers - Eight critical vulnerabilities discovered - igorslab.de,https://www.igorslab.de/en/urgent-security-warning-nvidia-urges-geforce-users-to-update-drivers-eight-critical-vulnerabilities-discovered/,0.0,0.8,0.11463085399449036,0.5362045227499773
AMD gives Intel a run for its money in the datacenter landscape - Windows Central,https://www.windowscentral.com/hardware/cpu-gpu-components/amd-breaks-intels-long-running-reign-in-the-data-center-landscape-with-usd3-549-billion-in-revenue-but-nvidia-continues-to-top-the-charts-with-ai-chips,0.0,0.25,0.20023015873015876,0.39893650793650787
This MSI Nvidia GeForce RTX 4070 Ti Super graphics card deal is incredible - PCGamesN,https://www.pcgamesn.com/msi/nvidia-geforce-rtx-4070-ti-super-expert-deal,0.6166666666666667,0.7833333333333333,0.20285493827160497,0.5845789241622574
This Acer gaming laptop with RTX 4060 is a bargain at this price - PCWorld,https://www.pcworld.com/article/2510835/this-acer-gaming-laptop-with-rtx-4060-is-a-bargain-at-this-price.html,0.0,0.0,0.34325611325611327,0.5314543114543114
Supercomputer No. 6 Project Budget Boosted by 53% Amid Rising GPU Prices - BusinessKorea,https://www.businesskorea.co.kr/news/articleView.html?idxno=228634,0.0,0.0,0.2245834973107701,0.46118982028072936
"For the first time ever, AMD outsells Intel in the datacenter space - Tom's Hardware",https://www.tomshardware.com/pc-components/cpus/for-the-first-time-ever-amd-outsells-intel-in-the-datacenter-space,0.25,0.3333333333333333,0.11082545454545456,0.5445826262626263
Nvidia chips are so valuable some tech companies are using them as collateral to raise billions in loans - India Today,https://www.indiatoday.in/technology/features/story/nvidia-chips-are-so-valuable-some-tech-companies-are-using-them-as-collateral-to-raise-billions-in-loans-2628448-2024-11-05,0.0,0.0,0.15799212361712356,0.4315746753246754
"Graphics card discounts are a bit pants ahead of Black Friday, but I'd pick up this RX 7900 XT - Gamesradar",https://www.gamesradar.com/hardware/desktop-pc/graphics-card-discounts-are-a-bit-pants-ahead-of-black-friday-but-id-pick-up-this-rx-7900-xt/,-0.16666666666666666,0.43333333333333335,0.16277648417799942,0.49340072805981905
"PS5 Pro specs: how powerful the new PlayStation 5 console is, and how it compares to the PS5 - TechRadar",https://www.techradar.com/gaming/ps5-pro-specs,0.21818181818181817,0.7272727272727273,0.17654482070369923,0.48147132203206994
"PS5 Pro Boost Mode Takes Full Advantage Of GPU, Improves Resolution & Performance On Unpatched PS5 Games Up To Their Cap - PlayStation Universe",https://www.psu.com/news/ps5-pro-boost-mode-takes-full-advantage-of-gpu-improves-resolution-performance-on-unpatched-ps5-games-up-to-their-cap/,0.35,0.55,0.12568526170798897,0.43026400367309453
PS5 Pro vs Xbox Series X: Which Console Should You Get? - Beebom,https://beebom.com/ps5-pro-vs-xbox-series-x/,0.0,0.0,0.07573094894523465,0.49582145147621326
Generation gaps: How much faster Apple Silicon gets with each release - AppleInsider,https://appleinsider.com/articles/24/11/06/generation-gaps-how-much-faster-apple-silicon-gets-with-each-release,0.2,0.2,0.1665134011287857,0.4960906614752767
Wall Street’s $11 billion bet on AI firms fuelled by NVIDIA chips sparks global ambitions - Business Today,https://www.businesstoday.in/technology/news/story/wall-streets-11-billion-bet-on-ai-firms-fuelled-by-nvidia-chips-sparks-global-ambitions-452592-2024-11-05,0.0,0.0,0.1464790356702121,0.4735472615619676
Achieve 60 FPS Mobile Animations with CSS3 - SitePoint,https://www.sitepoint.com/achieve-60-fps-mobile-animations-with-css3/,0.0,0.0,0.08569707138499084,0.4349928092042186
"AMD to add 3D V-Cache to GPUs and Threadripper, — insider - ITC",https://itc.ua/en/news/amd-to-add-3d-v-cache-to-gpus-and-threadripper-insider/,0.0,0.0,0.12919480519480517,0.43779220779220784
"PS5 Pro Expected to Launch with 16.7 TFLOPS RDNA GPU: Check Out Specs, Price, and More - Techlusive",https://www.techlusive.in/gaming/ps5-pro-is-expected-to-launch-with-16-7-tflops-rdna-gpu-check-out-specs-price-and-more-1530552/,0.2,0.45,0.34895104895104895,0.5522727272727272
"GPU, stakeholders meet Barrow on concerns over press freedom - The Point",https://thepoint.gm/africa/gambia/headlines/gpu-stakeholders-meet-barrow-on-concerns-over-press-freedom,0.0,0.0,0.1252025459920197,0.4374313113786795
IFP and ANC top brass to meet to ease GPU tensions in KZN - The Witness | Your compass in the community,https://witness.co.za/news/kzn/2024/11/06/ifp-and-anc-top-brass-to-meet-to-ease-gpu-tensions-in-kzn/,0.5,0.5,0.18770833333333334,0.4359523809523808
"DA self-serving and IFP divisive but GPU is stable, says KZN ANC - SowetanLIVE",https://www.sowetanlive.co.za/news/2024-11-05-da-self-serving-and-ifp-divisive-but-gpu-is-stable-says-kzn-anc/,0.0,0.0,0.06693435141302449,0.39513779182025627
PS5 Pro Losing To Radeon RX 6800 – 4-Year-Old GPU In New Benchmarks - Tech4Gamers,https://tech4gamers.com/ps5-pro-underperforms-rx-6800/,0.13636363636363635,0.45454545454545453,0.08018314093314094,0.48511495911495917
