標題,真實新聞連結,標題_情感極性,標題_主觀性,全文_情感極性,全文_主觀性
AMD’s mid-range RDNA 4 GPUs are shaping up to be Nvidia RTX 4080 and 4060 Ti killers – but they may not arrive until 2025 - TechRadar,https://www.techradar.com/computing/gpu/amds-mid-range-rdna-4-gpus-are-shaping-up-to-be-nvidia-rtx-4080-and-4060-ti-killers-but-they-may-not-arrive-until-2025,0.0,0.0,0.16717854217854222,0.449742234117234
NVIDIA RTX 2000 Ada GPU To Aim Entry-Level Workstations With Small Form Factor Designs - Wccftech,https://wccftech.com/nvidia-rtx-2000-ada-gpu-entry-level-workstations-small-form-factor-designs/,-0.25,0.4,0.04710055999046815,0.49203622066007374
Sapphire Pulse Radeon RX 7900 XT 20GB GPU drops down to $699 - Tom's Hardware,https://www.tomshardware.com/pc-components/gpus/sapphire-pulse-radeon-rx-7900-xt-20gb-gpu-drops-down-to-dollar699,-0.15555555555555559,0.2888888888888889,0.20431405895691612,0.5456528722600149
Best GPUs for video editing in 2025 - XDA Developers,https://www.xda-developers.com/best-gpus-video-editing/,1.0,0.3,0.2985771263674947,0.5204735734834889
Nvidia CEO elected to National Academy of Engineering for work on AI and high-powered GPUs - DatacenterDynamics,https://www.datacenterdynamics.com/en/news/nvidia-ceo-elected-to-national-academy-of-engineering-for-work-on-ai-and-high-powered-gpus/,0.0,0.0,0.07122434017595307,0.4503176930596286
Forget about AI GPU scarcity: data center operators may have to wait a whopping three years to get key component — and this may be killing off competition by driving smaller operators out - TechRadar,https://www.techradar.com/pro/forget-about-ai-gpu-scarcity-data-center-operators-may-have-to-wait-a-whopping-three-years-to-get-key-component-and-this-may-be-killing-off-competition-by-driving-smaller-operators-out,-0.03333333333333333,0.5333333333333333,0.12759500823660117,0.4535369497758876
This AI Workstation PC Comes Equipped With An NVIDIA GPU & A NVIDIA CPU: Grace Hopper Superchip Starts At $41K - Wccftech,https://wccftech.com/ai-workstation-pc-e-nvidia-gpu-nvidia-cpu-grace-hopper-superchip-starts-41k-usd/,0.0,0.0,0.15349195075757585,0.5297635957792208
Nvidia DSR and DLDSR tech can work on some DSC monitors - Tom's Hardware,https://www.tomshardware.com/pc-components/gpus/nvidia-dsr-and-dldsr-tech-can-work-on-some-dsc-monitors,0.0,0.0,0.09928999571856716,0.4645965145965144
'Instincts are massively cheaper than Nvidia's H100': AMD is selling flagship AI GPUs at a huge discount to Microsoft — but I'm not sure that will be enough to bother Nvidia - TechRadar,https://www.techradar.com/pro/instincts-are-massively-cheaper-than-nvidias-h100-amds-selling-flagship-ai-gpus-at-a-huge-discount-to-microsoft-but-im-not-sure-that-will-be-enough-to-bother-nvidia,0.03750000000000002,0.8222222222222222,0.1787674825174825,0.5657206682206681
Gigabyte Revises PCB Design Of GeForce RTX 4090 & RTX 4080 GPUs To Tackle Cracking Issues - Wccftech,https://wccftech.com/gigabyte-revises-pcb-design-geforce-rtx-4090-rtx-4080-gpus-to-tackle-cracking-issues/,0.0,0.0,0.12665339526653407,0.4734177015198912
First crack in Nvidia AI wall? Meta set to use own AI chips in its servers in 2024 — but it will still use Nvidia H100 GPUs as well in its datacenters for now - TechRadar,https://www.techradar.com/pro/first-crack-in-nvidia-ai-wall-meta-set-to-use-its-own-ai-chips-in-its-servers-in-2024-but-it-will-still-use-nvidia-h100-gpus-as-well-in-its-datacenters-for-now,0.425,0.6666666666666666,0.21959790209790214,0.5602899184149185
"Sycom Unveils Custom GeForce RTX 4080 SUPER GPU With Hybrid AIO Cooling, Equipped With Dual Noctua Fans - Wccftech",https://wccftech.com/sycom-unveils-custom-geforce-rtx-4080-super-gpu-hybrid-aio-cooling-dual-noctua-fans/,0.3333333333333333,0.6666666666666666,0.12331315301240126,0.5465075025225399
Nvidia RTX 4080 Super vs AMD RX 7900 XTX: we pitch the new Ada high-end against the RDNA 3 flagship - TechRadar,https://www.techradar.com/computing/gpu/rtx-4080-super-vs-rx-7900-xtx,0.23484848484848483,0.5606060606060606,0.2782601727677486,0.47938043718346773
Nvidia RTX 4080 Super vs RTX 4080: does the Ada refresh do enough? - TechRadar,https://www.techradar.com/computing/gpu/rtx-4080-super-vs-rtx-4080,0.16666666666666666,0.5833333333333333,0.19068500672504574,0.43968699919871806
Nvidia GeForce RTX 4070 Super vs AMD Radeon RX 7800 XT: Which midrange GPU should you buy? - XDA Developers,https://www.xda-developers.com/rtx-4070-super-vs-rx-7800-xt/,0.3333333333333333,0.6666666666666666,0.2988792780217198,0.5544158038344084
Pure Charity Performance of Activity without Consideration is not Envisioned u/s 2(15) of Income Tax Act as GPU object: ITAT [Read Order] - taxscan.in,https://www.taxscan.in/pure-charity-performance-of-activity-without-consideration-is-not-envisioned-u-s-215-of-income-tax-act-as-gpu-object-itat-read-order/373711/,0.21428571428571427,0.5,0.15192972350230424,0.36008064516129024
How to Turn Windows 11 Hardware Accelerated GPU Scheduling On or Off - WinBuzzer,https://winbuzzer.com/2024/02/10/how-to-turn-windows-11-hardware-accelerated-gpu-scheduling-on-or-off-xcxwbt/,0.0,0.0,0.15195753048694222,0.499717482952777
