標題,真實新聞連結,標題_情感極性,標題_主觀性,全文_情感極性,全文_主觀性
The Best GPU Upgrades For AMD's Zen 5-Based Ryzen 9000 Series CPUs - GameRant,https://gamerant.com/best-gpu-upgrade-for-amd-zen-5-ryzen-9000-cpu/,1.0,0.3,0.28671464013569287,0.4846212500949347
When Are Next-Gen GPUs Launching? Should You Buy Now or Wait? - TechSpot,https://www.techspot.com/article/2855-gpu-pricing-update/,0.0,0.0,0.10501182164785101,0.4308673570438277
How to Overclock Your NVIDIA GPU Without Voiding Its Warranty - How-To Geek,https://www.howtogeek.com/how-to-overclock-your-nvidia-gpu-without-voiding-its-warranty/,0.0,0.0,0.14247562202107655,0.42625752474237316
"AMD Adds More RDNA 4 “Radeon RX 8000” GPU Patches On Linux, Enabling DCC For Faster & Efficient Performance - Wccftech",https://wccftech.com/amd-rdna-4-radeon-rx-8000-gpu-patches-linux-dcc-faster-efficient-performance/,0.5,0.5,0.11649069088093485,0.5048979927028707
EVGA’s former overclocker KINGPIN is now working at PNY - KitGuru,https://www.kitguru.net/components/graphic-cards/joao-silva/evgas-former-overclocker-kingpin-is-now-working-at-pny/,0.0,0.0,0.05905723905723906,0.4691414141414141
AI Power Consumption: Rapidly Becoming Mission-Critical - IO Fund,https://io-fund.com/artificial-intelligence/ai-platforms/ai-power-consumption-becoming-mission-critical,0.45,0.8500000000000001,0.13608663888115924,0.4484340364100632
RTX 4070 Super vs. RTX 4070 Ti Super: Which GPU Should You Buy? - MUO - MakeUseOf,https://www.makeuseof.com/rtx-4070-super-vs-rtx-4070-ti-super/,0.3333333333333333,0.6666666666666666,0.23389393939393932,0.545304897000019
Nvidia to sell its advanced AI processors to Middle East countries amid tough US export rules - Tom's Hardware,https://www.tomshardware.com/tech-industry/artificial-intelligence/nvidia-to-sell-its-advanced-ai-processors-to-middle-east-countries-despite-sanctions,0.003703703703703709,0.4777777777777778,0.09977994227994233,0.4451532467532467
"Nvidia's Chips Are Very Popular. Its Brand, Less so. - Business Insider",https://www.businessinsider.com/nvidia-gpu-chips-ai-branding-popularity-2024-6,0.3066666666666667,0.5333333333333333,0.10327965367965365,0.3999718614718615
The Best GPUs to Experience the Ultra-realistic Graphics of Bodycam - GameRant,https://gamerant.com/best-gpus-experience-ultra-realistic-graphics-bodycam/,1.0,0.3,0.24893227386648417,0.47215989785068774
Nvidia RTX 3050 vs Intel Arc A580: Which is the best budget GPU? - Sportskeeda,https://www.sportskeeda.com/gaming-tech/nvidia-rtx-3050-vs-intel-arc-a580-which-best-budget-gpu,1.0,0.3,0.3078271838536736,0.4348378332484294
Snapdragon X-plained: What you need to know about the chip in Copilot Plus PCs - Android Authority,https://www.androidauthority.com/snapdragon-x-need-to-know-3451992/,0.0,0.0,0.163768834695515,0.4883346117562001
"Gigabyte Pushes Out A GeForce RTX 4070 Ti SUPER GPU With Hidden 16-Pin Connector, Features WindForce Max Cooler - Wccftech",https://wccftech.com/gigabyte-geforce-rtx-4070-ti-super-gpu-hidden-16-pin-connector-windforce-max-cooler/,0.08333333333333333,0.5,0.10873718004590495,0.43406984514367053
Competition in the AI segment: AMD’s Instinct GPUs challenge NVIDIA - igorslab.de,https://www.igorslab.de/en/competition-in-the-ai-segment-amds-instinct-gpus-challenge-nvidia/,0.0,0.0,0.07121212121212123,0.49242424242424243
"Nvidia's next-gen DLSS may leverage AI — tech will be able to generate in-game textures, characters, and objects from scratch - Tom's Hardware",https://www.tomshardware.com/pc-components/gpus/nvidias-next-gen-dlss-may-leverage-ai,0.5,0.625,0.0580762528303512,0.5174789448559942
The Best RTX 4090 PC Builds - GameRant,https://gamerant.com/best-rtx-4090-pc-builds/,1.0,0.3,0.2319901704943254,0.5099007732802753
AMD's Strix Halo being tested with 128GB RAM — shipping records reveal more about extreme 120W APU - Tom's Hardware,https://www.tomshardware.com/pc-components/cpus/amds-strix-halo-being-tested-with-128gb-ram-shipping-records-reveal-more-about-extreme-120w-apu,0.1875,0.75,0.1506342442279943,0.5985783930575597
