標題,真實新聞連結,標題_情感極性,標題_主觀性,全文_情感極性,全文_主觀性
[News] NVIDIA Reportedly in Talk with Samsung for Potential GPU Orders amid Rumored Tensions with TSMC - TrendForce,https://www.trendforce.com/news/2024/10/21/news-nvidia-reportedly-in-talk-with-samsung-for-potential-gpu-orders-amid-rumored-tensions-with-tsmc/,0.0,1.0,0.024668958492487895,0.43669467787114874
Liquid Web launches GPU hosting offering - DatacenterDynamics,https://www.datacenterdynamics.com/en/news/liquid-web-launches-gpu-hosting-offering/,0.0,0.0,0.07200956937799044,0.3424441786283891
How to use your GPU in Visual Studio Code - XDA Developers,https://www.xda-developers.com/how-use-gpu-visual-studio-code/,0.0,0.0,0.16519348603303838,0.4167897256143524
Insiders Selling Nvidia (NVDA) Amid Blackwell GPU Delay and Stock Surge - Yahoo Finance,https://finance.yahoo.com/news/insiders-selling-nvidia-nvda-amid-163054886.html,0.0,0.0,0.13306967635539066,0.4812823472823472
NVIDIA GeForce RTX 5090 GPU Allegedly Pictured In New Leak From A ZOTAC Factory - Wccftech,https://wccftech.com/nvidia-geforce-rtx-5090-gpu-pictured-leak-zotac-factory/,0.018181818181818174,0.2772727272727273,0.12121673546092158,0.44783885365280707
"Yes, the new iPad Mini's chip is missing a GPU core - here's why it doesn't matter - ZDNet",https://www.zdnet.com/article/yes-the-new-ipad-minis-chip-is-missing-a-gpu-core-heres-why-it-doesnt-matter/,-0.03181818181818183,0.25227272727272726,0.4474178587635318,0.4039453544237209
M136279841: New largest known Mersenne prime number confirmed with GPU - heise online,https://www.heise.de/en/news/M136279841-New-largest-known-Mersenne-prime-number-confirmed-with-GPU-9989146.html,0.2681818181818182,0.7272727272727273,0.29161838161838166,0.49433233433233437
Nvidia Blackwell vs Nvidia Hopper - 9Meters.com,https://9meters.com/technology/ai/nvidia-blackwell-vs-nvidia-hopper,0.0,0.0,0.17323387646304308,0.5327370430495432
Mysterious Intel Arc 140T graphics engine significantly outpaces Xe2 Lunar Lake iGPU - Tom's Hardware,https://www.tomshardware.com/pc-components/gpus/mysterious-intel-arc-140t-graphics-engine-significantly-outpaces-xe2-lunar-lake-igpu,0.1875,0.9375,0.146518556350017,0.5463443859511273
"Trust me, you don't want an Nvidia RTX 50-series gaming laptop: Here's why - Laptop Mag",https://www.laptopmag.com/laptops/gaming-laptops-pcs/trust-me-you-dont-want-an-nvidia-rtx-50-series-gaming-laptop-heres-why,0.0,0.0,0.25572497461386356,0.5377835230613006
"Too little, too late? Bertha Language Processing Unit joins Groq's ultrafast LPU as challenge to Nvidia's formidable GPU firepower grows - TechRadar",https://www.techradar.com/pro/too-little-too-late-bertha-language-processing-unit-joins-groqs-ultrafast-lpu-as-challenge-to-nvidias-formidable-gpu-firepower-grows,-0.24375,0.55,0.1964397829839006,0.4827695017400896
"GPUs, CPUs And Serial Chips – Who’s Going To Be Manufacturing, And Who Will Be Begging For Help? - Forbes",https://www.forbes.com/sites/johnwerner/2024/10/21/gpus-cpus-and-serial-chips--whos-going-to-be-manufacturing-and-who-will-be-begging-for-help/,0.0,0.0,0.12176611351611356,0.41408918858918864
NVIDIA Corp. (NVDA): Leading the AI and GPU Revolution - Yahoo Finance,https://finance.yahoo.com/news/nvidia-corp-nvda-leading-ai-191010365.html,0.0,0.0,0.15514154909838365,0.4505160027821896
"Ori deploys private cloud cluster with 1,024 Nvidia H100s - DatacenterDynamics",https://www.datacenterdynamics.com/en/news/ori-deploys-private-cloud-cluster-with-1024-nvidia-h100s/,0.0,0.375,0.11496492013733393,0.2430959844752948
Zotac denies recent RTX 5090 GPU boot-up rumor — vendor clarifies that the GPU was an RTX 4070 Ti Super - Tom's Hardware,https://www.tomshardware.com/pc-components/gpus/zotac-denies-recent-rtx-5090-gpu-boot-up-rumor-vendor-clarifies-that-the-gpu-was-an-rtx-4070-ti-super,0.16666666666666666,0.4583333333333333,0.1608225108225108,0.46422594818117197
Zotac denies recent RTX 5090 GPU boot-up rumor — vendor clarifies that the GPU was an RTX 4070 Ti Super - Yahoo,https://www.yahoo.com/tech/zotac-denies-recent-rtx-5090-175440837.html,0.16666666666666666,0.4583333333333333,0.12166937229437229,0.40049512987012986
"Lian Li Lancool 207 Airflow Case Review | Cable Management, Build Quality, & Benchmarks - GamersNexus",https://gamersnexus.net/cases/lian-li-lancool-207-airflow-case-review-cable-management-build-quality-benchmarks,0.0,0.0,0.13972651336353967,0.48472340099162253
Alleged GeForce RTX 5090 Seen Booting In Indonesian Factory Test Run But Is It Real? - Hot Hardware,https://hothardware.com/news/alleged-geforce-rtx-5090-seen-booting-in-chinese-factory-test-run-but-is-it,0.1375,0.55,0.1518445945692039,0.5495774335618089
DataCrunch wants to be Europe's first AI cloud hyperscaler — powered by renewable energy - TechCrunch,https://techcrunch.com/2024/10/21/datacrunch-wants-to-be-europes-first-ai-cloud-hyperscaler-powered-by-renewable-energy/,0.225,0.21666666666666667,0.17967083936471703,0.45003313013517066
"Qualcomm announces Snapdragon 8 Elite chip with Oryon CPU, 40% faster GPU - GSMArena.com news - GSMArena.com",https://www.gsmarena.com/qualcomm_announces_snapdragon_8_elite_chip_with_oryon_cpu_unreal_engine_53_support_and_40_fater_gpu-news-65009.php,0.0,0.0,0.149768875192604,0.4004402377283732
Best GPU Deals for Gamers - Analytics Insight,https://www.analyticsinsight.net/gaming/best-gpu-deals-for-gamers,1.0,0.3,0.2346410342266688,0.5134262300008159
Bigger and better: Triumphant return for Global Peace and Unity Festival (GPU) - Islam Channel,https://islamchannel.tv/bigger-and-better-triumphant-return-for-global-peace-and-unity-festival-gpu/,0.16666666666666666,0.3333333333333333,0.12876695736434107,0.429358157991879
Inside PNY: The rise of America’s GPU powerhouse against the Asia giants - Nasi Lemak Tech,https://nasilemaktech.com/pny-brand-history-portfolio-nvidia-gpu/,0.0,0.0,0.24056544094346513,0.4933109005689651
"Qualcomm’s Snapdragon 8 Elite Press Image Leaks Out, Showing Performance Cores Clocked At Up To 4.32GHz, New Adreno 830 GPU Delivers Up To A 40 Percent Gain & More - Wccftech",https://wccftech.com/qualcomm-snapdragon-8-elite-press-image-leaked-showing-various-details/,0.3181818181818182,0.4772727272727273,0.17004109172077933,0.4815729843073592
5 improvements I want to see from the Nvidia RTX 5000 series - XDA Developers,https://www.xda-developers.com/improvements-i-want-to-see-from-rtx-5000-series/,0.0,0.0,0.1763403601229688,0.5164259991216513
Snapdragon 8 Elite deep dive: A return to custom CPUs and much more - Android Authority,https://www.androidauthority.com/snapdragon-8-elite-deep-dive-3491526/,0.25,0.45,0.13839485827674813,0.47337565103313145
PNY: The U.S.-Based GPU Powerhouse and a Strong Alternative in the Global Market - Tech Critter,https://www.tech-critter.com/pny-nvidia-gpu-alternative-to-chinese-taiwanese-brand/,0.21666666666666665,0.36666666666666664,0.18436147186147187,0.4036255411255411
Does the Ryzen 7 7800X3D have an iGPU? - WePC - PC Tech & PC Gaming News,https://www.wepc.com/cpu/faq/does-the-ryzen-7-7800x3d-have-an-igpu/,0.0,0.0,0.16846341477942858,0.5179176729006375
