標題,真實新聞連結,標題_情感極性,標題_主觀性,全文_情感極性,全文_主觀性
Nosana Launches GPU Marketplace to Drive AI Innovation - GlobeNewswire,https://www.globenewswire.com/news-release/2025/01/14/3009585/0/en/Nosana-Launches-GPU-Marketplace-to-Drive-AI-Innovation.html,0.0,0.0,0.2523895202020201,0.4857891414141414
"Asus GPU power connector delivers 1,000W for cableless builds — GC-HPWR has a retractable design - Tom's Hardware",https://www.tomshardware.com/pc-components/gpus/asus-gpu-power-connector-delivers-1-000w-for-cableless-builds-gc-hpwr-has-a-retractable-design,0.0,0.0,0.127083719851577,0.47479733560090687
Here's how the new RTX 50-series cards perform against the previous generation of GeForce GPUs - PC Gamer,https://www.pcgamer.com/hardware/graphics-cards/heres-how-the-new-rtx-50-series-cards-perform-against-the-previous-generation-of-geforce-gpus/,-0.015151515151515152,0.3106060606060606,0.1727659959893463,0.4911810270947328
This is a Fun AMD Instinct MI325X 8-GPU Baseboard Feature - ServeTheHome,https://www.servethehome.com/this-is-a-fun-amd-instinct-mi325x-8-gpu-baseboard-nvidia-hgx-feature/,0.3,0.2,0.003188368648894964,0.45195203918888127
Intel is taking the budget GPU market by storm - leaked Arc B570 benchmark shows solid performance for a very reasonable price - TechRadar,https://www.techradar.com/computing/gpu/intel-is-taking-the-budget-gpu-market-by-storm-leaked-arc-b570-benchmark-shows-solid-performance-for-a-very-reasonable-price,0.13,0.44,0.1712662901334776,0.4732012085137083
Biden admin’s cap on GPU exports may hit India's AI ambitions - The Economic Times,https://economictimes.indiatimes.com/tech/technology/biden-admins-cap-on-gpu-exports-may-hit-indias-ai-ambitions/articleshow/117245296.cms?from=mdr,0.2,0.2,0.12590651412079984,0.4874963924963926
Latest Nintendo Switch 2 leaks detail GPU power and a new button - Tom's Guide,https://www.tomsguide.com/gaming/nintendo/latest-nintendo-switch-2-leaks-detail-gpu-power-and-a-new-button,0.3181818181818182,0.6772727272727272,0.17442088798432084,0.554754824363033
"NVIDIA Blackwell “RTX 50” GPU Architecture Detailed: Advanced Cores, DLSS 4, Next-Gen Gaming Technologies & More - Wccftech",https://wccftech.com/nvidia-blackwell-rtx-50-gpu-architecture-advanced-cores-dlss-4-next-gen-gaming-technologies/,0.43333333333333335,0.6166666666666667,0.149227994227994,0.45973603871563057
Intel Could Dominate GPU Space With The Right Plan (NASDAQ:INTC) - Seeking Alpha,https://seekingalpha.com/article/4749659-intel-could-dominate-gpu-space-with-right-plan,0.2857142857142857,0.5357142857142857,0.10082972582972584,0.4121933621933623
"Asus’ new motherboard connection can power a 1,000-watt GPU - PCWorld",https://www.pcworld.com/article/2576750/asus-new-motherboard-connection-can-power-a-1000-watt-gpu.html,0.13636363636363635,0.45454545454545453,0.15718742042271458,0.4241628469569646
"Nintendo Switch 2 GPU Power Leaks Hint At Performance Exceeding Steam Deck In Handheld Mode, 1/4th Of Nvidia RTX 3060 In Docked Mode - TheGamePost",https://thegamepost.com/nintendo-switch-2-gpu-power-leaks-steam-deck/,0.0,0.0,0.06461017316017316,0.559373593073593
I thought the RTX 5070 was my next GPU — this new tech has me reconsidering - Windows Central,https://www.windowscentral.com/gaming/pc-gaming/nvidia-rtx-5070-or-amd-rx-9070-xt-next-pc,0.04545454545454545,0.23484848484848486,0.14172007150195073,0.48709066846650717
LACT Linux GPU Control Panel Adds Support For Intel Graphics - Phoronix,https://www.phoronix.com/news/LACT-0.7-GPU-Control-Panel,0.0,0.0,0.01628787878787879,0.41996753246753243
An ode to the RTX 4090 and why high-end GPUs can sometimes be the best value - PC Gamer,https://www.pcgamer.com/hardware/graphics-cards/an-ode-to-the-rtx-4090-and-why-high-end-gpus-can-sometimes-be-the-best-value/,1.0,0.3,0.20222981980263524,0.5093411496809556
I got an exclusive look at Nvidia’s RTX 50-Series GPUs — 5 big reveals - Tom's Guide,https://www.tomsguide.com/gaming/pc-gaming/i-got-an-exclusive-look-at-nvidias-rtx-50-series-gpus-5-big-reveals,0.0,0.1,0.1464166964348781,0.4746798958617142
"AMD Radeon RX 9070 XT & RX 9070 GPUs Listed On A Danish Retailer, Getting Stocked On 23rd January - Wccftech",https://wccftech.com/amd-radeon-rx-9070-xt-rx-9070-gpus-listed-retailer-23rd-january/,0.0,0.0,0.11258988186954294,0.5156009244992296
Big AI beasts reportedly delay Nvidia Blackwell orders due to GPU overheating but it doesn't worry us for RTX 50 gaming cards - PC Gamer,https://www.pcgamer.com/hardware/graphics-cards/big-ai-beasts-reportedly-delay-nvidia-blackwell-orders-due-to-gpu-overheating-but-it-doesnt-worry-us-for-rtx-50-gaming-cards/,-0.0625,0.2375,0.1256061894454752,0.4666256957328385
"I'll say it: The best thing I saw from Nvidia at CES wasn't its sweet new GPUs, but some tasty AI every RTX gamer can enjoy - PC Gamer",https://www.pcgamer.com/hardware/graphics-cards/ill-say-it-the-best-thing-i-saw-from-nvidia-at-ces-wasnt-its-sweet-new-gpus-but-some-tasty-ai-every-rtx-gamer-can-enjoy/,0.47159090909090906,0.47613636363636364,0.17943406571811232,0.48569397528541514
"The RTX 5060 will be Nvidia’s most important GPU, and I’m worried about it - Digital Trends",https://www.digitaltrends.com/computing/im-worried-about-rtx-5060/,0.3,0.5,0.10932342897487125,0.5277968025564179
"Cableless GPU design supports backward compatibility and up to 1,000W - TechSpot",https://www.techspot.com/news/106366-cableless-gpu-design-supports-backward-compatibility-up-1000w.html,0.0,0.0,0.07156318475762918,0.40293009459676127
"NVIDIA Confirms Updated DLSS Frame Generation On RTX 40 GPUs, Leads to Lower VRAM Usage & Faster Performance - Wccftech",https://wccftech.com/nvidia-dlss-frame-generation-rtx-40-gpus-new-ai-model-faster-lower-vram-requirement/,0.0,0.0,0.10540863177226821,0.503098517643972
GMK's AD-GP1 is a Tiny External GPU - How-To Geek,https://www.howtogeek.com/gmks-ad-gp1-is-a-tiny-external-gpu/,0.0,0.3,0.22404729109274565,0.4778638659320476
"Yes, the Nvidia GeForce RTX 5090 is a 600W gaming GPU, sometimes - PCGamesN",https://www.pcgamesn.com/nvidia/geforce-rtx-5090-600w-zotac,0.0,0.0,0.16659051554506096,0.5704236521054703
Nvidia reportedly prioritizing dual-die Blackwell GPUs with CoWoS-L packaging - Tom's Hardware,https://www.tomshardware.com/pc-components/gpus/nvidia-reportedly-prioritizing-dual-die-blackwell-gpus-with-cowos-l-packaging,0.0,0.0,0.14135704333980192,0.5230885206747274
"AMD Radeon RX 9070 XT, Ryzen 9950X3D, Z2 Extreme SOC for Ally / Legion, & More - GamersNexus",https://gamersnexus.net/news-cpus-gpus/amd-radeon-rx-9070-xt-ryzen-9950x3d-z2-extreme-soc-ally-legion-more,0.1875,0.75,0.0936899830784723,0.4473024178060149
Arc B570 GPU is 10% slower than B580 in Geekbench AI test — Battlemage tested ahead of release - Tom's Hardware,https://www.tomshardware.com/pc-components/gpus/arc-b570-is-10-percent-slower-than-b580-in-geekbench-ai-test-battlemage-gpu-tested-ahead-of-release,0.0,0.0,0.13111197004054148,0.5056106988249844
"Tiny Corp Nearing ""Completely Sovereign"" Compute Stack For AMD GPUs With Tinygrad - Phoronix",https://www.phoronix.com/news/Tiny-Sovereign-Stack-AMD-Close,0.05,0.45,0.1610714285714286,0.48303571428571423
Nvidia RTX 5050 laptop GPU just showed up in LG Gram 2025 — but there's bad news - Tom's Guide,https://www.tomsguide.com/computing/gaming-laptops/nvidia-rtx-5050-laptop-gpu-just-showed-up-in-lg-gram-2025-but-theres-bad-news,-0.6999999999999998,0.6666666666666666,0.1752801439898215,0.5014316746574808
"NVIDIA RTX 5090 at 575 Watts, RTX 5080, 5070 Ti, & 5070 Specs - GamersNexus",https://gamersnexus.net/gpus/nvidia-rtx-5090-575-watts-rtx-5080-5070-ti-5070-specs,0.0,0.0,0.056865208204493915,0.47136380814952233
Nintendo Switch 2 CPU and GPU clock speeds allegedly leaked - Sportskeeda,https://www.sportskeeda.com/gaming-tech/rumor-nintendo-switch-2-cpu-gpu-clock-speeds-allegedly-leaked,-0.1,0.1,0.27669802077209493,0.4190436997844408
Nvidia Blackwell architecture deep dive: A closer look at the upgrades coming with RTX 50-series GPUs - Tom's Hardware,https://www.tomshardware.com/pc-components/gpus/nvidia-blackwell-architecture-deep-dive-a-closer-look-at-the-upgrades-coming-with-rtx-50-series-gpus,0.0,0.4,0.16745881226053638,0.44051271334029946
AI Mission GPU tender bidders showcase their solutions to MeitY - The Economic Times,https://economictimes.indiatimes.com/tech/technology/ai-mission-gpu-tender-bidders-showcase-their-solutions-to-meity/articleshow/117213289.cms?from=mdr,0.2,0.2,0.14092592592592595,0.3366666666666666
"Benchmarking Blackwell and RTX 50-series GPUs with Multi Frame Generation will require some changes, according to Nvidia - Tom's Hardware",https://www.tomshardware.com/pc-components/gpus/benchmarking-blackwell-and-rtx-50-series-gpus-with-multi-frame-generation-will-require-some-changes-according-to-nvidia,0.0,0.0,0.11082844814987668,0.46808386486957926
"NVIDIA RTX Titan Ada Prototype GPU Spotted With 18,432 CUDA Cores And 48GB VRAM - Hot Hardware",https://hothardware.com/news/nvidia-rtx-titan-ada-prototype-gpu-18432-cuda-cores-48gb-vram,0.25,0.8500000000000001,0.02051112787627311,0.5128955530407807
Nvidia RTX 5000 series vs RTX 4000 series: Which is the better GPU lineup? - Sportskeeda,https://www.sportskeeda.com/gaming-tech/nvidia-rtx-5000-series-vs-rtx-4000-series-which-better-gpu-lineup,0.5,0.5,0.30606919048845377,0.4992045096860964
"Apple, Alibaba Cloud join board of group developing GPU interconnect standards - Capacity Media",https://www.capacitymedia.com/article/2eaaqz88k8c0o36kmsetc/news/article-apple-alibaba-cloud-join-board,0.0,0.0,0.15683684131959993,0.39662636214360353
"I can't believe I'm saying this, but Nvidia, good on you - RTX 4000 series GPUs will receive DLSS Frame Generation enhancements this month - TechRadar",https://www.techradar.com/computing/gpu/i-cant-believe-im-saying-this-but-nvidia-good-on-you-rtx-4000-series-gpus-will-receive-dlss-frame-generation-enhancements-this-month,0.7,0.6000000000000001,0.13841808712121206,0.4932200126262626
"Nvidia Blackwell for creators and professionals — upgrades for editing video, images, audio, and more - Tom's Hardware",https://www.tomshardware.com/pc-components/gpus/nvidia-blackwell-for-creators-and-professionals-upgrades-for-editing-video-images-audio-and-more,0.5,0.5,0.1770948550360315,0.496473787650258
Here’s Why 8GB VRAM GPUs Might Not Be Future-Proof; New Benchmarks Reveal Sluggish GPU Performance With Less VRAM Onboard - Wccftech,https://wccftech.com/heres-why-8gb-vram-gpus-might-not-be-future-proof/,-0.015151515151515152,0.2606060606060606,0.1285400496938959,0.4397282204974513
Nvidia RTX 5050 was missing in action at CES 2025 – but the budget GPU might just have been spotted in a surprising laptop - TechRadar,https://www.techradar.com/computing/gpu/nvidia-rtx-5050-was-missing-in-action-at-ces-2025-but-the-budget-gpu-might-just-have-been-spotted-in-a-surprising-laptop,0.19999999999999998,0.21666666666666667,0.17149266591014167,0.48528009207620837
DLSS 4 Improvements Are Coming To All NVIDIA RTX GPUs - How-To Geek,https://www.howtogeek.com/dlss-4-improvements-all-nvidia-rtx-gpus/,0.0,0.0,0.23918195206855003,0.4911489713036104
Battlemage win? Leaked Arc B570 figures suggest strong value for Intel's next GPU. - Windows Central,https://www.windowscentral.com/hardware/cpu-gpu-components/intel-arc-b570-geekbench-leak,0.30833333333333335,0.3458333333333333,0.17520380052847578,0.4464637094507223
"NVIDIA’s AI GPU Export Control Rules Likely To Tighten Under Trump Admin, Says Analyst - Wccftech",https://wccftech.com/nvidias-ai-gpu-export-control-rules-likely-to-tighten-under-trump-admin-says-analyst/,0.0,1.0,0.11911838442141484,0.4760606789394667
Nvidia plots Quantum Day at GTC 2025 – for tech it called a distant dream - The Register,https://www.theregister.com/2025/01/15/nvidia_quantum_day_gtc/,-0.1,0.35,0.2126177944862155,0.4839110275689223
[CES2025] Cooler Master in the GPU business? - Overclocking.com,https://en.overclocking.com/ces2025-cooler-master-in-the-gpu-business/,0.0,0.0,0.06934523809523808,0.5279265873015874
Nvidia’s CES Announcements Resulted in a Six Percent Stock Drop. Why? - PR News - For Smart Communicators,https://www.prnewsonline.com/nvidias-ces-announcements-resulted-in-a-six-percent-stock-drop-why/,0.21428571428571427,0.6428571428571429,0.03984208279982928,0.5120937747698311
Alleged GeForce RTX 5050 Mobile GPU For Budget Gaming Laptops Breaks Cover - Hot Hardware,https://hothardware.com/news/geforce-rtx-5050-mobile-gpu-budget-gaming-laptops,0.075,0.47500000000000003,0.16971364589289115,0.4177649132837812
Chinese GPU developers face more issues - DIGITIMES,https://www.digitimes.com/news/a20250114PD237/china-gpu-ban-huawei-nvidia.html,0.25,0.25,0.10401027543884686,0.3911017553874693
"NVIDIA GeForce RTX 5080 Custom Models From Gigabyte Listed, WindForce For €1229 MSRP, Premium Models Up To €1669 - Wccftech",https://wccftech.com/nvidia-geforce-rtx-5080-custom-models-gigabyte-listed/,0.0,0.0,0.09671255034000138,0.4925675051165243
"AMD Radeon RX 9070 XT GPUs appear for sale early, but you won’t like the price - PCGamesN",https://www.pcgamesn.com/amd/radeon-rx-9070-xt-early-sale,0.1,0.3,0.1752946127946128,0.5485746352413018
Hands on With Nvidia Multi Frame Gen on the RTX 5090 - Gizmodo,https://gizmodo.com/nvidias-rtx-50-series-cards-are-powerful-but-their-real-promise-hinges-on-fake-frames-2000550251,0.0,0.0,0.1635076927576927,0.47423027573027565
Nvidia GeForce RTX 50 Series GPUs real weapon is DLSS 4 - Club386,https://www.club386.com/nvidia-geforce-50-series-gpus-real-weapon-is-dlss-4/,0.2,0.30000000000000004,0.10903770945607677,0.4763979150101601
"More than 251 million GPUs shipped in 2024, according to new research - Yahoo Finance",https://finance.yahoo.com/news/more-251-million-gpus-shipped-203221930.html,0.3181818181818182,0.4772727272727273,-0.01833520389075945,0.3972914328469884
This Nvidia GeForce RTX 5050 leak appears to show a new budget laptop gaming GPU - PCGamesN,https://www.pcgamesn.com/nvidia/geforce-rtx-5050-guide,0.13636363636363635,0.45454545454545453,0.11553823953823952,0.39148196248196254
"Nvidia RTX 50 series card price, details, and the best pick - ONE Esports",https://www.oneesports.gg/gaming/nvidia-rtx-50-series-card-price-details/,1.0,0.3,0.23275132650132674,0.39120632870632865
Where to buy the Intel Arc B580 — all the different models currently available - Tom's Hardware,https://www.tomshardware.com/pc-components/gpus/where-to-buy-the-intel-arc-b580,0.2,0.5,0.14076403318903316,0.44307799422799427
"This new Asus graphics card connector can supply 1,000W of power with no cable - PCGamesN",https://www.pcgamesn.com/asus/gc-hpwr-graphics-card-connector,0.13636363636363635,0.45454545454545453,0.19571007696007697,0.49565396023729347
"Nvidia slams Biden government’s new chip rules, calls them 'unprecedented and misguided' - The Times of India",https://timesofindia.indiatimes.com/technology/tech-news/nvidia-slams-biden-governments-new-chip-rules-calls-them-unprecedented-and-misguided/articleshow/117227961.cms,0.36818181818181817,0.6772727272727272,0.1947032791168596,0.5176442556072159
Sapphire teases dual-fan RX 9070 XT GPU — may be the smallest custom RX 9070 XT - Tom's Hardware,https://www.tomshardware.com/pc-components/gpus/sapphire-teases-dual-fan-rx-9070-xt-gpu-may-be-the-smallest-custom-rx-9070-xt,0.0,0.0,0.1596164607749974,0.4491493330517721
Intel is knocking it out of the park with these new Battlemage GPUs - XDA Developers,https://www.xda-developers.com/thread/intel-is-knocking-it-out-of-the-park-with-these-new-battlemage-gpus/,0.13636363636363635,0.45454545454545453,0.20991120906485494,0.5428135521885522
"Nvidia releases stats that prove DLSS and Frame Generation are here to stay - sorry, angry gamers - TechRadar",https://www.techradar.com/computing/gpu/nvidia-releases-stats-that-prove-dlss-and-frame-generation-are-here-to-stay-sorry-angry-gamers,-0.5,1.0,0.15607007575757573,0.4957397463647463
Nintendo Switch 2 specs leak suggests it could be the first console to support DLSS - Club386,https://www.club386.com/nintendo-switch-2-specs-leak-suggests-it-could-be-the-first-console-to-support-dlss/,0.25,0.3333333333333333,0.13496536796536795,0.48359090909090907
Nvidia's RTX 5090 still can't game in 4K without DLSS 4 - Laptop Mag,https://www.laptopmag.com/laptops/gaming-laptops-pcs/nvidia-rtx-5090-4k-dlss-4-gaming,-0.4,0.4,0.15283661355826303,0.47595349667514597
"Nvidia Blackwell RTX 50-series Founders Edition graphics cards — Details on the new design, cooling, and features of the reference models - Tom's Hardware",https://www.tomshardware.com/pc-components/gpus/nvidia-blackwell-rtx-50-series-founders-edition-graphics-cards-details-on-the-new-design-cooling-and-features-of-the-reference-models,0.13636363636363635,0.45454545454545453,0.08161379833318605,0.47953994758076407
US Expands AI Chip Export Restrictions with Global Framework - TechInformed,https://techinformed.com/us-tightens-grip-on-chips-with-new-export-rules/,0.0,0.0,0.1318390767648191,0.4545036646521798
This Lian Li Strimmer cable deal will brighten your gaming PC for next to nothing - Club386,https://www.club386.com/this-lian-li-strimmer-cable-deal-will-brighten-your-gaming-pc-for-next-to-nothing/,0.0,0.0,0.11887301587301582,0.46640917107583774
Nvidia’s DLSS is surprisingly popular. - The Verge,https://www.theverge.com/2025/1/15/24344212/nvidias-dlss-is-surprisingly-popular,0.6,0.9,0.12491258741258739,0.3298368298368298
"This RTX 4070 desktop is so cheap, it'll make you forget all about RTX 50-series - Tom's Guide",https://www.tomsguide.com/computing/gaming-desktops/this-rtx-4070-desktop-is-so-cheap-itll-make-you-forget-all-about-rtx-50-series,0.4,0.7,0.3298129377397668,0.5488552188552186
Supermicro Unveils Advanced AI Solutions for Retail with NVIDIA at NRF 2024 - StockTitan,https://www.stocktitan.net/news/SMCI/supermicro-empowers-ai-driven-capabilities-for-enterprise-retail-and-85cd3c2ta2ks.html,0.4,0.6,0.12352574270513204,0.3950736922110966
NVIDIA Released RTX 2000 Ada Generation GPU - Digital Engineering 24/7 News,https://www.digitalengineering247.com/article/nvidia-released-rtx-2000-ada-generation-gpu/generative-design,0.0,0.0,0.1800407509915702,0.3877638760753518
India’s AI Dreams at Risk? US GPU Clampdown Explained: What does it mean for consumers? - Digit,https://www.digit.in/features/general/indias-ai-dreams-at-risk-us-gpu-clampdown-explained-what-does-it-mean-for-users.html,-0.3125,0.6875,0.04883723361984231,0.4530743813352509
