標題,真實新聞連結,標題_情感極性,標題_主觀性,全文_情感極性,全文_主觀性
"Evaluating CPU, GPU, and FPGA Performance in the Context of Modal Reverberation: A Comparative Analysis - Frontiers",https://www.frontiersin.org/journals/signal-processing/articles/10.3389/frsip.2025.1522604/abstract,0.0,0.0,0.675,0.65
Bolt Graphics Unveiled New Revolutionary GPU Zeus - 80.lv,https://80.lv/articles/new-challenger-to-nvidia-s-rtx-5090-zeus-graphics-card-promises-10x-power/,0.13636363636363635,0.45454545454545453,0.15875668449197863,0.5740418894830659
"Nvidia RTX 5050, RTX 5060, and RTX 5060 Ti specs leak — expect 8GB/16GB flavors and higher TGPs - Tom's Hardware",https://www.tomshardware.com/pc-components/gpus/nvidia-rtx-5050-rtx-5060-and-rtx-5060-ti-specs-leak-expect-8gb-16gb-flavors-and-higher-tgps,0.25,0.5,0.09531010328254427,0.46419921941575476
"AMD’s RX 9070 XT beats Nvidia’s $1,000+ GPU, but there’s a catch - Digital Trends",https://www.digitaltrends.com/computing/rx-9070-xt-benchmark-beats-rtx-5080/,0.0,0.0,0.26897370921761166,0.5236933797909408
AMD RX 9070 XT vs 9070: Which RDNA 4 GPU should you buy? - TechRadar,https://www.techradar.com/computing/gpu/amd-rx-9070-xt-vs-9070-which-rdna-4-gpu-should-you-buy,0.0,0.0,0.2596907590515544,0.4776060114128294
"Screw waiting for GPU restocks, with an AMD RX 9070 gaming PC going for as cheap as this I'd hop on the pre-built bandwagon - PC Gamer",https://www.pcgamer.com/hardware/gaming-pcs/screw-waiting-for-gpu-restocks-with-an-amd-rx-9070-gaming-pc-going-for-as-cheap-as-this-id-hop-on-the-pre-built-bandwagon/,0.4,0.7,0.1589815473719583,0.5114730969183023
StartStick GPU Powers Jungle Aviation and Relay Service's Missions - Aviation International News,https://www.ainonline.com/aviation-news/business-aviation/2025-03-10/startstick-gpu-powers-charitys-aviation-missions,0.0,0.0,0.17974342730440293,0.38861436666314736
"I wasn't going to upgrade my Nvidia GPU this gen, but new leaks may change my mind - Laptop Mag",https://www.laptopmag.com/laptops/gaming-laptops-pcs/nvidia-5050-5060-5060ti-specs-leak,0.13636363636363635,0.45454545454545453,0.20846816791770922,0.49792141599481043
"Loongson lands 2nd China Energy deal, accelerates CPU & GPU expansion amid market shift - DIGITIMES",https://www.digitimes.com/news/a20250307VL210/loongson-china-cpu-gpu-ipo.html,0.0,0.0,0.12133838383838379,0.37668350168350184
Bolt Graphics unveils Zeus GPU for high-performance workloads - ENGINEERING.com,https://www.engineering.com/bolt-graphics-unveils-zeus-gpu-for-high-performance-workloads/,0.0,0.0,0.07867010440539852,0.4368458747135218
"Gaming GPU Market Size, Share | CAGR of 38.7% - Market.us",https://market.us/report/gaming-gpu-market/,0.0,0.0,0.15367474686330615,0.5025901570181228
Imagination GPU Powers Renesas R-Car Gen 5 SoC - WebWire,https://www.webwire.com/ViewPressRel.asp?aId=335410,0.0,0.0,0.22961748633879783,0.39748633879781414
Investigating NVIDIA’s Defective GPUs: RTX 5080 Missing ROPs Benchmarks - GamersNexus,https://gamersnexus.net/gpus/investigating-nvidias-defective-gpus-rtx-5080-missing-rops-benchmarks,-0.2,0.05,0.08190995842781557,0.4950245653817083
Nvidia says it really has sorted RTX 50-series black screen issues this time around as yet another driver fix finds its way to release - PC Gamer,https://www.pcgamer.com/hardware/graphics-cards/nvidia-says-it-really-has-sorted-rtx-50-series-black-screen-issues-this-time-around-as-yet-another-driver-fix-finds-its-way-to-release/,0.016666666666666677,0.31666666666666665,0.09965858986692318,0.484557329244829
Where to buy 5070 – Nvidia RTX 5070 stock for March 10 - PCGamesN,https://www.pcgamesn.com/nvidia/rtx-5070-buy-stock,0.0,0.0,0.35117316017316014,0.4552597402597403
AI cloud provider Ori Industries deploys GPUs at Kao Data facility - DatacenterDynamics,https://www.datacenterdynamics.com/en/news/ai-cloud-provider-ori-industries-deploys-gpus-at-kao-data-facility/,0.0,0.0,0.09895506792058514,0.2728578892371995
xAI supercharges Colossus supercomputer: Elon Musk's AI powerhouse races toward 1 million Nvidia GPUs - DIGITIMES,https://www.digitimes.com/news/a20250310PD230/xai-supercomputer-expansion-nvidia-ai-gpu.html,0.0,0.0,0.1453181818181818,0.41822727272727284
Where to Buy the AMD Radeon RX 9070 and 9070 XT Graphics Cards - IGN,https://www.ign.com/articles/where-to-buy-amd-radeon-rx-9070-and-9070-xt-graphics-cards,0.0,0.0,0.21106529122200007,0.3783626032254836
"NVIDIA's GeForce RTX 5060 Ti, 5060 And 5050 Mainstream GPU Specs Leak - Hot Hardware",https://hothardware.com/news/nvidia-geforce-rtx-5060-ti-5050-mainstream-gpu-specs-leak,0.25,0.8500000000000001,0.13754893331656814,0.46786097489416983
"The RX 7800 XT is the only mid-range GPU at a remotely reasonable price right now, and it comes with Monster Hunter Wilds - Gamesradar",https://www.gamesradar.com/hardware/desktop-pc/the-rx-7800-xt-is-the-only-mid-range-gpu-at-a-remotely-reasonable-price-right-now-and-it-comes-with-monster-hunter-wilds/,0.1619047619047619,0.7119047619047619,0.23051856335754645,0.5320779424592984
Where to buy 9070 XT – AMD RX 9070 XT stock for March 10 - PCGamesN,https://www.pcgamesn.com/amd/9070-xt-buy-stock,0.0,0.0,0.35639835858585855,0.5052283249158249
NVIDIA's New Hotfix GPU Driver Fixes Black Screen Crashes And An Overclocking Issue - Hot Hardware,https://hothardware.com/news/nvidia-hotfix-gpu-driver-black-screen-bug-overclocking-issue,0.07323232323232323,0.5792929292929293,0.06037595581988104,0.44739055726205335
"RTX 5050 rumors detail full spec of desktop graphics card, suggesting Nvidia may use slower video RAM – but I wouldn’t panic yet - TechRadar",https://www.techradar.com/computing/gpu/rtx-5050-rumors-detail-full-spec-of-desktop-graphics-card-suggesting-nvidia-may-use-slower-video-ram-but-i-wouldnt-panic-yet,0.35,0.55,0.18035453052694433,0.5121364650674994
AMD Radeon RX 9070 review: A powerful gaming GPU that’s nearly the right price - PCGamesN,https://www.pcgamesn.com/amd/radeon-rx-9070-review,0.22857142857142856,0.6452380952380952,0.08749653837854787,0.47831850198088555
Curious Nvidia GeForce RTX 5050 specs leak alongside RTX 5060 Ti and RTX 5060 GPU details - Club386,https://www.club386.com/curious-nvidia-geforce-rtx-5050-specs-leak-alongside-rtx-5060-ti-and-rtx-5060-gpu-details/,-0.1,1.0,0.06316262353998203,0.5045971847858641
This modded AMD Radeon RX 9070 XT runs faster than an RTX 5080 in Cyberpunk 2077 - PCGamesN,https://www.pcgamesn.com/amd/radeon-rx-9070-xt-overclocking,0.0,0.0,0.16510648442466624,0.46184970332697595
"NVIDIA GeForce RTX 5060 Specifications Leaked: GB206, 3840 CUDA Cores, 8GB GDDR7, And 150W Of TDP - Wccftech",https://wccftech.com/nvidia-geforce-rtx-5060-specifications-leak-3840-cores-8-gb-memory/,0.0,0.0,0.11680004268032443,0.4503307725138712
Nvidia’s upcoming budget GPUs could be underwhelming for gamers - Yahoo,https://www.yahoo.com/tech/nvidia-upcoming-budget-gpus-could-080525426.html,0.0,0.0,0.08637414965986392,0.37148299319727895
"Nvidia's GeForce graphics driver woes continue for some users, despite 572.75 hotfix's overclock and black screen promises - TechRadar",https://www.techradar.com/computing/gpu/nvidias-geforce-graphics-driver-woes-continue-for-some-users-despite-572-75-hotfixs-overclock-and-black-screen-promises,-0.16666666666666666,0.43333333333333335,0.11807608553063098,0.4840030171848353
"Foxconn unveils 'FoxBrain,' built on Nvidia GPUs to boost AI efforts - Yahoo Finance",https://finance.yahoo.com/news/foxconn-unveils-first-large-language-072858118.html,0.0,0.0,0.12957393483709273,0.36528822055137844
AMD's RX 9060 XT may keep the RX 9070 XT memory but connected to a smaller bus - Club386,https://www.club386.com/amd-radeon-rx-9060-xt-may-cut-back-on-bus-width-to-match-rx-9070-vram-capacity/,0.0,0.5,0.1961257713917288,0.4179665192963065
"Trump’s Stargate Project Just Created 64,000 Reasons to Buy Nvidia Stock - TradingView",https://www.tradingview.com/news/barchart:d924f71d8094b:0-trump-s-stargate-project-just-created-64-000-reasons-to-buy-nvidia-stock/,0.0,0.0,0.04377505210838544,0.4020823312489978
"Nvidia RTX 5090 cards selling for $5,000 on China's black market as DeepSeek models drive demand - TechSpot",https://www.techspot.com/news/107079-rtx-5090-selling-5000-china-black-market-deepseek.html,-0.16666666666666666,0.43333333333333335,0.09964037698412699,0.49929315476190483
This Developer Ran the 671 Billion Parameter DeepSeek-R1 Model—Without a GPU - AIM,https://analyticsindiamag.com/ai-features/this-developer-ran-the-671-billion-parameter-deepseek-r1-model-without-a-gpu/,0.0,0.0,-0.029292929292929273,0.31902356902356904
"MEF, Infosys show LSO APIs in practice with GPUaaS demo - Telecompaper EN",https://www.telecompaper.com/news/mef-infosys-show-lso-apis-in-practice-with-gpuaas-demo--1530270,0.0,0.0,0.15441176470588236,0.4007352941176471
GPU Prices Too High? Render Network Bridges the Gap - KnowTechie,https://knowtechie.com/render-network-gpu-solution/,0.16,0.5399999999999999,0.1483818491996062,0.4845335220335219
Nvidia Actions: Why This Drop Is Your Golden Ticket to the Future of AI - Robots Rising,https://macholevante.com/el/news-en/103759/nvidia-actions-why-this-drop-is-your-golden-ticket-to-the-future-of-ai/,0.15,0.3125,0.10507021243863351,0.5246597067649699
AMD Radeon RX 9070 XT Hands On Review : 1440p and 4K Gameplay Performance - Geeky Gadgets,https://www.geeky-gadgets.com/amd-radeon-rx-970-xt-gpu-performance/,0.0,0.0,0.1605831485076768,0.5553585879529277
Nvidia tegevused: Miks see langus on teie kuldne pilet tuleviku IA-sse - Robots Rising,https://macholevante.com/et/news-en/103765/nvidia-tegevused-miks-see-langus-on-teie-kuldne-pilet-tuleviku-ia-sse/,0.0,0.0,0.11464964214964216,0.5181121531121532
Nvidia’s Stock: Why This Dip Is Your Golden Ticket Into the AI Future - Robots Rising,https://macholevante.com/uk/news-en/103715/nvidias-stock-why-this-dip-is-your-golden-ticket-into-the-ai-future-2/,0.15,0.3125,0.08956479452447201,0.5170961184872476
Nvidia RTX 5050 Rumors: A Budget-Friendly GPU on the Horizon - Research Snipers,https://researchsnipers.com/nvidia-rtx-5050-rumors-a-budget-friendly-gpu-on-the-horizon/,0.0,0.0,0.17761363636363633,0.5625238496071828
