發佈時間,標題,描述,來源,連結
2025-02-24 08:00:00,President Trump Participates in a Ceremonial Swearing In of Secretary of Commerce Howard Lutnick - US Department of Commerce,"<a href=""https://news.google.com/rss/articles/CBMiuAFBVV95cUxQQzBHcTl1T05TYnpTbkJkRkRfMDFyWDktZVRUSGZUb3F3X25XeFVoNFR5ZVdueF9FaGFOQnBPazYyUEVWWl9yalhlWnJSSlhMNk1BN3NRRmdSbGw1VUF1OWdVRThwdFg3Nmwxc01ZZkhpMDFWOWV1dUVYd3NtZEVpbWJobXBxa3R3bllwVXZQeFU1QzZnd3A1eXpBeWpzSV80TlIteWdEOVE2LTk4ZkpOSHpJUUwtNUZr?oc=5"" target=""_blank"">President Trump Participates in a Ceremonial Swearing In of Secretary of Commerce Howard Lutnick</a>&nbsp;&nbsp;<font color=""#6f6f6f"">US Department of Commerce</font>",US Department of Commerce,https://news.google.com/rss/articles/CBMiuAFBVV95cUxQQzBHcTl1T05TYnpTbkJkRkRfMDFyWDktZVRUSGZUb3F3X25XeFVoNFR5ZVdueF9FaGFOQnBPazYyUEVWWl9yalhlWnJSSlhMNk1BN3NRRmdSbGw1VUF1OWdVRThwdFg3Nmwxc01ZZkhpMDFWOWV1dUVYd3NtZEVpbWJobXBxa3R3bllwVXZQeFU1QzZnd3A1eXpBeWpzSV80TlIteWdEOVE2LTk4ZkpOSHpJUUwtNUZr?oc=5
2025-02-25 08:00:00,"Rolling Back the Administrative State: Understanding Trump’s Deregulatory Initiative - Skadden, Arps, Slate, Meagher & Flom LLP","<a href=""https://news.google.com/rss/articles/CBMilgFBVV95cUxPRjZCc1I3X0J6dUM3MEJfclNmZ1FRbzhiMkpER1o1VDQxd0paMHZrMVpHRHhJRkkwSkJGM0h4Y2JBMmJoVU9jaFJNVTdmLWhFTks0cEJlcGRKVkoyTmpEeUdwcmVmSUhUX2ZxdGZaR19TRDZkTUl2bEQ1QlRrZEw1YXp5ZF9nNnZ1SExoRlNlbkpPa1puZWc?oc=5"" target=""_blank"">Rolling Back the Administrative State: Understanding Trump’s Deregulatory Initiative</a>&nbsp;&nbsp;<font color=""#6f6f6f"">Skadden, Arps, Slate, Meagher & Flom LLP</font>","Skadden, Arps, Slate, Meagher & Flom LLP",https://news.google.com/rss/articles/CBMilgFBVV95cUxPRjZCc1I3X0J6dUM3MEJfclNmZ1FRbzhiMkpER1o1VDQxd0paMHZrMVpHRHhJRkkwSkJGM0h4Y2JBMmJoVU9jaFJNVTdmLWhFTks0cEJlcGRKVkoyTmpEeUdwcmVmSUhUX2ZxdGZaR19TRDZkTUl2bEQ1QlRrZEw1YXp5ZF9nNnZ1SExoRlNlbkpPa1puZWc?oc=5
2025-02-25 08:00:00,Single Day Border Apprehensions Hit 15-Year Low Under President Trump - Homeland Security,"<a href=""https://news.google.com/rss/articles/CBMiqAFBVV95cUxPaTZRVHhEbmQ1TTRfTkJIbXJaN0RDZkU3QVJzWjNnY01sOE1GNVFFeDI1eURqa0hGT2xqOW5TUjRFdk53dVdoNENHNjRabVphazNaUjBpWjNuaEtmNWc2cFg2Nk9FVnB2Q1poakYxenk3cm8tM3BLYU9iSWhOVHk4LXhwbU9Ja3N4WnJMTlN6ZG5odXN3WEJtMUp2ODRFeFU2c2JmdkRGbW8?oc=5"" target=""_blank"">Single Day Border Apprehensions Hit 15-Year Low Under President Trump</a>&nbsp;&nbsp;<font color=""#6f6f6f"">Homeland Security</font>",Homeland Security,https://news.google.com/rss/articles/CBMiqAFBVV95cUxPaTZRVHhEbmQ1TTRfTkJIbXJaN0RDZkU3QVJzWjNnY01sOE1GNVFFeDI1eURqa0hGT2xqOW5TUjRFdk53dVdoNENHNjRabVphazNaUjBpWjNuaEtmNWc2cFg2Nk9FVnB2Q1poakYxenk3cm8tM3BLYU9iSWhOVHk4LXhwbU9Ja3N4WnJMTlN6ZG5odXN3WEJtMUp2ODRFeFU2c2JmdkRGbW8?oc=5
2025-02-25 08:00:00,How Trump’s policy changes to NIH's ‘indirect costs’ would affect one Idaho research program - Idaho Capital Sun,"<a href=""https://news.google.com/rss/articles/CBMixwFBVV95cUxQdGN1RmFDam1GQmVoeHhIMHUtamxUa0VqbllHZmdSWmljcWJxUkdTVjJCWjVrbnhwamxaaHpaSDMyNHA0SmxsTTNob3VqVThpZDB5c0xCdTgyN2ozdW4tQ0hiVDV6UEwzajZOMlctTk1hbFRVUmx0anp4d2NIZlBWUlRWLUVSQ2VZRllhVS13WDNSdGpLWnpMeFZzRTNQaDlPQVI3YkhvM0x0SVFKd016OURWY0VpWkZ0V1kxVTZnQ1FwNXlzUFNv?oc=5"" target=""_blank"">How Trump’s policy changes to NIH's ‘indirect costs’ would affect one Idaho research program</a>&nbsp;&nbsp;<font color=""#6f6f6f"">Idaho Capital Sun</font>",Idaho Capital Sun,https://news.google.com/rss/articles/CBMixwFBVV95cUxQdGN1RmFDam1GQmVoeHhIMHUtamxUa0VqbllHZmdSWmljcWJxUkdTVjJCWjVrbnhwamxaaHpaSDMyNHA0SmxsTTNob3VqVThpZDB5c0xCdTgyN2ozdW4tQ0hiVDV6UEwzajZOMlctTk1hbFRVUmx0anp4d2NIZlBWUlRWLUVSQ2VZRllhVS13WDNSdGpLWnpMeFZzRTNQaDlPQVI3YkhvM0x0SVFKd016OURWY0VpWkZ0V1kxVTZnQ1FwNXlzUFNv?oc=5
2025-02-25 08:00:00,Hearing Wrap Up: Trump Administration is Restoring U.S. Global Leadership by Undoing Weak and Ineffective Foreign Policy of the Biden Administration - House Committee on Oversight and Reform |,"<a href=""https://news.google.com/rss/articles/CBMikAJBVV95cUxOZkg2UWRpWGJTM193WmI3NWFIakhRYlBGTmxPTFh1eVFkWGlrU0JLTml0N04wNHFVeWx2U19iczJqV045OGNHa3ZsbkttMEF0ZUVYM2VnWEQ0MFlfTHgwWmRpb2d1cjN2Wm5oa1M3VmZRdktjOXg1TGN3WFcxWl8tQVpfMWFyTURtLU1TZEhkWXkzRVRTZ2szM19lbkx4b2tFZ0U4QnNSaG9SMlRxcC1jNVU1UkZHd0oxcGdRR2FHU0dOcGdqVFNRd2tSZ3FmWG5lbmdGNGxsTThXX3dKR3NlTmQ3YlJoZldWSGxCTDU3XzBZaVRvdnpGcFI4RUh5Zkp6enlsSDgzUXU4RW5PUWNzUQ?oc=5"" target=""_blank"">Hearing Wrap Up: Trump Administration is Restoring U.S. Global Leadership by Undoing Weak and Ineffective Foreign Policy of the Biden Administration</a>&nbsp;&nbsp;<font color=""#6f6f6f"">House Committee on Oversight and Reform |</font>",House Committee on Oversight and Reform |,https://news.google.com/rss/articles/CBMikAJBVV95cUxOZkg2UWRpWGJTM193WmI3NWFIakhRYlBGTmxPTFh1eVFkWGlrU0JLTml0N04wNHFVeWx2U19iczJqV045OGNHa3ZsbkttMEF0ZUVYM2VnWEQ0MFlfTHgwWmRpb2d1cjN2Wm5oa1M3VmZRdktjOXg1TGN3WFcxWl8tQVpfMWFyTURtLU1TZEhkWXkzRVRTZ2szM19lbkx4b2tFZ0U4QnNSaG9SMlRxcC1jNVU1UkZHd0oxcGdRR2FHU0dOcGdqVFNRd2tSZ3FmWG5lbmdGNGxsTThXX3dKR3NlTmQ3YlJoZldWSGxCTDU3XzBZaVRvdnpGcFI4RUh5Zkp6enlsSDgzUXU4RW5PUWNzUQ?oc=5
2025-02-25 08:00:00,Trump 2.0: an assault on science anywhere is an assault on science everywhere - Nature.com,"<a href=""https://news.google.com/rss/articles/CBMiX0FVX3lxTE9PTTIza0NiYlAtNlZRV2VUa3RVR2VJekFGYnE0dVNxcUUzNnJScWdGdGpnd3l3akRTY2IyUHJmOFFNODdWR29Ea0VCbmVjU0lfdll6SDZqTEJRZjF6YnVn?oc=5"" target=""_blank"">Trump 2.0: an assault on science anywhere is an assault on science everywhere</a>&nbsp;&nbsp;<font color=""#6f6f6f"">Nature.com</font>",Nature.com,https://news.google.com/rss/articles/CBMiX0FVX3lxTE9PTTIza0NiYlAtNlZRV2VUa3RVR2VJekFGYnE0dVNxcUUzNnJScWdGdGpnd3l3akRTY2IyUHJmOFFNODdWR29Ea0VCbmVjU0lfdll6SDZqTEJRZjF6YnVn?oc=5
2025-02-25 08:00:00,The Debate Over Federal Medicaid Cuts: Perspectives of Medicaid Enrollees Who Voted for President Trump and Vice President Harris - KFF,"<a href=""https://news.google.com/rss/articles/CBMi-AFBVV95cUxQSHBfY21lZU8xd19jX3ZjSURZTFBXZy01SExuQWFOZzhULVhNeVpqdXFTQXNGdnBUQkJGZ2pXMExZUXZWWVBXSERvdWIwd1hjOUU4MHFkSUtvZVBMYU5kTEVsaVZoYUFlcWZobGxCdjdWSjNUTGw0SndZYS10UHdwMjJqdF9rVDgxMjAwQnE1WV9vajNRal9WWTJHR3hqNm9hcVAybkpxTVRxZ1ZjN19McUQ2eWdtRlI2emFwQ3VITDJQdTk4em04YVluQnQ0dkJZajNCcVlIVk5BLWxONTdPNUtLXzFQQnNzbVUwUnM3ejNUbUdsWm1QRA?oc=5"" target=""_blank"">The Debate Over Federal Medicaid Cuts: Perspectives of Medicaid Enrollees Who Voted for President Trump and Vice President Harris</a>&nbsp;&nbsp;<font color=""#6f6f6f"">KFF</font>",KFF,https://news.google.com/rss/articles/CBMi-AFBVV95cUxQSHBfY21lZU8xd19jX3ZjSURZTFBXZy01SExuQWFOZzhULVhNeVpqdXFTQXNGdnBUQkJGZ2pXMExZUXZWWVBXSERvdWIwd1hjOUU4MHFkSUtvZVBMYU5kTEVsaVZoYUFlcWZobGxCdjdWSjNUTGw0SndZYS10UHdwMjJqdF9rVDgxMjAwQnE1WV9vajNRal9WWTJHR3hqNm9hcVAybkpxTVRxZ1ZjN19McUQ2eWdtRlI2emFwQ3VITDJQdTk4em04YVluQnQ0dkJZajNCcVlIVk5BLWxONTdPNUtLXzFQQnNzbVUwUnM3ejNUbUdsWm1QRA?oc=5
2025-02-24 08:00:00,New map illustrates public lands reach of Trump’s “energy dominance” vision - The Wilderness Society,"<a href=""https://news.google.com/rss/articles/CBMiqgFBVV95cUxQQVhHZ3hNTlRteVFtNl9iZE1ibVVWNVhWMnU5UV9LUVVGUEdxbDdHTVhVNFFLVlBBVHJNNmxSY3JhNEQwN21mM2U4ZUJUdWlvZzBCaDcyeDBrUXlnWkhUV3d2RHlOQndjclVRcUdOekxhU0NhR2pFUXZTTWhFSzk1YkVYN0NJSTVNRmpRenNvRVRYbUg2dUJSWmRCM3FUTndFSWxVZmNMdktJUQ?oc=5"" target=""_blank"">New map illustrates public lands reach of Trump’s “energy dominance” vision</a>&nbsp;&nbsp;<font color=""#6f6f6f"">The Wilderness Society</font>",The Wilderness Society,https://news.google.com/rss/articles/CBMiqgFBVV95cUxQQVhHZ3hNTlRteVFtNl9iZE1ibVVWNVhWMnU5UV9LUVVGUEdxbDdHTVhVNFFLVlBBVHJNNmxSY3JhNEQwN21mM2U4ZUJUdWlvZzBCaDcyeDBrUXlnWkhUV3d2RHlOQndjclVRcUdOekxhU0NhR2pFUXZTTWhFSzk1YkVYN0NJSTVNRmpRenNvRVRYbUg2dUJSWmRCM3FUTndFSWxVZmNMdktJUQ?oc=5
2025-02-24 08:00:00,Devin Scillian: I'm mystified by the blind allegiance of Trump supporters | Opinion - Detroit Free Press,"<a href=""https://news.google.com/rss/articles/CBMitAFBVV95cUxNU2JxeG1teV9vaDNtZUZfbTNsWGh0amxKdjJlWEd5VzJqU3lZTzJJOWI0dE1hRUtYc2hoUlNSZjc1b01XZ1gxS0Y3T0huS1RySHZwVTZCcTVEQ05LclQzMExBTUJSYlJaczVVNWRGZHphdEFST2RWOUV0STVyalU1SC1Uclp0VjBwTmVPY00tbXkyODJvQjZfNGM4N3BMNFlac2l6VHduY2piekVtalRraFRRYWI?oc=5"" target=""_blank"">Devin Scillian: I'm mystified by the blind allegiance of Trump supporters | Opinion</a>&nbsp;&nbsp;<font color=""#6f6f6f"">Detroit Free Press</font>",Detroit Free Press,https://news.google.com/rss/articles/CBMitAFBVV95cUxNU2JxeG1teV9vaDNtZUZfbTNsWGh0amxKdjJlWEd5VzJqU3lZTzJJOWI0dE1hRUtYc2hoUlNSZjc1b01XZ1gxS0Y3T0huS1RySHZwVTZCcTVEQ05LclQzMExBTUJSYlJaczVVNWRGZHphdEFST2RWOUV0STVyalU1SC1Uclp0VjBwTmVPY00tbXkyODJvQjZfNGM4N3BMNFlac2l6VHduY2piekVtalRraFRRYWI?oc=5
2025-02-25 08:00:00,Three Ways that Argentina’s Milei is Trump’s Doppelganger - Washington Office on Latin America (WOLA),"<a href=""https://news.google.com/rss/articles/CBMijwFBVV95cUxNY2xpRWRGLTk1eXQ1cTNINjdQVHJuWlRua3pjWTNYYWU0dVBwZkw3TFlWS3J6bU1INFllb2JKWFdDZmVrZHNiYzVodVlZeHFzcE9ndk94VlhnWkhXT180MTYzOTllOVFEclR5YjFILVQyR2tybl9LTmFiWlBNb1N6bG80WGJ5Qk5fZ18zREhjWQ?oc=5"" target=""_blank"">Three Ways that Argentina’s Milei is Trump’s Doppelganger</a>&nbsp;&nbsp;<font color=""#6f6f6f"">Washington Office on Latin America (WOLA)</font>",Washington Office on Latin America (WOLA),https://news.google.com/rss/articles/CBMijwFBVV95cUxNY2xpRWRGLTk1eXQ1cTNINjdQVHJuWlRua3pjWTNYYWU0dVBwZkw3TFlWS3J6bU1INFllb2JKWFdDZmVrZHNiYzVodVlZeHFzcE9ndk94VlhnWkhXT180MTYzOTllOVFEclR5YjFILVQyR2tybl9LTmFiWlBNb1N6bG80WGJ5Qk5fZ18zREhjWQ?oc=5
2025-02-25 08:00:00,"Trump, Newsom play high-stakes game over billions in federal wildfire aid - CalMatters","<a href=""https://news.google.com/rss/articles/CBMifkFVX3lxTE9VRkZQRXVqSFQ5eDFiY0I1Rm1TazJzV2Y2U19YTGhFa00zUkhpb2c1MU9JMXdNd2dlY1ItWTRSWmx0a3RUcUNMZmlUVGkxMk1EWVR3aFMxY043aGxmUjUySUt0RWUtWVVyX3ZwLS16Z0hUZm1PTTFPdUJ5bHRJQQ?oc=5"" target=""_blank"">Trump, Newsom play high-stakes game over billions in federal wildfire aid</a>&nbsp;&nbsp;<font color=""#6f6f6f"">CalMatters</font>",CalMatters,https://news.google.com/rss/articles/CBMifkFVX3lxTE9VRkZQRXVqSFQ5eDFiY0I1Rm1TazJzV2Y2U19YTGhFa00zUkhpb2c1MU9JMXdNd2dlY1ItWTRSWmx0a3RUcUNMZmlUVGkxMk1EWVR3aFMxY043aGxmUjUySUt0RWUtWVVyX3ZwLS16Z0hUZm1PTTFPdUJ5bHRJQQ?oc=5
2025-02-25 08:00:00,Are we headed for a constitutional crisis? Kennedy School scholars on the Trump administration and the rule of law - Harvard Kennedy School,"<a href=""https://news.google.com/rss/articles/CBMiwAFBVV95cUxNNmh1LVdjcFBGbUNmMThsdzE3cnNpTXFLQmxKV2wyakxQUW1fYWowT3FNb3VJX1YzWXYtNFZXWEZadWFvUHpsem83UkJsd1lCaEFSSFNmMlUwQ01wSDgxUUdBNUdtanZCWjV0bFdjUmRKUHMzdXpwTi16YXhDSzBCRERWLU1sdGhCaUxtMV9TRDBKbUNfWXA2aUsyeXFlV3JfRW9pQ1R3NEZDMGI1dW0wbjF5ZXBFd0dHUHZUMEVwMXY?oc=5"" target=""_blank"">Are we headed for a constitutional crisis? Kennedy School scholars on the Trump administration and the rule of law</a>&nbsp;&nbsp;<font color=""#6f6f6f"">Harvard Kennedy School</font>",Harvard Kennedy School,https://news.google.com/rss/articles/CBMiwAFBVV95cUxNNmh1LVdjcFBGbUNmMThsdzE3cnNpTXFLQmxKV2wyakxQUW1fYWowT3FNb3VJX1YzWXYtNFZXWEZadWFvUHpsem83UkJsd1lCaEFSSFNmMlUwQ01wSDgxUUdBNUdtanZCWjV0bFdjUmRKUHMzdXpwTi16YXhDSzBCRERWLU1sdGhCaUxtMV9TRDBKbUNfWXA2aUsyeXFlV3JfRW9pQ1R3NEZDMGI1dW0wbjF5ZXBFd0dHUHZUMEVwMXY?oc=5
2025-02-24 08:00:00,State and Local Governments Are Saying No to Trump's Radical Agenda - ACLU,"<a href=""https://news.google.com/rss/articles/CBMirAFBVV95cUxQRjhpZ3p2MER3YUpna0dHYUpTRThOWGp3aVpoUDEzWGtQbkgzTjB4Rm9WUzBfVDF4UWRsbktQRTJIRHNOcFk4ODB5aDVZYnBaYURlQjE3QVJsdFJkVXM3Y0p3S05IOUVreGYyYUQwSndqcUJQRmVQYTZUSHNkZHFwS0kwaWFsbm5iNkk5bjFGdlQzX0RTSGI5NTBhVV9QZVE1d2ZERjNWdmZycVlj?oc=5"" target=""_blank"">State and Local Governments Are Saying No to Trump's Radical Agenda</a>&nbsp;&nbsp;<font color=""#6f6f6f"">ACLU</font>",ACLU,https://news.google.com/rss/articles/CBMirAFBVV95cUxQRjhpZ3p2MER3YUpna0dHYUpTRThOWGp3aVpoUDEzWGtQbkgzTjB4Rm9WUzBfVDF4UWRsbktQRTJIRHNOcFk4ODB5aDVZYnBaYURlQjE3QVJsdFJkVXM3Y0p3S05IOUVreGYyYUQwSndqcUJQRmVQYTZUSHNkZHFwS0kwaWFsbm5iNkk5bjFGdlQzX0RTSGI5NTBhVV9QZVE1d2ZERjNWdmZycVlj?oc=5
2025-02-25 08:00:00,Not ‘deregulation’ but heavy-handed regulation at the Trump FCC - Brookings Institution,"<a href=""https://news.google.com/rss/articles/CBMingFBVV95cUxNRk5RUlZCQktxMnQzeHRudE1ubC1sT2lhbVFyek5BZFJkanY0ZmVPVjBBNVpjaTdOQV9Ia3AzRnRQbG5jZHpzR3hxYzBBcE5BeHdCSEJUaXBxaEFBSVdockswVXRZU3RPV2lvbGgzYml5Zm5HM2c5UkRmcllhb2ItZGV0YkZtNEFJcUpQYnFPWV9pMnNTZVNObGxUYnZSdw?oc=5"" target=""_blank"">Not ‘deregulation’ but heavy-handed regulation at the Trump FCC</a>&nbsp;&nbsp;<font color=""#6f6f6f"">Brookings Institution</font>",Brookings Institution,https://news.google.com/rss/articles/CBMingFBVV95cUxNRk5RUlZCQktxMnQzeHRudE1ubC1sT2lhbVFyek5BZFJkanY0ZmVPVjBBNVpjaTdOQV9Ia3AzRnRQbG5jZHpzR3hxYzBBcE5BeHdCSEJUaXBxaEFBSVdockswVXRZU3RPV2lvbGgzYml5Zm5HM2c5UkRmcllhb2ItZGV0YkZtNEFJcUpQYnFPWV9pMnNTZVNObGxUYnZSdw?oc=5
2025-02-25 08:00:00,Opinion | The Disturbing Question at the Heart of the Trump-Zelensky Drama - The New York Times,"<a href=""https://news.google.com/rss/articles/CBMidkFVX3lxTE92VXFBOGlreENHWDFBb1NZd2Vhc2ZqUUp2VFpialAwZ1VvUzd6LXNTOWlLOGIyeW5xYUdfamdueDVjUWdIVS1Kc0F1U2NTVWI5aUE4anJXam9YU0hCX3VCZUNzWWFMNUVOMUxld1dqcXc4bnV6VGc?oc=5"" target=""_blank"">Opinion | The Disturbing Question at the Heart of the Trump-Zelensky Drama</a>&nbsp;&nbsp;<font color=""#6f6f6f"">The New York Times</font>",The New York Times,https://news.google.com/rss/articles/CBMidkFVX3lxTE92VXFBOGlreENHWDFBb1NZd2Vhc2ZqUUp2VFpialAwZ1VvUzd6LXNTOWlLOGIyeW5xYUdfamdueDVjUWdIVS1Kc0F1U2NTVWI5aUE4anJXam9YU0hCX3VCZUNzWWFMNUVOMUxld1dqcXc4bnV6VGc?oc=5
2025-02-25 08:00:00,"Despite Trump’s threats, withholding federal funds from schools easier said than done - Maine Morning Star","<a href=""https://news.google.com/rss/articles/CBMiwgFBVV95cUxONEM5X1hHUHZMa0dEaDBJdlRGWXdnVVlYYU5jV2FMUFdEd1hWYm1iVnRDM0l6QlFGSDQzdnZhd0FZVU5YUUM1bVM3ejZ4c1FQZFkzamFOMVk1MERONlFTWHFoNUtkLXFacTBDUHFOeWJPNXI0QTd6a1BlcUFEUDNMWnZ1Wks5RTVUc25UMWlZaUpwbW9iNERXRXdNT2ptdXhINWZlQXptTTBKQWdMTDdKcktPMDZ2aGNpME0zY3pxSkt5UQ?oc=5"" target=""_blank"">Despite Trump’s threats, withholding federal funds from schools easier said than done</a>&nbsp;&nbsp;<font color=""#6f6f6f"">Maine Morning Star</font>",Maine Morning Star,https://news.google.com/rss/articles/CBMiwgFBVV95cUxONEM5X1hHUHZMa0dEaDBJdlRGWXdnVVlYYU5jV2FMUFdEd1hWYm1iVnRDM0l6QlFGSDQzdnZhd0FZVU5YUUM1bVM3ejZ4c1FQZFkzamFOMVk1MERONlFTWHFoNUtkLXFacTBDUHFOeWJPNXI0QTd6a1BlcUFEUDNMWnZ1Wks5RTVUc25UMWlZaUpwbW9iNERXRXdNT2ptdXhINWZlQXptTTBKQWdMTDdKcktPMDZ2aGNpME0zY3pxSkt5UQ?oc=5
2025-02-25 08:00:00,"Trump and Unchecked Billionaire Musk Have Fired Nearly 6,000 Veterans - House Committee on Appropriations |","<a href=""https://news.google.com/rss/articles/CBMiygFBVV95cUxPMC1DWG1SN3ZKcG84cVF1bkFvRlZ3SGt0TjNwVGwwR3V4aTdJcjNqSlR6YmdFRFRzdVhFcE5lQk9uT2VhdUJJUkN5QURFRGdQV19EVFJTS0R0cHZXeExMdjBILUVWM0pBZU1maWlDb2xXN3NrdkpNOUY0V2hNMzBwZGlUaTdscFVMWnY1VGhxTU1FdnVGTjFTSmxDYUNqSGdvUXdkMWtzYXU1NTdVNFdrTllNOThnM0ZxeEVuSjZ4S1NSWlpobDA1YVZR?oc=5"" target=""_blank"">Trump and Unchecked Billionaire Musk Have Fired Nearly 6,000 Veterans</a>&nbsp;&nbsp;<font color=""#6f6f6f"">House Committee on Appropriations |</font>",House Committee on Appropriations |,https://news.google.com/rss/articles/CBMiygFBVV95cUxPMC1DWG1SN3ZKcG84cVF1bkFvRlZ3SGt0TjNwVGwwR3V4aTdJcjNqSlR6YmdFRFRzdVhFcE5lQk9uT2VhdUJJUkN5QURFRGdQV19EVFJTS0R0cHZXeExMdjBILUVWM0pBZU1maWlDb2xXN3NrdkpNOUY0V2hNMzBwZGlUaTdscFVMWnY1VGhxTU1FdnVGTjFTSmxDYUNqSGdvUXdkMWtzYXU1NTdVNFdrTllNOThnM0ZxeEVuSjZ4S1NSWlpobDA1YVZR?oc=5
2025-02-24 08:00:00,What will deregulation look like under the second Trump administration? - Brookings Institution,"<a href=""https://news.google.com/rss/articles/CBMiqgFBVV95cUxPTlZOcUpucXRpalY2Qm9JcWpoYkZZcUsxOWViYnJKdm5SX2k3Z3hRNVlkNFhBOFgwcWtlaGZIa3piUG1mODRpYWlhSF9BbGFERVZOM3VaaVNDTGFWVHl6M2JZS0k2dG40V0tZd1dKRGx0eWpFanlTY1dSU1FiSWE0MTVWMFQ0VUh6QkdkdVZSTWw1T3NveWRXNVVUVmV0TnNjdlB2RXFHeDMwUQ?oc=5"" target=""_blank"">What will deregulation look like under the second Trump administration?</a>&nbsp;&nbsp;<font color=""#6f6f6f"">Brookings Institution</font>",Brookings Institution,https://news.google.com/rss/articles/CBMiqgFBVV95cUxPTlZOcUpucXRpalY2Qm9JcWpoYkZZcUsxOWViYnJKdm5SX2k3Z3hRNVlkNFhBOFgwcWtlaGZIa3piUG1mODRpYWlhSF9BbGFERVZOM3VaaVNDTGFWVHl6M2JZS0k2dG40V0tZd1dKRGx0eWpFanlTY1dSU1FiSWE0MTVWMFQ0VUh6QkdkdVZSTWw1T3NveWRXNVVUVmV0TnNjdlB2RXFHeDMwUQ?oc=5
2025-02-25 08:00:00,"Higher prices, economic disruptions expected as a result of tariff increases - Today at Elon","<a href=""https://news.google.com/rss/articles/CBMi0gFBVV95cUxOLTZNdy1oenJPNl9Ka1hxTDZkTW12MlJoZWFlOGFnandVQ040Ny1SemdOMWs2SEhCZXVncU5nU0ZpRUI1OWlqaUtEQUhmcmJpaGlYaGdaOGRSaG52aVQtZm4wWUxmVVBHdkp4b2doYWFkRGluVXdmbVRRTTNWQWpTXzlQVXB0ekhQVWJ2SzJ2UWdOUi1VYjNFZ3ZiZ3JKSTJHNFFJbEdhcjQ0ZjdlTzBwc1NTQUxqZERIUF9QdEhjRUdPOHpxTlZ5LWthOHN6XzFNY3c?oc=5"" target=""_blank"">Higher prices, economic disruptions expected as a result of tariff increases</a>&nbsp;&nbsp;<font color=""#6f6f6f"">Today at Elon</font>",Today at Elon,https://news.google.com/rss/articles/CBMi0gFBVV95cUxOLTZNdy1oenJPNl9Ka1hxTDZkTW12MlJoZWFlOGFnandVQ040Ny1SemdOMWs2SEhCZXVncU5nU0ZpRUI1OWlqaUtEQUhmcmJpaGlYaGdaOGRSaG52aVQtZm4wWUxmVVBHdkp4b2doYWFkRGluVXdmbVRRTTNWQWpTXzlQVXB0ekhQVWJ2SzJ2UWdOUi1VYjNFZ3ZiZ3JKSTJHNFFJbEdhcjQ0ZjdlTzBwc1NTQUxqZERIUF9QdEhjRUdPOHpxTlZ5LWthOHN6XzFNY3c?oc=5
2025-02-25 08:00:00,The World Trump Wants: American Power in the New Age of Nationalism - Foreign Affairs Magazine,"<a href=""https://news.google.com/rss/articles/CBMihAFBVV95cUxOX2JuSVpLQl9melhpbElqOFVNc25iVEFEV0hHOXhIODg5ZG1hS1FuQmxWQ3c5Zi1XbzdZMG9oWmRHYTFURmw3WGRobV9nVFl1ZV9LblVPdHRIZDhrUVplemtqMWVjQnlZaFBfWFVCai1VY1ZVcmRGZ1duaTE1ZnlvbElFcnU?oc=5"" target=""_blank"">The World Trump Wants: American Power in the New Age of Nationalism</a>&nbsp;&nbsp;<font color=""#6f6f6f"">Foreign Affairs Magazine</font>",Foreign Affairs Magazine,https://news.google.com/rss/articles/CBMihAFBVV95cUxOX2JuSVpLQl9melhpbElqOFVNc25iVEFEV0hHOXhIODg5ZG1hS1FuQmxWQ3c5Zi1XbzdZMG9oWmRHYTFURmw3WGRobV9nVFl1ZV9LblVPdHRIZDhrUVplemtqMWVjQnlZaFBfWFVCai1VY1ZVcmRGZ1duaTE1ZnlvbElFcnU?oc=5
2025-02-25 08:00:00,Trump disbands health equity panel examining Medicare and Medicaid - Stateline,"<a href=""https://news.google.com/rss/articles/CBMiogFBVV95cUxObzJwQ2tFNExCUU9Ga2FLZnNWblBORjVpQ0MtTjlzUXJiSUI2ZnotaTBKcVlXMzg3eDZGN2dwTlhFR3NaMGZybGdmRVlWYzZmSlBBZlMtVmxIS2hLbk52WEdJSU8zNzdFTHltajY4OER6SUhIbW9fWHRVV21sMURwXzU1d3d6a2hYa29sNDlqcmtzcXI3MnFnZ0Z6NDEtcEZEUUE?oc=5"" target=""_blank"">Trump disbands health equity panel examining Medicare and Medicaid</a>&nbsp;&nbsp;<font color=""#6f6f6f"">Stateline</font>",Stateline,https://news.google.com/rss/articles/CBMiogFBVV95cUxObzJwQ2tFNExCUU9Ga2FLZnNWblBORjVpQ0MtTjlzUXJiSUI2ZnotaTBKcVlXMzg3eDZGN2dwTlhFR3NaMGZybGdmRVlWYzZmSlBBZlMtVmxIS2hLbk52WEdJSU8zNzdFTHltajY4OER6SUhIbW9fWHRVV21sMURwXzU1d3d6a2hYa29sNDlqcmtzcXI3MnFnZ0Z6NDEtcEZEUUE?oc=5
2025-02-24 08:00:00,Trump Administration Denies Access to Affordable Repayment Plans in Extreme Response to Right-Wing Court Order - Student Borrower Protection Center,"<a href=""https://news.google.com/rss/articles/CBMi1wFBVV95cUxNTGJLVXlDVk5Kc2tObDg3NlZDWU1ZeU5EYktCQTc1R3lHdFkzTkpaSHlrZlRLZFVEZEs1allPWkpvS3RGTmE0S3ByNVNGaGZuNHVEbDNzaEJUcG5OY1RaOUVaMzdHY09ZNk1iLVBPUWFjWHVvcW5la3Q2b19mdG5XNzJjUHJQQzZUc1c2dzJnOHZDN29TazZuWHV4anNrTE9VX1k0dzVJVHJYT1lidXd3c21PNXZCSlpFcG5ranVsbk9TYmZSaVZ1YmE3UzJSWmZzYkMwekNHbw?oc=5"" target=""_blank"">Trump Administration Denies Access to Affordable Repayment Plans in Extreme Response to Right-Wing Court Order</a>&nbsp;&nbsp;<font color=""#6f6f6f"">Student Borrower Protection Center</font>",Student Borrower Protection Center,https://news.google.com/rss/articles/CBMi1wFBVV95cUxNTGJLVXlDVk5Kc2tObDg3NlZDWU1ZeU5EYktCQTc1R3lHdFkzTkpaSHlrZlRLZFVEZEs1allPWkpvS3RGTmE0S3ByNVNGaGZuNHVEbDNzaEJUcG5OY1RaOUVaMzdHY09ZNk1iLVBPUWFjWHVvcW5la3Q2b19mdG5XNzJjUHJQQzZUc1c2dzJnOHZDN29TazZuWHV4anNrTE9VX1k0dzVJVHJYT1lidXd3c21PNXZCSlpFcG5ranVsbk9TYmZSaVZ1YmE3UzJSWmZzYkMwekNHbw?oc=5
2025-02-25 08:00:00,A majority of Americans are worried about the Trump administration’s prospects - Brookings Institution,"<a href=""https://news.google.com/rss/articles/CBMiswFBVV95cUxQRHl3Tkg3cWV4N2lpUHphUEpQSlc1emtvVmZFazBLM09wdVhjM2ViaDZFV1JoTnZBV3VlSUt6ZjR2b3MwR0I0XzRzWVhFNGdDUGlfdGsyNzhWTXNYZG5YbW5TM0tBclF5djF5aFBfNEstZ0lqcTdLNlZUM3JETHhNNVVSalVXUThYc1lMZ1hNa284RXN3VnlOeVg2T3psTmJGN2t3QkZlWDh5MkFDbkpNY1k1bw?oc=5"" target=""_blank"">A majority of Americans are worried about the Trump administration’s prospects</a>&nbsp;&nbsp;<font color=""#6f6f6f"">Brookings Institution</font>",Brookings Institution,https://news.google.com/rss/articles/CBMiswFBVV95cUxQRHl3Tkg3cWV4N2lpUHphUEpQSlc1emtvVmZFazBLM09wdVhjM2ViaDZFV1JoTnZBV3VlSUt6ZjR2b3MwR0I0XzRzWVhFNGdDUGlfdGsyNzhWTXNYZG5YbW5TM0tBclF5djF5aFBfNEstZ0lqcTdLNlZUM3JETHhNNVVSalVXUThYc1lMZ1hNa284RXN3VnlOeVg2T3psTmJGN2t3QkZlWDh5MkFDbkpNY1k1bw?oc=5
2025-02-25 08:00:00,Trump Administration Asserts Control Over Independent Agencies - K&L Gates,"<a href=""https://news.google.com/rss/articles/CBMinAFBVV95cUxNU2JuQ0VmTHJ4dVgzUVk4R0V2cldQQUExSU1yUnBDNGNab25FZ3MzTGJsb1VVejNyUVFsenRkQU8yeXFEZWZpZzZVVGhKemlvUDNLYVdkaU1KREcwejJxRUVNVUd6cXYyTk9udkxHVTRDZHVoOFF4SGM1amMyWDZaTkt4V21DYWd0Q1RKNUlQXzhGNTEyRnZ2Q0UyaTE?oc=5"" target=""_blank"">Trump Administration Asserts Control Over Independent Agencies</a>&nbsp;&nbsp;<font color=""#6f6f6f"">K&amp;L Gates</font>",K&L Gates,https://news.google.com/rss/articles/CBMinAFBVV95cUxNU2JuQ0VmTHJ4dVgzUVk4R0V2cldQQUExSU1yUnBDNGNab25FZ3MzTGJsb1VVejNyUVFsenRkQU8yeXFEZWZpZzZVVGhKemlvUDNLYVdkaU1KREcwejJxRUVNVUd6cXYyTk9udkxHVTRDZHVoOFF4SGM1amMyWDZaTkt4V21DYWd0Q1RKNUlQXzhGNTEyRnZ2Q0UyaTE?oc=5
2025-02-25 08:00:00,"Bitcoin slides under $90,000, erasing some of the gains made under Trump - The Associated Press","<a href=""https://news.google.com/rss/articles/CBMimgFBVV95cUxQNWwwNmp1ZG1mOVRyLUIyOFZncmNNVXZuMThOVTg5Tjhid3dyU2JVOERuSmpnVVVndWNaWlNCZ0U0Q2NlcGtIdDd1LXFlbGlWcVZaeXNraHRtNGo4LVhYb2ZPSS13UzhUVzlmbmw4Z0EybjlTeG1TblJ2MEU0aTBpVndrbWhFd0tNNkptcF9iaDJrOHpMOVRXSkhB?oc=5"" target=""_blank"">Bitcoin slides under $90,000, erasing some of the gains made under Trump</a>&nbsp;&nbsp;<font color=""#6f6f6f"">The Associated Press</font>",The Associated Press,https://news.google.com/rss/articles/CBMimgFBVV95cUxQNWwwNmp1ZG1mOVRyLUIyOFZncmNNVXZuMThOVTg5Tjhid3dyU2JVOERuSmpnVVVndWNaWlNCZ0U0Q2NlcGtIdDd1LXFlbGlWcVZaeXNraHRtNGo4LVhYb2ZPSS13UzhUVzlmbmw4Z0EybjlTeG1TblJ2MEU0aTBpVndrbWhFd0tNNkptcF9iaDJrOHpMOVRXSkhB?oc=5
2025-02-25 08:00:00,"Wisconsin farmers share uncertainty caused by Trump administration policies, funding freeze - Wisconsin Public Radio News","<a href=""https://news.google.com/rss/articles/CBMifEFVX3lxTFB6MTBfR0VWb0VHclYtSDAyYlNtVHBpSzB3TEk1RWwwQS1oYnFyVXJlZkFsSVhXQmxVWmxpSkg1LWVsUzY3U3dRNXpOTy1NWHFGd095aWlKaEdVbE9uekdKcVJ6eDl0NjhhRWdmeEh5ZHY3VXZfeXdVWW43VzQ?oc=5"" target=""_blank"">Wisconsin farmers share uncertainty caused by Trump administration policies, funding freeze</a>&nbsp;&nbsp;<font color=""#6f6f6f"">Wisconsin Public Radio News</font>",Wisconsin Public Radio News,https://news.google.com/rss/articles/CBMifEFVX3lxTFB6MTBfR0VWb0VHclYtSDAyYlNtVHBpSzB3TEk1RWwwQS1oYnFyVXJlZkFsSVhXQmxVWmxpSkg1LWVsUzY3U3dRNXpOTy1NWHFGd095aWlKaEdVbE9uekdKcVJ6eDl0NjhhRWdmeEh5ZHY3VXZfeXdVWW43VzQ?oc=5
2025-02-25 08:00:00,"Trump, Xi, and the false hope of a grand bargain - Brookings Institution","<a href=""https://news.google.com/rss/articles/CBMiigFBVV95cUxQQWxPdzA2ejRERUszSm5sOGhrR3FmbzN6ZjQ2OC14ZmdmeUJvTGtjbzdyaTFySzZNcXlVYXRZbl9SSDhTQ2pFdEhvQ1hxTUtGdE5Mb2NUTWEwYTlNZ0ptVlN6V2owV2lreDI2MGhmMkJ4Ymx4cC1DaDJWaHhic2VoOVdhdC1ERDI0N3c?oc=5"" target=""_blank"">Trump, Xi, and the false hope of a grand bargain</a>&nbsp;&nbsp;<font color=""#6f6f6f"">Brookings Institution</font>",Brookings Institution,https://news.google.com/rss/articles/CBMiigFBVV95cUxQQWxPdzA2ejRERUszSm5sOGhrR3FmbzN6ZjQ2OC14ZmdmeUJvTGtjbzdyaTFySzZNcXlVYXRZbl9SSDhTQ2pFdEhvQ1hxTUtGdE5Mb2NUTWEwYTlNZ0ptVlN6V2owV2lreDI2MGhmMkJ4Ymx4cC1DaDJWaHhic2VoOVdhdC1ERDI0N3c?oc=5
2025-02-25 08:00:00,Correcting the Record: Trump’s Tax Cuts Were a Boon for the Working Class - Ways and Means Committee,"<a href=""https://news.google.com/rss/articles/CBMitAFBVV95cUxPYmg5VVl1QjZWUHJYYUp5ZUlyV2NlZHRSRXhhbjVaS1JTdUp0SUFZNExOSFJlUXFWTHROZ1hPb01lNjczczFobHdjUUxDOTY5SzZsT0t3VTdnUjZsTkNtRThNX1dpQzk2N1BiRUp0eDhuZFo3TjEwZi01dWlxX3NxWFFNMGdvanZBdG1paDJHUElWd1NYWGZaMUhBZEptaHg1UjItQVgwXzZsYWszNE9XeXFQbEI?oc=5"" target=""_blank"">Correcting the Record: Trump’s Tax Cuts Were a Boon for the Working Class</a>&nbsp;&nbsp;<font color=""#6f6f6f"">Ways and Means Committee</font>",Ways and Means Committee,https://news.google.com/rss/articles/CBMitAFBVV95cUxPYmg5VVl1QjZWUHJYYUp5ZUlyV2NlZHRSRXhhbjVaS1JTdUp0SUFZNExOSFJlUXFWTHROZ1hPb01lNjczczFobHdjUUxDOTY5SzZsT0t3VTdnUjZsTkNtRThNX1dpQzk2N1BiRUp0eDhuZFo3TjEwZi01dWlxX3NxWFFNMGdvanZBdG1paDJHUElWd1NYWGZaMUhBZEptaHg1UjItQVgwXzZsYWszNE9XeXFQbEI?oc=5
2025-02-25 08:00:00,"Stephen Feinberg, Trump’s pick for deputy defense secretary, vows to ‘review the value’ of Replicator - DefenseScoop","<a href=""https://news.google.com/rss/articles/CBMirwFBVV95cUxPZzVPYmhEb0NOZUNMXzY1QnhMOHNkOFZMLWxJd0xRS1FqUDBRLUxkRGJBZjJSZkJtVFpnV0J0QjhTZXB0ZGxVOUFqQkd3UkI3Q0tMUEdqaWlnWUhSb0FwV0F2MkRldlRqLVRGT1o5d0dVejZibnZZV2xuVExuQ3p3VDkwSUJMRTVsVmpWNHBxQ1A1VUIzRHRGQndOdERaWElXU0pHY3FlTW11ZWlvenZZ?oc=5"" target=""_blank"">Stephen Feinberg, Trump’s pick for deputy defense secretary, vows to ‘review the value’ of Replicator</a>&nbsp;&nbsp;<font color=""#6f6f6f"">DefenseScoop</font>",DefenseScoop,https://news.google.com/rss/articles/CBMirwFBVV95cUxPZzVPYmhEb0NOZUNMXzY1QnhMOHNkOFZMLWxJd0xRS1FqUDBRLUxkRGJBZjJSZkJtVFpnV0J0QjhTZXB0ZGxVOUFqQkd3UkI3Q0tMUEdqaWlnWUhSb0FwV0F2MkRldlRqLVRGT1o5d0dVejZibnZZV2xuVExuQ3p3VDkwSUJMRTVsVmpWNHBxQ1A1VUIzRHRGQndOdERaWElXU0pHY3FlTW11ZWlvenZZ?oc=5
