發佈時間,標題,描述,來源,連結
2025-03-27 07:00:00,Trump’s Pentagon acquisition chief nominee vows to review controversial CMMC program - DefenseScoop,"<a href=""https://news.google.com/rss/articles/CBMijgFBVV95cUxNX0FVZlJmMFdfMVY5SmhtekttWHFxbHFMVy04MnJEZjR5dzh6ekVnTk9jSlpPcnl4cEQtUVoyRkNoOWxTaHBFcXFYYmU4RUxzd2VDcTR6V2syYk9NZ2FZNGZlWnBsb0l6NEIydm1sdzR2aWFjNHdhdkJBNUo1R3U4Tlpiclh2U2lYZ2JxX2hR?oc=5"" target=""_blank"">Trump’s Pentagon acquisition chief nominee vows to review controversial CMMC program</a>&nbsp;&nbsp;<font color=""#6f6f6f"">DefenseScoop</font>",DefenseScoop,https://news.google.com/rss/articles/CBMijgFBVV95cUxNX0FVZlJmMFdfMVY5SmhtekttWHFxbHFMVy04MnJEZjR5dzh6ekVnTk9jSlpPcnl4cEQtUVoyRkNoOWxTaHBFcXFYYmU4RUxzd2VDcTR6V2syYk9NZ2FZNGZlWnBsb0l6NEIydm1sdzR2aWFjNHdhdkJBNUo1R3U4Tlpiclh2U2lYZ2JxX2hR?oc=5
2025-03-27 07:00:00,Trump Executive Order Would Disenfranchise Millions of Black Voters - Lawyers' Committee for Civil Rights Under Law,"<a href=""https://news.google.com/rss/articles/CBMiowFBVV95cUxQM1B1N0ZSclFVX2MySlBkN2c2VnNPa0x3c0U4X0VCX3dockh1b3ZnbW53bnR0RzZMWGxDc3N5RThxb2IzWENIbnJBVU9VS1hFVnJQVS1jTGg4eGRmaFVmNEdqcmRDRzBHcXhKbmc2NXU1QU0zejFUVzdKSk5TZmFtdnJPdFBvNzFYSGYxQUowQ3FZVG1UTjk0dXVkZTlxdkZPdl80?oc=5"" target=""_blank"">Trump Executive Order Would Disenfranchise Millions of Black Voters</a>&nbsp;&nbsp;<font color=""#6f6f6f"">Lawyers' Committee for Civil Rights Under Law</font>",Lawyers' Committee for Civil Rights Under Law,https://news.google.com/rss/articles/CBMiowFBVV95cUxQM1B1N0ZSclFVX2MySlBkN2c2VnNPa0x3c0U4X0VCX3dockh1b3ZnbW53bnR0RzZMWGxDc3N5RThxb2IzWENIbnJBVU9VS1hFVnJQVS1jTGg4eGRmaFVmNEdqcmRDRzBHcXhKbmc2NXU1QU0zejFUVzdKSk5TZmFtdnJPdFBvNzFYSGYxQUowQ3FZVG1UTjk0dXVkZTlxdkZPdl80?oc=5
2025-03-28 07:00:00,Trump’s executive order threatens to undermine American elections - Brookings,"<a href=""https://news.google.com/rss/articles/CBMimAFBVV95cUxNcnRkRXRlekdCTGZIZEt0Qld0QnlaQ3RoczU0M3N0cFJ5bE10SjcxRkVWYTJ6V3hzcnVueDk1aTNVcTlrQi1mNEpWYTBPN1NwdEM2c3N3enptVF93dE1ZckVTWVp5R0Q2cFdpZDNNMDFvNXFUOUpHNnRPdVJROEg1SFJQVmZZYkRQMUJ0c2h2aU9pLUsyY3BORQ?oc=5"" target=""_blank"">Trump’s executive order threatens to undermine American elections</a>&nbsp;&nbsp;<font color=""#6f6f6f"">Brookings</font>",Brookings,https://news.google.com/rss/articles/CBMimAFBVV95cUxNcnRkRXRlekdCTGZIZEt0Qld0QnlaQ3RoczU0M3N0cFJ5bE10SjcxRkVWYTJ6V3hzcnVueDk1aTNVcTlrQi1mNEpWYTBPN1NwdEM2c3N3enptVF93dE1ZckVTWVp5R0Q2cFdpZDNNMDFvNXFUOUpHNnRPdVJROEg1SFJQVmZZYkRQMUJ0c2h2aU9pLUsyY3BORQ?oc=5
2025-03-27 07:00:00,Twenty Trump-branded real estate projects will be developed in foreign countries during Trump’s presidency - Citizens for Responsibility and Ethics in Washington,"<a href=""https://news.google.com/rss/articles/CBMipwFBVV95cUxObW56U1hxREJRR3pGYUVsa2owMEt6VzBQbDNNNEtKYURvY0c0ZHpYU01wQ21JWWppcXh2SjNDemdJaDhpbHprbTcwX29aZXFocmxHZURLT2hkN1p3YUZzSFhnaUNROXY2R3p4dWYyenNPb2R5cHUwd1dwWDBhYXozcXFiaGl3VVFuZGNWWExMTFhmLXF0OHR1MU45Q2RGb3h1amEwc2JNTQ?oc=5"" target=""_blank"">Twenty Trump-branded real estate projects will be developed in foreign countries during Trump’s presidency</a>&nbsp;&nbsp;<font color=""#6f6f6f"">Citizens for Responsibility and Ethics in Washington</font>",Citizens for Responsibility and Ethics in Washington,https://news.google.com/rss/articles/CBMipwFBVV95cUxObW56U1hxREJRR3pGYUVsa2owMEt6VzBQbDNNNEtKYURvY0c0ZHpYU01wQ21JWWppcXh2SjNDemdJaDhpbHprbTcwX29aZXFocmxHZURLT2hkN1p3YUZzSFhnaUNROXY2R3p4dWYyenNPb2R5cHUwd1dwWDBhYXozcXFiaGl3VVFuZGNWWExMTFhmLXF0OHR1MU45Q2RGb3h1amEwc2JNTQ?oc=5
2025-03-27 07:00:00,Starving for funds: California food banks face funding crunch - CalMatters,"<a href=""https://news.google.com/rss/articles/CBMidkFVX3lxTE1DTzZHZWkzQ2o5OE5VamdVMjFiOVhwRmNENTZWNEpKQ3o0cGlTRDVmZ1gzWE0xVlgybkJQVllRT0pSZ3B2Y1E1Q3h5NGRoVk1aRVQzOS12QVhrVk1aeUZ6Z1dBSGdCVi14TUItLUJncDdwcGFMa0E?oc=5"" target=""_blank"">Starving for funds: California food banks face funding crunch</a>&nbsp;&nbsp;<font color=""#6f6f6f"">CalMatters</font>",CalMatters,https://news.google.com/rss/articles/CBMidkFVX3lxTE1DTzZHZWkzQ2o5OE5VamdVMjFiOVhwRmNENTZWNEpKQ3o0cGlTRDVmZ1gzWE0xVlgybkJQVllRT0pSZ3B2Y1E1Q3h5NGRoVk1aRVQzOS12QVhrVk1aeUZ6Z1dBSGdCVi14TUItLUJncDdwcGFMa0E?oc=5
2025-03-27 07:00:00,RESTORING TRUTH AND SANITY TO AMERICAN HISTORY - The White House (.gov),"<a href=""https://news.google.com/rss/articles/CBMipgFBVV95cUxPempOMVhvTGlWSzdmUFU0TzJRVVF5WURnY3Y2N29mNmg5X1JLendzSm1VRWphWlpoN0szcDJicUcxblZNWFZyVDhIbkFYYjRaSHpOOTZwODg4ZW5nN0x0TWRaY0FDNzBiTkVGTl9LUTg5Q2dhZWI3cEZzWV9WV1Q4ZVNuQlA3a2Rzd2NhNjQwN2ktQkxJbGxDaVVSaVlGSXd5TUxHVExn?oc=5"" target=""_blank"">RESTORING TRUTH AND SANITY TO AMERICAN HISTORY</a>&nbsp;&nbsp;<font color=""#6f6f6f"">The White House (.gov)</font>",The White House (.gov),https://news.google.com/rss/articles/CBMipgFBVV95cUxPempOMVhvTGlWSzdmUFU0TzJRVVF5WURnY3Y2N29mNmg5X1JLendzSm1VRWphWlpoN0szcDJicUcxblZNWFZyVDhIbkFYYjRaSHpOOTZwODg4ZW5nN0x0TWRaY0FDNzBiTkVGTl9LUTg5Q2dhZWI3cEZzWV9WV1Q4ZVNuQlA3a2Rzd2NhNjQwN2ktQkxJbGxDaVVSaVlGSXd5TUxHVExn?oc=5
2025-03-28 07:00:00,Trump's Executive Orders Against Law Firms | The First Amendment Encyclopedia - Free Speech Center,"<a href=""https://news.google.com/rss/articles/CBMiigFBVV95cUxNMHluWWcyS1JIWnR3Sks0UmswaWtMV0pGZjZPWkJINDc5YVpYVDFiVU1lR0V1bjJjZWY0TWFhT3hDVmtYUkpXZVFUNmdMdU1uRVhtMHgtMFg5Y0FLeTN0WVhuMHFqb0MyNFRtUF9VRzc2WFNDVHdvenItekdlMndTY1BjRmJFbkFyeXc?oc=5"" target=""_blank"">Trump's Executive Orders Against Law Firms | The First Amendment Encyclopedia</a>&nbsp;&nbsp;<font color=""#6f6f6f"">Free Speech Center</font>",Free Speech Center,https://news.google.com/rss/articles/CBMiigFBVV95cUxNMHluWWcyS1JIWnR3Sks0UmswaWtMV0pGZjZPWkJINDc5YVpYVDFiVU1lR0V1bjJjZWY0TWFhT3hDVmtYUkpXZVFUNmdMdU1uRVhtMHgtMFg5Y0FLeTN0WVhuMHFqb0MyNFRtUF9VRzc2WFNDVHdvenItekdlMndTY1BjRmJFbkFyeXc?oc=5
2025-03-28 07:00:00,Trump to OSTP’s Kratsios: ‘Blaze a trail’ for science and tech supremacy - FedScoop,"<a href=""https://news.google.com/rss/articles/CBMifEFVX3lxTE4yWTA5NWdrNDR0WEZPUHpmYWVrU1UxMmJ4Y3lkWV9HdTluR19GSmJyVjcwZFdGd2l6WXlQNnpTZ1E5Qk5vZV80cm1Ka05SUFRVTXlfSkQwWjQtSmoxemN1aXpLYkFFMkRiWUJJcDh5bHJzai1pRVlRdXY4eXE?oc=5"" target=""_blank"">Trump to OSTP’s Kratsios: ‘Blaze a trail’ for science and tech supremacy</a>&nbsp;&nbsp;<font color=""#6f6f6f"">FedScoop</font>",FedScoop,https://news.google.com/rss/articles/CBMifEFVX3lxTE4yWTA5NWdrNDR0WEZPUHpmYWVrU1UxMmJ4Y3lkWV9HdTluR19GSmJyVjcwZFdGd2l6WXlQNnpTZ1E5Qk5vZV80cm1Ka05SUFRVTXlfSkQwWjQtSmoxemN1aXpLYkFFMkRiWUJJcDh5bHJzai1pRVlRdXY4eXE?oc=5
2025-03-27 07:00:00,What Happened at the Trump Administration’s Annual Threat Assessment Hearing? - CSIS | Center for Strategic and International Studies,"<a href=""https://news.google.com/rss/articles/CBMinwFBVV95cUxOR0w3NjBiMTJZVkhzTlpxWGdIVnlrV2FNQ3hfOUJ2NWpxQkhfODZIS05Qc3h6eGNpbFA2NWE4WVN4WG9CWWJNZ1RKMUpRME12UUFsVmRnNWhIb3JTM1NyQjk2eVA4NFQ4U2RudFJDaVMzZnV3UXE1WVJHYnp4TW1hN2hJNDhCR05MMFdKNkFHNnlSaDJ1V1ZPT2pudU1vc1E?oc=5"" target=""_blank"">What Happened at the Trump Administration’s Annual Threat Assessment Hearing?</a>&nbsp;&nbsp;<font color=""#6f6f6f"">CSIS | Center for Strategic and International Studies</font>",CSIS | Center for Strategic and International Studies,https://news.google.com/rss/articles/CBMinwFBVV95cUxOR0w3NjBiMTJZVkhzTlpxWGdIVnlrV2FNQ3hfOUJ2NWpxQkhfODZIS05Qc3h6eGNpbFA2NWE4WVN4WG9CWWJNZ1RKMUpRME12UUFsVmRnNWhIb3JTM1NyQjk2eVA4NFQ4U2RudFJDaVMzZnV3UXE1WVJHYnp4TW1hN2hJNDhCR05MMFdKNkFHNnlSaDJ1V1ZPT2pudU1vc1E?oc=5
2025-03-28 07:00:00,NAACP Opposes Trump’s Recent Attempts to Whitewash American History - NAACP,"<a href=""https://news.google.com/rss/articles/CBMilAFBVV95cUxPWDV5dHhhMzd5UVRPSE1yejJ4Z1hyMG9KSXhhZkJqWWNaV3VGN3R2eU44bC1BaHNfT1NXalllblNkU3hRWS15NVVrWlZTa2lBdmdKaUV1NFpRdmkxQjV4Q1RWZGFtc2NEeW9uWW5La0kybnNjUDZMMjBFWWRoZ2U2ZUZYY3dZU3FwTnRtY0UtM3JhbXEt?oc=5"" target=""_blank"">NAACP Opposes Trump’s Recent Attempts to Whitewash American History</a>&nbsp;&nbsp;<font color=""#6f6f6f"">NAACP</font>",NAACP,https://news.google.com/rss/articles/CBMilAFBVV95cUxPWDV5dHhhMzd5UVRPSE1yejJ4Z1hyMG9KSXhhZkJqWWNaV3VGN3R2eU44bC1BaHNfT1NXalllblNkU3hRWS15NVVrWlZTa2lBdmdKaUV1NFpRdmkxQjV4Q1RWZGFtc2NEeW9uWW5La0kybnNjUDZMMjBFWWRoZ2U2ZUZYY3dZU3FwTnRtY0UtM3JhbXEt?oc=5
2025-03-28 07:00:00,Health Policy in Flux: Trump Administration Updates - AJMC,"<a href=""https://news.google.com/rss/articles/CBMiggFBVV95cUxQY3AzZGJtYjhjQUVQeGhBV0Q2cmhQbVdIZzZLTXR3dHc3T3NYMjdVTHEyWXBRVEx0S3dVWUp5UDFCQjdVVnBNdE1aYzNuR0FZOHVNT2hOT1o1VWZ5M05rcWstQ1NSRnVCZnQ0TTlnNFVEVC1GYnpCS1pxa04zeTNBcmdn?oc=5"" target=""_blank"">Health Policy in Flux: Trump Administration Updates</a>&nbsp;&nbsp;<font color=""#6f6f6f"">AJMC</font>",AJMC,https://news.google.com/rss/articles/CBMiggFBVV95cUxQY3AzZGJtYjhjQUVQeGhBV0Q2cmhQbVdIZzZLTXR3dHc3T3NYMjdVTHEyWXBRVEx0S3dVWUp5UDFCQjdVVnBNdE1aYzNuR0FZOHVNT2hOT1o1VWZ5M05rcWstQ1NSRnVCZnQ0TTlnNFVEVC1GYnpCS1pxa04zeTNBcmdn?oc=5
2025-03-28 07:00:00,Appeals court rules Trump can fire board members of independent agencies - NPR,"<a href=""https://news.google.com/rss/articles/CBMijwFBVV95cUxQbFl3am84emI5YUhwR1NvQ0VQTTc2MVhWeHE2Tm1aejg5dkhoT0FkS1FNTWlOODliZ1RYdW9YZzhHNno3a0FWelFMNnI5QmVTWnNBd0xsLXRwOUpqcVR6Y3BaRGt1bEl1d0pvRHdDOGZtbGlOUElsUTk4V2tHMGxkSnZoVVhHOFhXcURMcjV2aw?oc=5"" target=""_blank"">Appeals court rules Trump can fire board members of independent agencies</a>&nbsp;&nbsp;<font color=""#6f6f6f"">NPR</font>",NPR,https://news.google.com/rss/articles/CBMijwFBVV95cUxQbFl3am84emI5YUhwR1NvQ0VQTTc2MVhWeHE2Tm1aejg5dkhoT0FkS1FNTWlOODliZ1RYdW9YZzhHNno3a0FWelFMNnI5QmVTWnNBd0xsLXRwOUpqcVR6Y3BaRGt1bEl1d0pvRHdDOGZtbGlOUElsUTk4V2tHMGxkSnZoVVhHOFhXcURMcjV2aw?oc=5
2025-03-27 07:00:00,HHS Announces Transformation to Make America Healthy Again - HHS.gov,"<a href=""https://news.google.com/rss/articles/CBMiakFVX3lxTE1qSlc1MFlyd3Q1NTY2MTdxTmtXZHYzNVNYd25BcVQ0NGE2M3djTHRmQ0g5UThYZnlycUdOb09tMEhLejJuNXdFTUM3RXh0U2tQeGJXejVwTmsyYll6WnRILWs0WkRLSEdoSlE?oc=5"" target=""_blank"">HHS Announces Transformation to Make America Healthy Again</a>&nbsp;&nbsp;<font color=""#6f6f6f"">HHS.gov</font>",HHS.gov,https://news.google.com/rss/articles/CBMiakFVX3lxTE1qSlc1MFlyd3Q1NTY2MTdxTmtXZHYzNVNYd25BcVQ0NGE2M3djTHRmQ0g5UThYZnlycUdOb09tMEhLejJuNXdFTUM3RXh0U2tQeGJXejVwTmsyYll6WnRILWs0WkRLSEdoSlE?oc=5
2025-03-27 07:00:00,How Trump is following Project 2025’s radical roadmap to defund science - Nature,"<a href=""https://news.google.com/rss/articles/CBMiX0FVX3lxTE1pMjJablByRzNpcmZ0Z2VHVmJHZDlKN3FRZEI3MXlmLWh3REd6NWdOMmR1ckJCZTIwSl9BOHBnM2RvU3R1bXZabnF0MTRmaENNbWp6SDBqSldjYVpjbUZR?oc=5"" target=""_blank"">How Trump is following Project 2025’s radical roadmap to defund science</a>&nbsp;&nbsp;<font color=""#6f6f6f"">Nature</font>",Nature,https://news.google.com/rss/articles/CBMiX0FVX3lxTE1pMjJablByRzNpcmZ0Z2VHVmJHZDlKN3FRZEI3MXlmLWh3REd6NWdOMmR1ckJCZTIwSl9BOHBnM2RvU3R1bXZabnF0MTRmaENNbWp6SDBqSldjYVpjbUZR?oc=5
2025-03-28 07:00:00,Second Federal Court Blocks Trump’s Transgender Military Ban - GLAD Law,"<a href=""https://news.google.com/rss/articles/CBMiiAFBVV95cUxOTzM0SldTS08xbUtzSGExdzBTR3VQSEU5Rk1IMm8zYW1hVWRXM3ktc3JaTXVFcS00NU1GeWw2a0J3NkZIaU1iUk5UdWUwMzJOYjJINzFwUWVXclNKY2dmdHVJZDQzVVpGeWo3Znlpa1VSUlRSYjFTbDNwMm5XMUdmdjJoM1ZkSm1m?oc=5"" target=""_blank"">Second Federal Court Blocks Trump’s Transgender Military Ban</a>&nbsp;&nbsp;<font color=""#6f6f6f"">GLAD Law</font>",GLAD Law,https://news.google.com/rss/articles/CBMiiAFBVV95cUxOTzM0SldTS08xbUtzSGExdzBTR3VQSEU5Rk1IMm8zYW1hVWRXM3ktc3JaTXVFcS00NU1GeWw2a0J3NkZIaU1iUk5UdWUwMzJOYjJINzFwUWVXclNKY2dmdHVJZDQzVVpGeWo3Znlpa1VSUlRSYjFTbDNwMm5XMUdmdjJoM1ZkSm1m?oc=5
2025-03-28 07:00:00,Federal Court Clears Way for Trump to Fire 2 Independent Federal Board Members - Democracy Docket,"<a href=""https://news.google.com/rss/articles/CBMiwAFBVV95cUxNejBGYW9NTmNCZGpmaDdXbEJadXh4SUFjV3dSbDdKOE91ZVRJb3dHT3U0ZEdFSHg1YlJLZXY1ZmtueEZoMXQtM1JOdnpWNVRST3hfR0NqbmVweVVmSnlDT0s5eHlReU82aTFRb081TDRnVjdkZldqS2FSb1RyM0FKM3lPWjZWOFZuLXdHS0g3ZFpPNnR4S2JJWDd2V01kNlE4V1kzdE9zSC1yLXNYS2kzb0NXS05UUGpNMkxidlNjdS0?oc=5"" target=""_blank"">Federal Court Clears Way for Trump to Fire 2 Independent Federal Board Members</a>&nbsp;&nbsp;<font color=""#6f6f6f"">Democracy Docket</font>",Democracy Docket,https://news.google.com/rss/articles/CBMiwAFBVV95cUxNejBGYW9NTmNCZGpmaDdXbEJadXh4SUFjV3dSbDdKOE91ZVRJb3dHT3U0ZEdFSHg1YlJLZXY1ZmtueEZoMXQtM1JOdnpWNVRST3hfR0NqbmVweVVmSnlDT0s5eHlReU82aTFRb081TDRnVjdkZldqS2FSb1RyM0FKM3lPWjZWOFZuLXdHS0g3ZFpPNnR4S2JJWDd2V01kNlE4V1kzdE9zSC1yLXNYS2kzb0NXS05UUGpNMkxidlNjdS0?oc=5
2025-03-27 07:00:00,Trump and the Disruption of the Policy Status Quo - Baker Institute,"<a href=""https://news.google.com/rss/articles/CBMihAFBVV95cUxOTjdremppVlU5QmNvd0RFb0JocFNVSEFUVkF4UHZ2YkQweTNQM3ZDQ2ZmTGFSV1gtbmdkWVRiUlhwZlRtRHB4ZllXbURwOUtxRVBmOEpWWVJCVjN2TDlTWE5ZMjlIRlA4SWVDaklha2JHR0MwMjRBT1RlYjRUeDliR1hyX0w?oc=5"" target=""_blank"">Trump and the Disruption of the Policy Status Quo</a>&nbsp;&nbsp;<font color=""#6f6f6f"">Baker Institute</font>",Baker Institute,https://news.google.com/rss/articles/CBMihAFBVV95cUxOTjdremppVlU5QmNvd0RFb0JocFNVSEFUVkF4UHZ2YkQweTNQM3ZDQ2ZmTGFSV1gtbmdkWVRiUlhwZlRtRHB4ZllXbURwOUtxRVBmOEpWWVJCVjN2TDlTWE5ZMjlIRlA4SWVDaklha2JHR0MwMjRBT1RlYjRUeDliR1hyX0w?oc=5
2025-03-27 07:00:00,ADDRESSING RISKS FROM WILMERHALE - The White House (.gov),"<a href=""https://news.google.com/rss/articles/CBMikwFBVV95cUxPaGxENl9YNE8zU0VZSUJUQTFVUmRna25sUk5fTXgweENsbWtpUThsTGw3dnY0YnVsR3d6d1BRdmRPcXFsTzFyTUZXZjBPNU5ZbkNmRGdXMXlBQ3hFQktseTl4U2hKVlRBX2hGRktSMm9URmZDbTdkUnFvc1VVWVF5ODJPT0ZtbE15RUtiY0xVZDFpZ2c?oc=5"" target=""_blank"">ADDRESSING RISKS FROM WILMERHALE</a>&nbsp;&nbsp;<font color=""#6f6f6f"">The White House (.gov)</font>",The White House (.gov),https://news.google.com/rss/articles/CBMikwFBVV95cUxPaGxENl9YNE8zU0VZSUJUQTFVUmRna25sUk5fTXgweENsbWtpUThsTGw3dnY0YnVsR3d6d1BRdmRPcXFsTzFyTUZXZjBPNU5ZbkNmRGdXMXlBQ3hFQktseTl4U2hKVlRBX2hGRktSMm9URmZDbTdkUnFvc1VVWVF5ODJPT0ZtbE15RUtiY0xVZDFpZ2c?oc=5
2025-03-27 07:00:00,Trump Takes on the Houthis - CSIS | Center for Strategic and International Studies,"<a href=""https://news.google.com/rss/articles/CBMiXkFVX3lxTFBESmZXa2pCWm5ZSGpubm5HQ3NPR3hhcENuRHphQnh2eTVsWmU1bnVhOUp3Y0lqZ21LbHhkM1lKSmFXOVFNMEZVdG10SWxCTTFHU2ZYZjV2cUxfRHRBR3c?oc=5"" target=""_blank"">Trump Takes on the Houthis</a>&nbsp;&nbsp;<font color=""#6f6f6f"">CSIS | Center for Strategic and International Studies</font>",CSIS | Center for Strategic and International Studies,https://news.google.com/rss/articles/CBMiXkFVX3lxTFBESmZXa2pCWm5ZSGpubm5HQ3NPR3hhcENuRHphQnh2eTVsWmU1bnVhOUp3Y0lqZ21LbHhkM1lKSmFXOVFNMEZVdG10SWxCTTFHU2ZYZjV2cUxfRHRBR3c?oc=5
2025-03-28 07:00:00,"Signal chat fallout, tariff tension — and 3 more takeaways from Trump's week - NPR","<a href=""https://news.google.com/rss/articles/CBMilgFBVV95cUxON1N0bmhIamFKQjFmVTU2YkdwSWctcU5BeXl5a0RkWXFfWlQzSXBfY1AyaWhHSlRXWFhQOXdXWGFaa1c3NlpLY3NkVFRQNFM0bG9pUkExZTFZQlpvZE1fYUxJdlBDaGdRLTNZZUQ2ZkJ2SDIzdkRLbVdrMF9pLWljMlFNT2xrVjlwem03SzFsNzZEMDdrdGc?oc=5"" target=""_blank"">Signal chat fallout, tariff tension — and 3 more takeaways from Trump's week</a>&nbsp;&nbsp;<font color=""#6f6f6f"">NPR</font>",NPR,https://news.google.com/rss/articles/CBMilgFBVV95cUxON1N0bmhIamFKQjFmVTU2YkdwSWctcU5BeXl5a0RkWXFfWlQzSXBfY1AyaWhHSlRXWFhQOXdXWGFaa1c3NlpLY3NkVFRQNFM0bG9pUkExZTFZQlpvZE1fYUxJdlBDaGdRLTNZZUQ2ZkJ2SDIzdkRLbVdrMF9pLWljMlFNT2xrVjlwem03SzFsNzZEMDdrdGc?oc=5
2025-03-27 07:00:00,Trump clawed back billions in federal health grants. Here’s how much California is losing - CalMatters,"<a href=""https://news.google.com/rss/articles/CBMiekFVX3lxTE5yb09rY2doRXlPTmhRN0g3NGMzT3E1UElIbmVrOFMzTHJVN1VmaDc5a1oxbUhybGNBRlk4cXJwaEc4T09LcHI3d1pVVnJNMWtfcVdOd0tSbDhydHM4XzA1NVNCekk0M1djRVRPcU43MlN6amxVYVdvanhn?oc=5"" target=""_blank"">Trump clawed back billions in federal health grants. Here’s how much California is losing</a>&nbsp;&nbsp;<font color=""#6f6f6f"">CalMatters</font>",CalMatters,https://news.google.com/rss/articles/CBMiekFVX3lxTE5yb09rY2doRXlPTmhRN0g3NGMzT3E1UElIbmVrOFMzTHJVN1VmaDc5a1oxbUhybGNBRlk4cXJwaEc4T09LcHI3d1pVVnJNMWtfcVdOd0tSbDhydHM4XzA1NVNCekk0M1djRVRPcU43MlN6amxVYVdvanhn?oc=5
2025-03-27 07:00:00,President Trump Orders 25% Global Tariff on Automotive Imports - White & Case LLP,"<a href=""https://news.google.com/rss/articles/CBMinwFBVV95cUxOTlpLYTlfSmdsblhNOXZJbkxocGZvekE0TVAxOXVQYXVnOGlYMzBTaENFUnRRbnZwZUVlWWNBU3pHaTJJN2dPS0pPa3dYSjVPeUlyMWVqUlREamZPUW85cnRlOEtRUVY2NmlIWlAwQmZjRHAtMkFKVElJV2Nab1UxNjVjMFVVaEprM01VajJ5UHQ1LVh5WVRURDhzWEdJaHc?oc=5"" target=""_blank"">President Trump Orders 25% Global Tariff on Automotive Imports</a>&nbsp;&nbsp;<font color=""#6f6f6f"">White & Case LLP</font>",White & Case LLP,https://news.google.com/rss/articles/CBMinwFBVV95cUxOTlpLYTlfSmdsblhNOXZJbkxocGZvekE0TVAxOXVQYXVnOGlYMzBTaENFUnRRbnZwZUVlWWNBU3pHaTJJN2dPS0pPa3dYSjVPeUlyMWVqUlREamZPUW85cnRlOEtRUVY2NmlIWlAwQmZjRHAtMkFKVElJV2Nab1UxNjVjMFVVaEprM01VajJ5UHQ1LVh5WVRURDhzWEdJaHc?oc=5
2025-03-27 07:00:00,President Trump’s Power to Remove FTC Commissioners - The Regulatory Review,"<a href=""https://news.google.com/rss/articles/CBMipAFBVV95cUxNd3A4VFdZYy1vTU5VVUw0ZjFIT0g0QWZsM0FfS3JJVDhkQjROYUowbnVUMXEyTV9ZOW11OGpaRjl2ZGFENk94WW9kWDZIbGFzTGV1QWxqT3V0a0xtYktpbThIZ1l3V0NwZmtja0hwWjdHNzVzdy1HUERvM3VxaWFDOWYzSHVrZGJtSUF4eXdXNjhSOEN5YVpEMkpCX2Rsc0Y4UTk0YQ?oc=5"" target=""_blank"">President Trump’s Power to Remove FTC Commissioners</a>&nbsp;&nbsp;<font color=""#6f6f6f"">The Regulatory Review</font>",The Regulatory Review,https://news.google.com/rss/articles/CBMipAFBVV95cUxNd3A4VFdZYy1vTU5VVUw0ZjFIT0g0QWZsM0FfS3JJVDhkQjROYUowbnVUMXEyTV9ZOW11OGpaRjl2ZGFENk94WW9kWDZIbGFzTGV1QWxqT3V0a0xtYktpbThIZ1l3V0NwZmtja0hwWjdHNzVzdy1HUERvM3VxaWFDOWYzSHVrZGJtSUF4eXdXNjhSOEN5YVpEMkpCX2Rsc0Y4UTk0YQ?oc=5
2025-03-27 07:00:00,"Elon Musk, President Trump, and RFK Jr. Announce Illegal Dismantling of Federal Health Agencies - House.gov","<a href=""https://news.google.com/rss/articles/CBMi0AFBVV95cUxPa2hSNXo0M3BsNi1ma293RGlIY1JzSmR0dTV4RWJyWTR0T3lqV1pPUUIydXNJRDVBemR5QWszclJiV19nY25ka2M0djdNdWZSQ0FOT3VybGJOVUszbzJuSGh1NXZaeDRQVExlTlMwb1Q2WHphRzd4WnM1ZmQxN2FrcU43Qk5NblNNdDI1X1dDYkhiZkVSdHduQnJaNDlHa0hlT1FIc2FOanFPQXlvTFd0dFk2TEFDSDhGckpQeHlkaldjemJGNGluTFlRODRiMjZ6?oc=5"" target=""_blank"">Elon Musk, President Trump, and RFK Jr. Announce Illegal Dismantling of Federal Health Agencies</a>&nbsp;&nbsp;<font color=""#6f6f6f"">House.gov</font>",House.gov,https://news.google.com/rss/articles/CBMi0AFBVV95cUxPa2hSNXo0M3BsNi1ma293RGlIY1JzSmR0dTV4RWJyWTR0T3lqV1pPUUIydXNJRDVBemR5QWszclJiV19nY25ka2M0djdNdWZSQ0FOT3VybGJOVUszbzJuSGh1NXZaeDRQVExlTlMwb1Q2WHphRzd4WnM1ZmQxN2FrcU43Qk5NblNNdDI1X1dDYkhiZkVSdHduQnJaNDlHa0hlT1FIc2FOanFPQXlvTFd0dFk2TEFDSDhGckpQeHlkaldjemJGNGluTFlRODRiMjZ6?oc=5
2025-03-27 07:00:00,How India Is Responding to Trump: Five Takeaways from a Trip to New Delhi - Council on Foreign Relations,"<a href=""https://news.google.com/rss/articles/CBMiiAFBVV95cUxQdlJOc1dwNmRIcFdBdEw5Nm56eXIwU0dsMFdPb19pWGVxWE1tX2EyamdXYnRaSVNDY0lYbkJQZmpaMm8zQ1d0aDVrc3NMczZ3dTIxZmExUXlFY2NpT1pPM3JEajRJSzNhTVFPUl9BY0tZMlVGdHBnWjVQT3M1ZWlmS0Q3bzhJNTB2?oc=5"" target=""_blank"">How India Is Responding to Trump: Five Takeaways from a Trip to New Delhi</a>&nbsp;&nbsp;<font color=""#6f6f6f"">Council on Foreign Relations</font>",Council on Foreign Relations,https://news.google.com/rss/articles/CBMiiAFBVV95cUxQdlJOc1dwNmRIcFdBdEw5Nm56eXIwU0dsMFdPb19pWGVxWE1tX2EyamdXYnRaSVNDY0lYbkJQZmpaMm8zQ1d0aDVrc3NMczZ3dTIxZmExUXlFY2NpT1pPM3JEajRJSzNhTVFPUl9BY0tZMlVGdHBnWjVQT3M1ZWlmS0Q3bzhJNTB2?oc=5
2025-03-28 07:00:00,Trump signs order ending union bargaining rights for wide swaths of federal employees - NPR,"<a href=""https://news.google.com/rss/articles/CBMingFBVV95cUxONUxRcXhYOHFEXzAtMWtRQUdndnNIdTl3QTNlTW55dU5QRWpBZVlyMU1keXVwaTJNN3lLZGJDdThqM1RsT0hHWXV0bnFSbk5KLWNKZ0lla3Jkb0FrX3pveUZ0RW52aEJCR291d0phS1pESUlweFFybk1TaUNQeHd6al9zYVVwSHc4R0RSQXBQLUhHN2ExOGxZZWtHbTBWdw?oc=5"" target=""_blank"">Trump signs order ending union bargaining rights for wide swaths of federal employees</a>&nbsp;&nbsp;<font color=""#6f6f6f"">NPR</font>",NPR,https://news.google.com/rss/articles/CBMingFBVV95cUxONUxRcXhYOHFEXzAtMWtRQUdndnNIdTl3QTNlTW55dU5QRWpBZVlyMU1keXVwaTJNN3lLZGJDdThqM1RsT0hHWXV0bnFSbk5KLWNKZ0lla3Jkb0FrX3pveUZ0RW52aEJCR291d0phS1pESUlweFFybk1TaUNQeHd6al9zYVVwSHc4R0RSQXBQLUhHN2ExOGxZZWtHbTBWdw?oc=5
2025-03-27 07:00:00,The blatant Trump attack on workers you may not have heard about Cutting the wages of hundreds of thousands of workers - Economic Policy Institute,"<a href=""https://news.google.com/rss/articles/CBMi1AFBVV95cUxQUFVNV1hTcHlRUUJTWm0wUWhYNnJ0TklBN0hLNDdfazRNXzFDcVVWU3RmVHl2enFyTmxTbS1kLUp6di1HUjVlLTZnOHY4eks4UzBNVllxTThoc21NSE5KbFZDZTNsa251dGl6eHdaRlNyM3BkdWlYR0hReWxUT0EyQVFTa2R1dTZpdmpWQjkxUk1QUFlydWNCSUp6bElRMjVKT05FM1N1SXZoMnFZNXBVSm5pbUFhclNlbF9LM1pKMnYyX00yLW1wUkdVVExCNDdRVUx4dg?oc=5"" target=""_blank"">The blatant Trump attack on workers you may not have heard about Cutting the wages of hundreds of thousands of workers</a>&nbsp;&nbsp;<font color=""#6f6f6f"">Economic Policy Institute</font>",Economic Policy Institute,https://news.google.com/rss/articles/CBMi1AFBVV95cUxQUFVNV1hTcHlRUUJTWm0wUWhYNnJ0TklBN0hLNDdfazRNXzFDcVVWU3RmVHl2enFyTmxTbS1kLUp6di1HUjVlLTZnOHY4eks4UzBNVllxTThoc21NSE5KbFZDZTNsa251dGl6eHdaRlNyM3BkdWlYR0hReWxUT0EyQVFTa2R1dTZpdmpWQjkxUk1QUFlydWNCSUp6bElRMjVKT05FM1N1SXZoMnFZNXBVSm5pbUFhclNlbF9LM1pKMnYyX00yLW1wUkdVVExCNDdRVUx4dg?oc=5
2025-03-28 07:00:00,"Trump executive order to force changes at Smithsonian Institution, targeting funding for programs with 'improper ideology' - PBS","<a href=""https://news.google.com/rss/articles/CBMi6wFBVV95cUxOejBNN0tLN2xfUjExWFRrRm04a0Nzb0NSdlpaamM4anBFSEQ1dU9nTmlLUEozWUx4QURTQUNxcUdHWWVlMklKdW5nOW1Tb2JCeXp5UHk0OHFwWXNvV1RCYVJtUktDQWNIUjRqX1YweU1wVzBmdEk3V2hiN3FSTDB2UUNnbmNUZjlVc0w3X1htTW9leFh0TkhJUVZwVkRramRYZ1J4WUlsc3dQcDVIRHktRFdPbnRZem1qcl9EX3E5U0FsdXNObmd4V2thMnQyYTRHT2o2SXFSUkFmZy1hUzJlSWxoX2RON1BtTVVZ?oc=5"" target=""_blank"">Trump executive order to force changes at Smithsonian Institution, targeting funding for programs with 'improper ideology'</a>&nbsp;&nbsp;<font color=""#6f6f6f"">PBS</font>",PBS,https://news.google.com/rss/articles/CBMi6wFBVV95cUxOejBNN0tLN2xfUjExWFRrRm04a0Nzb0NSdlpaamM4anBFSEQ1dU9nTmlLUEozWUx4QURTQUNxcUdHWWVlMklKdW5nOW1Tb2JCeXp5UHk0OHFwWXNvV1RCYVJtUktDQWNIUjRqX1YweU1wVzBmdEk3V2hiN3FSTDB2UUNnbmNUZjlVc0w3X1htTW9leFh0TkhJUVZwVkRramRYZ1J4WUlsc3dQcDVIRHktRFdPbnRZem1qcl9EX3E5U0FsdXNObmd4V2thMnQyYTRHT2o2SXFSUkFmZy1hUzJlSWxoX2RON1BtTVVZ?oc=5
2025-03-27 07:00:00,Trump executive order seeks to 'restore' American history through Smithsonian overhaul - NPR,"<a href=""https://news.google.com/rss/articles/CBMikgFBVV95cUxNS3BHNWswN1hwS3htbkcydjZqTEFMRWJoZ21sOUxZemJmd0hNV3AzcWhLR081a29BenJ5dGFfY3NxM3pCaHZzMV9UUm5LOXc4bGhwVDhaaXZ0TDU2S1ZsbklMRGEwbEVZMTFTM20tQVJFQVlwOGZxWHNvTW1vNmFwcVVOVVNqZU5KQ3ZFRkdYSGYyZw?oc=5"" target=""_blank"">Trump executive order seeks to 'restore' American history through Smithsonian overhaul</a>&nbsp;&nbsp;<font color=""#6f6f6f"">NPR</font>",NPR,https://news.google.com/rss/articles/CBMikgFBVV95cUxNS3BHNWswN1hwS3htbkcydjZqTEFMRWJoZ21sOUxZemJmd0hNV3AzcWhLR081a29BenJ5dGFfY3NxM3pCaHZzMV9UUm5LOXc4bGhwVDhaaXZ0TDU2S1ZsbklMRGEwbEVZMTFTM20tQVJFQVlwOGZxWHNvTW1vNmFwcVVOVVNqZU5KQ3ZFRkdYSGYyZw?oc=5
2025-03-28 07:00:00,Trump asks justices to intervene on Alien Enemies Act removals - SCOTUSblog,"<a href=""https://news.google.com/rss/articles/CBMinwFBVV95cUxPUjJDRXlVQ1UyQXFrT1ZHX0I2a0pjOE50bGlPT1hqQ2d4VllKaTYzQU9yNU85QUwwUldROFpCamFzM3dkbTNfaDJJdWFpZmVrYnhzVGNISVZqaTFkX2JLcEljNjZsZTcxeDhZRnJnNktzc3cydHdoNUswc20xdXVuZDcxeHByN2tVanR0VFJiTTBiZ29vQ3h0NXk5SEd1VWs?oc=5"" target=""_blank"">Trump asks justices to intervene on Alien Enemies Act removals</a>&nbsp;&nbsp;<font color=""#6f6f6f"">SCOTUSblog</font>",SCOTUSblog,https://news.google.com/rss/articles/CBMinwFBVV95cUxPUjJDRXlVQ1UyQXFrT1ZHX0I2a0pjOE50bGlPT1hqQ2d4VllKaTYzQU9yNU85QUwwUldROFpCamFzM3dkbTNfaDJJdWFpZmVrYnhzVGNISVZqaTFkX2JLcEljNjZsZTcxeDhZRnJnNktzc3cydHdoNUswc20xdXVuZDcxeHByN2tVanR0VFJiTTBiZ29vQ3h0NXk5SEd1VWs?oc=5
2025-03-28 07:00:00,Federal judge blocks Trump administration from dismantling Consumer Financial Protection Bureau - PBS,"<a href=""https://news.google.com/rss/articles/CBMizgFBVV95cUxOMldMcmZMVnllcE9RdmdsMmE0OVlMTk1rdnh5cndOTlRacjMzRHdFVlR5ajAtN3Y3RVo5M0dSVmtxNjF1cEo2dUpXQVJDTjJSTjZoUFFkQy15QlM1N0NrMGpaSkNKX0RaMnhidXUxc1RQcXVDeXY5dTlLdjFDakZNLVgzaVF5a3lEU1RxcW5mRVg2WUF2MklWZV9lOU9Gcy1aQ1JwRFg5ZW5wTFAwVVd1d0w1VDJzcjJZdGF6MXJ5ZXdOQlc0N0hFY2ViUkExQQ?oc=5"" target=""_blank"">Federal judge blocks Trump administration from dismantling Consumer Financial Protection Bureau</a>&nbsp;&nbsp;<font color=""#6f6f6f"">PBS</font>",PBS,https://news.google.com/rss/articles/CBMizgFBVV95cUxOMldMcmZMVnllcE9RdmdsMmE0OVlMTk1rdnh5cndOTlRacjMzRHdFVlR5ajAtN3Y3RVo5M0dSVmtxNjF1cEo2dUpXQVJDTjJSTjZoUFFkQy15QlM1N0NrMGpaSkNKX0RaMnhidXUxc1RQcXVDeXY5dTlLdjFDakZNLVgzaVF5a3lEU1RxcW5mRVg2WUF2MklWZV9lOU9Gcy1aQ1JwRFg5ZW5wTFAwVVd1d0w1VDJzcjJZdGF6MXJ5ZXdOQlc0N0hFY2ViUkExQQ?oc=5
