標題,真實新聞連結,標題_情感極性,標題_主觀性,全文_情感極性,全文_主觀性
NVIDIA Accelerates Neural Graphics PC Gaming Revolution at GDC With New DLSS 3 PC Games and Tools - NVIDIA Blog,https://nvidianews.nvidia.com/news/nvidia-accelerates-neural-graphics-pc-gaming-revolution-at-gdc-with-new-dlss-3-pc-games-and-tools,0.13636363636363635,0.45454545454545453,0.0,0.0
"Nvidia's going to be using TSMC, not Intel's Arizona fabs - PC Gamer",https://www.pcgamer.com/nvidia-gpus-made-by-intel-look-like-theyre-actually-going-to-be-a-thing/,0.0,0.0,0.09033816738816743,0.5461662337662336
Using DPUs Hands-on Lab with the NVIDIA BlueField-2 DPU and VMware vSphere Demo - ServeTheHome,https://www.servethehome.com/using-dpus-hands-on-lab-with-the-nvidia-bluefield-2-dpu-and-vmware-vsphere-demo/,0.0,0.0,0.14910755576418225,0.4428824823101931
NVIDIA Bundles Redfall Bite Back Edition With GeForce RTX 40 Series GPUs - AnandTech,https://www.anandtech.com/show/18771/nvidia-bundles-redfall-bite-back-edition-with-geforce-rtx-40series-gpus,0.0,0.0,0.08333333333333333,0.19444444444444445
How to Fix the NVIDIA OpenGL Driver Error Code 3 in Windows 10 & 11 - MUO - MakeUseOf,https://www.makeuseof.com/fix-nvidia-opengl-driver-error-code-3-windows/,0.0,0.0,0.11647633975220181,0.43538090262228185
"NVIDIA DLSS 3: Coming to Diablo IV, Forza Horizon 5 & Redfall, DLSS Frame Generation Publicly Available At GDC - NVIDIA Daily News Report",https://www.nvidia.com/en-us/geforce/news/march-2023-rtx-dlss-game-updates/,0.2,0.2,0.11755120108309065,0.4435420678621641
Nvidia's GeForce RTX 4060 Founders Edition Pictured - Tom's Hardware,https://www.tomshardware.com/news/nvidia-geforce-rtx-4060-fe-pictured,0.0,0.0,0.1302926952926953,0.5140808990808988
NVIDIA GeForce 40 Series GPU Bundle Treats Gamers To Redfall Bite Back Edition Worth $100 - Hot Hardware,https://hothardware.com/news/nvidia-geforce-40-series-gpu-bundle-redfall-bite-back-edition,0.18333333333333335,0.3166666666666667,0.07311360891523935,0.4140748517786566
"NVIDIA GeForce RTX 4070 Ti & RTX 4060 Ti Founders Edition GPUs Pictured, Compact PCB & Cooling - Wccftech",https://wccftech.com/nvidia-geforce-rtx-4070-ti-rtx-4060-ti-founders-edition-gpus-pictured-compact-pcb-cooling/,0.0,0.0,0.05638160314630902,0.43607800696035975
NVIDIA Canvas: creating panoramas with AI by Jose Antunes - ProVideo Coalition - ProVideo Coalition,https://www.provideocoalition.com/nvidia-canvas-creating-panoramas-with-ai/,0.0,0.0,0.1956198513160539,0.5038677918424752
Dinky Nvidia RTX 4060 graphics card pops up in leaked photos - PCGamesN,https://www.pcgamesn.com/nvidia/rtx-4060-graphics-card-photo-leak,0.0,0.0,0.02857142857142856,0.49523809523809526
NVIDIA GeForce NOW Ultimate Membership Review: Cloud Gaming at Its Best - How-To Geek,https://www.howtogeek.com/865631/nvidia-geforce-now-ultimate-membership-review/,0.5,0.65,0.11819249522878558,0.5443122323465066
6 Reasons the Nvidia RTX 2060 Is Better Than the RTX 3050 - MUO - MakeUseOf,https://www.makeuseof.com/reasons-nvidia-rtx-2060-better-than-rtx-3050/,0.5,0.5,0.1572759334682412,0.5233872495026342
Game Like a PC: GeForce NOW Breaks Boundaries Transforming Macs Into Ultimate Gaming PCs - NVIDIA Blog,https://blogs.nvidia.com/blog/geforce-now-thursday-march-16/,-0.2,0.7,0.2051515151515151,0.5992396184062849
Just when you thought PC HDR gaming couldn't possibly get more awkward this happens - PC Gamer,https://www.pcgamer.com/just-when-you-thought-pc-hdr-gaming-couldnt-possibly-get-more-awkward-this-happens/,-0.033333333333333326,0.8333333333333334,0.15589818882098297,0.47838524424921475
How to Customize Your Graphics Settings With the NVIDIA Control Panel and GeForce Experience Apps - MUO - MakeUseOf,https://www.makeuseof.com/how-to-customize-graphics-settings-nvidia-control-panel-geforce-experience/,0.0,0.0,0.13906664686076453,0.46298255665902716
"Redfall Bite Back Edition GeForce RTX 40 Series Bundle Available Now, A $99 Value - NVIDIA Daily News Report",https://www.nvidia.com/en-us/geforce/news/redfall-bite-back-geforce-rtx-40-series-bundle/,0.13333333333333333,0.13333333333333333,0.024277994788538676,0.3343826564359309
NVIDIA Canvas 1.4 Available With Panorama Beta This Week ‘In the NVIDIA Studio’ - NVIDIA Blog,https://blogs.nvidia.com/blog/in-the-nvidia-studio-march-16/,0.4,0.4,0.135561698061698,0.5133677508677505
"NVIDIA Reflex Coming To Diablo IV, Forza Horizon 5 and Redfall, Now Available In Atomic Heart and THE FINALS - NVIDIA Daily News Report",https://www.nvidia.com/en-us/geforce/news/march-2023-reflex-game-hardware-updates/,0.2,0.2,0.12259314910582261,0.411474929177299
GeForce RTX 4090 Laptops? But why?! Well…stick with me here… - Gaming Trend,https://gamingtrend.com/impressions/geforce-rtx-4090-laptops-but-why-well-stick-with-me-here/,0.0,0.0,0.1354858003108003,0.46462410644910657
NVIDIA GeForce RTX 4090 Founders Edition Graphics Card Drops To €1819 In Europe - Wccftech,https://wccftech.com/nvidia-geforce-rtx-4090-founders-edition-graphics-card-drops-to-e1819-in-europe/,0.0,0.0,0.05803030303030299,0.4415692640692641
Nvidia RTX 4060: everything we know about Nvidia's next-gen 'budget' graphics card - TechRadar,https://www.techradar.com/news/nvidia-rtx-4060,0.0,0.0,0.1606543300205273,0.5464152084222508
Get a freebie copy of Redfall with your Nvidia RTX 40-series GPU or laptop buy - PC Gamer,https://www.pcgamer.com/redfall-free-copy-nvidia-rtx-40-series-gpu/,0.0,0.0,0.1283147122485358,0.4760172099142685
NVIDIA Upgraded by Morgan Stanley: The Development of Generative AI Is Too Much of a Megatrend To Get Distracted by Tactical Concerns - Wccftech,https://wccftech.com/nvidia-upgraded-by-morgan-stanley-the-development-of-generative-ai-is-too-much-of-a-megatrend-to-get-distracted-by-tactical-concerns/,0.2,0.2,0.057612031646514385,0.421282579489476
"Prices, Specs, and Everything Else We Know About Nvidia's RTX 4060 and RTX 4070 GPUs - MUO - MakeUseOf",https://www.makeuseof.com/prices-specs-nvidia-rtx-4060-rtx-4070-gpus/,0.0,0.0,0.14458233393016007,0.5166776319493712
NVIDIA RTX4090 runs Diablo 4 with 40-50fps at Native 8K/Max Settings - DSOGaming,https://www.dsogaming.com/articles/nvidia-rtx4090-runs-diablo-4-with-40-50fps-at-native-8k-max-settings/,0.0,0.0,0.21122294372294373,0.500489417989418
Grab Redfall for free with this new Nvidia GeForce RTX 4000 GPU bundle - PCGamesN,https://www.pcgamesn.com/redfall/nvidia-bundle,0.2681818181818182,0.6272727272727273,0.1462037962037962,0.4077672327672328
GPU Photo Shoot Suggests GeForce RTX 4060 And 4070 Ti FE Cards Are Coming - Hot Hardware,https://hothardware.com/news/geforce-rtx-4060-and-4070-ti-fe-photos-emerge,0.25,0.8500000000000001,0.15601667939903235,0.5434227782021902
Nvidia RTX 4070 might cost more than RTX 3080: What does it mean for the performance? - Sportskeeda,https://www.sportskeeda.com/gaming-tech/nvidia-rtx-4070-might-cost-rtx-3080-what-mean-performance,0.09375,0.59375,0.22447277200044688,0.42852957620485327
GeForce NOW Adds Disney Dreamlight Valley and The Legend of Heroes: Trails to Azure - Wccftech,https://wccftech.com/geforce-now-adds-disney-dreamlight-valley-and-the-legend-of-heroes-trails-to-azure/,0.0,0.0,0.09911142480707705,0.4601629964238661
NVIDIA GeForce RTX 4090 and a design problem on the PCB - The 12VHPWR connector can be significantly cooler! | Pad Mod 2.0 - igorslab.de,https://www.igorslab.de/en/nvidia-geforce-rtx-4090-and-a-design-problem-on-the-board-12vhpwr-connector-could-clearly-be-cool-pad-mod/,0.334375,0.6375,0.10446708005109642,0.48978390461997007
3 AI Stocks That Are Revolutionizing the Auto Industry - Yahoo Finance,https://finance.yahoo.com/news/3-ai-stocks-revolutionizing-auto-195619740.html,0.0,0.0,0.09285284032990453,0.472965897507182
Best WWE 2K23 graphics settings for RTX 3080 and RTX 3080 Ti - Sportskeeda,https://www.sportskeeda.com/gaming-tech/best-wwe-2k23-graphics-settings-rtx-3080-rtx-3080-ti,1.0,0.3,0.4078002699055329,0.500053981106613
Photos of NVIDIA GeForce RTX 4060 (Ti) FE Has Surfaced Online - Pokde.Net,https://pokde.net/system/pc/gpu/photos-of-nvidia-rtx-4060-ti-fe,0.0,0.0,0.11659090909090908,0.43318979266347685
"NVIDIA GeForce NOW cloud gaming is finally in Malaysia thanks to Yes 5G, but there's a catch - SoyaCincau.com",https://soyacincau.com/2023/03/17/nvidia-geforce-now-cloud-gaming-is-finally-in-malaysia-thanks-to-yes-but-theres-a-catch/,0.1,0.6,0.1707070707070707,0.4727272727272728
NVIDIA GeForce Now Cloud Gaming Service Goes Live In Malaysia: Currently In Beta - Lowyat.NET,https://www.lowyat.net/2023/296497/nvidia-geforce-now-cloud-gaming-malaysia-live/,0.06818181818181818,0.45,0.1787878787878788,0.40151515151515155
