標題,真實新聞連結,標題_情感極性,標題_主觀性,全文_情感極性,全文_主觀性
Nvidia GeForce RTX 4070 Ti vs. Nvidia RTX 3090 Ti: Battle of the generations - PCWorld,https://www.pcworld.com/article/1474555/nvidia-geforce-rtx-4070-ti-vs-nvidia-rtx-3090-ti-battle-of-the-generations.html,0.0,0.0,0.15673863291697682,0.4897683632715481
Leaker: Nvidia RTX 4060 Ti May Offer RTX 3070 Performance - Tom's Hardware,https://www.tomshardware.com/news/geforce-rtx-4060-ti-rumors,0.0,0.0,0.030413073827707984,0.5372936977205268
How to Fix the GeForce Experience Error Code 0x0001 in Windows 10 & 11 - MUO - MakeUseOf,https://www.makeuseof.com/windows-geforce-experience-error-0x0001-fix/,0.0,0.0,0.12560314217617588,0.5606425409796194
NVIDIA GeForce RTX 4060 Ti May Only Be As Fast As The RTX 3070 - Wccftech,https://wccftech.com/nvidia-geforce-rtx-4060-ti-may-only-be-as-fast-as-the-rtx-3070/,0.1,0.8,0.11022442469810889,0.4583921926027184
Nvidia’s GeForce Now Ultimate Turned My Boring Work Laptop into a Gaming Rig - Gizmodo,https://gizmodo.com/nvidia-geforce-now-ultimate-rtx-4080-reflex-dlss-3-fps-1850009745,-0.5,1.0,0.14762172747887034,0.5363022057307771
Destiny 2 Stadia refugees can claim a free month of Nvidia GeForce NOW Priority membership - Chrome Unboxed,https://chromeunboxed.com/nvidia-geforce-now-stadia-destiny-2-offer,0.4,0.8,0.2027134085957616,0.4945830857595564
Nvidia RTX 4060 Ti GPU may only offer RTX 3070 performance - PCGamesN,https://www.pcgamesn.com/nvidia/rtx-4060-ti-gpu-rtx-3070-performance,0.0,1.0,0.12935606060606059,0.4760653409090909
Will there be an NVIDIA GeForce RTX 4080 Ti? - XDA Developers,https://www.xda-developers.com/will-there-be-an-nvidia-geforce-rtx-4080-ti/,0.0,0.0,0.28498178210678216,0.5165847763347763
Nvidia did AMD a huge favor by releasing the RTX 4070 Ti - Digital Trends,https://www.digitaltrends.com/computing/nvidia-did-amd-a-favor-by-releasing-the-rtx-4070-ti/,0.20000000000000004,0.45,0.07426068722943724,0.479106845535417
"Unreal Engine 5.1 Dune Desert Landscape Demo released, pushes NVIDIA RTX 4090 to its limits - DSOGaming",https://www.dsogaming.com/news/unreal-engine-5-1-dune-desert-landscape-demo-released-pushes-nvidia-rtx-4090-to-its-limits/,0.0,0.0,0.2910117302052786,0.5052003910068427
"Which Nvidia GPU is identical to the Steam Deck? Specs, performance, and more compared - Sportskeeda",https://www.sportskeeda.com/gaming-tech/which-nvidia-gpu-identical-steam-deck-specs-performance-compared,0.5,0.5,0.264666666666667,0.4913675213675215
I really hope this Nvidia RTX 4060 Ti GPU performance rumor is fake - TechRadar,https://www.techradar.com/news/i-really-hope-this-nvidia-rtx-4060-ti-gpu-performance-rumor-is-fake,-0.15,0.6,0.1075624681690858,0.5354833789576436
NVIDIA RTX 6000 Ada Workstation Graphics Card With Over 18K Cores & 48 GB Memory Hits Retail For $6800 US - Wccftech,https://wccftech.com/nvidia-rtx-6000-ada-workstation-graphics-card-with-over-18k-cores-48-gb-memory-hits-retail-for-6800-us/,0.0,0.0,0.0905113842900103,0.45820285736316274
Nvidia’s GeForce Now Ultimate Turned My Boring Work Laptop into a Gaming Rig - Gizmodo,https://gizmodo.com/nvidia-geforce-now-ultimate-rtx-4080-reflex-dlss-3-fps-1850009745/2,-0.5,1.0,0.11856098296396804,0.4936167646615407
NVIDIA Grace CPU Superchip Benchmarks Show 2.5x Performance & 3.5x Efficiency Gain Over AMD EPYC Milan CPUs - Wccftech,https://wccftech.com/nvidia-grace-cpu-superchip-benchmarks-show-2-5x-performance-3-5x-efficiency-gain-over-amd-epyc-milan-cpus/,0.0,0.0,0.12968965320393905,0.48042254887969144
"NVIDIA DLSS 2.5.1 brings visual improvements to Cyberpunk 2077, Red Dead Redemption 2 & God of War - DSOGaming",https://www.dsogaming.com/news/nvidia-dlss-2-5-1-brings-visual-improvements-to-cyberpunk-2077-red-dead-redemption-2-god-of-war/,-0.06666666666666667,0.13333333333333333,0.12426839826839828,0.44425974025974035
"What is Nvidia Reflex, and how to use it to enhance your gaming experience? - Sportskeeda",https://www.sportskeeda.com/gaming-tech/what-nvidia-reflex-use-enhance-gaming-experience,0.0,0.0,0.19219482965245696,0.47867830850881743
"Global Metaverse Market Report 2022-2030 Featuring Major Players - Meta Platforms, Microsoft, Nvidia, Tencent, Roblox, Unity Software, Bytedance, Epic Games, Decentraland, and Alibaba Among Others - PR Newswire",https://www.prnewswire.com/news-releases/global-metaverse-market-report-2022-2030-featuring-major-players---meta-platforms-microsoft-nvidia-tencent-roblox-unity-software-bytedance-epic-games-decentraland-and-alibaba-among-others-301726865.html,0.05416666666666667,0.3,0.07997186147186147,0.3378744588744588
Is the Nvidia GeForce RTX 2060 Super worth buying in 2023? - Sportskeeda,https://www.sportskeeda.com/gaming-tech/is-nvidia-geforce-rtx-2060-super-worth-buying-2023,0.31666666666666665,0.3833333333333333,0.28957370313302483,0.3969594247560353
Someone Made NVIDIA’s RTX 4080 Founders Edition In White - Pokde.Net,https://pokde.net/system/pc/gpu/rtx-4080-founders-edition-in-white,0.0,0.0,0.12487422487422488,0.4145635895635896
NVIDIA GeForce NOW Ultimate Review | RTX 4080 Game Streaming for the Masses - Gstyle magazine,https://gstylemag.com/2023/01/20/nvidia-geforce-now-ultimate-review-rtx-4080-game-streaming-for-the-masses/,-0.2,0.7,0.0757504017447199,0.5472824839302112
How to use Nvidia Reflex to reduce latency on PC - PC Invasion,https://www.pcinvasion.com/how-to-use-nvidia-reflex-to-reduce-latency-on-pc/,0.0,0.0,-0.04272727272727273,0.410909090909091
DirectX function GetDeviceRemovedReason failed with DXGI error - The Windows Club,https://www.thewindowsclub.com/directx-function-getdeviceremovedreason-failed-with-dxgi-error,-0.5,0.3,-0.0014335764335764295,0.4413592163592161
NVIDIA GeForce RTX 4080 review: Deadly gaming GPU but not cheap - TechnoSports Media Group,https://technosports.co.in/nvidia-geforce-rtx-4080-review/,-0.2,0.55,0.16377306964090405,0.49672149153040895
