標題,真實新聞連結,標題_情感極性,標題_主觀性,全文_情感極性,全文_主觀性
NVIDIA and Partners Explore the Future of Robotics at Automatica - NVIDIA Blog,https://blogs.nvidia.com/blog/automatica-robotics-trade-show/,0.0,0.125,0.16810882915534076,0.32294120608074095
Nvidia CEO tells EU Commissioner that chipmaker plans to invest in Europe - Investment Monitor,https://www.investmentmonitor.ai/news/nvidia-ceo-tells-eu-commissioner-that-chipmaker-plans-to-invest-in-europe/,0.0,0.0,0.19807724252491699,0.33483388704318934
Group test: Nvidia GeForce RTX 40 Series GPUs - CG Channel,https://www.cgchannel.com/2023/06/group-test-nvidia-geforce-rtx-40-series-gpus/,0.0,0.0,0.12912508865898695,0.4338419913419917
"Snowflake, Nvidia partner to enable generative AI app development in the Snowflake Data Cloud - VentureBeat",https://venturebeat.com/ai/snowflake-nvidia-partner-enable-generative-ai-application-development-snowflake-data-cloud/,0.0,0.0,0.19120046620046618,0.5281834831834831
"Alleged NVIDIA GeForce RTX 4090 Ti or Titan Ada Graphics Card Pictured Once Again, Massive Quad-Slot Cooler - Wccftech",https://wccftech.com/nvidia-geforce-rtx-4090-ti-titan-ada-graphics-card-pictured-once-again-massive-quad-slot-cooler/,-0.05,0.55,0.060967521252495396,0.44274230087701577
Ido Bukspan Appointed New CEO of Pliops - GlobeNewswire,https://www.globenewswire.com/news-release/2023/06/26/2694485/0/en/Ido-Bukspan-Appointed-New-CEO-of-Pliops.html,0.13636363636363635,0.45454545454545453,0.2328867028493893,0.49075644504748966
US export ban drives prices of Nvidia's latest GPUs sky high in China - The Register,https://www.theregister.com/2023/06/26/us_export_ban_of_nvidias/,0.33,0.72,0.11641458202526904,0.4135628387727624
This mysterious Nvidia GPU is an absolute monstrosity — and we just got another look - Digital Trends,https://www.digitaltrends.com/computing/nvidia-rtx-4090-ti-or-titan-pictured-again/,0.06666666666666667,0.6333333333333333,0.09922318422318423,0.4557161357161358
"Open-Source NVIDIA Vulkan Driver NVK Now Supports Older GPUs, New Extensions - 9to5Linux",https://9to5linux.com/open-source-nvidia-vulkan-driver-nvk-now-supports-older-gpus-new-extensions,0.1515151515151515,0.3939393939393939,0.25175026123301986,0.46483803552769065
Radeon RX 7600 Deals Arrive Just In Time To Spoil NVIDIA's RTX 4060 Launch Party - Hot Hardware,https://hothardware.com/news/rx-7600-deals-pre-rtx-4060-launch,0.25,0.8500000000000001,0.22362174325235012,0.4485812516419375
Nvidia European investment ‘extremely likely’ - 台北時報,https://www.taipeitimes.com/News/biz/archives/2023/06/26/2003802152,0.0,0.5,0.14161106094053102,0.4248210582647665
Beyond Nvidia: Does AI processing = GPUs? - TechSpot,https://www.techspot.com/news/99197-beyond-nvidia-does-ai-processing-gpus.html,0.0,0.0,0.11768221574344023,0.5016083576287657
NVIDIA GeForce RTX 4060 Ti Review: Upgrade or Not? - Beebom,https://beebom.com/nvidia-rtx-4060-ti-review/,0.0,0.0,0.09298922121649401,0.48077263309081525
Nvidia GeForce RTX 4060 benchmark leak shows 23% boost vs RTX 3060 - PCGamesN,https://www.pcgamesn.com/nvidia/geforce-rtx-4060-3dmark-leak,0.0,0.0,0.23316017316017315,0.5670129870129871
NVK Open-Source NVIDIA Vulkan Driver Progresses On Running Some Games - Phoronix,https://www.phoronix.com/news/NVK-Summer-2023-Status,0.0,0.0,0.09500962000962002,0.4665223665223666
Nvidia RTX 4060 outperforms the RTX 3060 12GB variant by 23% in 3DMark - KitGuru,https://www.kitguru.net/components/graphic-cards/joao-silva/nvidia-rtx-4060-outperforms-the-rtx-3060-12gb-variant-by-23-in-3dmark/,0.0,0.0,0.06794077134986226,0.5024793388429752
Alleged RTX 4090 Ti GPU cooler pops up and it’s ultra thicc - PCGamesN,https://www.pcgamesn.com/nvidia/rtx-4090-ti-cooler,-0.1,0.1,0.1975277326839827,0.3937432359307359
"This company's AI potential just 'blew everything out of the park', but can it live up to its surging share value? - ABC News",https://www.abc.net.au/news/2023-06-27/ai-has-helped-nvidia-share-price-surge-almost-200-per-cent/102469476,0.06818181818181818,0.75,0.05610521972032768,0.38701026192033366
"NVIDIA RTX 4060 Allegedly 23% Faster Than RTX 3060 12GB, According To 3DMark Tests - Pokde.Net",https://pokde.net/system/pc/gpu/nvidia-rtx-4060-allegedly-23-faster,-0.1,0.1,0.0914855072463768,0.43550724637681165
NVIDIA DGX GH200: A Game Changer for Generative AI - StorageReview.com,https://www.storagereview.com/news/nvidia-dgx-gh200-a-game-changer-for-generative-ai,-0.4,0.4,0.16100642832186454,0.5273867966485416
Nvidia Leads List Of America's Top 10 Semiconductor Companies - IBT Graphics - International Business Times,https://www.ibtimes.com/nvidia-leads-list-americas-top-10-semiconductor-companies-ibt-graphics-3702043,0.25,0.25,0.137037037037037,0.3777777777777777
Fix: Black Screen after Installing Nvidia Graphics Driver in Windows - Appuals,https://appuals.com/black-screen-installing-nvidia/,-0.16666666666666666,0.43333333333333335,0.06484698469846986,0.4685870729930134
Nvidia RTX 4090 Ti and its massive size leaks once again - Dexerto,https://www.dexerto.com/tech/nvidia-rtx-4090-ti-and-its-massive-size-leaks-once-again-2189435/,0.0,1.0,0.04322390572390573,0.4025673400673401
