標題,真實新聞連結,標題_情感極性,標題_主觀性,全文_情感極性,全文_主觀性
GeForce NOW-vember Brings Over 50 New Games to Stream In the Cloud - NVIDIA Blog,https://blogs.nvidia.com/blog/geforce-now-thursday-nov-2/,0.13636363636363635,0.45454545454545453,0.10818530128874965,0.41785527690700064
UF opens Malachowsky Hall for Data Science & Information Technology - University of Florida,https://news.ufl.edu/2023/11/malachowsky-hall/,0.0,0.0,0.10976658476658477,0.5468468468468468
University of Florida opens $150M tech center with help from Nvidia cofounder Chris Malachowsky - VentureBeat,https://venturebeat.com/ai/university-of-florida-opens-150m-tech-center-with-help-from-nvidia-cofounder-chris-malachowsky/,-0.1,0.1,0.1736842105263158,0.47192982456140353
"Intel Arc Goes Where NVIDIA Won't: A580 GPU Benchmarks & Review vs. A750, RX 6600, & More - GamersNexus",https://gamersnexus.net/gpus/intel-arc-goes-where-nvidia-wont-a580-gpu-benchmarks-review-vs-a750-rx-6600-more,0.5,0.5,0.11717278338945009,0.46692650312650325
Nvidia Revs North American Channel To Sell Workstation Version Of Banned-In-China A800 GPU - CRN,https://www.crn.com/news/components-peripherals/nvidia-revs-north-american-channel-to-sell-banned-in-china-a800-gpu,0.0,0.0,0.06113341204250293,0.4118949232585597
"With help from NVIDIA, a new $150 million hub for AI and data science at the University of Florida hopes to transform the future workforce - Fortune",https://fortune.com/education/articles/university-of-florida-nvidia-malachowsky-hall-jensen-huang-ben-sasse-ai/,0.06818181818181818,0.2897727272727273,0.21019564355831968,0.3323562587647088
Sanctions Change Means Hobbled 'China-Only' Nvidia A800 GPUs Now Diverted to Western Markets - Tom's Hardware,https://www.tomshardware.com/pc-components/gpus/sanctions-change-mean-cut-down-china-only-nvidia-a800-gpus-now-diverted-to-western-markets,0.0,0.0,0.13227271631876894,0.45858626023099697
Inside Nvidia's new hardware for Switch 2: what is the T239 processor? - Eurogamer,https://www.eurogamer.net/digitalfoundry-2023-inside-nvidias-latest-hardware-for-nintendo-what-is-the-t239-processor,0.13636363636363635,0.45454545454545453,0.1499193728202474,0.5067377755059976
China claims to have developed AI chip more powerful than US’s Nvidia - Interesting Engineering,https://interestingengineering.com/innovation/chinese-claim-ai-chip-more-efficient-nvidia,0.35,0.575,0.09300189393939397,0.4594247159090908
How to uninstall NVIDIA graphics drivers - Windows Central,https://www.windowscentral.com/gaming/how-to-uninstall-nvidia-graphics-drivers,0.0,0.25,0.1871851851851852,0.46959259259259256
"‘Starship for the Mind’: University of Florida Opens Malachowsky Hall, an Epicenter for AI and Data Science - NVIDIA Blog",https://blogs.nvidia.com/blog/starship-for-mind-uf-malachowsky-hall/,0.0,0.0,0.1275066844919786,0.5462477718360071
"Apple M2 Max GPU vs Nvidia V100, P100 and T4 - Towards Data Science",https://towardsdatascience.com/apple-m2-max-gpu-vs-nvidia-v100-p100-and-t4-8b0d18d08894/,0.0,0.0,0.12104035749197013,0.5135976951875577
ChipNeMo LLM helps Nvidia design chips - Techzine Europe,https://www.techzine.eu/news/applications/112863/chipnemo-llm-helps-nvidia-design-chips/,0.0,0.0,0.15742424242424247,0.42406371406371407
"Nvidia's RTX 40-Series Super Increased Performance, Not Power Consumption: Leak - Tom's Hardware",https://www.tomshardware.com/pc-components/gpus/nvidias-rtx-40-series-super-increased-performance-not-power-consumption-leak,0.3333333333333333,0.6666666666666666,0.1983640755379886,0.5456416168372691
How AI-Based Cybersecurity Strengthens Business Resilience - NVIDIA Blog,https://blogs.nvidia.com/blog/ai-cybersecurity-business-resilience/,0.0,0.0,0.12671203494573052,0.42030118733923066
How Are Foundation Models Used in Gaming? - NVIDIA Blog,https://blogs.nvidia.com/blog/foundation-models-gaming/,0.0,0.0,0.12510956674179818,0.5448293442095096
Best Modern Warfare 3 graphics settings for Nvidia RTX 4070 - Sportskeeda,https://www.sportskeeda.com/gaming-tech/best-modern-warfare-3-graphics-settings-nvidia-rtx-4070,0.6,0.3,0.339319142986963,0.4767026668064731
Best Ark: Survival Ascended graphics settings for Nvidia RTX 3070 and RTX 3070 Ti - Sportskeeda,https://www.sportskeeda.com/gaming-tech/best-ark-survival-ascended-graphics-settings-nvidia-rtx-3070-rtx-3070-ti,1.0,0.3,0.2819441793563195,0.40750093357122147
Best Call of Duty Modern Warfare 3 graphics settings for Nvidia RTX 3080 and RTX 3080 Ti - Sportskeeda,https://www.sportskeeda.com/gaming-tech/best-call-duty-modern-warfare-3-graphics-settings-nvidia-rtx-3080-rtx-3080-ti,0.6,0.3,0.343778761830338,0.42603108448380655
Solar-powered AI barges loaded with GPUs proposed to bypass AI regulations - DatacenterDynamics,https://www.datacenterdynamics.com/en/news/solar-powered-ai-barges-loaded-with-gpus-proposed-to-bypass-ai-regulations/,0.0,0.0,0.018214962121212118,0.39716418997668984
Best Ark: Survival Ascended graphics settings for Nvidia RTX 3060 and RTX 3060 Ti - Sportskeeda,https://www.sportskeeda.com/gaming-tech/best-ark-survival-ascended-graphics-settings-nvidia-rtx-3060-rtx-3060-ti,1.0,0.3,0.34808197808197777,0.47861159861159885
Best Modern Warfare 3 graphics settings for Nvidia RTX 2060 - Sportskeeda,https://www.sportskeeda.com/gaming-tech/best-modern-warfare-3-graphics-settings-nvidia-rtx-2060,0.6,0.3,0.3354213703409849,0.4842860390770363
Best Ark: Survival Ascended graphics settings for Nvidia RTX 3080 and RTX 3080 Ti - Sportskeeda,https://www.sportskeeda.com/gaming-tech/best-ark-survival-ascended-graphics-settings-nvidia-rtx-3080-rtx-3080-ti,1.0,0.3,0.2575489061203346,0.47486629772344097
"ECE Seminar Series – Nov 3 (Fri) @ 2:00pm: “NVIDIA NeMo Toolkit for Conversational AI: An Open Source Framework for Advanced Speech Models,”Jagadeesh Balam, Senior Research Manager & Taejin Park, Senior Research Scientist, NVIDIA | Electrical a - UCSB ECE",https://www.ece.ucsb.edu/events/all/2023/ece-seminar-series-nov-3-fri-200pm-nvidia-nemo-toolkit-conversational-ai-open,0.2,0.55,0.11694405917706888,0.4195677300046231
Best Modern Warfare 3 graphics settings for Nvidia RTX 4060 Ti - Sportskeeda,https://www.sportskeeda.com/gaming-tech/best-modern-warfare-3-graphics-settings-nvidia-rtx-4060-ti,0.6,0.3,0.2969896374750742,0.48222483737046895
NVIDIA & Partners Reallocating “China-Only” A800 AI GPU Supply As US Restrictions Go Into Affect - Wccftech,https://wccftech.com/nvidia-reallocating-china-only-a800-ai-gpu-supply-as-us-restrictions-go-into-affect/,0.0,0.0,0.008893192009783935,0.48243278395744776
Best Modern Warfare 3 graphics settings for Nvidia RTX 3060 Ti - Sportskeeda,https://www.sportskeeda.com/gaming-tech/best-modern-warfare-3-graphics-settings-nvidia-rtx-3060-ti,0.6,0.3,0.3089793012088093,0.47214836893525464
Best Modern Warfare 3 graphics settings for Nvidia RTX 2070 - Sportskeeda,https://www.sportskeeda.com/gaming-tech/best-modern-warfare-3-graphics-settings-nvidia-rtx-2070,0.6,0.3,0.413315082287045,0.4700418515371791
Best Modern Warfare 3 graphics options for Nvidia GTX 1660 Super - Sportskeeda,https://www.sportskeeda.com/gaming-tech/best-modern-warfare-3-graphics-options-nvidia-gtx-1660-super,0.5111111111111111,0.4222222222222222,0.3858181905902271,0.5105324192862194
"Elon Musk says AI will create a world ‘where no job is needed,’ but Nvidia billionaire Jensen Huang couldn’t disagree more: ‘Humans have a lot of ideas’ - Fortune",https://fortune.com/2023/11/03/elon-musk-versus-nvidia-ceo-jensen-huang-on-how-ai-will-affect-jobs-economy/,0.5,0.5,0.15954057679409794,0.3756371562709592
Best Modern Warfare 3 graphics settings for Nvidia RTX 2070 Super - Sportskeeda,https://www.sportskeeda.com/gaming-tech/best-modern-warfare-3-graphics-settings-nvidia-rtx-2070-super,0.5111111111111111,0.4222222222222222,0.34952772563392,0.4871398349274462
"Starfield will get official Nvidia DLSS support, Frame Generation soon - PCWorld",https://www.pcworld.com/article/2124242/starfield-will-get-official-nvidia-dlss-support-soon.html,0.0,0.0,0.10085137085137086,0.36783549783549785
Nvidia RTX 4090 Subject to China Export Restrictions Starting November 17 - Tom's Hardware,https://www.tomshardware.com/pc-components/gpus/nvidia-rtx-4090-subject-to-china-export-restrictions-starting-november-17,-0.08333333333333333,0.21666666666666667,0.15498113180678966,0.46450790802764463
Best Modern Warfare 3 graphics settings for Nvidia GTX 1660 Ti - Sportskeeda,https://www.sportskeeda.com/gaming-tech/best-modern-warfare-3-graphics-settings-nvidia-gtx-1660-ti,0.6,0.3,0.3378617035138775,0.4673555430077172
"2 Reasons to Buy Nvidia Stock, and 1 Reason to Sell - The Motley Fool",https://www.fool.com/investing/2023/11/03/2-reasons-to-buy-nvidia-stock-and-1-reason-to-sell/,0.6,0.9,0.28717603920502516,0.4501260709231718
Best Call of Duty Modern Warfare 3 graphics settings for Nvidia GTX 1650 and GTX 1650 Super - Sportskeeda,https://www.sportskeeda.com/gaming-tech/best-call-duty-modern-warfare-3-graphics-settings-nvidia-gtx-1650-gtx-1650-super,0.5111111111111111,0.4222222222222222,0.29258054018874097,0.46500271179086766
Starfield GPU Benchmarks & Comparison: The Best Graphics Cards for Starfield - GamersNexus,https://gamersnexus.net/game-benchmarks-graphics-guides/starfield-gpu-benchmarks-comparison-best-graphics-cards-starfield,1.0,0.3,0.06672885447885446,0.429851370851371
"Good News For Alibaba - ACCEL Chip Outshines Nvidia's AI Chips, China Claims - Benzinga",https://www.benzinga.com/government/23/11/35556758/good-news-for-alibaba-accel-chip-outshines-nvidias-ai-chips-china-claims,0.7,0.6000000000000001,0.17155660723457336,0.47859600851126227
Best Modern Warfare 3 graphics settings for Nvidia RTX 4070 Ti - Sportskeeda,https://www.sportskeeda.com/gaming-tech/best-modern-warfare-3-graphics-settings-nvidia-rtx-4070-ti,0.6,0.3,0.33862026862026845,0.4671794871794874
"Dell Made an Impressive RTX 4090: Relatively Small, Large Flow-Through, & Good Cooling - GamersNexus",https://gamersnexus.net/gpus/dell-made-impressive-rtx-4090-relatively-small-large-flow-through-good-cooling,0.41607142857142854,0.6071428571428572,0.15343574612848357,0.45553891670092816
Nvidia may cancel chip orders worth $5 billion from China - TechNode,https://technode.com/2023/11/03/nvidia-may-cancel-chip-orders-worth-5-billion-from-china/,0.3,0.1,0.06977272727272728,0.36924242424242426
Can NVIDIA RTX4090 run Call of Duty: Modern Warfare 3 Single-Player Campaign with 60fps at Native 4K/Max Settings? - DSOGaming,https://www.dsogaming.com/pc-performance-analyses/can-nvidia-rtx4090-run-call-of-duty-modern-warfare-3-single-player-campaign-with-60fps-at-native-4k-max-settings/,0.2,0.3,0.17917899929527836,0.39395348837209304
What do we know about the Switch 2’s hardware power? - Ars Technica,https://arstechnica.com/gaming/2023/11/what-do-we-know-about-the-switch-2s-hardware-power/,0.0,0.0,0.1462892401099948,0.4604000925699038
AMD rises as AI chip sales prediction bodes well for rivalry with Nvidia - ETAuto,https://auto.economictimes.indiatimes.com/news/auto-components/amd-rises-as-ai-chip-sales-prediction-bodes-well-for-rivalry-with-nvidia/104910639,0.0,0.0,0.14574762629557145,0.4309114300210191
50+ New NVIDIA GeForce NOW games arriving this month - Geeky Gadgets,https://www.geeky-gadgets.com/nvidia-geforce-now-games/,0.13636363636363635,0.45454545454545453,0.11737865348159478,0.4511828367710726
NVIDIA GeForce Now will add over 50 PC games to stream and play in November - Neowin,https://www.neowin.net/news/nvidia-geforce-now-will-add-over-50-pc-games-to-stream-and-play-in-november/,0.0,0.0,0.15763212481962488,0.4295492123617118
Starfield To Receive Official Nvidia DLSS Support Soon - ClutchPoints,https://clutchpoints.com/gaming/starfield-to-receive-official-nvidia-dlss-support-soon,0.0,0.0,-0.035049019607843145,0.4085784313725491
RoboCop: Rogue City Best Settings for PC and Consoles - MP1st,https://mp1st.com/news/robocop-rogue-city-best-settings-for-pc-and-consoles,1.0,0.3,0.17328159533855728,0.39942033353425743
"NVIDIA Hotfix driver fixes Windows 10 transparency, random BSODs, Alan Wake 2 performance - Neowin",https://www.neowin.net/news/nvidia-hotfix-driver-fixes-windows-10-transparency-random-bsods-alan-wake-2-performance/,-0.5,0.5,0.10663443699157985,0.4373031730174584
AMD’s RX 7900 XTX is 30% Faster than the NVIDIA RTX 4080 in Call of Duty: MW3 - Hardware Times,https://hardwaretimes.com/amds-rx-7900-xtx-is-30-faster-than-the-nvidia-rtx-4080-in-call-of-duty-mw3/,0.0,0.0,0.0005208333333333315,0.3260416666666667
[Top 15] Rainbow 6 Siege Best Nvidia Settings That Give You An Advantage - Gamers Decide,https://www.gamersdecide.com/articles/rainbow-6-siege-best-nvidia-settings,0.75,0.4,0.13719523588656246,0.475110658332598
