標題,真實新聞連結,標題_情感極性,標題_主觀性,全文_情感極性,全文_主觀性
NVIDIA to Reveal New AI Innovations at CES 2024 - NVIDIA Blog,https://blogs.nvidia.com/blog/ai-innovations-ces-2024/,0.13636363636363635,0.45454545454545453,0.04127705627705627,0.4495887445887446
"The secrets of Nvidia, a company sweeping the stock market on the back of artificial intelligence - EL PAÍS USA",https://english.elpais.com/economy-and-business/2023-12-20/the-secrets-of-nvidia-a-company-sweeping-the-stock-market-on-the-back-of-artificial-intelligence.html,-0.3,0.5,0.10869859307359307,0.46097943722943735
Feel Like You Missed the Nvidia Train? Think Again. - The Motley Fool,https://www.fool.com/investing/2023/12/19/feel-like-you-missed-the-nvidia-train-think-again/,0.6,0.9,0.34298962222533147,0.5172700194034069
"Intel CEO laments Nvidia's 'extraordinarily lucky' AI dominance, claims it coulda-woulda-shoulda have been Intel - PC Gamer",https://www.pcgamer.com/intel-ceo-laments-nvidias-extraordinarily-lucky-ai-dominance-claims-it-coulda-woulda-shoulda-have-been-intel/,0.3333333333333333,0.8333333333333334,0.17284449486256726,0.47500971418140114
Nvidia Workers Warned CEO Jensen Huang That AI Might Be Harmful to Minorities: Report - Business Insider,https://www.businessinsider.com/nvidia-workers-quit-warned-ceo-jensen-huang-ai-harmful-minorities-2023-12,0.0,0.0,0.04713264722698686,0.40507228620436164
NVIDIA Corporation (NVDA) Stock Tripled in 2023 - Yahoo Finance,https://finance.yahoo.com/news/nvidia-corporation-nvda-stock-tripled-131846035.html,0.0,0.0,0.1510646900269542,0.3285624438454627
NVIDIA A800 40GB Active: When Precision is Paramount in Engineering - ENGINEERING.com,https://www.engineering.com/nvidia-a800-40gb-active-when-precision-is-paramount-in-engineering/,-0.13333333333333333,0.6,0.1585376267568049,0.5255331198481881
Cerence (CRNC) Launches CaLLM in Collaboration With NVIDIA - Nasdaq,https://www.nasdaq.com/articles/cerence-crnc-launches-callm-in-collaboration-with-nvidia,0.0,0.0,0.13011286332714908,0.46830705009276424
Nvidia GeForce RTX 40 Release Dates Leak Online - GameRant,https://gamerant.com/nvidia-geforce-rtx-40-release-dates-leak/,0.0,0.0,0.1261154291836111,0.496777460754733
DLSS 3.5 Integration in D5 Render Marks New Era of Real-Time Rendering - NVIDIA Blog,https://blogs.nvidia.com/blog/studio-dlss-gilmour-blender-davinci-resolve-unreal-engine/,0.13636363636363635,0.45454545454545453,0.22156965058750774,0.5525394248608534
This Big Pharma Is Teaming Up With Nvidia to Make Drugs With AI. Here's What You Need to Know - The Motley Fool,https://www.fool.com/investing/2023/12/20/this-big-pharma-is-teaming-up-with-nvidia-to-make/,0.3,0.5,0.27100070212157057,0.45598614539730153
NVIDIA (NVDA) Up 243% YTD: Will It Carry Momentum in 2024? - Yahoo Finance,https://finance.yahoo.com/news/nvidia-nvda-243-ytd-carry-133100920.html,0.0,0.0,0.10829393939393939,0.5818575757575758
Into the Omniverse: Foundry Nuke’s OpenUSD Enhancements Ring in a 3D Renaissance - NVIDIA Blog,https://blogs.nvidia.com/blog/nuke-openusd-enhancements-3d-renaissance/,0.0,0.0,0.21239525355596786,0.48645640074211494
Nvidia Stock Could Face a Tougher 2024 After These 2 Recent Developments - The Motley Fool,https://www.fool.com/investing/2023/12/19/nvidia-stock-could-face-a-tougher-2024-after-these/,0.3,0.575,0.3048127452039026,0.4973717441121059
Nvidia Is Investing in Biotech Like Wild. Here's What It Means for the Stock. - The Motley Fool,https://www.fool.com/investing/2023/12/19/nvidia-is-investing-in-biotech-heres-what-it-means/,0.35,0.65,0.30012909204085764,0.5137905939376505
Where Will Nvidia Stock Be in 5 Years? - The Motley Fool,https://www.fool.com/investing/2023/12/20/where-will-nvidia-stock-be-in-5-years/,0.6,0.9,0.2842398141225429,0.4723670710557695
Don’t Bet AMD Stock Can Rise On $400 Billion AI Chip Market - Forbes,https://www.forbes.com/sites/petercohan/2023/12/20/dont-bet-amd-stock-can-rise-on-150-billion-ai-chip-market/,0.0,0.0,0.12962011828516684,0.5095505142107084
NVIDIA First To Offer Driver Support For New Vulkan H.265 & H.264 Video Encode Extensions - Wccftech,https://wccftech.com/nvidia-first-to-offer-driver-support-new-vulkan-h-265-h-264-video-encode-extensions/,0.19318181818181818,0.3939393939393939,0.12621107628004188,0.47471891327063737
NVIDIA hosts Investor Day to support Israeli AI startups - CTech,https://www.calcalistech.com/ctechnews/article/hkblrrrl6,0.0,0.0,0.20415162454873662,0.4950661853188933
This Mod Enables AMD's FSR 3 Frame Generation On Any NVIDIA DLSS 3 Title - Hot Hardware,https://hothardware.com/news/fsr3-replace-dlss3-mod,0.225,0.625,0.15077419299860256,0.4693522968719831
Nvidia Planning January RTX 40-Series Super Launch With RTX 4070 Super - Forbes,https://www.forbes.com/sites/antonyleather/2023/12/20/nvidia-planning-january-rtx-40-series-super-launch-with-rtx-4070-super/,0.3333333333333333,0.6666666666666666,0.20058648546353472,0.516705580394105
"NVIDIA GeForce RTX 3050 6 GB GPU Launch Pushed Back To February, Priced At $179 US - Wccftech",https://wccftech.com/nvidia-geforce-rtx-3050-6-gb-gpu-launch-february-priced-179-usd/,0.0,0.0,0.08661217437533228,0.4666298321561481
How This Nvidia Cofounder Got A Quantum Computer for RPI - Forbes,https://www.forbes.com/video/6343611552112/how-this-nvidia-cofounder-got-a-quantum-computer-for-rpi/,0.0,0.0,0.19411764705882353,0.4607843137254901
CoreWeave buys thousands of Dell PowerEdge servers - DatacenterDynamics,https://www.datacenterdynamics.com/en/news/coreweave-buys-thousands-of-dell-poweredge-servers/,0.0,0.0,0.1847382920110193,0.4237524596615507
"Nvidia RTX 3050 6GB could launch in February – but if the spec and pricing rumors are right, it’ll be a disappointing budget GPU - TechRadar",https://www.techradar.com/computing/gpu/nvidia-rtx-3050-6gb-could-launch-in-february-but-if-the-spec-and-pricing-rumors-are-right-itll-be-a-disappointing-budget-gpu,-0.15714285714285714,0.6178571428571429,0.24109944801692376,0.5303876140041189
Nvidia rumored to focus on making tons of new RTX 4070 Super GPUs to battle AMD’s 7800 XT - TechRadar,https://www.techradar.com/computing/gpu/nvidia-rumored-to-focus-on-making-tons-of-new-rtx-4070-super-gpus-in-effort-to-battle-amds-rx-7800-xt-which-is-flying-off-shelves,0.23484848484848483,0.5606060606060606,0.24285314981879869,0.4798945011731269
China's GPU contender Moore Threads reveals card that can cope with Nvidia’s CUDA - The Register,https://www.theregister.com/2023/12/20/moore_threads_mtt_s4000_gpu/,0.0,0.0,0.21002886002886,0.4038961038961039
Nvidia RTX 3050 6GB expected to launch in February below $200 - Club386,https://www.club386.com/nvidia-rtx-3050-6gb-expected-to-launch-in-february-below-200/,-0.1,0.4,0.11556637806637804,0.4716630591630591
The reveal and release dates for the new RTX 40-series Super cards have been leaked and January's going to be a busy ol' month - PC Gamer,https://www.pcgamer.com/the-reveal-and-release-dates-for-the-new-rtx-40-series-super-cards-have-been-leaked-and-januarys-going-to-be-a-busy-ol-month/,0.1898989898989899,0.47373737373737373,0.15041263606078425,0.43427573797944186
Cerence and Nvidia Debut Automotive Large Language Model CaLLM to Power New Generative AI Features - Voicebot.ai,https://voicebot.ai/2023/12/20/cerence-and-nvidia-debut-automotive-large-language-model-callm-to-power-new-generative-ai-features/,0.17532467532467533,0.44155844155844154,0.21109278109278112,0.42667778167778175
The Finals settings for max fps and performance - PCGamesN,https://www.pcgamesn.com/the-finals/best-settings,0.0,0.0,0.19752156177156183,0.4496025641025639
GTA V NVIDIA DLSS 3 Frame Generation + DLAA Mod Doubles Performance While Providing Most Stable Image Yet - Wccftech,https://wccftech.com/gta-v-nvidia-dlss-3-frame-generation-dlaa-mod-doubles-performance/,0.35,0.45,0.1513899868247694,0.4908214651692912
NVIDIA’s Tech Strategy of 2023: A Comprehensive Report - Analytics Insight,https://www.analyticsinsight.net/latest-news/nvidias-tech-strategy-of-2023-a-comprehensive-report,0.0,0.0,0.19041184986257703,0.5459339529614172
Comparing NVIDIA’s Two Mid-Range GPUs: RTX 4060 vs RTX 4070 - Pokde.Net,https://pokde.net/blog/nvidia-mid-range-gpu-rtx-4060-4070-compare,0.0,0.0,0.12136984462565857,0.44165794154166255
Best GPUs for Blender - XDA Developers,https://www.xda-developers.com/best-gpus-for-blender/,1.0,0.3,0.2827763411495469,0.5008376047132029
Intel Battlemage GPU specs confirmed & they could take on Nvidia & AMD - Dexerto,https://www.dexerto.com/tech/intel-battlemage-gpu-specs-confirmed-they-could-take-on-nvidia-amd-2439834/,0.4,1.0,0.06657808241141577,0.5277441077441077
RTX 4080 Vs RTX 3090: We Benchmarked Both - Tech4Gamers,https://tech4gamers.com/rtx-4080-vs-rtx-3090/,0.0,0.0,0.2006614205917874,0.5228055006587615
