標題,真實新聞連結,標題_情感極性,標題_主觀性,全文_情感極性,全文_主觀性
Have Investors Missed the Boat on Nvidia? - The Motley Fool,https://www.fool.com/investing/2024/03/02/have-investors-missed-the-boat-on-nvidia/,0.6,0.9,0.32374139618858033,0.5260384275349044
Nvidia CEO: Artificial General Intelligence Could Be 5 Years Away - PYMNTS.com,https://www.pymnts.com/artificial-intelligence-2/2024/nvidia-ceo-artificial-general-intelligence-could-be-5-years-away/,-0.27499999999999997,0.75,-0.0038132490654745775,0.3794821894228422
"Nvidia's next-gen AI GPUs could draw an astounding 1000 Watts each, a 40 percent increase — Dell spills the beans on B100 and B200 in its earnings call - Tom's Hardware",https://www.tomshardware.com/tech-industry/artificial-intelligence/nvidias-b100-and-b200-processors-could-draw-an-astounding-1000-watts-per-gpu-dell-spills-the-beans-in-earnings-call,0.6,1.0,0.1391524188493886,0.4538665150786361
90 Billion Reasons Why Buying Nvidia Stock Is a No-Brainer Right Now - Nasdaq,https://www.nasdaq.com/articles/90-billion-reasons-why-buying-nvidia-stock-is-a-no-brainer-right-now,0.2857142857142857,0.5357142857142857,0.1694924977934687,0.5027745232114162
"GPU prices aren't actually that expensive — no, really - TechRadar",https://www.techradar.com/computing/gpu/gpu-prices-arent-actually-that-expensive-no-really,-0.19999999999999998,0.3333333333333333,0.17776285583103768,0.503707652826971
Nvidia CEO Jensen Huang says AI could pass most human tests in 5 years - Fox Business,https://www.foxbusiness.com/technology/nvidia-ceo-jensen-huang-says-ai-could-pass-most-human-tests-5-years,0.25,0.3,0.07445767195767196,0.48719576719576707
Nvidia might release its own handheld gaming PC - XDA Developers,https://www.xda-developers.com/nvidia-might-release-handheld-gaming-pc/,0.6,1.0,0.2380660501115046,0.5703734000487246
"Chipmaker Nvidia surges past Saudi Aramco, becomes world’s third-largest company - Mint",https://www.livemint.com/companies/news/chipmaker-nvidia-surges-past-saudi-aramco-becomes-worlds-third-largest-company-11709340408631.html,-0.25,0.25,0.08997099470253825,0.4168839884947271
[INTERVIEW] Why Tenstorrent CEO Jim Keller isn't worried about Nvidia - The Korea JoongAng Daily,https://koreajoongangdaily.joins.com/news/2024-03-03/business/tech/INTERVIEW-Why-Tenstorrent-CEO-Jim-Keller-isnt-worried-about-Nvidia/1993570,0.0,0.0,0.0,0.0
Huawei’s 910B ‘ascends’ amidst US sanctions to rival Nvidia GPU - Interesting Engineering,https://interestingengineering.com/innovation/huawei-ascend-910b-nvidia-rival,0.5,0.5,0.0844083694083694,0.4092911255411255
"Nvidia Is Making a Lot of Money Selling Artificial Intelligence (AI) Chips, but You May Be Surprised About How Much It Could Make From This Traditional Market - The Motley Fool",https://www.fool.com/investing/2024/03/02/nvidia-is-making-a-lot-of-money-selling-artificial/,0.06,0.75,0.2812195462048303,0.5173981240037477
"Nvidia wants to democratize AI with new RTX 500, RTX 1000 laptop GPUs — but I cannot help wonder whether Nvidia RTX 4000 GPUs are a better choice - TechRadar",https://www.techradar.com/pro/nvidia-wants-to-democratize-ai-with-new-rtx-500-rtx-1000-laptop-gpus-but-i-cannot-help-wonder-whether-nvidia-rtx-4000-gpus-are-a-better-choice,0.2787878787878788,0.35151515151515156,0.1859969318707183,0.4362827302147688
Nvidia Stock Still May Not Be Nearly As Expensive As You Think - Nasdaq,https://www.nasdaq.com/articles/nvidia-stock-still-may-not-be-nearly-as-expensive-as-you-think,-0.5,0.7,0.1851600260580843,0.5080898470461575
"Even After Rallying 239% in 1 Year, Nvidia Stock Still Isn't Expensive According to This Key Metric - The Motley Fool",https://www.fool.com/investing/2024/03/02/even-after-rallying-239-in-1-year-nvidia-stock-sti/,0.033333333333333326,0.8666666666666667,0.27263593308521417,0.49996115778050393
"Nvidia's Revenue From This Business Soared More than 1,000% in 4 Years - Nasdaq",https://www.nasdaq.com/articles/nvidias-revenue-from-this-business-soared-more-than-1000-in-4-years?time=1709375700,0.5,0.5,0.23360770402437067,0.5497913043746374
Could Nvidia Deliver Another 5X Gain by 2030? Here's Why It's Not Out of the Question. - The Motley Fool,https://www.fool.com/investing/2024/03/03/could-nvidia-deliver-another-5x-gain-by-2030-heres/,0.6,0.9,0.29601235407192095,0.5281278228390134
Cathie Wood's Ark Invest Is Selling Nvidia Stock and Buying This Artificial Intelligence (AI) Stock - The Motley Fool,https://www.fool.com/investing/2024/03/03/cathie-wood-selling-nvidia-stock-buying-ai-stock/,0.0,0.95,0.26134987687971334,0.48334279993744805
"Nvidia's Revenue From This Business Soared More than 1,000% in 4 Years - The Motley Fool",https://www.fool.com/investing/2024/03/02/nvidia-revenue-from-this-business-soared-more-than/,0.55,0.7,0.3503290360046468,0.5218428571428564
"""Motley Fool Money"" Looks at Nvidia - Nasdaq",https://www.nasdaq.com/articles/motley-fool-money-looks-at-nvidia,0.6,0.9,0.19529791530018817,0.500822559763469
Nvidia CEO Jensen Huang says AI could pass human tests in five years - The Economic Times,https://economictimes.indiatimes.com/tech/technology/nvidia-ceo-jensen-huang-says-ai-could-pass-human-tests-in-five-years/articleshow/108154506.cms?from=mdr,0.1,0.15000000000000002,0.00850179694519315,0.5097259658580413
"Nvidia CEO Jensen Huang predicts, ‘Artificial General Intelligence could emerge within 5 years!’ - Mint",https://www.livemint.com/ai/nvidia-ceo-jensen-huang-predicts-artificial-general-intelligence-could-emerge-within-5-years-11709362762628.html,-0.26875,0.75,0.06932486540843488,0.43484149467152405
RTX 4080 Super Vs RTX 3080: We Benchmarked Both - Tech4Gamers,https://tech4gamers.com/rtx-4080-super-vs-rtx-3080/,0.3333333333333333,0.6666666666666666,0.24116001524134065,0.5600636021720361
