標題,真實新聞連結,標題_情感極性,標題_主觀性,全文_情感極性,全文_主觀性
Nvidia Economics: Make $5-$7 for Every $1 Spent on GPUs - HPCwire,https://www.hpcwire.com/2024/06/30/nvidia-economics-make-5-7-for-every-1-spent-on-gpus/,-0.1,0.1,0.1189959560329931,0.4023524486487448
Why Nvidia stock is now in treacherous waters: Morning Brief - Yahoo Finance,https://finance.yahoo.com/news/why-nvidia-stock-is-now-in-treacherous-waters-morning-brief-100140753.html,0.0,0.3333333333333333,0.0599066913111857,0.5613488010117222
Is Nvidia Stock Actually Undervalued? - The Motley Fool,https://www.fool.com/investing/2024/06/29/is-nvidia-stock-actually-undervalued/,0.3,0.5,0.2809915557485544,0.47720897881278723
Nvidia (NVDA) vs. Microsoft (MSFT): A Battle of AI Giants - Nasdaq,https://www.nasdaq.com/articles/nvidia-nvda-vs-microsoft-msft-battle-ai-giants,0.0,0.0,0.12574940582293526,0.46554834054834054
"Alibaba Cloud ditches Nvidia's interconnect in favor of Ethernet — tech giant uses own High Performance Network to connect 15,000 GPUs inside data center - Tom's Hardware",https://www.tomshardware.com/tech-industry/alibaba-cloud-ditches-nvidias-interconnect-in-favor-of-ethernet-tech-giant-uses-own-high-performance-network-to-connect-15000-gpus-inside-data-center,0.165,0.66,0.11642153501064391,0.44651958052948154
"DLSS 4 could be amazing, and Nvidia needs it to be - Digital Trends",https://www.digitaltrends.com/computing/dlss-4-could-be-amazing-nvidia-needs-it-to-be/,0.30000000000000004,0.45,0.13635305302432374,0.49171880605582297
"Nvidia will produce such a massive ‘cash gusher’ that it will have to buy back more stock because all that money has nowhere else to go, analyst says - Fortune",https://fortune.com/2024/06/29/nvidia-stock-buyback-outlook-cash-pile-dividend-shareholder-returns-ai/,0.125,0.5,0.14522283272283273,0.394490231990232
Nvidia's Broadcast AI app turns any room into a studio - Creative Bloq,https://www.creativebloq.com/3d/video-game-design/content-creators-are-using-ai-powered-features-for-a-studio-quality-setup,0.5,1.0,0.18911665676371567,0.5283580907110318
Best Fortnite graphics settings for Nvidia RTX 4060 and RTX 4060 Ti - Sportskeeda,https://www.sportskeeda.com/gaming-tech/best-fortnite-graphics-settings-nvidia-rtx-4060-rtx-4060-ti,1.0,0.3,0.2593051729415361,0.48426691153963936
What Would You Do If Nvidia Plunged 66%? History Suggests a Massive Decline is Coming. - The Motley Fool,https://www.fool.com/investing/2024/06/30/what-would-you-do-if-nvidia-plunged-66-history-sug/,0.3,0.95,0.27784003326644385,0.5262943668359751
Nvidia Stock Is Up 149% This Year. Here Are 2 Stocks That Could Outperform It the Rest of 2024. - Yahoo Finance,https://finance.yahoo.com/news/nvidia-stock-149-2-stocks-085500636.html,0.0,0.0,0.2254889688624629,0.4737127330500823
Is Nvidia Going to Crash in the Second Half of 2024? History Weighs in and Offers a Big Clue - The Motley Fool,https://www.fool.com/investing/2024/06/29/nvidia-going-to-crash-history-weighs-in-big-clue/,0.10666666666666666,0.23333333333333334,0.23974339185404775,0.46619697242647873
"With 67% ownership, NVIDIA Corporation (NASDAQ:NVDA) boasts of strong institutional backing - Yahoo Finance",https://finance.yahoo.com/news/67-ownership-nvidia-corporation-nasdaq-130129692.html,0.4333333333333333,0.7333333333333333,0.17770450461488202,0.5046830842113863
"Forget Nvidia: Here's Another Spectacular Semiconductor Stock to Buy Right Now, According to Wall Street - The Motley Fool",https://www.fool.com/investing/2024/06/30/forget-nvidia-semiconductor-stock-buy-wall-street/,0.49523809523809526,0.7785714285714286,0.26590218041545466,0.5026221713389835
Best Fortnite graphics settings for Nvidia RTX 4070 and RTX 4070 Ti - Sportskeeda,https://www.sportskeeda.com/gaming-tech/best-fortnite-graphics-settings-nvidia-rtx-4070-rtx-4070-ti,1.0,0.3,0.2757664233576633,0.5221248986212494
Best Fortnite graphics settings for Nvidia RTX 3070 and RTX 3070 Ti in 2024 - Sportskeeda,https://www.sportskeeda.com/gaming-tech/best-fortnite-chapter-4-graphics-settings-nvidia-geforce-rtx-3070-rtx-3070-ti-2023,1.0,0.3,0.272824646919135,0.46838895138107733
Stop buying these 10 GPUs in 2024 (here's what to buy instead) - XDA Developers,https://www.xda-developers.com/never-buy-these-gpus-what-to-buy-instead/,0.0,0.0,0.13919599970736335,0.5158339942885398
Best Fortnite graphics settings for Nvidia RTX 3090 and RTX 3090 Ti - Sportskeeda,https://www.sportskeeda.com/gaming-tech/best-fortnite-graphics-settings-nvidia-rtx-3090-rtx-3090-ti,1.0,0.3,0.3594555112881801,0.4910756972111558
CNA Explains: The story of Nvidia's rise to become the world's No 1 company - CNA,https://www.channelnewsasia.com/singapore/nvidia-story-ai-semiconductors-chips-jensen-huang-cna-explains-4442656,0.0,0.0,0.0955438029852092,0.43040956656191054
