標題,真實新聞連結,標題_情感極性,標題_主觀性,全文_情感極性,全文_主觀性
Byte-Sized Courses: NVIDIA Offers Self-Paced Career Development in AI and Data Science - NVIDIA Blog,https://blogs.nvidia.com/blog/ai-data-science-career-development/,0.1,0.0,0.17898074148074145,0.4630841380841379
NPUs are Emerging as the Main Rival to NVIDIA’s AI Dominance - insideAI News,https://insideainews.com/2024/07/20/npus-are-emerging-as-the-main-rival-to-nvidias-ai-dominance/,0.16666666666666666,0.3333333333333333,0.11331435955348992,0.46539278475148116
3 Things Every Nvidia Investor Must Know - The Motley Fool,https://www.fool.com/investing/2024/07/20/3-things-every-nvidia-investors-must-know/,0.6,0.9,0.28969267002193905,0.4888923086849906
A Big Nvidia Stake Sends Another AI Stock Soaring - Investopedia,https://www.investopedia.com/nvidia-stake-sends-serve-robotics-stock-soaring-8680765,0.0,0.1,0.1835206907787553,0.40543336591723683
Nvidia Stock (NASDAQ:NVDA): Analysts Are Divided. Is It Overvalued? - Yahoo Finance,https://finance.yahoo.com/news/nvidia-stock-nasdaq-nvda-analysts-203643941.html,0.0,0.0,0.12332317887873441,0.43103789214900334
NVDA Stock Forecast: Will Nvidia Become a $4 Trillion Company This Year? - Nasdaq,https://www.nasdaq.com/articles/nvda-stock-forecast-will-nvidia-become-4-trillion-company-year,0.0,0.0,0.1568927681265344,0.45399355334420266
"Arrcus raises $30m in funding round, featuring participation from Nvidia - DatacenterDynamics",https://www.datacenterdynamics.com/en/news/arrcus-raises-30m-in-funding-round-featuring-participation-from-nvidia/,-0.2,0.4,0.07549407114624503,0.3195816864295125
"Nvidia GPU partners reportedly cheap out on thermal paste, causing 100C hotspot temperatures — cheap paste allegedly degrades in a few months - Tom's Hardware",https://www.tomshardware.com/pc-components/gpus/nvidia-gpu-partners-reportedly-cheap-out-on-thermal-paste-cheap-paste-allegedly-degrades-in-a-few-months-causing-over-100oc-hotspot-temperatures,0.125,0.4,0.13066581398399588,0.557470943198216
"AI’s new frontier: Hugging Face, Nvidia, and OpenAI lead charge in small language models - VentureBeat",https://venturebeat.com/ai/ais-new-frontier-hugging-face-nvidia-and-openai-lead-charge-in-small-language-models/,-0.05681818181818182,0.42727272727272725,0.10547699522699525,0.5328172938172938
Serve Robotics stock soars 241% after Nvidia takes $4 million stake in the company - Markets Insider,https://markets.businessinsider.com/news/stocks/serve-robotics-stock-price-soars-nvidia-discloses-investment-stake-serv-2024-7,0.0,0.0,0.04150432900432901,0.28325517075517076
SERV Stock Soars as Nvidia Reveals Big Bet on Serve Robotics - InvestorPlace,https://investorplace.com/2024/07/serv-stock-soars-as-nvidia-reveals-big-bet-on-serve-robotics/,0.0,0.1,0.10635521885521884,0.3991822991822992
Magnetic Marvels: NVIDIA’s Supercomputers Spin a Quantum Tale - NVIDIA Blog,https://blogs.nvidia.com/blog/quantum-research-gpus/,0.0,0.0,0.12331388418344942,0.5384450090971827
Opinion: This Nvidia Forecast All but Confirms That the Artificial Intelligence (AI) Bubble Will Burst Sooner Rather Than Later - The Motley Fool,https://www.fool.com/investing/2024/07/20/nvidia-forecast-confirms-the-ai-bubble-will-burst/,0.0,0.6333333333333333,0.24196406749299848,0.46864800210504326
"The CEO of Nvidia Just Sold 700,000 Shares of His Company's Stock. Here's What Investors Need to Know. - Yahoo Finance",https://finance.yahoo.com/news/ceo-nvidia-just-sold-700-101500926.html,0.0,0.0,0.16500663315179442,0.4532341314599378
Jensen Huang Just Sold Nvidia Stock. Should You? - The Motley Fool,https://www.fool.com/investing/2024/07/20/jensen-huang-just-sold-nvidia-stock-should-you/,0.6,0.9,0.3123384322495082,0.5255846780543614
Where Will Nvidia Stock Be in 20 Years? - The Motley Fool,https://www.fool.com/investing/2024/07/20/where-will-nvidia-stock-be-in-20-years/,0.6,0.9,0.2692902948845095,0.514216452472902
Prediction: This Stock Will Benefit Even More Than Nvidia From the AI Boom - The Motley Fool,https://www.fool.com/investing/2024/07/19/prediction-this-stock-will-benefit-even-more-than/,0.55,0.7,0.31938364185565643,0.5251728774956375
Nvidia Recently Completed a 10-for-1 Stock Split: Here Are the 3 Likeliest Candidates to Become Wall Street's Next Stock-Split Stocks - The Motley Fool,https://www.fool.com/investing/2024/07/19/nvidia-recently-completed-a-10-for-1-stock-split/,0.19999999999999998,0.3833333333333333,0.2511325065014601,0.4687904237016289
Blackwell Demand to Benefit Both Nvidia and Taiwan Semiconductor. Is It Time to Buy Both Stocks? - The Motley Fool,https://www.fool.com/investing/2024/07/19/blackwell-demand-to-benefit-both-nvidia-and-taiwan/,0.6,0.9,0.3229998907193401,0.5117185749801916
Nvidia and Broadcom Completed 10-for-1 Stock Splits. History Says the Artificial Intelligence (AI) Stocks Will Do This Next - The Motley Fool,https://www.fool.com/investing/2024/07/19/nvidia-broadcom-stock-split-ai-stock-will-do-next/,0.0,0.6333333333333333,0.25990913679959665,0.49104576813057166
Nvidia cuts GeForce Now pricing in half — Priority and Ultimate memberships 50% off for a limited time - Tom's Hardware,https://www.tomshardware.com/video-games/cloud-gaming/nvidia-cuts-geforce-now-pricing-in-half-priority-and-ultimate-memberships-50-off-for-a-limited-time,-0.07936507936507936,0.4365079365079365,0.09123648493213712,0.4695640671727626
Interview: Nvidia on AI workload demands and storage performance - ComputerWeekly.com,https://www.computerweekly.com/feature/Interview-Nvidia-on-AI-workload-demands-and-storage-performance,0.0,0.0,0.09752637418603806,0.48056577176325066
Nvidia weighs in on Arrcus $30M funding round - Mobile World Live,https://www.mobileworldlive.com/network-tech/nvidia-weighs-in-on-arrcus-30m-funding-round/,-0.03181818181818183,0.45,0.09781024531024529,0.34010037348272654
3 reasons why I’m more excited about Intel Battlemage than Nvidia Blackwell - XDA Developers,https://www.xda-developers.com/im-more-excited-about-battlemage-than-blackwell/,0.4375,0.625,0.14106668674967637,0.5125782865473586
"CNBC Daily Open: Dow drops, Netflix beats estimates, Nvidia rebounds - CNBC",https://www.cnbc.com/2024/07/19/cnbc-daily-open-dow-drops-netflix-beats-estimates-nvidia-rebounds.html,0.0,0.25,0.05554681782622953,0.4074196341108105
Best Once Human graphics settings for Nvidia RTX 4060 and RTX 4060 Ti - Sportskeeda,https://www.sportskeeda.com/gaming-tech/best-once-human-graphics-settings-nvidia-rtx-4060-rtx-4060-ti,0.5,0.2,0.27315738025415387,0.43696969696969745
