標題,真實新聞連結,標題_情感極性,標題_主觀性,全文_情感極性,全文_主觀性
Accenture and NVIDIA Lead Enterprises into Era of AI - Newsroom | Accenture,https://newsroom.accenture.com/news/2024/accenture-and-nvidia-lead-enterprises-into-era-of-ai,0.0,0.0,0.14002554615926713,0.39291138125440456
"No Tricks, Just Games: GeForce NOW Thrills With 22 Games in October - NVIDIA Blog",https://blogs.nvidia.com/blog/geforce-now-thursday-october-2024-games-list/,0.0,0.0,0.12658927830160707,0.4576572970408584
Nvidia Hires Top Cisco Inventor Amid Big Networking Sales Push - CRN,https://www.crn.com/news/networking/2024/nvidia-hires-lead-cisco-inventor-amid-big-networking-sales-push,0.25,0.3,0.14771639716492657,0.5061669743655037
"Watch These Nvidia Stock Price Levels After CEO Cites ""Insane"" Demand for AI Chips - Investopedia",https://www.investopedia.com/watch-these-nvidia-stock-price-levels-after-ceo-cites-insane-demand-for-ai-chips-8722487,-1.0,1.0,0.02969244685662595,0.5398123021257348
Accenture-Nvidia deal: A first peek into the new world of gen AI-centric strategies - CIO,https://www.cio.com/article/3544711/accenture-nvidia-deal-a-first-peek-into-the-new-world-of-genai-centric-strategies.html,0.19318181818181818,0.3939393939393939,0.1792020202020201,0.5292236652236653
Nvidia stock rises as CEO Jensen Huang touts 'insane' chip demand - Yahoo Finance,https://finance.yahoo.com/news/nvidia-stock-rises-as-ceo-jensen-huang-touts-insane-chip-demand-162700341.html,-1.0,1.0,0.08658536585365852,0.4499999999999999
Is It Too Late to Buy Nvidia Stock? Wall Street's Answer May Surprise Investors - The Motley Fool,https://www.fool.com/investing/2024/10/03/too-late-buy-nvidia-stock-wall-street-may-surprise/,0.15,0.75,0.2805162111320123,0.48177169783482626
Tech Collaboration Designed to Power the Future - Energized by Edison,https://energized.edison.com/stories/tech-collaboration-designed-to-power-the-future,0.0,0.125,0.15454759056732748,0.4867438482570059
"Accenture, NVIDIA Launch AI Platform to Scale Enterprise AI - Channel Insider",https://www.channelinsider.com/news-and-trends/us/accenture-nvidia-partnership-launch-ai-platform/,0.0,0.0,0.158590335678641,0.4186560456250197
How AI and Accelerated Computing Drive Energy Efficiency and Sustainability - NVIDIA Blog,https://blogs.nvidia.com/blog/ai-energy-efficiency/,0.0,0.0,0.1474193416646247,0.4400571755288734
"Accenture To Train 30,000 Staff On Nvidia AI Tech In Blockbuster Deal - CRN",https://www.crn.com/news/ai/2024/accenture-to-train-30-000-staff-on-nvidia-ai-tech-in-blockbuster-deal,0.0,0.0,0.09569485174323886,0.39955930270446394
Accenture forms new Nvidia business group focused on agentic AI adoption - CIO,https://www.cio.com/article/3543730/accenture-forms-new-nvidia-business-group-focused-on-agentic-ai-adoption.html,0.13636363636363635,0.45454545454545453,0.15481499632443033,0.4134893408478313
Nvidia CEO Jensen Huang Says Demand for Its Chips Is ‘Insane' - Investopedia,https://www.investopedia.com/nvidia-ceo-jensen-huang-says-demand-for-its-chips-is-insane-8722350,-1.0,1.0,0.049018055115616084,0.49086685672051517
Brave New World: Leo AI and Ollama Bring RTX-Accelerated Local LLMs to Brave Browser Users - NVIDIA Blog,https://blogs.nvidia.com/blog/rtx-ai-brave-browser/,0.4340909090909091,0.6136363636363636,0.2387233681351329,0.4818754774637125
NVIDIA to Showcase Blackwell and Networking Solutions at OCP Summit - NVIDIA Blog,https://blogs.nvidia.com/blog/blackwell-networking-ocp-summit/,0.0,0.0,0.11269988514886473,0.37180404629384217
Nvidia CEO Jensen Huang says demand for next-generation Blackwell AI chip is 'insane' - CNBC,https://www.cnbc.com/2024/10/03/nvidia-ceo-demand-for-blackwell-ai-chip-is-insane.html,-1.0,1.0,-0.0640922988668891,0.45301489721571736
Nvidia Shares Jump After CEO Jensen Huang Notes ‘Insane’ Demand For Blackwell AI ‘Superchip’ - Forbes,https://www.forbes.com/sites/antoniopequenoiv/2024/10/03/nvidia-shares-jump-after-ceo-jensen-huang-notes-insane-demand-for-blackwell-ai-superchip/,-1.0,1.0,0.015048262548262546,0.4648262548262549
Nvidia and Accenture Tie-up Promotes Corporate AI Adoption - PYMNTS.com,https://www.pymnts.com/news/artificial-intelligence/2024/nvidia-accenture-tie-up-promotes-corporate-ai-adoption/,0.0,0.0,0.07678999122298091,0.3793725175168471
Why the I/O Fund is Not Buying Nvidia Right Now: Video Interview - IO Fund,https://io-fund.com/media/semiconductors/why-the-io-fund-is-not-buying-nvidia-right-now-video-interview,0.2857142857142857,0.5357142857142857,0.12118698412698406,0.46201349206349157
"Nvidia NVLM competes with GPT-4o, but open-source it is not - Techzine Europe",https://www.techzine.eu/news/analytics/124954/nvidia-nvlm-competes-with-gpt-4o-but-open-source-it-is-not/,0.0,0.0,0.19148400504034307,0.5250599556937584
How Much Will Nvidia Pay Out in Dividends This Year? - The Motley Fool,https://www.fool.com/investing/2024/10/02/how-much-will-nvidia-pay-out-in-dividends/,0.4,0.55,0.32821095098977915,0.5029395698819128
Accenture forms Nvidia business group to scale enterprise AI adoption - VentureBeat,https://venturebeat.com/ai/accenture-forms-nvidia-business-group-to-scale-enterprise-ai-adoption/,0.0,0.0,0.19283593510866243,0.39716636057545146
"Why Nvidia and TSMC Stocks Just Popped, but Intel Dropped Today - The Motley Fool",https://www.fool.com/investing/2024/10/03/nvidia-and-tsmc-stocks-popped-intel-dropped-today/,0.6,0.9,0.2934264944844146,0.5332611690472205
4 Billion-Dollar Reasons to Buy Nvidia Stock Right Now - The Motley Fool,https://www.fool.com/investing/2024/10/02/4-billion-dollar-reasons-to-buy-nvidia/,0.44285714285714284,0.7178571428571429,0.28421278240989756,0.49780431907835687
"For Nvidia, spatial AI and the ‘omniverse’ entering physical world may be the next big thing - CNBC",https://www.cnbc.com/2024/10/02/nvidia-spatial-ai-the-omniverse-next-big-thing.html,0.0,0.08095238095238096,0.04960059610953055,0.39170800373977305
Nvidia stock jumps after CEO Jensen Huang says 'demand for Blackwell is insane' - Markets Insider,https://markets.businessinsider.com/news/stocks/nvidia-stock-price-jensen-huang-blackwell-gpu-demand-ai-tech-2024-10,-1.0,1.0,0.1452813852813853,0.4995490620490621
Demand for NVIDIA's Blackwell is 'insane' - Jensen Huang - Yahoo Finance,https://finance.yahoo.com/news/demand-nvidias-blackwell-insane-jensen-221702225.html,-1.0,1.0,0.02920454545454545,0.5960984848484849
NVIDIA Temporarily Halts GeForce RTX 4060 Ti & RTX 4060 GPU Supply To AICs - Wccftech,https://wccftech.com/nvidia-temporarily-halts-geforce-rtx-4060-ti-rtx-4060-gpu-supply/,0.0,0.0,0.08674898094606134,0.4411896862261824
Billionaires Are Selling Nvidia Stock and Buying 2 Brilliant Growth Stocks That Have Little to Do With Artificial Intelligence - The Motley Fool,https://www.fool.com/investing/2024/10/02/billionaires-sell-nvidia-stock-buy-2-growth-stocks/,0.178125,0.85,0.3070592747199895,0.48702253830825143
Nvidia's GPU Classes Through the Years: What to Expect from the RTX 5080 - TechSpot,https://www.techspot.com/article/2902-nvidia-gpu-configuration-history/,0.0,0.0,0.06342725197177251,0.3964761494213551
IBM Cloud adds Nvidia H100 GPUs - DatacenterDynamics,https://www.datacenterdynamics.com/en/news/ibm-cloud-adds-nvidia-h100-gpus/,0.0,0.0,0.05847107438016529,0.36891873278236925
Nvidia and Accenture partner to foster development of AI agents - SiliconANGLE News,https://siliconangle.com/2024/10/02/nvidia-accenture-partner-foster-development-ai-agents/,0.0,0.0,0.17866615472804795,0.38459374138985825
Is NVIDIA Stock Worth Buying Despite Its 136% YTD Rally? - Nasdaq,https://www.nasdaq.com/articles/nvidia-stock-worth-buying-despite-its-136-ytd-rally,0.3,0.1,0.14768242268242268,0.5531193531193529
Should You Buy Nvidia Before Oct. 7? - The Motley Fool,https://www.fool.com/investing/2024/10/03/should-you-buy-nvidia-before-oct-7/,0.6,0.9,0.29202280179392887,0.4923212676733793
Accenture and NVIDIA expand partnership to scale agentic AI adoption - TechInformed,https://techinformed.com/accenture-and-nvidia-expand-partnership-to-scale-agentic-ai-adoption/,0.0,0.0,0.15573910664204113,0.38288846217740097
Is Nvidia Corp (NASDAQ:NVDA) the Best Ken Fisher Stock to Buy Now? - Yahoo Finance,https://finance.yahoo.com/news/nvidia-corp-nasdaq-nvda-best-132739731.html,1.0,0.3,0.1027020202020202,0.39780271011040247
NVIDIA GeForce Experience Will Be Discontinued by 2025 - How-To Geek,https://www.howtogeek.com/new-nvidia-app-beta-2/,0.0,0.0,0.17373536956870286,0.4552936775158997
Could Nvidia Stock Soar If Donald Trump Wins in November? - The Motley Fool,https://www.fool.com/investing/2024/10/03/could-nvidia-stock-soar-if-donald-trump-wins-in-no/,0.44999999999999996,0.55,0.27445554504430075,0.45577905239503436
There’s a big new Nvidia App update out and it’s finally worth the upgrade - PCGamesN,https://www.pcgamesn.com/nvidia/new-app-update-oct-2024,0.14545454545454545,0.21818181818181817,0.1657232704402516,0.40906708595387836
"OpenAI closes funding at $157 billion valuation, as Microsoft, Nvidia, SoftBank join round - CNBC",https://www.cnbc.com/2024/10/02/openai-raises-at-157-billion-valuation-microsoft-nvidia-join-round.html,-0.2,0.4,-0.017136616929170123,0.40103318135764954
Nvidia CEO calls Blackwell AI chip demand 'insane': CNBC - Yahoo Finance,https://finance.yahoo.com/video/nvidia-ceo-calls-blackwell-ai-150315713.html,-1.0,1.0,0.05765639589168999,0.5141923436041084
Accenture Melds Smarts And Wares With Nvidia For Agentic AI Push - The Next Platform,https://www.nextplatform.com/2024/10/03/accenture-melds-smarts-and-wares-with-nvidia-for-agentic-ai-push/,0.0,0.0,0.07671199573373488,0.43115451879038835
"China Discourages Purchases of NVIDIA Corporation (NVDA) Chips Amid U.S. Export Restrictions, Pushing for Domestic Alternatives - Yahoo Finance",https://finance.yahoo.com/news/china-discourages-purchases-nvidia-corporation-150926044.html,0.0,0.1,0.18809504822662715,0.45541429330903016
Nvidia stunned the world with a ChatGPT rival that’s as good as GPT-4o - BGR,https://bgr.com/tech/nvidia-stunned-the-world-with-a-chatgpt-rival-thats-as-good-as-gpt-4o/,0.7,0.6000000000000001,0.17882359307359313,0.5308129995004994
The Nvidia GeForce Experience is getting replaced by the end of 2024 - XDA Developers,https://www.xda-developers.com/nvidia-geforce-experience-replaced-2024/,0.0,0.0,0.276010101010101,0.4873376623376624
Accenture launches global NVIDIA Business Group and AI Refinery platform - Consultancy-me.com,https://www.consultancy-me.com/news/9351/accenture-launches-global-nvidia-business-group-and-ai-refinery-platform,0.0,0.0,0.11393585030832312,0.33016001624088714
"AWS, Deloitte, Microsoft & NVIDIA Back Establishment of Cancer AI Alliance - Executive Gov",https://executivegov.com/2024/10/ai-cancer-alliance-backed-by-aws-deloitte-microsoft-nvidia/,0.0,0.0,-0.023517786561264808,0.33066534914361
Wall Street Analysts See Nvidia (NVDA) as a Buy: Should You Invest? - Yahoo Finance,https://finance.yahoo.com/news/wall-street-analysts-see-nvidia-133011662.html,0.0,0.0,0.06028138528138527,0.5753747294372291
"Why Nvidia, Micron, Broadcom, and Other Artificial Intelligence (AI) and Semiconductor Stocks Slumped on Tuesday - Yahoo Finance",https://finance.yahoo.com/news/why-nvidia-micron-broadcom-other-190347467.html,-0.3625,0.6875,0.14803318903318902,0.489099234099234
Nvidia stock rises after Jensen Huang says demand for its new AI chips is 'insane' - Quartz,https://qz.com/nvidia-stock-jensen-huang-demand-ai-chip-blackwell-1851664485,-0.4318181818181818,0.7272727272727273,0.028843416987746902,0.3671291957374425
"This Incredibly Cheap Tech Stock Has Crushed Nvidia in the Past 3 Months, and It Is Still a Solid Buy - The Motley Fool",https://www.fool.com/investing/2024/10/03/this-incredibly-cheap-tech-stock-crushed-nvidia/,0.13,0.41,0.28676507437846543,0.4944388968363038
"The NVIDIA app, currently in beta, will replace GeForce Experience soon - Engadget",https://www.engadget.com/gaming/pc/the-nvidia-app-currently-in-beta-will-replace-geforce-experience-soon-152853070.html,0.0,0.4,0.10425324675324676,0.5031060606060606
"Nvidia, Accenture Join Forces to Boost Agentic AI in Enterprise - InformationWeek",https://www.informationweek.com/machine-learning-ai/nvidia-accenture-join-forces-to-boost-agentic-ai-in-enterprise,0.0,0.0,0.1248789691983409,0.4186501083060522
Nvidia Is Likely To Have A Time Correction Vs The Broader Market - citybiz,https://www.citybiz.co/article/607575/nvidia-is-likely-to-have-a-time-correction-vs-the-broader-market/,0.0,1.0,0.03137626262626263,0.33093434343434347
Nvidia RTX 4060 graphics cards are finally impressing PC gamers – and we’re betting they’ll soon be the most popular GPUs around - TechRadar,https://www.techradar.com/computing/gpu/nvidia-rtx-4060-graphics-cards-are-finally-impressing-pc-gamers-and-were-betting-theyll-soon-be-the-most-popular-gpus-around,0.3666666666666667,0.7999999999999999,0.19862902996126688,0.47513184001670833
"Nvidia's RTX 4060 is THE dominant GPU, boosting its desktop market share by 34% in a single month on Steam's Hardware Survey - PC Gamer",https://www.pcgamer.com/hardware/graphics-cards/nvidias-rtx-4060-is-the-dominant-gpu-boosting-its-desktop-market-share-by-34-in-a-single-month-on-steams-hardware-survey/,-0.07142857142857142,0.21428571428571427,0.17138292415347214,0.43678354978354966
Appaloosa Management’s David Tepper Urges Caution on NVIDIA Corporation (NVDA) Amid Concerns Over Long-Term AI Growth Prospects - Yahoo Finance,https://finance.yahoo.com/news/appaloosa-management-david-tepper-urges-083744566.html,0.0,0.0,0.1680445906432749,0.4668629908103591
"AI coding startup Poolside raises $500M from eBay, Nvidia, and others - TechCrunch",https://techcrunch.com/2024/10/02/ai-coding-startup-poolside-raises-500m-from-ebay-nvidia-and-others/,0.0,0.0,0.18069001705365345,0.4149022694477248
Nvidia surges as Jensen Huang touts ‘insane’ Blackwell demand - Fortune,https://fortune.com/2024/10/03/nvidia-stock-jensen-huang-ai/,-1.0,1.0,0.04766004197822377,0.4166289518562245
"OpenAI secures $6.6bn from Microsoft, Nvidia, and others at $157bn valuation - Tech Monitor",https://www.techmonitor.ai/digital-economy/ai-and-automation/openai-secures-6-6bn-from-microsoft-nvidia-and-others-at-157bn-valuation,0.0,0.0,0.0,0.022222222222222223
"Meet the Best-Performing Stock in the Entire S&P 500 This Year -- No, It's Not Nvidia - The Motley Fool",https://www.fool.com/investing/2024/10/02/meet-the-best-performing-stock-in-the-entire-sp-50/,0.3,0.7625,0.2779085821520732,0.5034165470935335
3 reasons I'm scared my RTX 5000 dream might go up in smoke - XDA Developers,https://www.xda-developers.com/rtx-5000-gpu-dream-might-not-happen/,0.0,0.0,0.1901275953346018,0.5115745949026204
The Nvidia App will officially swallow GeForce Experience soon - PCWorld,https://www.pcworld.com/article/2475926/the-nvidia-app-will-swallow-geforce-experience-soon.html,0.0,0.0,0.09202020202020203,0.3651010101010101
Nvidia just released an open-source LLM to rival GPT-4 - Digital Trends,https://www.digitaltrends.com/computing/nvidia-72-billion-parameter-open-source-llm-gpt-4-rival/,0.0,0.0,0.046183066183066175,0.5484144534144533
The Market Just Set a New All-Time High. Will Nvidia Do the Same? - AOL,https://www.aol.com/market-just-set-time-high-101500026.html,0.0987878787878788,0.3731818181818181,0.17039555960608596,0.5242156771104143
SPIE helps with deployment of AI in companies in collaboration with NVIDIA - SPIE,https://www.spie.com/en/news/spie-helps-deployment-ai-companies-collaboration-nvidia,0.0,0.0,0.0985802203682998,0.34940770046730313
"Nvidia's RTX 4060 is THE dominant GPU, boosting its desktop market share by 34% in a single month on Steam's Hardware Survey - Yahoo",https://www.yahoo.com/tech/nvidias-rtx-4060-dominant-gpu-141158050.html,-0.07142857142857142,0.21428571428571427,0.0830909215305767,0.40773401502711853
I made mistakes with Nvidia shares. I won’t make them with this growth stock - Motley Fool UK,https://www.fool.co.uk/2024/10/02/i-made-mistakes-with-nvidia-shares-i-wont-make-them-with-this-growth-stock/,0.6,0.9,0.15690984661889834,0.48032448872966116
Nvidia introduces open-source NVLM 1.0 models - Dataconomy,https://dataconomy.com/2024/10/02/open-source-nvidia-nvlm-1-0-models/,0.0,0.0,0.31,0.44666666666666666
