標題,真實新聞連結,標題_情感極性,標題_主觀性,全文_情感極性,全文_主觀性
A New Tax on Imports and a Split From China: Trump’s 2025 Trade Agenda (Published 2023) - The New York Times,https://www.nytimes.com/2023/12/26/us/politics/trump-2025-trade-china.html,0.13636363636363635,0.45454545454545453,0.09222310708159763,0.4397441395082905
Trump augurs divisive year in angry Christmas rant - CNN,https://edition.cnn.com/2023/12/26/politics/trump-christmas-rant/index.html,-0.5,1.0,0.05057419432419437,0.4441384078884078
Trump: ‘May they rot in Hell. Merry Christmas’ - The Hill,https://thehill.com/homenews/campaign/4376797-trump-may-they-rot-in-hell-merry-christmas/,0.0,0.0,0.08616565167412626,0.40844877344877334
How Trump Plans to Wield Power in 2025: What We Know - The New York Times,https://www.nytimes.com/article/trump-2025-second-term.html,0.13636363636363635,0.45454545454545453,0.10893273393273394,0.4041958041958042
Trump shares Christmas message insulting politicians - CNN,https://edition.cnn.com/videos/politics/2023/12/26/donald-trump-christmas-rant-analysis-cnntm-vpx.cnn,-1.0,1.0,-0.023226873047016927,0.41685742315238794
Fact-Checking Trump’s Recent Immigration Claims (Published 2023) - The New York Times,https://www.nytimes.com/2023/12/24/us/politics/trump-immigration-fact-check.html,0.06818181818181818,0.3522727272727273,0.04411290322580645,0.399543010752688
"Wealthy should give more to charity, people who stopped donating say - Chippewa Herald",https://chippewa.com/news/nation-world/article_48bd838f-581c-55d7-8137-56dba0f5723d.html,0.5,0.75,0.09745886369020695,0.47179389847300296
Woman Asks 'Cute Guy' On Her Flight Out With Message On Napkin—And The Result Is Adorable - Comic Sands,https://www.comicsands.com/message-napkin-guy-flight-tiktok,0.4166666666666667,0.8333333333333334,0.16023004385434547,0.4653248365538867
