標題,真實新聞連結,標題_情感極性,標題_主觀性,全文_情感極性,全文_主觀性
White House race heats up with cries of dictatorship - BBC.com,https://www.bbc.com/news/world-us-canada-67667198,0.0,0.0,0.06655878368207135,0.39925234582768826
Appeals court upholds gag order on Trump in Washington case but narrows restrictions on his speech - The Associated Press,https://apnews.com/article/trump-capitol-riot-gag-order-33f75551e369b43cc903ad9f2c5d9439,0.0,0.0,0.10694382161514711,0.4220483233762426
Appeals court maintains most of Trump gag order in federal election subversion case - CNN,https://edition.cnn.com/2023/12/08/politics/federal-appeals-courts/index.html,0.5,0.5,0.041205106621773305,0.3914097322430656
New IOP poll finds younger voters unenthusiastic on Biden-Trump rematch - Harvard Gazette,https://news.harvard.edu/gazette/story/2023/12/new-iop-poll-finds-younger-voters-unenthusiastic-on-biden-trump-rematch/,0.06818181818181818,0.22727272727272727,0.08413133741258748,0.4366510052447556
NYS Senators Call on the Board of Elections to Exclude Insurrectionist Donald Trump From the 2024 Ballot - The New York State Senate,https://www.nysenate.gov/newsroom/press-releases/2023/brad-hoylman-sigal/nys-senators-call-board-elections-exclude,0.13636363636363635,0.45454545454545453,0.14931818181818182,0.42814393939393947
Conundrum of Covering Trump Lands at Univision’s Doorstep (Published 2023) - The New York Times,https://www.nytimes.com/2023/12/08/business/media/univision-trump.html,0.13636363636363635,0.45454545454545453,0.09748565388100272,0.37019027484143757
WHAT THEY ARE SAYING: President Trump Endorses Senator Rick Scott - rickscott.com,https://rickscott.com/2023/12/08/what-they-are-saying-president-trump-endorses-senator-rick-scott/,0.0,0.0,0.25416666666666665,0.40972222222222215
Republicans Split on Whether Trump Would Be 'Dictator' if Reelected - VOA - Voice of America English News,https://www.voanews.com/a/republicans-split-on-whether-trump-would-be-dictator-if-reelected/7389280.html,0.0,0.0,0.036163489523340524,0.3718700448727531
"Trump PAC paid part of nearly $900,000 fee to fraud trial expert witness - CNBC",https://www.cnbc.com/2023/12/08/trump-pac-paid-part-of-nearly-900000-fee-to-fraud-trial-expert-witness.html,0.1,0.4,0.012320476591309932,0.38581489498156163
"Appeals Court Upholds, but Narrows, Gag Order on Trump in Election Case (Published 2023) - The New York Times",https://www.nytimes.com/2023/12/08/us/politics/trump-gag-order-election-case.html,0.13636363636363635,0.45454545454545453,0.12375366568914951,0.42579946934785634
Kevin McCarthy endorses Trump for president and would consider serving in his Cabinet - The Associated Press,https://apnews.com/article/kevin-mccarthy-trump-cabinet-5162876e353128c27eca6dd7887368e1,0.0,0.0,0.10526928552695634,0.4186708066389441
"Trump narrowly leads Biden in hypothetical rematch, new poll finds, with a tenth of voters undecided - CNN",https://edition.cnn.com/2023/12/09/politics/trump-biden-2024-poll/index.html,-0.03181818181818183,0.42727272727272725,-0.001650175221603798,0.38957932090585157
Trump's dictator remark follows other authoritarian rhetoric - Spectrum News NY1,https://ny1.com/nyc/all-boroughs/politics/2023/12/08/trump-s-vow-to-only-be-a-dictator-on--day-one--follows-growing-worry-over-his-authoritarian-rhetoric,-0.125,0.375,0.05636037695248222,0.4346924761398446
Why are the 14th Amendment lawsuits seeking to bar Trump failing? - ABC News,https://abcnews.go.com/Politics/14th-amendment-lawsuits-seeking-bar-trump-failing/story?id=105391248,0.0,0.0,0.10272401385579713,0.4969215745494814
Liz Cheney says Donald Trump's 'dictator' remark should be taken 'literally and seriously' - ABC News,https://abcnews.go.com/Politics/liz-cheney-donald-trumps-dictator-remark-literally/story?id=105497248,-0.3333333333333333,0.6666666666666666,-0.002129460797082573,0.33901406616306307
Appeals court largely upholds Trump gag order in federal election interference case - ABC News,https://abcnews.go.com/US/appeals-court-largely-upholds-trump-gag-order-federal/story?id=105503790,0.21428571428571427,0.42857142857142855,0.015219902796589918,0.445289219982472
A Military Loyal to Trump - The Atlantic,https://www.theatlantic.com/magazine/archive/2024/01/trump-defense-department-military-loyalty/676140/,0.11666666666666665,0.4666666666666667,0.026217864501446617,0.3695947943709138
Talk of a Trump Dictatorship Charges the American Political Debate (Published 2023) - The New York Times,https://www.nytimes.com/2023/12/09/us/politics/trump-dictatorship.html,0.04545454545454545,0.18484848484848485,0.008921451355661872,0.40112497151970833
"Trump, Van Drew, and 'Normal People Like Us' - InsiderNJ",https://www.insidernj.com/trump-van-drew-normal-people-like-us/,0.15,0.6499999999999999,0.10682565789473691,0.4836257309941519
Former President Donald Trump’s First Job and the Money Lessons He Learned - Yahoo Finance,https://finance.yahoo.com/news/former-president-donald-trump-first-140008214.html,0.125,0.16666666666666666,0.07797468354430381,0.40570524412296555
Exclusive: Pro-Trump lawyer Kenneth Chesebro cooperating in multiple state probes into 2020 fake electors plot - CNN,https://edition.cnn.com/2023/12/08/politics/kenneth-chesebro-cooperating-multiple-investigations/index.html,-0.25,0.5,-0.12063328086055361,0.5449068608159517
The Catastrophe of a Second Trump Presidency - The Nation,https://www.thenation.com/article/politics/the-catastrophe-of-a-second-trump-presidency/,0.0,0.0,0.07610017032148182,0.3350691931019801
"Republican Adam Kinzinger says he's politically ""homeless,"" and if Trump is the nominee, he'll vote for Biden — The Takeout - CBS News",https://www.cbsnews.com/news/republican-adam-kinzinger-if-trump-is-gop-nominee-vote-for-biden-the-takeout/,0.0,0.1,0.10176817094625314,0.4645352744667813
Liz Cheney: Trump Should Go to Jail if Convicted - The New Yorker,https://www.newyorker.com/podcast/the-new-yorker-radio-hour/liz-cheney-trump-should-go-to-jail-if-convicted,0.018181818181818174,0.22727272727272727,0.12757575757575754,0.3561363636363636
Trump marks Pearl Harbor anniversary years after claim he didn’t know what it was - The Independent,https://www.independent.co.uk/news/world/americas/us-politics/donald-trump-pearl-harbor-anniversary-b2460578.html,0.0,0.125,0.0714150432900433,0.2593100649350649
"Former Speaker Kevin McCarthy talks his future, support of Trump in first TV interview since announcing he'll leave Congress - CBS News",https://www.cbsnews.com/news/former-house-speaker-kevin-mccarthy-cbs-news-sunday-morning-on-trump-the-republican-party-and-his-future/,0.08333333333333333,0.15277777777777776,0.24385714285714288,0.308042328042328
Why America Ferrera Was ‘Compelled’ to Play a Trump-Voting White Woman in ‘Dumb Money’: ‘I Was Being Considered for a Role That’s Not Latina’ - Yahoo Entertainment,https://www.yahoo.com/entertainment/why-america-ferrera-compelled-play-204720208.html,-0.1875,0.25,0.08129742121677605,0.4598752501978309
Melania Trump Has Surprising Choice For Donald Trump's Running Mate: Report - iHeartRadio,https://www.iheart.com/content/2023-12-08-melania-trump-has-surprising-choice-for-donald-trumps-running-mate-report/,0.7,0.5,0.07041396103896103,0.42831439393939386
Morning headlines: Trump's vow to only be a dictator on 'day one' follows growing worry over his authoritarian rhetoric - The Times of Northwest Indiana,https://www.nwitimes.com/news/nation-world/article_23304d72-dbe4-58a0-83f0-269aab7402af.html,0.0,1.0,0.06566603088880317,0.3608314402868858
