標題,真實新聞連結,標題_情感極性,標題_主觀性,全文_情感極性,全文_主觀性
Trump sold his DC hotel. GOP spending disappeared. - CREW - Citizens for Responsibility and Ethics in Washington,https://www.citizensforethics.org/reports-investigations/crew-investigations/trump-sold-his-dc-hotel-gop-spending-disappeared/,0.0,0.0,0.12474355354790143,0.3258446263881046
Trump struggles with the new politics of abortion as a triumphant March for Life arrives in Washington - CNN,https://www.cnn.com/2023/01/20/politics/donald-trump-march-for-life-abortion/index.html,0.13636363636363635,0.45454545454545453,0.15000901875901876,0.4843975468975469
Trump drops lawsuit against New York Attorney General Letitia James - BBC.com,https://www.bbc.com/news/world-us-canada-64347994,0.09318181818181819,0.4772727272727273,0.03715151515151515,0.34006060606060606
Tracker: Evidence of Trump's Knowledge and Involvement in Retaining Mar-a-Lago Documents - Just Security,https://www.justsecurity.org/83034/tracker-evidence-of-trumps-knowledge-and-involvement-in-retaining-mar-a-lago-documents/,0.0,0.0,0.0433637366508192,0.4026144549621958
Trump and lawyer sanctioned almost $1 million for 'frivolous' lawsuit against Hillary Clinton - CNBC,https://www.cnbc.com/2023/01/20/trump-and-lawyers-sanctioned-almost-1-million-for-frivolous-lawsuit-against-hillary-clinton.html,0.0,0.0,-0.003144566785871141,0.3559868875086269
Judge Orders Trump and Lawyer to Pay Nearly $1 Million for Bogus Suit (Published 2023) - The New York Times,https://www.nytimes.com/2023/01/19/us/politics/trump-clinton-lawsuit-fine.html,0.11818181818181818,0.42727272727272725,0.06935777636997151,0.42600966107063654
Judge fines Trump and his attorney nearly $1 million for filing 'revenge' lawsuit against Hillary Clinton - ABC News,https://abcnews.go.com/US/judge-fines-trump-attorney-1-million-filing-revenge/story?id=96554509,0.1,0.4,0.07246049661399553,0.3097886312333263
"Trump, lawyers sanctioned nearly $1m over Clinton lawsuit - Al Jazeera English",https://www.aljazeera.com/news/2023/1/20/trump-lawyers-sanctioned-nearly-1mn-over-clinton-lawsuit,0.05,0.2,0.0,0.0
"Trump and his attorneys on the hook for nearly $1 million in sanctions for Clinton lawsuit, judge says - CNN",https://www.cnn.com/2023/01/19/politics/trump-sanctions-clinton-lawsuit/index.html,0.1,0.4,0.016091954022988506,0.24770114942528737
Trump drops lawsuit against New York AG after judge in case sanctions him almost $1 million for Clinton suit - CNBC,https://www.cnbc.com/2023/01/20/trump-drops-lawsuit-against-new-york-attorney-general-james.html,0.13636363636363635,0.45454545454545453,0.009879106914259585,0.36092574349281087
Trump lashes out at evangelical Christian leaders - CNN,https://www.cnn.com/videos/politics/2023/01/18/trump-evangelical-christian-leaders-sot-avlon-cnntm-vpx.cnn,0.0,0.0,0.144842657342657,0.31599456099456064
"In deposition, Trump mistook rape accuser E. Jean Carroll for his 2nd wife - ABC News",https://abcnews.go.com/US/deposition-trump-mistook-rape-accuser-jean-carroll-2nd/story?id=96565155,0.0,0.0,0.027289407839866598,0.23127606338615503
Trump: ‘Under no circumstances’ should Republicans cut Social Security or Medicare - The Hill,https://thehill.com/homenews/campaign/3820987-trump-under-no-circumstances-should-republicans-cut-social-security-or-medicare/,0.03333333333333333,0.06666666666666667,0.08950016033349367,0.32889359868526535
"Nikki Haley plotted with Kushner and Ivanka to be Trump vice-president, Pompeo book says - The Guardian",https://www.theguardian.com/books/2023/jan/18/nikki-haley-plotted-kushner-ivanka-trump-vp-mike-pompeo-new-book,0.0,0.0,0.12337958844808157,0.4832428986538575
"Donald Trump mistook E. Jean Carroll for his ex-wife Marla Maples in a photo, deposition transcripts show - CNN",https://www.cnn.com/2023/01/19/politics/trump-e-jean-carroll-deposition-photo/index.html,0.0,0.0,0.09972774621212122,0.29874526515151517
Judge Fines Donald Trump Nearly $1M for 'Frivolous' Lawsuit Against Hillary Clinton - PEOPLE,https://people.com/politics/judge-fines-donald-trump-nearly-1m-for-frivolous-lawsuit-against-hillary-clinton/,0.1,0.4,0.10243391360412638,0.3092359767891683
Opinion | Donald Trump to Facebook: Accept my friend request? - Poynter,https://www.poynter.org/commentary/2023/is-donald-trump-coming-back-to-facebook/,0.0,0.0,0.10345238095238089,0.43212712501174017
"In new memoir, Mike Pompeo says Trump told him to ‘shut the hell up’ about China - Semafor",https://www.semafor.com/article/01/19/2023/in-new-memoir-mike-pompeo-says-trump-told-him-to-shut-the-hell-up-about-china,0.13636363636363635,0.45454545454545453,-0.015642393320964745,0.3681818181818183
Trump drops lawsuit attempting to block NY attorney general from accessing his trust records - CNN,https://www.cnn.com/2023/01/20/politics/donald-trump-letitia-james-trust-lawsuit/index.html,0.05000000000000002,0.5,0.0763821892393321,0.2731447124304267
John Eastman Is Unbowed as Investigations Proliferate (Published 2023) - The New York Times,https://www.nytimes.com/2023/01/19/us/politics/john-eastman-investigations.html,0.13636363636363635,0.45454545454545453,0.09038018433179722,0.3355990783410138
"Philip Esformes, whose prison sentence Trump commuted, loses appeal and faces retrial on health-care fraud charges - CNBC",https://www.cnbc.com/2023/01/20/philip-esformes-whose-prison-sentence-trump-commuted-loses-appeal.html,-0.3,0.1,-0.06986935239090403,0.4401769542717833
"Trump’s Interior Secretary Didn’t Violate Ethics Rules, Watchdog Finds (Published 2023) - The New York Times",https://www.nytimes.com/2023/01/19/climate/bernhardt-ethics-interior-trump.html,0.13636363636363635,0.45454545454545453,0.12503246753246752,0.3524891774891775
Facebook Was a Boon for Donald Trump’s Fundraising Operation—And Might Be Yet Again - Vanity Fair,https://www.vanityfair.com/news/2023/01/donald-trump-facebook-fundraising-operation,0.7,0.9,0.17708333333333331,0.3902777777777777
Can Trump Count on Evangelicals in 2024? Some Leaders Are Wavering. (Published 2023) - The New York Times,https://www.nytimes.com/2023/01/19/us/politics/trump-evangelicals-2024.html,0.13636363636363635,0.45454545454545453,0.032702020202020204,0.48891414141414136
"Trump ordered to pay nearly $1 million for ""frivolous"" lawsuit against Hillary Clinton and others, drops another suit soon after - CBS News",https://www.cbsnews.com/news/trump-frivolous-lawsuit-ordered-to-pay-drops-suit-new-york-letitia-james/,0.1,0.4,0.12306397306397308,0.3521885521885522
"Trump trying to get unbanned on Facebook, but remains silent on Twitter - KOMO News",https://komonews.com/news/nation-world/trump-trying-to-get-unbanned-on-facebook-but-remains-silent-on-twitter-president-donald-social-media-elon-musk-twitter-ban-jan6-free-speech,0.0,0.1,0.05922619047619048,0.22708333333333344
Donald Trump expected in Fayetteville for memorial to commentator Diamond - CityView,https://www.cityviewnc.com/stories/donald-trump-expected-in-fayetteville-for-memorial-to-commentator-diamond/,-0.1,0.4,0.16187628161312373,0.3840738209159262
Former Trump aide John McEntee appears before grand jury on Trump-related investigations - CNN,https://www.cnn.com/2023/01/20/politics/john-mcentee-trump-grand-jury/index.html,0.25,0.5,0.13534151034151035,0.449330607663941
White House blasts Trump for call to jail journalists - Spectrum News NY1,https://ny1.com/nyc/all-boroughs/politics/2023/01/20/white-house-blasts-trump-call-to-jail-scotus-leak-journalists-as-assault-on-constitution,-0.05,0.0,0.009302054154995335,0.34475957049486466
Trump Confused His Ex-Wife With the Rape Accuser He Called “Not My Type” - Mother Jones,https://www.motherjones.com/politics/2023/01/trump-e-jean-carroll-marla-maples/,-0.4,0.7,0.04514890973224303,0.37727473144139817
Trump calls for jailing journalists who broke Supreme Court’s draft abortion decision - The Hill,https://thehill.com/homenews/3820172-trump-calls-for-jailing-journalists-who-broke-supreme-courts-draft-abortion-decision/,0.0,0.0,0.06225424981522541,0.3282113821138211
"Trump, Russia, Biden: The US has 3 special counsel investigations at once. What are they? - USA TODAY",https://www.usatoday.com/story/news/politics/2023/01/20/biden-trump-russia-3-special-counsel-investigations/11076079002/,0.35714285714285715,0.5714285714285714,0.07900545634920629,0.4315676510989011
Fact check: Trump’s latest baseless claims about the documents investigation - CNN,https://www.cnn.com/2023/01/19/politics/fact-check-trump-2023-documents-fbi-mar-a-lago/index.html,0.5,0.9,0.027956038214658904,0.4067164875354533
Trump’s Dark Money Machine Just Got Darker - The Daily Beast,https://www.thedailybeast.com/trumps-dark-money-machine-just-got-darker/,-0.075,0.2,-0.13886043533930853,0.29910371318822043
Trump thinks Politico journalists should be jailed. This should be a turning point - The Independent,https://www.independent.co.uk/voices/trump-politico-reporter-jail-truth-social-b2266340.html,0.0,0.125,0.06631183486652234,0.3956808599386725
"Donald Trump mistook E. Jean Carroll for ex-wife Marla Maples in photo, deposition shows - USA TODAY",https://www.usatoday.com/story/news/politics/2023/01/19/trump-mistook-e-jean-carroll-ex-wife-photo-deposition-reveals/11082869002/,0.0,0.0,-0.000691699604743091,0.2980566534914361
Did Twitter Let Trump Post His Way Into a Coup? - The Nation,https://www.thenation.com/article/politics/january-6-social-media/,0.0,0.0,0.05567261442261449,0.4210712435712433
Republicans said they chose Trump's DC hotel out of convenience. They've spent almost nothing there since he sold it. - Business Insider,https://www.businessinsider.com/gop-stopped-spending-trump-dc-hotel-after-he-sold-lease-2023-1,-0.1,0.1,0.03753492370513646,0.2494550366890792
"Introducing the new, even Trumpier class of Senate Republicans - Vox.com",https://www.vox.com/policy-and-politics/2023/1/19/23560973/senate-republicans-trump,0.13636363636363635,0.45454545454545453,0.14632084505356396,0.4151764518123965
South Dakota Republican Party names ex-Trump staffer as its executive director - Argus Leader,https://www.argusleader.com/story/news/politics/2023/01/19/former-trump-staffer-named-south-dakota-republican-party-executive-director-gop-madison-sheahan/69822848007/,0.0,0.0,0.20126262626262628,0.36717171717171715
Donald Trump’s Fissure With Evangelicals Opens the Door for Mike Pence - Vanity Fair,https://www.vanityfair.com/news/2023/01/donald-trumps-evangelicals-mike-pence-2024,0.7,0.9,0.10420076498843622,0.4148016367194448
Pompeo says Trump told him to ‘shut the hell up’ about China - The Hill,https://thehill.com/blogs/blog-briefing-room/3819558-pompeo-says-trump-told-him-to-shut-the-hell-up-about-china/,0.0,0.0,0.09456635318704289,0.36516457680250786
3News Investigates: 85-year-old Hinckley man convicted twice for littering on Trump-supported neighbors - WKYC.com,https://www.wkyc.com/article/news/investigations/3news-investigates-hinckley-man-85-convicted-twice-littering-trump-supporting-neighbors/95-616406a4-b1a2-4302-90d9-bc5e86c51555,0.0,0.0,0.13575450050859889,0.3456857805218461
A brief history of Donald Trump’s failed lawsuit against Hillary Clinton - The Independent,https://www.independent.co.uk/news/world/americas/us-politics/donald-trump-hillary-clinton-lawsuit-b2266210.html,-0.16666666666666666,0.25277777777777777,0.06121186042872789,0.3442773692171283
"Trump Is Plotting How to Kick DeSantis ‘In the Nuts.’ Here’s His Playbook, So Far - Rolling Stone",https://www.rollingstone.com/politics/politics-features/donald-trump-plots-against-ron-desantis-2024-election-1234663645/,0.1,1.0,0.1269506399397704,0.42953006534528293
US judge fines Trump over 'frivolous' Clinton lawsuit - DW (English),https://www.dw.com/en/us-judge-fines-trump-over-frivolous-clinton-lawsuit/a-64460748,0.0,0.0,0.04786608319217015,0.3181371165066817
"Trump ordered to pay Hillary Clinton $171,631 in legal fees over bogus lawsuit - Business Insider",https://www.businessinsider.com/trump-pay-hillary-clinton-legal-fees-over-bogus-lawsuit-2023-1,0.2,0.2,0.020012095747389855,0.28987458619811557
March for Life amid tensions with Trump - CNN,https://www.cnn.com/videos/tv/2023/01/21/exp-tsr-todd-march-for-life-evangelicals-and-trump.cnn,0.0,0.0,0.08371424923391241,0.37205056179775275
Trump mistook photo of rape accuser E. Jean Carroll for ex-wife during deposition - The Hill,https://thehill.com/blogs/blog-briefing-room/3819286-trump-mistook-photo-of-rape-accuser-e-jean-carroll-for-ex-wife-during-deposition/,0.0,0.0,0.00847494703877682,0.360676291793313
Trump Drops Lawsuit Against New York AG After Judge in Case Sanctions Him Almost $1 Million for Clinton Suit - NBC Boston,https://www.nbcboston.com/news/business/money-report/trump-drops-lawsuit-against-new-york-ag-after-judge-in-same-case-sanctions-him-almost-1-million/2950560/?os=fuzzscanazstr%26ref%3Dapp&ref=app,0.13636363636363635,0.45454545454545453,0.01343264578558696,0.38200025464731346
Ivana Trump’s will left a $1M condo and dog to an ex-nanny - New York Post,https://nypost.com/2023/01/20/ivana-trumps-will-left-a-1m-condo-to-her-ex-nanny/,0.06818181818181818,0.22727272727272727,0.00018874974232117276,0.259865749330035
Trump Demands Prison Sentence for Journalists Who Published Supreme Court Leak - Truthout,https://truthout.org/articles/trump-demands-prison-sentence-for-journalists-who-published-supreme-court-leak/,0.0,0.0,0.015151286828502024,0.36664771585657674
Biden and Trump documents expose wider problem: Missing classified records not uncommon - USA TODAY,https://www.usatoday.com/story/news/politics/2023/01/19/biden-trump-classified-documents-archives/11048131002/,-0.30000000000000004,0.525,0.06690892303516063,0.4197042932315209
"All the U.S. presidents who played golf, including Joe Biden, Donald Trump - Golfweek",https://golfweek.usatoday.com/story/sports/golf/2023/01/20/u-s-presidents-play-golf-donald-trump-joe-biden/76531915007/,0.0,0.0,0.09070777000776997,0.4126915306915308
Judge fines Trump and his lawyer almost $1 million over 'frivolous' lawsuit targeting Hillary Clinton and others - Business Insider,https://www.businessinsider.com/trump-and-lawyer-ordered-to-pay-1m-for-frivolous-lawsuit-2023-1,0.0,0.0,-0.012664640324214788,0.32464539007092186
"Extremists face off in California suburb over transgender rights, YMCA locker room - USA TODAY",https://www.usatoday.com/story/news/nation/2023/01/20/trans-rights-protest-proud-boys-blame-trump-attacks-power-grid/11083288002/,0.0,0.0,0.09424019607843136,0.45735294117647063
"Federal judge sanctions Trump, attorneys over $900,000 for ‘a continuing pattern of misuse of the courts’ - The Hill",https://thehill.com/regulation/court-battles/3820675-federal-judge-sanctions-trump-attorneys-over-900000-for-a-continuing-pattern-of-misuse-of-the-courts/,0.0,0.0,0.06254666849904944,0.35989543965734444
Trump criticizes evangelical leaders for not backing his 2024 presidential bid - CNN,https://www.cnn.com/2023/01/18/politics/donald-trump-evangelicals-2024/index.html,0.0,0.0,0.13637345808313545,0.3974724916660402
Lara Trump’s show devolves into conspiracies over Joe Biden’s classified papers - The Independent,https://www.independent.co.uk/news/world/americas/us-politics/lara-trump-biden-classified-documents-conspiracy-b2265525.html,0.0,0.125,0.06099815485061389,0.40991412958626083
Donald Trump plotting first tweet since ban was lifted - and he wants to return to Facebook too - Sky News,https://news.sky.com/story/donald-trump-plotting-first-tweet-since-ban-was-lifted-and-he-wants-to-return-to-facebook-too-12789896,0.225,0.21666666666666667,0.1839264354066985,0.3648923444976075
