標題,真實新聞連結,標題_情感極性,標題_主觀性,全文_情感極性,全文_主觀性
Trump sides with tech bosses in Maga fight over immigrant visas - BBC.com,https://www.bbc.com/news/articles/clyv7gxp02yo,0.0,0.0,0.11140961933215458,0.397396656551586
How Donald Trump Went From Calling for a TikTok Ban to Backing Off - The New York Times,https://www.nytimes.com/2024/12/28/us/politics/trump-tik-tok-ban.html,0.13636363636363635,0.45454545454545453,0.14270334928229664,0.39760765550239235
"In shift, Trump downgrades soaring rhetoric on campaign promises - Yahoo",https://www.yahoo.com/news/shift-trump-downgrades-soaring-rhetoric-110000169.html,0.0,0.0,0.02909636434026677,0.3991836483299898
Exclusive | Trump supports immigration visas backed by Musk: ‘I have many H-1B visas on my properties’ - New York Post,https://nypost.com/2024/12/28/us-news/donald-trump-backs-h-1b-visa-program-supported-by-elon-musk/,0.3181818181818182,0.4772727272727273,0.13778430564144853,0.41790094825809104
Trump Weighs In on Immigrant Visa Debate but Offers Little Clarity - The New York Times,https://www.nytimes.com/2024/12/28/business/trump-immigration-h1b-visa.html,0.016287878787878785,0.3181818181818182,0.19454806687565304,0.45146290491118074
