標題,真實新聞連結,標題_情感極性,標題_主觀性,全文_情感極性,全文_主觀性
Star witness Michael Cohen says Trump was intimately involved in all aspects of hush money scheme - The Associated Press,https://apnews.com/article/trump-trial-stormy-daniels-michael-cohen-hush-money-f96dd7289cf952145cdd6737b29add3d,0.2,0.6,0.09761710363221192,0.4221149872755171
"This is The Trump Trials by George T. Conway III, a newsletter that chronicles the former president’s legal troubles. - The Atlantic",https://www.theatlantic.com/newsletters/the-trump-trials/,0.1,0.1,0.12064294213477365,0.4803235844121483
Michael Cohen details what life was like as Trump's lawyer - BBC.com,https://www.bbc.com/news/world-us-canada-69006455,0.0,0.0,0.05563810012962556,0.4035775429843226
"Trump Up Over Biden by 6 in Arizona, 9 in Georgia, 13 in Nevada; Pennsylvania, Michigan & Wisconsin Remain Toss-ups Among Likely Voters - Siena College Research Institute",https://scri.siena.edu/2024/05/13/trump-up-over-biden-by-6-in-arizona-9-in-georgia-13-in-nevada-pennsylvania-michigan-wisconsin-remain-toss-ups-among-likely-voters/,0.0,1.0,0.13629968516332153,0.4694116489571035
"On Trade, a Return of Trump Would Spell Trouble for EU - IP Quarterly",https://ip-quarterly.com/en/trade-return-trump-would-spell-trouble-eu,-0.2,0.2,0.13456194874644067,0.394246475449684
Michael Cohen testifies in Trump hush money trial - CNN,https://edition.cnn.com/politics/live-news/trump-hush-money-trial-05-13-24/index.html,0.0,0.0,0.06341824824101278,0.3904016180494283
Trump hush money trial: A timeline of key events in the case - The Associated Press,https://apnews.com/article/trump-hush-money-michael-cohen-stormy-mcdougal-6e73d8e03fc749ec123ac833e0e0f6f2,0.0,1.0,0.11427046227166941,0.421272711007013
"Trump May Owe $100 Million From Double-Dip Tax Breaks, Audit Shows - The New York Times",https://www.nytimes.com/2024/05/11/us/trump-taxes-audit-chicago.html,0.13636363636363635,0.45454545454545453,0.039533799533799534,0.4726554001554
Ex-lawyer Michael Cohen says he paid hush money at Trump's direction - BBC.com,https://www.bbc.com/news/world-us-canada-69004872,0.0,0.0,-0.011100668337510444,0.375827589807853
Michael Cohen: A challenging star witness in Donald Trump’s hush money trial - The Associated Press,https://apnews.com/article/trump-hush-money-trial-michael-cohen-witness-091b0e50af2738eb261f395e9d658505,0.5,1.0,0.10061389563318636,0.4275810037034191
Michael Cohen Was Paid to Fix Trump’s Problems. Now He’s One of Them. - The New York Times,https://www.nytimes.com/2024/05/12/nyregion/michael-cohen-trump-trial.html,0.13636363636363635,0.45454545454545453,0.013759213759213764,0.41646191646191666
Trump tells Jersey Shore crowd he's being forced to endure 'Biden show trial' in hush money case - The Associated Press,https://apnews.com/article/trump-new-jersey-president-trial-gag-order-59a8073e5a22f7a1e13f1461e9998419,-0.30000000000000004,0.2,0.11471216975267624,0.39651156307197405
Donald Trump's GOP allies show up in force as Michael Cohen takes the stand in hush money trial - The Associated Press,https://apnews.com/article/donald-trump-court-allies-jd-vance-2666cc432e5291e8fa7dd7fba9c2ffad,0.0,0.0,0.11043192923498799,0.4147830531482565
"Trump will stump in Minnesota, traditionally blue state he insists he can win. Is it really in play? - The Associated Press",https://apnews.com/article/election-2024-trump-minnesota-a6fafab8ce447feadc43aca01c2c136b,0.3333333333333333,0.2333333333333333,0.11594287546668426,0.41264606461173664
"Ron DeSantis is planning to raise money for Donald Trump in Florida and Texas, AP sources say - The Associated Press",https://apnews.com/article/donald-trump-ron-desantis-a0ab6f0f421db0f26205b8b6ca9b824b,0.0,0.0,0.11964572966574702,0.42627382749713805
Tamara Keith and Amy Walter on polls showing Biden trailing Trump in key states - PBS NewsHour,https://www.pbs.org/newshour/show/tamara-keith-and-amy-walter-on-polls-showing-biden-trailing-trump-in-key-states,0.0,1.0,0.10621683704515025,0.43885837890355933
"Trump rally Wildwood 2024: Campaign stop comes to Jersey shore, drawing thousands to the beaches - ABC7 New York",https://abc7ny.com/post/donald-trump-wildwood-nj-2024-rally-new-jersey-tickets/14801435/,0.13636363636363635,0.45454545454545453,0.03724847224847219,0.36840263340263407
Live Updates: Michael Cohen takes the stand in Trump’s hush money trial - PBS NewsHour,https://www.pbs.org/newshour/politics/live-updates-michael-cohen-to-take-the-stand-in-trumps-hush-money-trial,0.13636363636363635,0.5,0.030482819809244697,0.3944076610397859
Michael Cohen and the Trump pardon that never happened - ABC News,https://abcnews.go.com/Politics/michael-cohen-trump-pardon-happened/story?id=110123476,0.0,0.0,0.0022582833027707293,0.4020070838252669
Fareed breaks down Trump's chances of retaking the White House - CNN,https://edition.cnn.com/videos/politics/2024/05/12/fareeds-take-biden-trump-2024-odds-gps-digvid.cnn,-0.07777777777777779,0.14444444444444446,0.10506997053872036,0.3668460648148149
Michael Cohen testifies Trump directly involved in hush money payment and coverup - PBS NewsHour,https://www.pbs.org/newshour/show/michael-cohen-testifies-trump-directly-involved-in-hush-money-payment-and-coverup,0.1,0.4,0.11513446495025449,0.4347041087567402
Un-silence of the lambs: Donald Trump (again) praises fictional cannibal Hannibal Lecter - USA TODAY,https://eu.usatoday.com/story/news/politics/elections/2024/05/13/donald-trump-hannibal-lecter-new-jersey-rally/73668610007/,0.0,0.25,0.04996157224418093,0.43819718928414575
"At New Jersey rally, Trump launches into bizarre riff on Hannibal Lecter - USA TODAY",https://eu.usatoday.com/,0.2681818181818182,0.5272727272727272,0.022270003113325033,0.29543378995433783
Hall of Famer Lawrence Taylor and former President Donald Trump are two peas in a pod - USA TODAY,https://eu.usatoday.com/story/sports/columnist/mike-freeman/2024/05/13/donald-trump-lawrence-taylor-nfl-new-jersey-rally/73664353007/,0.0,0.0,0.07925082296176048,0.49037022005772
Trump Goes On Charm Offensive With Republicans But Differences Remain - The National Memo,https://www.nationalmemo.com/trump-goes-on-charm-offensive-with-republicans-but-differences-remain,0.0,0.0,0.1687491801128165,0.3882126459399185
"Trump Taps Climate Change Skeptic As Energy Adviser, Pushes Back On Taxes - The National Memo",https://www.nationalmemo.com/trump-taps-climate-change-skeptic-as-energy-adviser-pushes-back-on-taxes,0.0,0.0,0.04252013808975833,0.3217970847717684
Endorse This: Trump Aide Calls Presidency ‘The Ultimate Reality Show’ - The National Memo,https://www.nationalmemo.com/endorse-trump-aide-calls-presidency-ultimate-reality-show,0.0,1.0,0.04794034090909091,0.2980823863636364
