標題,真實新聞連結,標題_情感極性,標題_主觀性,全文_情感極性,全文_主觀性
The Republicans who want to be Trump's VP were once harsh critics with key policy differences - The Associated Press,https://apnews.com/article/trump-rubio-vance-burgum-scott-stefanik-vp-11ec39b0da11152ad110ff987d4eaeee,-0.1,0.85,0.1303996910197388,0.43562125362676624
"To serve his country, Donald Trump should leave the race | Editorial Board - The Philadelphia Inquirer",https://www.inquirer.com/opinion/editorials/first-presidential-debate-joe-biden-donald-trump-withdraw-20240629.html,0.0,0.0,0.015395685305323856,0.4118324580372773
Trump and His Campaign Did Not Acknowledge Pride Month - GLAAD,https://glaad.org/the-trump-campaign-did-not-acknowledge-pride-month/,0.0,0.0,0.06964313464313461,0.3969953194953195
Biden vows to fight on and beat Trump after shaky debate - BBC.com,https://www.bbc.com/news/articles/cne4z2p7nl4o,-0.3333333333333333,0.5,0.09555652680652682,0.4951048951048951
Black Americans Respond To Trump’s Notion Of ‘Black Jobs’ - Forbes,https://www.forbes.com/sites/shaunharper/2024/06/29/black-peoples-responses-to-trumps-notion-of-black-jobs/,-0.16666666666666666,0.43333333333333335,0.03228758169934641,0.40399859943977573
Fauci on why he never quit during Trump administration - ABC News,https://abcnews.go.com/Politics/fauci-why-he-never-quit-trump-administration/story?id=111546139,0.0,0.0,0.041548683131416846,0.3572608406781066
The Supreme Court nears the end of another momentous term. A decision on Trump's immunity looms - The Associated Press,https://apnews.com/article/supreme-court-trump-immunity-social-media-posts-b0e2f4677267be2921fc83466ed5fb69,0.0,0.0,0.1147896621838628,0.4059066086299637
Watch the free 48 Hours stream - CBS News,https://www.cbsnews.com/live/48-hours/,0.4,0.8,0.13127272727272726,0.599030303030303
NBC Fires Donald Trump After Immigrant-Bashing Campaign Comments - The National Memo,https://www.nationalmemo.com/nbc-fires-donald-trump-after-immigrant-bashing-campaign-comments,0.0,0.0,0.12474747474747473,0.3727272727272727
