標題,真實新聞連結,標題_情感極性,標題_主觀性,全文_情感極性,全文_主觀性
"Trump’s HHS Secretary Pick Eyes Transparency, Data Access - GovCIO Media & Research",https://govciomedia.com/trumps-hhs-secretary-pick-eyes-transparency-data-access/,0.0,0.0,0.15010822510822514,0.3223495458789577
Statement by President-elect Donald J. Trump Announcing the Nomination of Scott Bessent as Secretary of the Treasury - The American Presidency Project,https://www.presidency.ucsb.edu/documents/statement-president-elect-donald-j-trump-announcing-the-nomination-scott-bessent-secretary,0.0,0.0,0.13870991468078842,0.33769385953851977
Trump nominates former Texas lawmaker Scott Turner to lead Housing and Urban Development - The Texas Tribune,https://www.texastribune.org/2024/11/22/scott-turner-nomination-housing-urban-development/,0.0,0.0,0.07324561403508771,0.2232456140350877
Public Narrowly Approves of Trump’s Plans; Most Are Skeptical He Will Unify the Country - Pew Research Center,https://www.pewresearch.org/politics/2024/11/22/public-narrowly-approves-of-trumps-plans-most-are-skeptical-he-will-unify-the-country/,-0.06000000000000001,0.31333333333333335,0.11458333333333333,0.37152777777777773
POV: How Trump’s Relationships with Saudi Arabia and Elon Musk Will Shape Foreign Policy - Boston University,https://www.bu.edu/articles/2024/trumps-relationships-saudi-arabia-elon-musk-foreign-policy/,-0.125,0.125,0.13983348522822203,0.4235085820612135
Trump’s picks for key positions in his second administration - WSFA,https://www.wsfa.com/2024/11/23/here-are-people-trump-has-picked-key-positions-so-far/,0.0,0.5,0.09181558854538652,0.3528931048375509
Trump names Pam Bondi for attorney general after Gaetz withdraws - BBC.com,https://www.bbc.com/news/articles/cjr4g50wxp2o,0.05000000000000002,0.5,0.0862473254714634,0.4427022689953724
Sanctions expectations in a second Trump administration - Atlantic Council,https://www.atlanticcouncil.org/blogs/econographics/sanctions-expectations-in-a-second-trump-administration/,0.0,0.0,0.04847551327814487,0.3341994506468191
Statement by President-elect Donald J. Trump Announcing the Appointments of Alex Wong as Assistant to the President and Principal Deputy National Security Advisor and Dr. Sebastian Gorka as Deputy Assistant to the President and Senior Director for Coun - The American Presidency Project,https://www.presidency.ucsb.edu/documents/statement-president-elect-donald-j-trump-announcing-the-appointments-alex-wong-assistant,0.0,0.0,0.12580034423407904,0.2962880091795754
Statement by President-elect Donald J. Trump Announcing the Nomination of Dr. Janette Nesheiwat as United States Surgeon General - The American Presidency Project,https://www.presidency.ucsb.edu/documents/statement-president-elect-donald-j-trump-announcing-the-nomination-dr-janette-nesheiwat,0.02500000000000001,0.25,0.17709527709527703,0.35237315237315237
What are Recess Appointments? How Could Trump Use Them to Undermine Democracy? - Democracy Docket,https://www.democracydocket.com/analysis/what-are-recess-appointments-how-could-trump-use-them-to-undermine-democracy/,0.0,0.0,0.06214513556618819,0.44320934913040166
Trump gave Interior nominee one directive for a half-billion acres of US land: ‘Drill.’ - The Associated Press,https://apnews.com/article/interior-burgum-public-lands-oil-gas-trump-97f7bc583f0a0de0fb16ea6f89bfbaf1,0.0,0.0,0.12421077772801867,0.41829606408916875
Will Trump 2.0 Be a Boon for Belarus? - Carnegie Endowment for International Peace,https://carnegieendowment.org/russia-eurasia/politika/2024/11/belarus-trump-new-hope?lang=en,0.0,0.0,0.02517694214262075,0.3917884550879874
"Trump taps Rollins as agriculture chief, completing proposed slate of Cabinet secretaries - The Associated Press",https://apnews.com/article/trump-transition-cabinet-agriculture-75911e79188c48e27d6c3c12f1a58e80,0.0,0.0,0.12178908971898568,0.41386003778581143
"1. Views of Trump: Personal traits, confidence on issues, ideology - Pew Research Center",https://www.pewresearch.org/politics/2024/11/22/views-of-trump-personal-traits-confidence-on-issues-ideology/,-0.05,0.2,0.11458333333333333,0.37152777777777773
Judge delays Trump's Nov. 26 sentencing date in his hush money case - ABC News,https://abcnews.go.com/US/judge-adjourns-trumps-nov-26-sentencing-date-hush/story?id=116136354,0.0,0.0,0.015518715518715523,0.3935856935856945
"After Trump’s Project 2025 denials, he is tapping its authors and influencers for key roles - The Associated Press",https://apnews.com/article/trump-project-2025-administration-nominees-843f5ff20131ccba5f056e7ccc5baf23,0.0,1.0,0.12221017022951204,0.4212451623167296
Biden’s Ukraine moves are a gift to Trump - Atlantic Council,https://www.atlanticcouncil.org/content-series/inflection-points/bidens-ukraine-moves-are-a-gift-to-trump/,0.0,0.0,0.0778039056531704,0.4313439011968423
"Trump 2.0: Anticipated Impacts on International Trade, Sanctions and Economic Policy - Pillsbury Winthrop Shaw Pittman",https://www.pillsburylaw.com/en/news-and-insights/trump-adminstration-international-trade-sanctions-economic-policy.html,0.1,0.1,0.0,0.0
Here are the people Trump has picked for key positions so far - WHYY,https://whyy.org/articles/trump-administration-susie-wiles-tom-homan/,0.05,1.0,0.11090967817711991,0.35616590612230126
Judge indefinitely delays Trump’s sentencing date in hush money case - PBS NewsHour,https://www.pbs.org/newshour/politics/judge-indefinitely-delays-trumps-sentencing-date-in-hush-money-case,0.0,0.0,0.14679834054834057,0.43363997113997105
"6 things to know about Pam Bondi, Trump’s new pick for attorney general - PBS NewsHour",https://www.pbs.org/newshour/politics/6-things-to-know-about-pam-bondi-trumps-new-pick-for-attorney-general,0.09318181818181819,0.4772727272727273,0.0633771802395964,0.4019722633816591
Trump names hedge fund founder Scott Bessent as pick for Treasury secretary - PBS NewsHour,https://www.pbs.org/newshour/politics/trump-names-hedge-fund-founder-scott-bessent-as-pick-for-treasury-secretary,0.0,0.0,0.11005136838470173,0.42289993956660615
Judge postpones Trump sentencing for a third time - BBC.com,https://www.bbc.com/news/articles/cz9xl79ny7eo,0.0,0.0,0.0373075998075998,0.43628547378547383
"Who is Pam Bondi, Donald Trump's nominee for attorney general? - BBC.com",https://www.bbc.com/news/articles/c079y0r1j8po,0.05000000000000002,0.5,0.05174431670333311,0.44252182243985533
Just how big was Donald Trump’s election victory? - BBC.com,https://www.bbc.com/news/articles/cn5w9w160xdo,0.0,0.1,0.18384181955610532,0.4448693997801139
"What Pam Bondi, Trump's new AG pick, has said about investigating DOJ prosecutors - ABC News",https://abcnews.go.com/Politics/pam-bondi-trumps-new-ag-pick-investigating-doj/story?id=116136850,0.13636363636363635,0.45454545454545453,0.034578099496132296,0.33652047406145713
Transition 2025: Did Trump Win an “Unprecedented and Powerful Mandate”? - Council on Foreign Relations,https://www.cfr.org/blog/transition-2025-did-trump-win-unprecedented-and-powerful-mandate,0.39375,0.60625,0.12355345848336499,0.4338012973526993
Trump expected to offer Kelly Loeffler secretary of Agriculture - CNN,https://edition.cnn.com/2024/11/22/politics/kelly-loeffler-trump-agriculture-department/index.html,-0.1,0.4,0.04155219780219779,0.41142399267399277
Trump nominates Scott Bessent to lead Treasury in flurry of picks - BBC.com,https://www.bbc.com/news/articles/cj3mv6l1ypyo,0.0,0.0,0.10485630110630109,0.3668975468975469
Trump picks Project 2025 architect Russell Vought to return as top budget official - PBS NewsHour,https://www.pbs.org/newshour/politics/trump-picks-project-2025-architect-russell-vought-to-return-as-top-budget-official,0.5,0.5,0.11659226190476188,0.27589285714285716
Will Donald Trump forge a political dynasty? Lara Trump waits in the wings - College of Social Sciences and Humanities,https://cssh.northeastern.edu/will-donald-trump-forge-a-political-dynasty-lara-trump-waits-in-the-wings/,0.016666666666666666,0.08333333333333334,0.2033333333333333,0.24888888888888888
Statement by President-elect Donald J. Trump Announcing the Nomination of Dr. Dave Weldon as Director of the Centers for Disease Control and Prevention (CDC) - The American Presidency Project,https://www.presidency.ucsb.edu/documents/statement-president-elect-donald-j-trump-announcing-the-nomination-dr-dave-weldon-director,0.0,0.0,0.1372962962962964,0.3046878306878306
Donald Trump’s Administration Hopefuls Descend on Mar-a-Lago - The New Yorker,https://www.newyorker.com/news/dispatch/donald-trumps-administration-hopefuls-descend-on-mar-a-lago,0.13636363636363635,0.45454545454545453,0.09630928932178934,0.34786432178932186
Trump nominee for education secretary would come backed with detailed policy agenda - EdSource,https://edsource.org/2024/trump-nominee-for-education-secretary-would-come-backed-with-detailed-policy-agenda/722774,0.4,0.75,0.0484375,0.37991452991452995
"Trump Picks Scott Turner, Little-Known Official From First Term, to Lead HUD - The New York Times",https://www.nytimes.com/2024/11/22/us/politics/scott-turner-hud-trump.html,0.19318181818181818,0.3939393939393939,0.12522522522522522,0.31306306306306314
Trump chooses Rep. Lori Chavez-DeRemer as his pick for Labor secretary - CNN,https://edition.cnn.com/2024/11/22/politics/lori-chavez-deremer-labor-secretary-trump/index.html,0.0,0.0,0.16886245265151517,0.46970457927489173
Trump chooses Scott Turner to lead HUD and Rep. Lori Chavez-DeRemer as labor secretary - PBS NewsHour,https://www.pbs.org/newshour/politics/trump-chooses-scott-turner-to-lead-hud-and-rep-lori-chavez-deremer-as-labor-secretary,0.0,0.0,0.1015181165866097,0.3940253810116824
"Trump taps Janette Nesheiwat for surgeon general, Marty Makary for FDA - The Associated Press",https://apnews.com/article/fda-trump-marty-makary-34424f5fefcbbc334c1983b025523aad,0.05000000000000002,0.5,0.12320018466849936,0.4140751022976692
Trump Picks Key Figure in Project 2025 for Powerful Budget Role - The New York Times,https://www.nytimes.com/2024/11/22/us/politics/russell-vought-office-of-management-and-budget.html,0.14545454545454545,0.8181818181818182,0.11559972014517468,0.4311436879618698
"Your questions about Trump 2.0, answered - CNN",https://edition.cnn.com/2024/11/22/politics/donald-trump-presidency-what-matters/index.html,0.0,0.0,0.06442044350207617,0.3675551064581678
The ‘Landslide’ That Wasn’t: Trump and Allies Pump Up His Narrow Victory - The New York Times,https://www.nytimes.com/2024/11/22/us/politics/trump-election-landslide.html,-0.03181818181818183,0.42727272727272725,0.2554743867243867,0.5969516594516593
"Trump’s hush money sentencing is postponed indefinitely, judge says - CNN",https://edition.cnn.com/2024/11/22/politics/trumps-hush-money-sentencing-is-postponed-indefinitely-judge-says/index.html,0.0,0.0,-0.006463443963443967,0.443512506012506
Trump chooses loyalist Pam Bondi for attorney general pick after Matt Gaetz withdraws - The Associated Press,https://apnews.com/article/gaetz-trump-fbi-justice-department-248b46ba0c882dd46d661568e8bd3bd7,0.05000000000000002,0.5,0.12709561337245853,0.4126124330553863
Trump’s Trade Agenda Could Benefit Friends and Punish Rivals - The New York Times,https://www.nytimes.com/2024/11/23/us/politics/trump-tariff-exemptions.html,0.13636363636363635,0.45454545454545453,0.172291280148423,0.4753586889301173
"Examining the record of Pam Bondi, Trump’s new pick for attorney general - PBS NewsHour",https://www.pbs.org/newshour/show/examining-the-record-of-pam-bondi-trumps-new-pick-for-attorney-general,0.09318181818181819,0.4772727272727273,0.14370377241805815,0.45590146361574935
What Trump’s latest picks mean for the future of U.S. public health policy - PBS NewsHour,https://www.pbs.org/newshour/show/what-trumps-latest-picks-mean-for-the-future-of-u-s-public-health-policy,0.046875,0.44479166666666664,0.06492911742911743,0.4235880710880711
Trump names billionaire Scott Bessent as Treasury secretary pick - CNN,https://edition.cnn.com/2024/11/22/politics/scott-bessent-treasury-secretary-trump/index.html,0.0,0.0,0.1289337250051536,0.4332303014445871
Trump's Republican Party is increasingly winning union voters. It's a shift seen in his labor pick - The Associated Press,https://apnews.com/article/trump-chavezderemer-labor-secretary-unions-republicans-1bff41e4caef610dbf38ead24d292e67,0.5,0.75,0.1302552319212567,0.4256061633206701
"Trump chooses Bessent to be treasury secretary, Vought as budget chief, Chavez-DeRemer for Labor - WHYY",https://whyy.org/articles/donald-trump-treasury-labor-secretary-budget-chief-bessent-vought-chavez-deremer/,0.0,0.0,0.10780308147329426,0.3791281610430546
How Trump Picked Gaetz for Attorney General on a 2-Hour Plane Ride - The New York Times,https://www.nytimes.com/2024/11/14/us/politics/trump-gaetz-decision-plane.html,0.09318181818181819,0.4772727272727273,0.15632240775097916,0.3825675118532261
Trump names Brooke Rollins as his pick for Agriculture secretary - CNN,https://edition.cnn.com/2024/11/23/politics/brooke-rollins-trump-agriculture/index.html,0.0,0.0,0.07941919191919193,0.34501262626262624
Trump nominates Rep. Lori Chavez-DeRemer for secretary of labor - HR Dive,https://www.hrdive.com/news/trump-nominates-rep-lori-chavez-deremer-for-secretary-of-labor/733665/,0.0,0.0,-0.0423076923076923,0.2551282051282051
"What Is Project 2025, and Why Did Trump Distance Himself From It During the Campaign? - The New York Times",https://www.nytimes.com/2024/11/06/us/politics/trump-project-2025.html,0.13636363636363635,0.45454545454545453,0.026212121212121204,0.41265151515151505
Why CEOs Are Cheering Donald Trump’s Pick for Treasury Secretary - TIME,https://time.com/7178829/why-ceos-are-cheering-donald-trump-bessent-pick-for-treasury-secretary/,0.0,0.0,0.17884114583333335,0.4996961805555555
Trump’s Labor secretary pick is surprisingly pro-union. It doesn’t mean his administration will be - CNN,https://edition.cnn.com/2024/11/23/business/trump-labor-secretary-pick/index.html,0.19374999999999998,0.59375,0.10893452988958606,0.4797741864876699
"What to know about Lori Chavez-DeRemer, Trump’s pick for labor secretary - The Associated Press",https://apnews.com/article/trump-cabinet-labor-secretary-lori-chavezderemer-feaa4672efac644aa60722d3a3215df1,0.0,0.0,0.12311257493937847,0.42002608708588185
"Trump nominates Marty Makary, who opposed COVID vaccine mandates, to head FDA - CBS News",https://www.cbsnews.com/news/trump-marty-makary-fda-administrator/,0.0,0.0,0.09215960979659617,0.4088920022139199
The three foreign policy factions fighting for Trump’s ear - Vox.com,https://www.vox.com/world-politics/386680/trump-foreign-policy-rubio-hegseth-waltz-gabbard,-0.125,0.125,0.04358470932425917,0.36826308293350096
"Trump cabinet picks: List of president-elect's appointees including RFK Jr., Pete Hegseth, Marco Rubio, Tom Homan - ABC7 New York",https://abc7ny.com/post/trump-cabinet-picks-list/15538044/,0.13636363636363635,0.45454545454545453,0.090229568785907,0.37536087807214746
"What to know about Scott Bessent, Trump’s pick for treasury secretary - The Associated Press",https://apnews.com/article/treasury-election-scott-bessent-trump-e4df1ef61309ee78f2affc2d9eabeff1,0.0,0.0,0.12604114892994586,0.41985638125153996
"Judge postpones Trump's New York ""hush money"" sentencing - CBS News",https://www.cbsnews.com/news/judge-postpones-trumps-new-york-hush-money-sentencing/,0.13636363636363635,0.45454545454545453,0.06494204720011171,0.36119955313503704
"Gaetz May Not Be Confirmed, Trump Admits. He’s Pushing Him and Others Anyway. - The New York Times",https://www.nytimes.com/2024/11/18/us/politics/trump-cabinet.html,0.2681818181818182,0.7272727272727273,0.09161856661856661,0.39913419913419906
"Trump chooses Bessent to be treasury secretary, Vought as budget chief, Chavez-DeRemer for Labor - The Associated Press",https://apnews.com/article/treasury-trump-biden-finance-elections-bessent-transition-8df8be88e4c83df4b9f3c4238966e79d,0.0,0.0,0.12230402233340085,0.40695864791347797
Trump hush money sentencing delayed indefinitely - CNBC,https://www.cnbc.com/2024/11/22/trump-hush-money-sentencing-delayed-indefinitely.html,0.0,0.0,-0.0012155830840951671,0.4295774269303694
Inside the Lobbying Career of Trump’s New Chief of Staff - The New York Times,https://www.nytimes.com/2024/11/21/us/politics/susie-wiles-trump-lobbying.html,0.13636363636363635,0.45454545454545453,0.14035334035334035,0.31786591786591784
