標題,真實新聞連結,標題_情感極性,標題_主觀性,全文_情感極性,全文_主觀性
US chip controls threaten China’s technology ambitions - The Associated Press,https://apnews.com/article/china-us-technology-processor-chips-tsmc-58b4d9bd2ba6543a9583cc3b49a9cc57,0.0,0.0,0.12630416570212855,0.4474489345988068
Intel Reportedly Making Next-Gen GPUs At TSMC: Battlemage 4nm In 2H 2024 & Celestial 3nm In 2H 2026 - Wccftech,https://wccftech.com/intel-making-next-gen-gpus-at-tsmc-battlemage-4nm-2h-2024-celestial-3nm-2h-2026/,0.0,0.0,0.04246531580868929,0.3730962812288114
Intel Reportedly Secures 4nm And 3nm TSMC Wafer Orders For Battlemage And Celestial GPUs - Hot Hardware,https://hothardware.com/news/intel-reportedly-secures-4nm-3nm-tsmc-orders,0.25,0.8500000000000001,0.1589315283987415,0.38148700115913214
Intel reportedly bets big on sales of its next-gen Arc graphics cards - PC Gamer,https://www.pcgamer.com/intel-reportedly-bets-big-on-sales-of-its-next-gen-arc-graphics-cards/,0.0,0.1,0.08801133253719459,0.4269328340880063
"Semiconductor Wars: A Busy Week For Taiwan, US, China, Netherlands, Japan And India - Swarajya",https://swarajyamag.com/world/semiconductor-wars-a-busy-week-for-taiwan-us-china-netherlands-japan-and-india,0.1,0.3,0.10881350838449101,0.46506355059397153
"Intel Next-Gen Battlemage GPUs to Leverage TSMC 4nm Node, 3nm for Celestial in 2026 [Rumor] - Hardware Times",https://hardwaretimes.com/intel-next-gen-battlemage-gpus-to-leverage-tsmc-4nm-node-3nm-for-celestial-in-2026-rumor/,0.0,0.0,-0.02017543859649122,0.2574561403508772
