標題,真實新聞連結,標題_情感極性,標題_主觀性,全文_情感極性,全文_主觀性
"TSMC needs to hire 4,500 Americans. Its 'brutal' corporate culture is getting in the way - Fortune",https://fortune.com/2023/06/03/tsmc-arizona-plant-jobs-salary-culture-hiring/,-0.4375,0.5,0.06381721348826608,0.4036753816359078
TSMC's fate will indeed be at stake if China attacks Taiwan - Nikkei Asia,https://asia.nikkei.com/Opinion/TSMC-s-fate-will-indeed-be-at-stake-if-China-attacks-Taiwan,0.0,0.0,0.11117487163998793,0.3813802476593175
"NVIDIA CEO, Jensen Huang, Says Next-Gen GPU Will Be Made By TSMC - Wccftech",https://wccftech.com/nvidia-ceo-jensen-huang-says-next-gen-gpu-will-be-made-by-tsmc/,0.0,0.0,0.09325401667683551,0.4712344925767744
You can now become a semiconductor technician in just 10 days - Quartz,https://qz.com/you-can-now-become-a-semiconductor-technician-in-just-1-1850479047,0.0,0.0,0.09313110339273128,0.448290924192087
City comes to the country: 3 new Phoenix apartment developments to make quiet rural life louder - 12news.com KPNX,https://www.12news.com/article/news/local/valley/phoenix-apartment-complex-rural-neighborhood-taiwan-semiconductor/75-ecca862e-d33b-414b-a3f2-cc62c89ee1af,0.1590909090909091,0.44696969696969696,0.05630964405964405,0.42127332852332844
Inno3D RTX 4060 Ti Twin X2 Review - KitGuru,https://www.kitguru.net/components/graphic-cards/dominic-moass/inno3d-rtx-4060-ti-twin-x2-review/,0.0,0.0,0.10342231842231843,0.4432082732082732
Qualcomm’s Snapdragon 8 Gen 2 Is Sold At A Higher Price Than What It Costs Apple To Make Each A16 Bionic - Wccftech,https://wccftech.com/snapdragon-8-gen-2-sold-at-higher-price-than-a16-bionic/,0.25,0.5,0.07447416854602489,0.5029644606890112
NVIDIA RTX 5090 and Co to be Fabbed by TSMC on 3nm or 4nm Process Node: CEO Jensen Huang - Hardware Times,https://hardwaretimes.com/nvidia-rtx-5090-and-co-to-be-fabbed-by-tsmc-on-3nm-or-4nm-process-node-ceo-jensen-huang/,0.0,0.0,0.17382716049382715,0.519074074074074
