標題,真實新聞連結,標題_情感極性,標題_主觀性,全文_情感極性,全文_主觀性
TSMC Opens Advanced Backend Packaging Fab for AI and HPC Products - AnandTech,https://www.anandtech.com/show/18906/tsmc-opens-advanced-backend-packaging-fab-for-ai-and-hpc-products,0.4,0.6,0.08333333333333333,0.19444444444444445
How Samsung became the world’s No. 2 advanced chipmaker and set the stage for a U.S. manufacturing boom - CNBC,https://www.cnbc.com/2023/06/09/samsungs-plans-to-catch-tsmc-in-semiconductor-manufacturing.html,-0.2,0.6,0.10882630281465781,0.4525574277466586
"TSMC's extreme work culture is putting off US workers, CEO says employees should have passion for job - TechSpot",https://www.techspot.com/news/99008-tsmc-extreme-work-culture-affecting-us-hiring-ceo.html,-0.125,1.0,0.030721076309311604,0.5018589253883371
"The microchip industry would implode if China invaded Taiwan, and it would affect everyone - The Conversation",https://theconversation.com/the-microchip-industry-would-implode-if-china-invaded-taiwan-and-it-would-affect-everyone-206335,0.0,0.0,0.13374083399593603,0.4020750507995406
TSMC opens new advanced backend fab - DIGITIMES,https://www.digitimes.com/news/a20230608PD214/tsmc-3dfabric-advanced-packaging-testing.html,0.2681818181818182,0.5272727272727272,0.16344831374528998,0.47304774059633636
Chips ahoy! Japan recharges home-made semiconductors – with Taipei’s help - South China Morning Post,https://www.scmp.com/week-asia/economics/article/3223465/chips-ahoy-japan-taiwans-help-recharges-home-made-semiconductor-sector,0.0,0.0,0.055288461538461536,0.3096153846153846
US scholar’s advice for Taiwan’s top chipmaker — ‘self-destruct mechanism could deter Chinese invasion’ - ThePrint,https://theprint.in/world/us-scholars-advice-for-taiwans-top-chipmaker-self-destruct-mechanism-could-deter-chinese-invasion/1622123/,0.25,0.25,0.12235562469937472,0.3840382996632996
This Company Stands to Benefit From Nvidia's AI Boom the Most - The Motley Fool,https://www.fool.com/investing/2023/06/10/this-company-stands-to-benefit-from-nvidia-ai-boom/,0.55,0.7,0.3216898542494801,0.5366691679511085
Midge bite vaccine patch developed - 台北時報,https://www.taipeitimes.com/News/taiwan/archives/2023/06/09/2003801267,0.1,0.3,0.08257381631821091,0.38493855919864906
