標題,真實新聞連結,標題_情感極性,標題_主觀性,全文_情感極性,全文_主觀性
"Global chipmaking giant TSMC plans to hire 6,000 employees this year - CNN",https://www.cnn.com/2023/03/06/tech/taiwan-tsmc-hiring-plans-2023-intl-hnk/index.html,0.0,0.5,0.05497019374068554,0.4010345255837056
Taiwan’s dominance of the chip industry makes it more important - The Economist,https://www.economist.com/special-report/2023/03/06/taiwans-dominance-of-the-chip-industry-makes-it-more-important,0.45,0.75,0.37023809523809526,0.5464285714285714
Intel puts TSMC on notice with step towards Angstrom era chips - PC Gamer,https://www.pcgamer.com/intel-puts-tsmc-on-notice-with-step-towards-angstrom-era-chips/,0.0,0.0,0.09100557700557702,0.4133805233805234
Here’s Why TSMC Stock Is in the Spotlight - TipRanks,https://www.tipranks.com/news/heres-why-tsmc-stock-is-in-the-spotlight,0.0,0.0,0.14548302574618366,0.5811517429938482
Top 3 memory vendors account for three-fourths of leading-edge wafer capacity - DIGITIMES,https://www.digitimes.com/news/a20230306VL202/foundry-semiconductor-tsmc.html,0.5,0.5,0.11598594642072904,0.4556214317083879
Apple M3 Being Prepared For Upcoming 13-Inch And 15-Inch MacBook Air Models; CPU Core Count Also Revealed - Wccftech,https://wccftech.com/apple-m3-soc-used-for-new-macbook-air-models/,0.0,0.0,0.09420511080958849,0.4996898623764296
Average housing costs top NT$10m in major locales - 台北時報,https://www.taipeitimes.com/News/biz/archives/2023/03/07/2003795603,0.13749999999999998,0.4666666666666666,0.08357094610894013,0.41962778019008956
