標題,真實新聞連結,標題_情感極性,標題_主觀性,全文_情感極性,全文_主觀性
"Google’s Tensor G5 Likely To Be Mass Produced On TSMC’s N3E Process, Tensor G4 May Only Be a Minor Update Due To Undisclosed ‘Issues’ - Wccftech",https://wccftech.com/google-tensor-g5-mass-produced-on-tsmc-n3e-process/,-0.04375,0.64375,-0.029413603637741623,0.4936424782114439
"Taiwan's APEC envoy, TSMC founder Chang, arrives in San Francisco - Focus Taiwan",https://focustaiwan.tw/politics/202311150006,0.0,0.0,0.1007552101814397,0.32522857379414727
TSMC founder in US for APEC meet - 台北時報,https://www.taipeitimes.com/News/front/archives/2023/11/16/2003809240,0.0,0.0,0.10464665032679742,0.2722528594771244
Nvidia challenger Sapeon unveils new AI chip for data centers - Korea Economic Daily,https://www.kedglobal.com/artificial-intelligence/newsView/ked202311160011,0.11212121212121212,0.21818181818181817,0.10710896022216784,0.35420791472678315
Samsung Foundry's 4nm yield doubles from 2022 to 70% - PhoneArena,https://www.phonearena.com/news/samsung-foundrys-4nm-yield-hits-70-percent_id152642,0.0,0.0,0.15480578298513079,0.5238956333521549
"Samsung Foundry’s 4nm Yield Reach 70 Percent, Aiming To Match TSMC’s Output To Attract More Clients; 3nm GAA Node Seeing Improvements Too - Wccftech",https://wccftech.com/samsung-4nm-yield-nearing-tsmc-output-to-attract-more-clients/,0.5,0.5,0.04549613784907897,0.4484574031632854
7 best Minecraft library builds - Sportskeeda,https://www.sportskeeda.com/minecraft/7-best-minecraft-library-builds,1.0,0.3,0.3415977595099932,0.5522012679991408
