標題,真實新聞連結,標題_情感極性,標題_主觀性,全文_情感極性,全文_主觀性
"SMIC, Huawei chip advances will continue despite US sanctions, says TSMC veteran - South China Morning Post",https://www.scmp.com/tech/tech-war/article/3239382/huawei-smic-chip-advances-cannot-be-stopped-futile-us-sanctions-says-tsmc-and-semiconductor-veteran,0.0,0.0,0.19497979797979798,0.4563585858585858
"If TSMC builds the fully customized Tensor G5 chip, the 2025 Pixel 10 could see another price hike - PhoneArena",https://www.phonearena.com/news/tensor-g5-fully-google-customized_id152052,0.0,0.0,0.1745207708957709,0.5221803196803197
"US cannot halt Chinese advances, chip expert says - 台北時報",https://www.taipeitimes.com/News/biz/archives/2023/10/28/2003808317,0.0,0.0,0.07455960457453001,0.4107075660657744
TSMC founder Morris Chang’s major worry: US-China decoupling - South China Morning Post,https://www.scmp.com/news/china/article/3239349/tsmc-founder-morris-changs-major-worry-us-china-tech-decoupling,0.0625,0.5,0.010885642135642129,0.5153860028860028
Taiwan's PSMC to build chip plant in Miyagi with Japan's SBI - Nikkei Asia,https://asia.nikkei.com/Business/Tech/Semiconductors/Taiwan-s-PSMC-to-build-chip-plant-in-Miyagi-with-Japan-s-SBI,0.0,0.0,0.09059561128526643,0.47210031347962367
"US-China tensions will slow global chip industry, TSMC founder says - The Fiji Times",https://www.fijitimes.com.fj/us-china-tensions-will-slow-global-chip-industry-tsmc-founder-says/,-0.15000000000000002,0.19999999999999998,0.01499600525024253,0.39401786223820134
