標題,真實新聞連結,標題_情感極性,標題_主觀性,全文_情感極性,全文_主觀性
TSMC would not exist without K. T. Li; Nvidia would not be possible without TSMC - DIGITIMES,https://www.digitimes.com/news/a20231110PD205/tsmc-morris-chang-k.-t.-li-nvidia-jensen-huang.html,0.0,1.0,0.13169326241134757,0.5101190476190477
TSMC to build 1.4nm fab in Taiwan despite aborted Longtan plan: Chair - Focus Taiwan,https://focustaiwan.tw/business/202311100005,0.0,0.0,0.10410220471695884,0.3357476994772073
"AMD To Utilize Samsung 4nm & TSMC 3nm Nodes For Next-Gen Chips, Zen 5C Possibly Codenamed Prometheus - Wccftech",https://wccftech.com/amd-to-utilize-samsung-4nm-tsmc-3nm-nodes-for-next-gen-chips-zen-5c-possibly-codenamed-prometheus/,0.0,1.0,0.1463727272727273,0.4707799903799901
Morris Chang honored for national contributions - 台北時報,https://www.taipeitimes.com/News/biz/archives/2023/11/10/2003808937,0.0,0.0,0.0525646678424457,0.39731407995296825
"China's SMIC Foundry Fumbles, 80% Decline In Profit - Tom's Hardware",https://www.tomshardware.com/tech-industry/semiconductors/chinas-smic-foundry-fumbles-80-decline-in-profit,0.0,0.0,0.100418005648067,0.45753189210244416
Japan to spend USD 13 bn to boost domestic chip production - ETAuto,https://auto.economictimes.indiatimes.com/news/auto-components/japan-to-spend-usd-13-bn-to-boost-domestic-chip-production/105127848,0.0,0.1,0.149113475177305,0.31506458966565354
"TSMC to soon announce 2nd fab project in Japan, say sources - DIGITIMES",https://www.digitimes.com/news/a20231109PD221/tsmc-fab-japan-ic-manufacturing.html,0.0,0.0,0.10404761904761901,0.4368253968253964
TSMC founder Chang vows to enhance Taiwan's visibility as APEC envoy - Focus Taiwan,https://focustaiwan.tw/politics/202311100009,0.0,0.0,0.09886436173299445,0.3191250884950614
From Shortage to Surplus: The shifting dynamics of the semiconductor market post-COVID-19 - CNBCTV18,https://www.cnbctv18.com/technology/from-shortage-to-surplus-the-shifting-dynamics-of-the-semiconductor-market-post-covid-19-18303181.htm,0.0,0.0,0.06988474488474487,0.4078347578347578
