標題,真實新聞連結,標題_情感極性,標題_主觀性,全文_情感極性,全文_主觀性
Finesse Technology soars on emerging market debut - 台北時報,https://www.taipeitimes.com/News/biz/archives/2023/12/02/2003809995,0.0,0.0,0.03718341830089683,0.38695946365000744
"Apple Watch Series 9’s S9 SiP Is A 4nm Part And Cut-Down Version Of The A16 Bionic, Revealing A Scalable Architecture For Various Product Lines - Wccftech",https://wccftech.com/apple-watch-series-9-s9-sip-based-on-the-a16-bionic/,0.0,0.5,0.06569584133493904,0.5043827642699823
Gotcha! - 台北時報,https://www.taipeitimes.com/News/biz/archives/2023/12/02/2003809998,0.0,0.0,0.03137090773809527,0.39087146577380927
"CoreWeave backed by Fidelity, Jane Street at $7B valuation - Fortune",https://fortune.com/2023/12/03/coreweave-fidelity-investment-cloud-provider-ai-startup/,0.0,0.0,0.06766198282591722,0.4224629195940671
"Tech News Today: GTA 6 trailer on December 5, iQOO 12 pre-booking, and more - The Indian Express",https://indianexpress.com/article/technology/tech-news-today-3-december-2023-gta-6-trailer-iqoo-12-prebooking-santa-gpt-9052377/,0.5,0.5,0.1256562702859854,0.5360820718686382
