標題,真實新聞連結,標題_情感極性,標題_主觀性,全文_情感極性,全文_主觀性
Taiwan Is Running Low on a Strategic Asset: Engineers (Published 2023) - The New York Times,https://www.nytimes.com/2023/05/11/technology/taiwan-tsmc-microchips.html,0.06818181818181818,0.37727272727272726,0.1758991008991009,0.5102772227772229
US Threatens To ‘Blow Up’ Taiwan’s Semiconductor Manufacturing Firm If China Invades The Island; Taipei Unhappy - EurAsian Times,https://www.eurasiantimes.com/us-threatens-to-blow-up-taiwans-semiconductor-manufacturing/,-0.4,0.65,-0.031622574955908284,0.4340564373897706
Nvidia places additional orders requiring TSMC CoWoS - DIGITIMES,https://www.digitimes.com/news/a20230510PD217/ai-cowos-nvidia-packaging-tsmc.html,0.0,0.0,0.0828954948726812,0.43967911049660086
Taiwan Will Not Let US Blow up TSMC if China Invades – TN - Asia Financial,https://www.asiafinancial.com/taiwan-will-not-let-us-blow-up-tsmc-if-china-invades-tn,0.0,0.0,0.07263599020787521,0.19672212771254327
Samsung to fill the void as TSMC trims spending? - Korea Economic Daily,https://www.kedglobal.com/korean-chipmakers/newsView/ked202305100015,0.1,0.1,0.09188666282522945,0.3800451738250376
This Japanese company believes it can catch up with chipmakers like TSMC by 2027 - TechSpot,https://www.techspot.com/news/98644-japanese-company-believes-can-catch-up-chipmakers-like.html,0.0,0.0,0.1168838312402669,0.3756047033274755
"TSMC leader highlighted ""trust"" as a key success ingredient at 2023 TSMC Technology Symposium - DIGITIMES",https://www.digitimes.com/news/a20230511VL207/tsmc.html,0.15,0.5,0.08349642255892255,0.5578545875420876
TSMC Working Hard To Control Costs - BusinessToday,https://www.businesstoday.com.my/2023/05/11/tsmc-working-hard-to-control-costs/,-0.2916666666666667,0.5416666666666666,0.003628117913832197,0.48374149659863946
