標題,真實新聞連結,標題_情感極性,標題_主觀性,全文_情感極性,全文_主觀性
"Intel denies rumors of 3nm delays, says planned 2024 releases are on schedule - TechSpot",https://www.techspot.com/news/97731-intel-denies-rumors-3nm-delays-planned-2024-releases.html,0.0,0.0,0.08116666666666666,0.3977792207792207
"Samsung, SK Hynix Likely To Face Further Manufacturing Restrictions - Wccftech",https://wccftech.com/samsung-sk-hynix-likely-to-face-further-manufacturing-restrictions/,0.0,0.75,0.059969996999700036,0.4492666409498093
iPhone 15 to Receive Upgraded OLED Display Chip for Better Efficiency & Battery Life - AppleMagazine,https://applemagazine.com/iphone-15-to-receive-upgraded-oled-display-chip-for-better-efficiency-battery-life/,0.5,0.5,0.1771556931440653,0.4076562971911809
[UNBOXING] Acer Predator BiFrost Intel Arc A770 OC - Overclocking.com,https://en.overclocking.com/unboxing-acer-predator-bifrost-intel-arc-a770-oc/2/,0.0,0.0,0.12038816738816739,0.461028379028379
Chip industry doubles down on Singapore as production hub - Nikkei Asia,https://asia.nikkei.com/Business/Tech/Semiconductors/Chip-industry-doubles-down-on-Singapore-as-production-hub,-0.15555555555555559,0.2888888888888889,0.04241856769946658,0.3204006355691747
"Peru’s top tourist attraction, Machu Picchu, reopens after violent protests end - The Star Online",https://www.thestar.com.my/lifestyle/travel/2023/02/26/perus-top-tourist-attraction-machu-picchu-reopens-after-violent-protests-end,-0.15000000000000002,0.75,0.0225448933782267,0.5653759820426488
