標題,真實新聞連結,標題_情感極性,標題_主觀性,全文_情感極性,全文_主觀性
‘Selectively clipped’ video misrepresents US official’s TSMC comments - 台北時報,https://www.taipeitimes.com/News/taiwan/archives/2023/05/12/2003799660,0.0,0.0,0.09301584483225106,0.3527915313852816
"NVIDIA’s Top GPUs Are In Big Demand For AI, Places Additional Orders At TSMC - Wccftech",https://wccftech.com/nvidias-top-gpus-are-in-big-demand-for-ai-places-additional-orders-at-tsmc/,0.25,0.3,0.10748624518677999,0.43664104760361405
Gaw Capital eyes more Japan property deals amid TSMC expansion - South China Morning Post,https://www.scmp.com/business/companies/article/3220280/gaw-capital-eyes-more-japan-property-deals-amid-high-expectations-tsmcs-chip-factories,0.5,0.5,0.03696428571428571,0.3514285714285714
TSMC says new chips to be world’s most advanced - 台北時報,https://www.taipeitimes.com/News/biz/archives/2023/05/12/2003799625,0.34545454545454546,0.5181818181818182,0.11281870075245468,0.44284792494571606
3nm Apple Silicon: What Is It and Why Does It Matter? - MacRumors,https://www.macrumors.com/guide/3nm/,0.0,0.0,0.060779078377762606,0.43323080428343563
Wife of TSMC founder appears at Taiwan rally with Terry Gou - Taiwan News,https://taiwannews.com.tw/news/4890808,0.0,0.0,0.07361111111111111,0.26666666666666666
Foxconn founder Terry Gou and TSMC founder’s wife visit temple before Taiwan KMT presidential candidate announcement - Dimsum Daily,https://www.dimsumdaily.hk/foxconn-founder-terry-gou-and-tsmc-founders-wife-visit-temple-before-taiwan-kmt-presidential-candidate-announcement/,0.0,0.0,0.051073232323232326,0.38806818181818187
NVIDIA GeForce RTX 4060 Ti 16 GB Graphics Card To Feature 5W Higher TDP Than 8 GB Model - Wccftech,https://wccftech.com/nvidia-geforce-rtx-4060-ti-16-gb-graphics-card-feature-5w-higher-tdp-8-gb-model/,0.25,0.5,0.07824259074259084,0.4764337884337885
