標題,真實新聞連結,標題_情感極性,標題_主觀性,全文_情感極性,全文_主觀性
Where Will TSMC Stock Be in 1 Year? - The Motley Fool,https://www.fool.com/investing/2023/10/22/where-will-tsmc-stock-be-in-1-year/,0.6,0.9,0.3077394730064261,0.47031052648745447
TSMC affiliate eyes Singapore for its most advanced chip plant - Nikkei Asia,https://asia.nikkei.com/Business/Tech/Semiconductors/TSMC-affiliate-eyes-Singapore-for-its-most-advanced-chip-plant,0.45,0.55,0.15717505634860995,0.3139994991234661
EMD Electronics marks major expansion in Chandler as Ariz. semiconductor sector continues to grow - Chamber Business News,https://chamberbusinessnews.com/2023/10/23/emd-electronics-marks-major-expansion-in-chandler-as-ariz-semiconductor-sector-continues-to-grow/,0.0625,0.5,0.17186048799685164,0.4554260133805587
Hokkaido waits to gauge impact from upcoming Rapidus chip plant - The Japan Times,https://www.japantimes.co.jp/business/2023/10/23/tech/rapidus-plants-hokkaido/,0.0,0.0,0.08815483689663109,0.37541632328284397
Mediatek Dimensity 9300 sets new AnTuTu record - GSMArena.com news - GSMArena.com,https://www.gsmarena.com/mediatek_dimensity_9300_appears_on_antutu_with_recordbreaking_results-news-60323.php,0.13636363636363635,0.45454545454545453,0.10936769274681366,0.44802464019496974
Mumbai: Did Kriti Sanon Buy A New Apartment In Bandra For ₹35 Crore? Actress Gets Spotted (WATCH) - Free Press Journal,https://www.freepressjournal.in/entertainment/mumbai-did-kriti-sanon-buy-a-new-apartment-in-bandra-for-35-crore-actress-gets-spotted-watch,0.2681818181818182,0.6272727272727273,0.26524064171122985,0.4772727272727271
