標題,真實新聞連結,標題_情感極性,標題_主觀性,全文_情感極性,全文_主觀性
"TSMC to partner with Kyushu University on chip personnel, research - Nikkei Asia",https://asia.nikkei.com/Business/Tech/Semiconductors/TSMC-to-partner-with-Kyushu-University-on-chip-personnel-research,0.0,0.0,0.03581818181818182,0.24497727272727265
TSMC staff’s babies make up 1.8% of total newborns - 台北時報,https://www.taipeitimes.com/News/taiwan/archives/2024/03/31/2003815732,0.0,0.75,0.07731222174350133,0.2973861841160421
TSMC boss says one-trillion transistor GPU is possible by early 2030s - The Register,https://www.theregister.com/2024/04/01/tsmc_one_trillion_transistor/,0.05,0.65,0.12494287499442139,0.5244438493923032
"[News] With Rampant Plant Construction, TSMC Reportedly Expected to Revise Upward Capital Expenditure - TrendForce",https://www.trendforce.com/news/2024/04/01/news-with-rampant-plant-construction-tsmc-reportedly-expected-to-revise-upward-capital-expenditure/,-0.1,0.4,0.04807104059462554,0.4228778349533067
"TSMC, Kyushu University to Agree on Comprehensive Partnership; Kyushu Chip Industry Said to Face Experts Shortfall - The Japan News",https://japannews.yomiuri.co.jp/business/companies/20240331-177752/,0.0,0.0,0.09830476075496009,0.4025976900478893
"[News] Intel Unveils Two New GPUs, Manufactured on TSMC’s 4nm Process while Reportedly Targeting NVIDIA RTX 40 Series - TrendForce",https://www.trendforce.com/news/2024/04/01/news-intel-unveils-two-new-gpus-manufactured-on-tsmcs-4nm-process-while-reportedly-targeting-nvidia-rtx-40-series/,0.13636363636363635,0.45454545454545453,-0.017006968076486793,0.39672662453411134
"TSMC to work with Kyushu school on research, training - 台北時報",https://www.taipeitimes.com/News/biz/archives/2024/04/01/2003815751,0.0,0.0,0.023607815219110928,0.3821586774244577
"‘Smart Factory’ Trend Sweeping Samsung, LG - BusinessKorea",https://www.businesskorea.co.kr/news/articleView.html?idxno=214117,0.21428571428571427,0.6428571428571429,0.13787743927930843,0.44568650456500936
