標題,真實新聞連結,標題_情感極性,標題_主觀性,全文_情感極性,全文_主觀性
Almost 300 Taiwanese students have come due to TSMC plants - KTAR.com,https://ktar.com/arizona-news/almost-300-taiwanese-students-have-come-due-to-tsmc-plants/5576077/,-0.125,0.375,0.14618191885633744,0.3330094969629853
TSMC’s May Sales Rise 30% as Countries Race to Secure AI Chips - Yahoo Finance,https://finance.yahoo.com/news/tsmc-may-sales-rise-30-054345656.html,0.4,0.6,0.3227916666666667,0.5222083333333333
"TSMC is in better shape than ever, despite fierce competition - Techzine Europe",https://www.techzine.eu/blogs/infrastructure/120863/tsmc-is-in-better-shape-than-ever-despite-fierce-competition/,0.5,0.5,0.12320931320931326,0.4468062380562379
The AI boom sent TSMC's sales surging 30% - Quartz,https://qz.com/taiwan-semiconductor-manufacturing-company-tsmc-ai-chip-1851525656,0.0,0.0,0.09563711773927856,0.38143319243515716
SK top executives visit TSMC's new chairman in secret mission - DIGITIMES,https://www.digitimes.com/news/a20240607PD210/sk-hynix-tsmc-hbm-ic-manufacturing-computex-2024-ai-nvidia.html,0.07878787878787878,0.5515151515151515,0.12361807867223022,0.4030435869786047
Who benefitted from the CHIPS Act? - The Verge,https://www.theverge.com/24166234/chips-act-funding-semiconductor-companies,0.0,0.0,0.11119617224880383,0.4262240829346092
"Intel & AMD Laptop CPU Roadmap Leak: Arrow Lake-HX In 2025, Refresh In 2026 With Panther Lake, Fire Range With 16-Cores & X3D In 2025 - Wccftech",https://wccftech.com/intel-amd-laptop-cpu-roadmap-leak-arrow-lake-hx-2025-refresh-2026-panther-lake-fire-range-16-cores-x3d-2025/,0.0,0.0,0.07192773706740188,0.42205494691528195
SK Group chairman meets TSMC chairman in Taiwan - koreatimes,https://www.koreatimes.co.kr/www/tech/2025/03/129_376143.html,0.0,0.0,0.0,0.6
"Taiwan key for next-generation tech, Lisa Su says - 台北時報",https://www.taipeitimes.com/News/front/archives/2024/06/08/2003819042,0.0,1.0,0.08600897595812851,0.31534047496759327
