標題,真實新聞連結,標題_情感極性,標題_主觀性,全文_情感極性,全文_主觀性
"TSMC plans third fab in Phoenix, increases investment to $65 billion - Arizona Big Media",https://azbigmedia.com/business/economic-development/tsmc-plans-third-fab-in-phoenix-increases-investment-to-65-billion/,0.0,0.05,0.1834991067133925,0.3707276850133993
Could TSMC Become the Next Nvidia? - The Motley Fool,https://www.fool.com/investing/2024/04/22/could-tsmc-become-the-next-nvidia/,0.3,0.45,0.29595918450775005,0.4889789702979541
"Chips manufactured in the US and Germany will cost more, TSMC says - TechSpot",https://www.techspot.com/news/102696-chips-manufactured-west-cost-more-tsmc.html,0.5,0.5,0.08350485991995427,0.42038307604345343
Advanced packaging still in short supply; production expansion spreading overseas - DIGITIMES,https://www.digitimes.com/news/a20240422PD210/advanced-packaging-tsmc-ase-production-expansion-testing.html,0.2,0.44999999999999996,0.15007148692810449,0.4842553688141926
Winning the race for capacity: challenges and solutions in high-tech construction - Arcadis,https://www.arcadis.com/en/insights/blog/global/2024/winning-the-race-for-capacity,0.5,0.75,0.0,0.0
Is It Too Late to Buy Taiwan Semiconductor Stock? - The Motley Fool,https://www.fool.com/investing/2024/04/22/is-it-too-late-to-buy-taiwan-semiconductor-stock/,0.15,0.75,0.2989395109549385,0.5138516865079346
SK Hynix to use TSMC's base die for HBM4 - 디일렉(THE ELEC 영문판),https://www.thelec.net/news/articleView.html?idxno=4808,-0.8,1.0,0.10275757575757576,0.5483030303030304
Malaysian technology firms to see demand picking up in second half? - New Straits Times,https://www.nst.com.my/business/corporate/2024/04/1040953/malaysian-technology-firms-see-demand-picking-second-half,-0.010101010101010102,0.20707070707070707,0.24024064171122994,0.480704099821747
