標題,真實新聞連結,標題_情感極性,標題_主觀性,全文_情感極性,全文_主觀性
TSMC Arizona ‘tops out’ second Phoenix fab - Arizona Big Media,https://azbigmedia.com/real-estate/tsmc-arizona-tops-out-second-phoenix-fab/,0.0,0.05,0.18175699300699305,0.4031643356643357
[News] NVIDIA Reportedly Overwhelms TSMC with 3 and 4-Nanometer Orders - TrendForce,https://www.trendforce.com/news/2024/03/04/news-nvidia-reportedly-overwhelms-tsmc-with-3-and-4-nanometer-orders/,0.0,0.0,0.052883597883597894,0.371554232804233
Nvidia's AI chips boom could help the Biden administration bring semiconductor jobs to the US - Business Insider,https://www.businessinsider.com/nvidia-ai-chip-semiconductors-tsmc-intel-jobs-arizona-2024-2,0.0,0.0,0.12721017078159935,0.4057433043147329
"Most upcoming Arrow Lake CPUs will leverage TSMC nodes for compute, Intel 20A only for Core i5 and lower: Leak - Tom's Hardware",https://www.tomshardware.com/pc-components/cpus/most-upcoming-arrow-lake-cpus-will-leverage-tsmc-nodes-for-compute-intel-20a-only-for-core-i5-and-lower-leak,0.25,0.75,0.1514732314099402,0.5062423968436625
"Meta Switching To Samsung Foundry For AI Chips, Leaving TSMC Due To Volatility - Wccftech",https://wccftech.com/meta-switching-samsung-foundry-for-ai-chips-leaving-tsmc-due-to-volatility/,-0.125,0.375,0.06091634911994197,0.48559750628612885
Japan in the midst of a semiconductor plant construction rush - The Japan Times,https://www.japantimes.co.jp/article-expired/,0.0,0.0,0.06766156462585037,0.3580895691609972
"Taiwan, Harvard sign PhD scholarship agreement - 台北時報",https://www.taipeitimes.com/News/taiwan/archives/2024/03/04/2003814443,0.0,0.0,0.09507172791747259,0.3450676982591877
Intel Foundry is trying to poach Samsung's South Korean customers in its bid to become world's second-biggest foundry: report - Tom's Hardware,https://www.tomshardware.com/tech-industry/semiconductors/intel-foundry-is-trying-to-poach-samsungs-south-korean-customers-in-its-bid-to-become-worlds-second-biggest-foundry-report,0.0,0.0,0.07108736171236173,0.4564739658489656
"Samsung Foundry Turns to NVIDIA's ""Digital Twin"" Technology to Counter Yield Issues and Competition from TSMC and IFS - Appuals",https://appuals.com/samsung-foundry-digital-twin/,0.0,0.0,0.07608149951899952,0.3237343674843675
