標題,真實新聞連結,標題_情感極性,標題_主觀性,全文_情感極性,全文_主觀性
TSMC Tempers Outlook on Quake Loss as AI Concerns Persist - Yahoo Finance,https://consent.yahoo.com/v2/collectConsent?sessionId=3_cc-session_99006ebe-7baf-4fdf-8fb3-c1aed4ba6b01,0.0,0.0,0.0,0.0
Taiwan and TSMC rush to head off Donald Trump’s tariff threat - Financial Times,https://www.ft.com/content/07aaca14-46a2-48f0-b427-aa9ed44da90b,0.0,0.0,0.22538648018648044,0.3959328671328684
[News] TSMC’s U.S. Board Meeting Focus at a Glance: Potential Expansion Amid Chip Export Restrictions - TrendForce,https://www.trendforce.com/news/2025/02/10/news-tsmcs-u-s-board-meeting-focus-at-a-glance-potential-expansion-amid-chip-export-restrictions/,0.0,1.0,0.07779622063329922,0.3949012597889003
TSMC reports $162m in losses after recent Taiwanese earthquake - DatacenterDynamics,https://www.datacenterdynamics.com/en/news/tsmc-reports-162m-in-losses-after-recent-taiwanese-earthquake/,0.0,0.25,0.08919145370758272,0.35824954615277205
TSMC trims Q1 sales target following earthquake - Mobile World Live,https://www.mobileworldlive.com/old_latest-stories/tsmc-trims-q1-sales-target-following-earthquake/,0.06818181818181818,0.3,0.11588804713804712,0.34042508417508416
"TSMC To Scale Up Investments On Its Arizona Facility, Likely To Drive Up Production Figures & Align With Trump’s Ambitions - Wccftech",https://wccftech.com/tsmc-to-scale-up-investments-on-its-arizona-facility/,0.0,1.0,0.048261494252873495,0.5381403940886698
"Trump seeks to force TSMC negotiations, experts say - 台北時報",https://www.taipeitimes.com/News/biz/archives/2025/02/10/2003831601,0.0,0.0,0.07571262490130412,0.43452955430313916
Ex-TSMC exec urges US-Taiwan chip cooperation amidst 100% tariff threat - gasworld,https://www.gasworld.com/story/ex-tsmc-exec-urges-us-taiwan-chip-cooperation-amidst-100-tariff-threat/2151045.article/,0.0,0.0,0.11583333333333334,0.29250000000000004
January earthquake shook $165M off TSMC’s revenue forecast - The Register,https://www.theregister.com/2025/02/11/tsmc_taiwan_earthquake_financial_impact/,0.0,0.0,0.18247354497354495,0.39917328042328054
Will Potential Tariffs on Taiwan Semiconductor Manufacturing Sink the Stock? - The Motley Fool,https://www.fool.com/investing/2025/02/10/will-president-donald-trumps-potential-tariffs-on/,0.3,0.95,0.3051553884711793,0.5235267335004161
"OpenAI Joins Forces with TSMC to Build AI Chips, Aims to Cut Nvidia Dependence - Yahoo Finance",https://consent.yahoo.com/v2/collectConsent?sessionId=3_cc-session_ca6e99f4-ff5f-4204-b3b2-24008c818c30,0.0,0.0,0.0,0.0
TSMC warns of weak Q1 sales due to earthquake impact - Yahoo Finance,https://consent.yahoo.com/v2/collectConsent?sessionId=3_cc-session_2b2d3635-f206-457c-9e0d-26b4763dcaf1,-0.25,0.5,0.0,0.0
Quake to bring Q1 to lower end: TSMC - 台北時報,https://www.taipeitimes.com/News/biz/archives/2025/02/11/2003831651,0.0,0.0,0.06987260915832345,0.40251912394769535
OpenAI reportedly finalizing design for in-house AI chip ahead of TSMC fabrication - SiliconANGLE News,https://siliconangle.com/2025/02/10/openai-reportedly-finalizing-design-house-ai-chip-ahead-tsmc-fabrication/,0.0,0.0,0.12473327135079945,0.47475172467094884
"TSMC Aligns with Trump’s Policies, Expanding U.S. Investment - BusinessKorea",https://www.businesskorea.co.kr/news/articleView.html?idxno=235181,0.0,0.0,0.15378250591016546,0.311111111111111
[News] TSMC Reportedly Set to Announce New Chief Human Resources Officer at Its First U.S. Board Meeting - TrendForce,https://www.trendforce.com/news/2025/02/11/news-tsmc-reportedly-set-to-announce-new-chief-human-resources-officer-at-its-first-board-meeting-in-the-u-s/,0.12878787878787878,0.295959595959596,0.038073868455547846,0.32895134551623123
"OpenAI close to finalising its own chip design, send it to TSMC for fabrication by 2025-end - Firstpost",https://www.firstpost.com/tech/openai-close-to-finalising-its-own-chip-design-send-it-for-fabrication-to-tsmc-by-2025-end-13862083.html,0.6,1.0,0.21526677755741785,0.5393383873925746
Earthquake in Taiwan causes $162 million loss for TSMC - Harici,https://harici.com.tr/en/earthquake-in-taiwan-causes-162-million-loss-for-tsmc/,0.0,0.0,0.07270684714346683,0.41449642298233863
"[News] TSMC Expects Q1 Revenue at Lower End of Guidance due to Earthquake, with NT$5.3 billion Losses - TrendForce",https://www.trendforce.com/news/2025/02/10/news-tsmc-expects-q1-revenue-at-lower-end-of-guidance-due-to-earthquake-with-nt5-3-billion-losses/,-0.125,0.375,0.01010101010101009,0.40562770562770595
"Cathie Wood's Massive Tuesday Overhaul: Unloads $28.4M In Palantir, Dumps Robinhood, Swoops Up Tech Giants Shopify, AMD, TSMC And Amazon - Advanced Micro Devices (NASDAQ:AMD), Amazon.com (NASDAQ:AMZN) - Benzinga",https://www.benzinga.com/25/02/43646255/cathie-woods-massive-tuesday-overhaul-unloads-28-4m-in-palantir-dumps-robinhood-swoops-up-tech-giants-shopify-amd-tsmc-and-amazon,0.2,0.8,0.1431094987433014,0.41699862474510285
Even earthquakes can’t rattle TSMC’s earnings outlook - Sherwood News,https://sherwood.news/markets/even-earthquakes-cant-rattle-tsmcs-earnings-outlook/,0.0,0.0,0.15,0.3761904761904762
"Geopolitics, FDI, and chips: TSMC’s Japan play | White paper - Hinrich Foundation",https://www.hinrichfoundation.com/research/wp/tech/tsmc-in-japan/,0.0,0.0,0.10240097828680503,0.34262828160465963
Tariff concerns drive TSMC price hikes while Samsung seeks competitive edge - DIGITIMES,https://www.digitimes.com/news/a20250208PD214/tsmc-price-samsung-production-tariff.html,0.0,0.0,0.16056301652892557,0.475077479338843
"[News] OpenAI Reportedly to Finalize In-House AI Chip Design Soon, Set for TSMC’s 3nm Production - TrendForce",https://www.trendforce.com/news/2025/02/11/news-openai-reportedly-to-finalize-in-house-ai-chip-design-soon-set-for-tsmcs-3nm-production/,0.0,0.0,0.014865689865689861,0.4281440781440782
Why TSMC elects to reveal its earthquake loss figures now - DIGITIMES,https://www.digitimes.com/news/a20250210PD239/tsmc-earthquake-outlook-tariff-production.html,0.0,0.0,0.17860180754917598,0.45411128832181463
"TSMC January sales 2nd highest ever, but will book NT$5.3 billion loss - Focus Taiwan",https://focustaiwan.tw/business/202502100008,0.0,0.0,0.13983890160598786,0.38342317055446606
OpenAI finalizing custom AI chip design ahead of 2026 launch - report - DatacenterDynamics,https://www.datacenterdynamics.com/en/news/openai-finalizing-custom-ai-chip-design-ahead-of-2026-launch-report/,0.0,0.0,0.05834839073969507,0.4355298324863542
Chinese AI firms grapple with TSMC's BIS whitelist restrictions - DIGITIMES,https://www.digitimes.com/news/a20250211PD218/tsmc-ic-design-testing-chips-packaging.html,0.0,0.0,0.14843893480257117,0.3915977961432508
Taiwan OSAT firms set to benefit from TSMC's enforcement of BIS whitelist - DIGITIMES,https://www.digitimes.com/news/a20250211PD208/tsmc-osat-ic-design-supply-chain-chips.html,0.0,0.0,0.1470381231671554,0.4186217008797655
Trump plan to kill CHIPS Act threatens US-made iPhone processors - Cult of Mac,https://www.cultofmac.com/news/us-chip-production-trump,0.0,0.0,0.07899044795783926,0.34099904322730407
"Trending tickers: Alibaba, TSMC, United States Steel, BP and ITV - Yahoo Finance UK",https://uk.finance.yahoo.com/news/alibaba-tsmc-united-states-steel-bp-itv-trending-tickers-114922219.html,0.0,0.0,0.11342014767339444,0.4256538014654898
TSMC Anticipates Lower Q1 Revenue from Earthquake Impact - KAOHOON INTERNATIONAL,https://www.kaohooninternational.com/markets/552282,0.0,0.0,0.065,0.3226923076923077
Decoding Taiwan-US semiconductor trade ties (Part 2): TSMC's fast track to US 2nm production - DIGITIMES,https://www.digitimes.com/news/a20250207VL211/2024-taiwan-production-tariff-tsmc.html,0.2,0.6,0.15030484485574297,0.4630321175830158
Quake impact prompts TSMC to narrow 1Q25 sales guidance range - DIGITIMES,https://www.digitimes.com/news/a20250210VL205/tsmc-sales-guidance-earthquake-growth.html,-0.2,0.4,0.13764568764568755,0.45822066822066804
TSMC sees $162m in losses from Taiwan's January quakes - Nikkei Asia,https://asia.nikkei.com/Business/Technology/TSMC-sees-162m-in-losses-from-Taiwan-s-January-quakes,0.0,0.0,0.08517800607352849,0.41170446468953936
"OpenAI Is In The Process Of Finalizing The Design Of Its Custom AI Chip In The Next Few Months, Tape-Out Process At TSMC Could Commence From H1 2025 - Wccftech",https://wccftech.com/openai-finalizing-custom-ai-chip-design-tape-out-at-tsmc-may-happen-in-h1-2025/,-0.1,0.05,0.05459821428571427,0.49218208874458863
Taiwan should cooperate with U.S. amid chip tariff threat: Ex-TSMC exec - Focus Taiwan,https://focustaiwan.tw/business/202502100014,0.0,0.0,0.09484626378507822,0.3364403113351486
TSMC’s Q1 Revenue Forecast Hurt by January Earthquake - TipRanks,https://www.tipranks.com/news/tsmcs-q1-revenue-forecast-hurt-by-january-earthquake,0.0,0.0,0.0625,0.44202898550724634
TSMC (TSM) Reports January Revenue Growth Amid Earthquake Impact - GuruFocus.com,https://www.gurufocus.com/news/2688555/tsmc-tsm-reports-january-revenue-growth-amid-earthquake-impact,0.0,0.0,0.13047416290116998,0.3875980477349091
OpenAI with own AI chip on the way to less Nvidia - Techzine Europe,https://www.techzine.eu/news/infrastructure/128582/openai-with-own-ai-chip-on-the-way-to-less-nvidia/,0.21666666666666667,0.5333333333333333,0.22959514974821096,0.4218161940100715
OpenAI to finalise first custom chip design to cut Nvidia reliance - South China Morning Post,https://www.scmp.com/tech/big-tech/article/3298154/openai-set-finalise-first-custom-chip-design-year-cut-reliance-nvidia,0.25,0.3333333333333333,0.1192959001782531,0.3674242424242424
[News] TSMC’s Impact? Kumamoto Sees Wave of Corporate Bankruptcies Amid TSMC’s Expansion - TrendForce,https://www.trendforce.com/news/2025/02/10/news-tsmcs-impact-kumamoto-sees-wave-of-corporate-bankruptcies-amid-tsmcs-expansion/,0.0,0.0,-0.0025785818713450364,0.3686421783625734
🌏 OpenAI gets chippy - Quartz,https://qz.com/emails/daily-brief/1851759907/open-ai-google-trump-tariffs-metal-amazon-mcdonalds,0.0,0.0,0.2501105462901704,0.4377009273121876
OpenAI is reportedly getting closer to launching its in-house chip - The Verge,https://www.theverge.com/news/609421/openai-in-house-chip-development,0.0,0.0,0.13863363067908524,0.3146213214395032
OpenAI to tape-out on TSMC 3nm this year - Electronics Weekly,https://www.electronicsweekly.com/news/business/openai-to-tape-out-on-tsmc-3nm-year-2025-02/,0.0,0.0,0.06875,0.4854166666666667
"TSMC's January 2025 Sales Growth Slows Amid AI Investment Concerns - News and Statistics - IndexBox, Inc.",https://www.indexbox.io/blog/tsmc-faces-decelerating-sales-growth-amidst-ai-spending-uncertainty/,0.0,0.0,0.15701268978732635,0.4245994447125306
TSMC Expects a $161M Revenue Hit from Earthquake in Taiwan - The Tokenist,https://tokenist.com/tsmc-expects-a-161m-revenue-hit-from-earthquake-in-taiwan/,0.0,0.0,0.19443541861188895,0.46233777551424593
OpenAI’s secret weapon against Nvidia dependence takes shape - Ars Technica,https://arstechnica.com/ai/2025/02/openais-secret-weapon-against-nvidia-dependence-takes-shape/,-0.4,0.7,0.06691883116883116,0.3846341991341991
"Apple begins M5 chip mass production with TSMC and key suppliers from Japan, South Korea - DIGITIMES",https://www.digitimes.com/news/a20250207PD224/tsmc-production-apple-manufacturing-3nm.html,0.0,1.0,0.1819304152637485,0.4972783389450057
TSMC plans to build a 1-nm gigafab in Taiwan - All-About-Industries,https://www.all-about-industries.com/tsmc-plans-to-build-a-1-nm-gigafab-in-taiwan-a-bc4288f0c6a5a9891bfcd53735efb073/,0.0,0.0,0.054022988505747126,0.31580459770114944
Intel Stock Marks Second Largest Gain In 2025 After VP Vance Asserts Powerful AI Chips Will Be Made In America - Wccftech,https://wccftech.com/intel-stock-marks-second-largest-gain-in-2025-after-vp-vance-asserts-powerfull-ai-chips-will-be-made-in-america/,0.15,0.5,0.16219504093266474,0.4550700784364149
Nvidia Leads Chip Stocks Higher Monday as Markets Rebound - Investopedia,https://www.investopedia.com/nvidia-leads-chip-stocks-higher-monday-as-markets-rebound-8789002,0.25,0.5,0.1356534090909091,0.38203914141414136
Taiwan Semiconductor Manufacturing Company Limited (TSM): A Bull Case Theory - Insider Monkey,https://www.insidermonkey.com/blog/taiwan-semiconductor-manufacturing-company-limited-tsm-a-bull-case-theory-4-1448951/,-0.060714285714285714,0.07142857142857142,0.18044579533941232,0.4488601823708206
OpenAI’s first AI chip to tape out at TSMC in first half of the year: report - TechNode,https://technode.com/2025/02/11/openais-first-ai-chip-to-tape-out-at-tsmc-in-first-half-of-the-year-report/,0.11111111111111112,0.27777777777777773,-0.016666666666666663,0.35000000000000003
[News] Potential U.S. Tariffs on Taiwan Semiconductors Spark Calls for Stronger U.S.-Taiwan Tech Cooperation - TrendForce,https://www.trendforce.com/news/2025/02/11/news-potential-u-s-tariffs-on-taiwan-semiconductors-spark-calls-for-stronger-u-s-taiwan-tech-cooperation/,0.0,1.0,0.060389610389610396,0.48356946084218827
OpenAI to Produce First AI Chip with TSMC’s 3nm Technology - AIM,https://analyticsindiamag.com/ai-news-updates/openai-to-produce-first-ai-chip-with-tsmcs-3nm-technology/,0.25,0.3333333333333333,0.15458603896103898,0.507325487012987
Taiwan and TSMC push back against Donald Trump's proposed chip tariffs - Moneycontrol,https://www.moneycontrol.com/news/world/taiwan-and-tsmc-push-back-against-donald-trump-s-proposed-chip-tariffs-12937644.html,0.0,0.0,0.13561593019140197,0.35947718424133523
OpenAI to send final chip design to Taiwan’s TSMC - Taiwan News,https://taiwannews.com.tw/news/6034480,0.0,1.0,0.06,0.2633333333333333
TSMC (TSM) Shares Rise on AI Chip Manufacturing News - GuruFocus.com,https://www.gurufocus.com/news/2688924/tsmc-tsm-shares-rise-on-ai-chip-manufacturing-news,0.0,0.0,0.1384282539682537,0.38295031746031744
[Insights] Exploring Rapidus’ Path to 2nm Mass Production: 3 Key Challenges Ahead - TrendForce,https://www.trendforce.com/news/2025/02/10/insights-exploring-rapidus-path-to-2nm-mass-production-3-key-challenges-ahead/,0.25,1.0,0.06638164999092148,0.44308792752501386
"Trump may renege on CHIPS Act, jeopardizing plans for Apple chips in the US - 9to5Mac",https://9to5mac.com/2025/02/11/trump-may-renege-on-chips-act-jeopardizing-plans-for-apple-chips-in-the-us/,0.0,0.0,0.016666666666666666,0.5875
TSMC sees Q1 revenue near lower end of guidance on January earthquake impact - CNA,https://www.channelnewsasia.com/east-asia/tsmc-sees-q1-revenue-near-lower-end-guidance-january-earthquake-impact-4928056,0.1,0.4,0.24312499999999998,0.45999999999999996
TSMC to hold first US board meeting - Taiwan News,https://taiwannews.com.tw/news/6034236,0.25,0.3333333333333333,0.03888888888888889,0.25555555555555554
"TSMC's sales last month, which was announced on the 10th, were $293.3 billion (about $8.9 billion) - 매일경제",https://www.mk.co.kr/en/stock/11237482,0.0,0.06666666666666667,0.09659436308372481,0.3232324767431153
Has the Shield Become a Snare? Taiwan’s Semiconductor Supremacy and the Challenge of Economic Sovereignty - Australian Institute of International Affairs,https://www.internationalaffairs.org.au/australianoutlook/has-the-shield-become-a-snare-taiwans-semiconductor-supremacy-and-the-challenge-of-economic-sovereignty/,0.06666666666666667,0.06666666666666667,0.07243559029966797,0.3356143963910953
"OpenAI’s first AI chip enters final design stage, mass production planned for 2026: Report | Mint - Mint",https://www.livemint.com/technology/tech-news/openais-first-ai-chip-enters-final-design-stage-mass-production-planned-for-2026-report-nvidia-chatgpt-tsmc-11739251765952.html,0.125,0.6666666666666666,0.12274749915341875,0.4032658814054166
Taiwan's TSMC January revenue hits NT$293.2 billion - Taiwan News,https://taiwannews.com.tw/news/6033595,0.0,0.0,0.027777777777777776,0.2888888888888889
ChatGPT-maker OpenAI’s rival to Nvidia’s AI chips may finally be ready this year - The Times of India,https://timesofindia.indiatimes.com/technology/tech-news/chatgpt-maker-openais-rival-to-nvidias-ai-chips-may-finally-be-ready-this-year/articleshow/118121812.cms,0.2,0.5,0.13438212904929936,0.47946519986989
"Intel stock surges as Vance pledges to protect US AI technology, boost domestic production - TradingView",https://www.tradingview.com/news/invezz:0e2766f7a094b:0-intel-stock-surges-as-vance-pledges-to-protect-us-ai-technology-boost-domestic-production/,0.0,0.1,0.04081023143523143,0.41815788378288377
OpenAI moves to develop its own AI chips by 2026 - THE DECODER,https://the-decoder.com/openai-moves-to-develop-its-own-ai-chips-by-2026/,0.6,1.0,0.12077658114243484,0.4062664977299124
The Race For Chip Dominance | CNBC Marathon - CNBCAfrica.com,https://www.cnbcafrica.com/2025/the-race-for-chip-dominance-cnbc-marathon/,0.0,0.0,0.153309114665822,0.4667831406398486
TSMC sales growth slows in January after DeepSeek roils market - The Straits Times,https://www.straitstimes.com/business/companies-markets/tsmc-sales-growth-slows-in-january-after-deepseek-roils-market,0.0,0.0,0.08204099821746881,0.46203208556149733
