標題,真實新聞連結,標題_情感極性,標題_主觀性,全文_情感極性,全文_主觀性
Nasdaq Index Performance: December 2022 - Nasdaq,https://www.nasdaq.com/articles/nasdaq-index-performance-december-2022,0.0,0.0,0.05932043509433784,0.3928728196655318
GE HealthCare starts trading on Nasdaq as independent company - MedTech Dive,https://www.medtechdive.com/news/GE-healthcare-goes-public-nasdaq/639602/,0.0,0.125,0.1479020979020979,0.46608391608391614
Could the Dow Jones Keep Outperforming the Nasdaq Composite in 2023? - The Motley Fool,https://www.fool.com/investing/2023/01/04/dow-jones-keep-outperforming-the-nasdaq-2023/,0.6,0.9,0.27557243774446416,0.457535850002086
Shares of GE's health care spinoff make trading debut on Nasdaq - Fox Business,https://www.foxbusiness.com/markets/shares-ge-health-care-spinoff-make-trading-debut-nasdaq,0.0,0.0,0.012450592885375509,0.3625164690382081
Why Micron Is Rallying Today - Nasdaq,https://www.nasdaq.com/articles/why-micron-is-rallying-today,0.0,0.0,0.15373383838383833,0.4740529581529579
"GE HealthCare completes spin-off, trading on Nasdaq - TMJ4 News",https://www.tmj4.com/news/local-news/ge-healthcare-completes-spin-off-trading-on-nasdaq,0.0,0.0,0.2081420688365133,0.5078792555181443
"Pre-Market Earnings Report for January 6, 2023 : GBX - Nasdaq",https://www.nasdaq.com/articles/pre-market-earnings-report-for-january-6-2023-:-gbx,0.0,0.0,0.08766233766233765,0.3796536796536797
What is the January Effect? And How it Can Boost Small-Caps in 2023 - Nasdaq,https://www.nasdaq.com/articles/what-is-the-january-effect-and-how-it-can-boost-small-caps-in-2023,0.0,0.0,0.09525297309950767,0.4085107137087324
The Biggest Mistake Investors Can Make in 2023 - Nasdaq,https://www.nasdaq.com/articles/the-biggest-mistake-investors-can-make-in-2023,0.0,0.0,0.13051398727535088,0.46972162517617044
3 Advancements in Biotech Investors Should Look Out for in 2023 - Nasdaq,https://www.nasdaq.com/articles/3-advancements-in-biotech-investors-should-look-out-for-in-2023,0.0,0.0,0.1113466635602051,0.42630440065335906
Einstein Said Compound Interest Is the 8th Wonder of the World. Why Graham Stephan Thinks That's Right - Nasdaq,https://www.nasdaq.com/articles/einstein-said-compound-interest-is-the-8th-wonder-of-the-world.-why-graham-stephan-thinks,0.2857142857142857,0.5357142857142857,0.28075060532687657,0.5266467995281553
Where Will Figs Stock Be in 1 Year? - Nasdaq,https://www.nasdaq.com/articles/where-will-figs-stock-be-in-1-year,0.0,0.0,0.1919208972845337,0.452091302636757
Dollar Scholar Asks: Why Do We Sign Credit Card Receipts? - Nasdaq,https://www.nasdaq.com/articles/dollar-scholar-asks:-why-do-we-sign-credit-card-receipts,0.0,0.0,0.17136507936507941,0.4241693121693121
AngloGold Ashanti Reaches Analyst Target Price - Nasdaq,https://www.nasdaq.com/articles/anglogold-ashanti-reaches-analyst-target-price-0,0.0,0.0,0.10917091836734694,0.42620323129251697
General Electric Shares Rise As It Completes Spin-off Of GE Healthcare Technologies - Nasdaq,https://www.nasdaq.com/articles/general-electric-shares-rise-as-it-completes-spin-off-of-ge-healthcare-technologies,0.05000000000000002,0.5,0.02035308441558443,0.39515016233766237
PTC Completes Acquisition of FSM Software Company ServiceMax - Nasdaq,https://www.nasdaq.com/articles/ptc-completes-acquisition-of-fsm-software-company-servicemax,0.0,0.0,0.05825442437511404,0.4169029374201787
You Can Now Live In This Swiss City Solely On Bitcoin - Nasdaq,https://www.nasdaq.com/articles/you-can-now-live-in-this-swiss-city-solely-on-bitcoin,0.13636363636363635,0.5,0.15056006493506494,0.41978625541125536
Alvarium Tiedemann SPAC Lists on Nasdaq - Wealth Management,https://www.wealthmanagement.com/ria-news/alvarium-tiedemann-spac-lists-on-nasdaq,0.0,0.0,0.5,0.5
Strong week for Taboola.com (NASDAQ:TBLA) shareholders doesn't alleviate pain of one-year loss - Yahoo Finance,https://finance.yahoo.com/news/strong-week-taboola-com-nasdaq-141507836.html,0.4333333333333333,0.7333333333333333,0.17132209670671208,0.46213201328585934
"One Autodesk, Inc. (NASDAQ:ADSK) insider reduced their stake by 100% in the previous year - Yahoo Finance",https://finance.yahoo.com/news/one-autodesk-inc-nasdaq-adsk-120059269.html,-0.16666666666666666,0.16666666666666666,0.1558854166666667,0.451939484126984
"A-Mark Precious Metals, Inc. (NASDAQ:AMRK) is a favorite amongst institutional investors who own 51% - Yahoo Finance",https://finance.yahoo.com/news/mark-precious-metals-inc-nasdaq-131710914.html,0.5333333333333333,1.0,0.20879246753246758,0.5497960173160176
"Institutions own 36% of Lantronix, Inc. (NASDAQ:LTRX) shares but individual investors control 38% of the company - Yahoo Finance",https://finance.yahoo.com/news/institutions-own-36-lantronix-inc-151137740.html,0.3,0.7,0.14373972357917308,0.49679971404742046
A Look At The Intrinsic Value Of BioNTech SE (NASDAQ:BNTX) - Yahoo Finance,https://finance.yahoo.com/news/look-intrinsic-value-biontech-se-140014543.html,0.0,0.0,0.08232371794871796,0.40693910256410243
The company managing Messi’s lifestyle brand plans to build on his World Cup success with a Nasdaq IPO - Quartz,https://qz.com/mgo-global-messi-lifestyle-brand-nasdaq-ipo-1849953107,0.3,0.0,0.09377439079219478,0.32431226208674324
GE HealthCare joins S&P 500 on first day of trading - Mass Device,https://www.massdevice.com/ge-healthcare-joins-sp-500/,0.25,0.3333333333333333,0.11629103535353535,0.4171275252525253
Want to Give Costco a Try? Use This Trick for a 'Free' Trial - Nasdaq,https://www.nasdaq.com/articles/want-to-give-costco-a-try-use-this-trick-for-a-free-trial,0.4,0.8,0.19005280984447653,0.5608225108225107
"Dow, S&P 500, Nasdaq edge higher in choppy trading to record first gains of 2023 (SP500) - Seeking Alpha",https://seekingalpha.com/news/3922100-dow-sp-500-nasdaq-edge-higher-in-choppy-trading-to-record-first-gains-of-2023,0.09999999999999999,0.3444444444444444,0.0803030303030303,0.37575757575757573
Home REIT investment adviser distances from trust ahead of Nasdaq listing - Investment Week,https://www.investmentweek.co.uk/news/4062194/home-reit-investment-adviser-distances-trust-ahead,0.0,0.0,0.07550769693626833,0.38485099199384853
Amazon UK workers to hold first strike later this month - Proactive Investors USA,https://www.proactiveinvestors.com/companies/news/1002428/amazon-uk-workers-to-hold-first-strike-later-this-month-1002428.html,0.125,0.16666666666666666,0.14977822723724363,0.41398587751046767
Best CSGO Trading Sites 2023: Top Sites With P2P Trades + Bonuses & Security - Nasdaq,https://www.nasdaq.com/press-release/best-csgo-trading-sites-2023:-top-sites-with-p2p-trades-bonuses-security-2023-01-04,0.75,0.4,0.2634796182511238,0.48388661318768844
