標題,真實新聞連結,標題_情感極性,標題_主觀性,全文_情感極性,全文_主觀性
3 Stocks Transforming the Travel and Tourism Industry - Nasdaq,https://www.nasdaq.com/articles/3-stocks-transforming-the-travel-and-tourism-industry,0.0,0.0,0.14331895485466914,0.42881658817373086
A Glimpse Into 11 Spot Bitcoin ETFs Set for Launch Today - Nasdaq,https://www.nasdaq.com/articles/a-glimpse-into-11-spot-bitcoin-etfs-set-for-launch-today,0.0,0.0,0.1442761216056671,0.49052808933490705
10 Key Signs It’s Time To Dump a Stock - Nasdaq,https://www.nasdaq.com/articles/10-key-signs-its-time-to-dump-a-stock,0.0,1.0,0.10171581151089351,0.4602667482790433
11 Spot Bitcoin ETFs Debut — What You Need to Know - Nasdaq,https://www.nasdaq.com/articles/11-spot-bitcoin-etfs-debut-what-you-need-to-know,0.0,0.0,0.1693864886021749,0.47783113582133213
"Bitcoin ETFs Are Here. Which One Should You Buy, If Any of Them? - Nasdaq",https://www.nasdaq.com/articles/bitcoin-etfs-are-here.-which-one-should-you-buy-if-any-of-them,0.0,0.0,0.20404207418096315,0.4525223490501267
Wipro Ltd. - ADR Shares Close the Day 16.9% Higher - Daily Wrap - Nasdaq,https://www.nasdaq.com/articles/wipro-ltd.-adr-shares-close-the-day-16.9-higher-daily-wrap,0.125,0.25,0.060061548428895356,0.37050210560414637
What Other Crypto Firms Could Go Public This Year - Nasdaq,https://www.nasdaq.com/articles/what-other-crypto-firms-could-go-public-this-year,-0.0625,0.22083333333333333,0.08930555555555557,0.38962698412698443
"3 Stocks To Turn $1,000 Into $10,000 in 10 Years - Nasdaq",https://www.nasdaq.com/articles/3-stocks-to-turn-$1000-into-$10000-in-10-years,0.0,0.0,0.17195597085840986,0.485317785195834
2 Hot Growth Stocks for 2024 and Beyond - Nasdaq,https://www.nasdaq.com/articles/2-hot-growth-stocks-for-2024-and-beyond,0.25,0.8500000000000001,0.0878756228048681,0.4328831781426122
3 Top Growth Stocks That Are Screaming Buys Right Now - Nasdaq,https://www.nasdaq.com/articles/3-top-growth-stocks-that-are-screaming-buys-right-now-8,0.39285714285714285,0.5178571428571428,0.2298205266955267,0.5200716528841526
Why JD.com Stock Plunged 49% Last Year - Nasdaq,https://www.nasdaq.com/articles/why-jd.com-stock-plunged-49-last-year,0.0,0.06666666666666667,0.12759934509934512,0.4348153555845861
Growth Stocks on the Brink: 7 Picks Poised for Explosive Returns - Nasdaq,https://www.nasdaq.com/articles/growth-stocks-on-the-brink:-7-picks-poised-for-explosive-returns,0.0,0.0,0.12418097968097967,0.4331410451410454
Why Eli Lilly Stock Skyrocketed 59% in 2023 - Nasdaq,https://www.nasdaq.com/articles/why-eli-lilly-stock-skyrocketed-59-in-2023,0.0,0.0,0.2887666645129332,0.5371229930931422
Thai Stock Market Due For Support On Friday - Nasdaq,https://www.nasdaq.com/articles/thai-stock-market-due-for-support-on-friday,-0.125,0.375,0.07394694564694565,0.39227888407888395
Why Coca-Cola Stock Fell 7% in 2023 - Nasdaq,https://www.nasdaq.com/articles/why-coca-cola-stock-fell-7-in-2023,0.0,0.0,0.2819019689987432,0.497106030170546
Why Alibaba Stock Fell 12% in 2023 - Nasdaq,https://www.nasdaq.com/articles/why-alibaba-stock-fell-12-in-2023,0.0,0.0,0.20559774500452466,0.44398544017188063
How Much College Costs in Every State - Nasdaq,https://www.nasdaq.com/articles/how-much-college-costs-in-every-state,0.2,0.2,-0.08374464156308953,0.3864513784572333
Is Nu Stock a Buy? - Nasdaq,https://www.nasdaq.com/articles/is-nu-stock-a-buy-0,0.0,0.0,0.24357499208108968,0.468612566295493
Uber Technologies Stock (NYSE:UBER): Ride This One with Caution - Nasdaq,https://www.nasdaq.com/articles/uber-technologies-stock-nyse:uber:-ride-this-one-with-caution,0.0,0.0,0.15571825396825398,0.4975006814173478
"Rivian Stock Prediction 2024: Here’s the Good, the Bad and Ugly About RIVN - Nasdaq",https://www.nasdaq.com/articles/rivian-stock-prediction-2024:-heres-the-good-the-bad-and-ugly-about-rivn,-0.23333333333333328,0.7555555555555555,0.09201125353722757,0.4330885384456812
Should You Buy Ethereum While It's Still Down? - Nasdaq,https://www.nasdaq.com/articles/should-you-buy-ethereum-while-its-still-down-1,-0.15555555555555559,0.2888888888888889,0.24723300901518735,0.5514712570158112
Understanding the Biometric Payment Systems Landscape - Nasdaq,https://www.nasdaq.com/articles/understanding-the-biometric-payment-systems-landscape,0.0,0.0,0.144829381836394,0.3962734315056842
Unusual Options Activity and Flow in Tesla (TSLA) - Nasdaq,https://www.nasdaq.com/articles/unusual-options-activity-and-flow-in-tesla-tsla,0.2,1.0,0.1281174472532498,0.42825952054347144
Why Intel Stock Nearly Doubled in 2023 - Nasdaq,https://www.nasdaq.com/articles/why-intel-stock-nearly-doubled-in-2023,0.1,0.4,0.1794571458633958,0.5240565279627777
Best Way to Make Money on Earnings Surprises - Nasdaq,https://www.nasdaq.com/articles/best-way-to-make-money-on-earnings-surprises-1,1.0,0.3,0.12921153894838103,0.48759752917647664
X vs. CLF: Which Steel Stock is the Better Buy? - Nasdaq,https://www.nasdaq.com/articles/x-vs.-clf:-which-steel-stock-is-the-better-buy,0.5,0.5,0.09296997328912222,0.45305448098001283
Bitcoin decouples from the Nasdaq-100 for the first time after four years - Crypto Briefing,https://cryptobriefing.com/bitcoin-decouples-nasdaq-100-first-time-after-four-years/,0.25,0.3333333333333333,0.11569577352472087,0.34004015721120934
Why the Active vs Passive Debate is Different for Fixed Income - Nasdaq,https://www.nasdaq.com/articles/why-the-active-vs-passive-debate-is-different-for-fixed-income,-0.011111111111111108,0.4666666666666666,0.08663076341647771,0.4293367346938775
5 Technology ETFs to Buy on a Rebound in PC Sales - Nasdaq,https://www.nasdaq.com/articles/5-technology-etfs-to-buy-on-a-rebound-in-pc-sales,0.0,0.0,0.1211536871693122,0.47505787037037006
What Happens to Stocks When a Natural Disaster Like Japan’s 7.6 Earthquake Happens? - Nasdaq,https://www.nasdaq.com/articles/what-happens-to-stocks-when-a-natural-disaster-like-japans-7.6-earthquake-happens,0.1,0.4,0.09157420663326171,0.412599080709317
Analog Devices (ADI) Boosts Generative AI Efforts With New Deal - Nasdaq,https://www.nasdaq.com/articles/analog-devices-adi-boosts-generative-ai-efforts-with-new-deal,0.13636363636363635,0.45454545454545453,0.10417850378787881,0.48484848484848475
Marathon Digital Stock (NASDAQ:MARA): Don’t Be a Victim of “Sell the News” - Yahoo Finance,https://finance.yahoo.com/news/marathon-digital-stock-nasdaq-mara-022314350.html,-0.037500000000000006,0.025,0.07388504088504086,0.3645090187590188
Bitcoin Is A Database - Nasdaq,https://www.nasdaq.com/articles/bitcoin-is-a-database,0.0,0.0,0.04551430612036672,0.48828909586485325
500 Million Reasons to Buy This Cathie Wood SpaceX Competitor in 2024 - Nasdaq,https://www.nasdaq.com/articles/500-million-reasons-to-buy-this-cathie-wood-spacex-competitor-in-2024,0.0,0.0,0.18720755693581786,0.5117581512690206
4 Million Student Loan Borrowers Have Monthly Payments Cut to $0 - Nasdaq,https://www.nasdaq.com/articles/4-million-student-loan-borrowers-have-monthly-payments-cut-to-$0,0.0,0.0,0.12715941730227448,0.4149360269360267
3 Cannabis Stocks Under $5 to Consider as the DEA Reviews Drug Status - Nasdaq,https://www.nasdaq.com/articles/3-cannabis-stocks-under-$5-to-consider-as-the-dea-reviews-drug-status,0.0,0.0,0.13729803616522368,0.42860767270923505
3 Growth Stocks Down More Than 80% That Are Screaming Buys in January - Nasdaq,https://www.nasdaq.com/articles/3-growth-stocks-down-more-than-80-that-are-screaming-buys-in-january-0,0.17222222222222222,0.3944444444444445,0.18338491088491096,0.4711037686037685
Institutions own 24% of PepGen Inc. (NASDAQ:PEPG) shares but private equity firms control 54% of the company - Yahoo Finance,https://finance.yahoo.com/news/institutions-own-24-pepgen-inc-101114680.html,0.3,0.6875,0.16164343786295005,0.48735965931087893
Will Shiba Inu Ride the Crypto Bull Run and Reach $1 in 2024? - Nasdaq,https://www.nasdaq.com/articles/will-shiba-inu-ride-the-crypto-bull-run-and-reach-%241-in-2024-0,0.0,0.0,0.204446819003781,0.5686068678157283
Move Over Bitcoin ETF — This Congressman Has Been Buying Ethereum - Nasdaq,https://www.nasdaq.com/articles/move-over-bitcoin-etf-this-congressman-has-been-buying-ethereum,0.0,0.0,0.15324944541362454,0.4120022183455019
9 Places Giving Away Land or Money To Move There - Nasdaq,https://www.nasdaq.com/articles/9-places-giving-away-land-or-money-to-move-there,0.0,0.0,0.13625577200577205,0.4142691197691195
"After Over A 40% Rally In 2023, Will Antitrust And iPhone Issues Hurt Apple Stock? - Nasdaq",https://www.nasdaq.com/articles/after-over-a-40-rally-in-2023-will-antitrust-and-iphone-issues-hurt-apple-stock,0.0,0.0,0.08061539306104523,0.42022217516782734
Hush-Hush Luxuries: 9 Coveted Luxury Brands of the Super-Rich - Nasdaq,https://www.nasdaq.com/articles/hush-hush-luxuries:-9-coveted-luxury-brands-of-the-super-rich,0.0,0.0,0.16795421499619975,0.48906265490234935
3 Natural Food Stocks in Focus on Impressive Industry Trends - Nasdaq,https://www.nasdaq.com/articles/3-natural-food-stocks-in-focus-on-impressive-industry-trends,0.55,0.7,0.0779930957120738,0.49494628242803423
10 Best AI Stocks for 2024 - Yahoo Finance,https://finance.yahoo.com/news/10-best-ai-stocks-2024-152636122.html,1.0,0.3,0.2213941577428419,0.41755050505050506
Surprising Data Reveals The Top 25 Tax-Friendly States To Retire - Nasdaq,https://www.nasdaq.com/articles/surprising-data-reveals-the-top-25-tax-friendly-states-to-retire,0.6,0.5,0.14597183407310022,0.34206175680859224
"Private equity firms among GoodRx Holdings, Inc.'s (NASDAQ:GDRX) largest shareholders, saw gain in holdings value after stock jumped 15% last week - Yahoo Finance",https://finance.yahoo.com/news/private-equity-firms-among-goodrx-155247694.html,0.0,0.22083333333333333,0.15072530680328847,0.4459063108145677
5 Key Signs You’re Keeping Too Much Money in Your Savings Account - Nasdaq,https://www.nasdaq.com/articles/5-key-signs-youre-keeping-too-much-money-in-your-savings-account,0.1,0.6,0.15083633611090255,0.4059518179315869
16 Best Mid-Cap Growth Stocks To Buy Now - Yahoo Finance,https://finance.yahoo.com/news/16-best-mid-cap-growth-142020937.html,1.0,0.3,0.18092202669125743,0.3984690950075565
Nifty50 now second most expensive index after Nasdaq - here’s why valuations are a worry - The Times of India,https://timesofindia.indiatimes.com/business/india-business/nifty50-now-second-most-expensive-index-after-nasdaq-heres-why-valuations-are-a-worry/articleshow/106720526.cms,0.0,0.39999999999999997,0.14775282108910423,0.4279377976988604
"Hanryu Holdings, First Korean Company to Directly List on NASDAQ, Raises Doubts about Corporate Survival Just Six Months after Listing - BusinessKorea",https://www.businesskorea.co.kr/news/articleView.html?idxno=209367,0.11666666666666665,0.24444444444444446,0.05667297979797979,0.3234122474747475
Shareholders May Not Be So Generous With Intuit Inc.'s (NASDAQ:INTU) CEO Compensation And Here's Why - Yahoo Finance,https://finance.yahoo.com/news/shareholders-may-not-generous-intuit-100946277.html,0.0,0.0,0.11325490196078433,0.43699719887955174
