標題,真實新聞連結,標題_情感極性,標題_主觀性,全文_情感極性,全文_主觀性
"Earnings Scheduled For February 11, 2025 - Nasdaq",https://www.nasdaq.com/articles/earnings-scheduled-february-11-2025,0.0,0.0,0.021819474058280035,0.5893390191897652
Why GDS Holdings Stock Rocketed 17% Higher Today - Nasdaq,https://www.nasdaq.com/articles/why-gds-holdings-stock-rocketed-17-higher-today,0.25,0.5,0.23198984923122853,0.4801607874883735
Nasdaq Stock: Is Wall Street Bullish or Bearish? - Nasdaq,https://www.nasdaq.com/articles/nasdaq-stock-wall-street-bullish-or-bearish,0.0,0.0,0.08602597402597402,0.4066461038961038
Stocks Settle Mixed Ahead of Wednesday’s CPI Report - Nasdaq,https://www.nasdaq.com/articles/stocks-settle-mixed-ahead-wednesdays-cpi-report,0.0,0.25,0.10033866539964109,0.32666085946573786
What's Going on With Amazon Stock? - Nasdaq,https://www.nasdaq.com/articles/whats-going-amazon-stock-0,0.0,0.0,0.2998253968253967,0.5517460317460317
"Stock Market News for Feb 12, 2025 - Nasdaq",https://www.nasdaq.com/articles/stock-market-news-feb-12-2025,0.0,0.0,0.07991408796964353,0.5084964726631389
"The Best Stocks to Invest $1,000 in Right Now - Nasdaq",https://www.nasdaq.com/articles/best-stocks-invest-1000-right-now-13,0.6428571428571428,0.4178571428571428,0.2412091009765429,0.4801222808199551
Why Investors Shunned Energy Stocks Today - Nasdaq,https://www.nasdaq.com/articles/why-investors-shunned-energy-stocks-today,0.0,0.0,0.22910571229536747,0.5019490088455605
Why Intel Stock Popped on Wednesday - Nasdaq,https://www.nasdaq.com/articles/why-intel-stock-popped-wednesday,0.0,0.0,0.24706392281019152,0.5269539747151685
Is the Bubble About to Burst for Palantir Technologies Stock? - Nasdaq,https://www.nasdaq.com/articles/bubble-about-burst-palantir-technologies-stock,0.0,0.0,0.22150400104945558,0.5430906034802135
Best Stock to Buy Right Now: Amazon vs Apple - Nasdaq,https://www.nasdaq.com/articles/best-stock-buy-right-now-amazon-vs-apple-4,0.6428571428571428,0.4178571428571428,0.195118944547516,0.48354707197564323
Why Intel Stock Is Soaring Today - Nasdaq,https://www.nasdaq.com/articles/why-intel-stock-soaring-today,0.0,0.0,0.19651045603426553,0.5020912068531113
Stocks Fall on US Tariffs and Higher Bond Yields - Nasdaq,https://www.nasdaq.com/articles/stocks-fall-us-tariffs-and-higher-bond-yields,0.25,0.5,0.11791304400548096,0.33288181939442446
Why Zillow Stock Crashed an Unlucky 13% Today - Nasdaq,https://www.nasdaq.com/articles/why-zillow-stock-crashed-unlucky-13-today,0.0,0.0,0.2292229329542762,0.5199419568822551
Stocks Recover Early Losses as Chip Stocks Rally - Nasdaq,https://www.nasdaq.com/articles/stocks-recover-early-losses-chip-stocks-rally,0.1,0.3,0.13878194028194024,0.34079181929181923
3 Top AI Stocks That Could Crash in 2025 - Nasdaq,https://www.nasdaq.com/articles/3-top-ai-stocks-could-crash-2025,0.5,0.5,0.1617513227513227,0.5165479969765683
Why Coca-Cola Stock Jumped Today - Nasdaq,https://www.nasdaq.com/articles/why-coca-cola-stock-jumped-today,0.0,0.0,0.17602788800705463,0.5333917548500878
Why Tesla Stock Is Surging Today - Nasdaq,https://www.nasdaq.com/articles/why-tesla-stock-surging-today-0,0.0,0.0,0.23817889035280343,0.5102212602212599
Why ChargePoint Stock Plummeted Today - Nasdaq,https://www.nasdaq.com/articles/why-chargepoint-stock-plummeted-today,0.0,0.0,0.21129950296616964,0.4853313793789982
Nasdaq Announces End-of-Month Open Short Interest Positions - GlobeNewswire,https://www.globenewswire.com/news-release/2025/02/11/3024596/6948/en/Nasdaq-Announces-End-of-Month-Open-Short-Interest-Positions-in-Nasdaq-Stocks-as-of-Settlement-Date-January-31-2025.html,0.0,0.4,0.0006508264462809928,0.27432851239669376
Nvidia Stock Is Doing Something It's Only Done Twice Before in the Past 4 Years. History Says This Will Happen Next. - Nasdaq,https://www.nasdaq.com/articles/nvidia-stock-doing-something-its-only-done-twice-past-4-years-history-says-will-happen,-0.08333333333333333,0.4166666666666667,0.18095489939829562,0.521205283186415
Stocks Tumble as Sticky US Inflation Keeps Fed on Hold - Nasdaq,https://www.nasdaq.com/articles/stocks-tumble-sticky-us-inflation-keeps-fed-hold,0.0,0.0,0.12320735254329004,0.40988839285714296
"The Best Index ETF to Invest $1,000 in Right Now - Nasdaq",https://www.nasdaq.com/articles/best-index-etf-invest-1000-right-now,0.6428571428571428,0.4178571428571428,0.23006838294448928,0.5316838765953809
Juniper Networks Stock Outlook: Is Wall Street Bullish or Bearish? - Nasdaq,https://www.nasdaq.com/articles/juniper-networks-stock-outlook-wall-street-bullish-or-bearish,0.0,0.0,0.05317055393586006,0.40258746355685116
SEALSQ Corp Rings the Nasdaq Stock Market Closing Bell - Nasdaq,https://www.nasdaq.com/videos/sealsq-corp-rings-nasdaq-stock-market-closing-bell,0.0,0.0,0.12521351463485245,0.3581697235856375
2 Monster Stocks That Could Set You Up for Life - Nasdaq,https://www.nasdaq.com/articles/2-monster-stocks-could-set-you-life,0.0,0.0,0.20622840963750058,0.514117364117364
Is Wall Street Bullish or Bearish on Adobe Stock? - Nasdaq,https://www.nasdaq.com/articles/wall-street-bullish-or-bearish-adobe-stock,0.0,0.0,0.07945365646258502,0.4551764455782311
Is Wall Street Bullish or Bearish on Lennox Stock? - Nasdaq,https://www.nasdaq.com/articles/wall-street-bullish-or-bearish-lennox-stock,0.0,0.0,0.11306630291005292,0.41969659391534386
Do Wall Street Analysts Like Costco Stock? - Nasdaq,https://www.nasdaq.com/articles/do-wall-street-analysts-costco-stock,0.0,0.0,0.10107705383129112,0.4371465869347224
Taiwan Stock Market May See Continued Consolidation - Nasdaq,https://www.nasdaq.com/articles/taiwan-stock-market-may-see-continued-consolidation-0,0.0,0.0,0.042613483503314,0.36122483919094084
Should You Forget AMD and Buy 2 Tech Stocks Instead? - Nasdaq,https://www.nasdaq.com/articles/should-you-forget-amd-and-buy-2-tech-stocks-instead,0.0,0.0,0.24427841235070158,0.4828779654080857
Why Heineken Stock Is Skyrocketing Today - Nasdaq,https://www.nasdaq.com/articles/why-heineken-stock-skyrocketing-today,0.0,0.0,0.2707397424378556,0.5478137166816409
Prediction: Nvidia Stock Is Going to Surge After Feb. 26 - Nasdaq,https://www.nasdaq.com/articles/prediction-nvidia-stock-going-surge-after-feb-26,0.0,0.0,0.18059876543209885,0.4620098605098604
What Are Wall Street Analysts' Target Price for Arista Networks Stock? - Nasdaq,https://www.nasdaq.com/articles/what-are-wall-street-analysts-target-price-arista-networks-stock,0.0,0.0,0.1208547619047619,0.4092642857142855
Why Leidos Stock Is Down Today - Nasdaq,https://www.nasdaq.com/articles/why-leidos-stock-down-today,-0.15555555555555559,0.2888888888888889,0.23269841269841265,0.5209080298786178
What's Behind The Recent Surge In Confluent Stock? - Nasdaq,https://www.nasdaq.com/articles/whats-behind-recent-surge-confluent-stock,-0.2,0.475,0.08152855081426509,0.40542774685631816
Mark Zuckerberg Just Made 3 Startling AI Predictions. Should You Buy Meta Stock Before They Come True? - Nasdaq,https://www.nasdaq.com/articles/mark-zuckerberg-just-made-3-startling-ai-predictions-should-you-buy-meta-stock-they-come,-0.07500000000000001,0.575,0.2072037870266218,0.5301743532058494
Globalstar Rings the Nasdaq Stock Market Opening Bell - Nasdaq,https://www.nasdaq.com/videos/globalstar-rings-nasdaq-stock-market-opening-bell,0.0,0.0,0.12521351463485245,0.3581697235856375
Archer Aviation Stock Sank Today -- Is This a Buying Opportunity? - Nasdaq,https://www.nasdaq.com/articles/archer-aviation-stock-sank-today-buying-opportunity,0.0,0.0,0.23329443993506493,0.5017481216699964
Fox Corporation Stock: Analyst Estimates & Ratings - Nasdaq,https://www.nasdaq.com/articles/fox-corporation-stock-analyst-estimates-ratings,0.0,0.0,0.12247963900506273,0.43691118203830054
Stocks Settle Higher and Brush Aside Tariff Concerns - Nasdaq,https://www.nasdaq.com/articles/stocks-settle-higher-and-brush-aside-tariff-concerns,0.25,0.5,0.10521376896376906,0.3271067821067825
Why Fluence Energy Stock Is Tumbling Today - Nasdaq,https://www.nasdaq.com/articles/why-fluence-energy-stock-tumbling-today,0.0,0.0,0.20139225589225587,0.5189971139971139
This Tech Giant Could Skyrocket on Its $100 Billion AI Bet in 2025 - Nasdaq,https://www.nasdaq.com/articles/tech-giant-could-skyrocket-its-100-billion-ai-bet-2025,0.0,1.0,0.16829355058521728,0.4948585750669082
What Are Wall Street Analysts' Target Price for NetApp Stock? - Nasdaq,https://www.nasdaq.com/articles/what-are-wall-street-analysts-target-price-netapp-stock,0.0,0.0,0.05646217817270449,0.37503512569302033
Super Micro Sees Strong Growth Next Year - Buy SMCI Stock Now? - Nasdaq,https://www.nasdaq.com/articles/super-micro-sees-strong-growth-next-year-buy-smci-stock-now,0.25555555555555554,0.4666666666666666,0.1329278151567309,0.5120064674281538
Should You Buy Ford While It's Below $10? - Nasdaq,https://www.nasdaq.com/articles/should-you-buy-ford-while-its-below-10-0,0.0,0.0,0.1975881834215168,0.47965688632355297
2 No-Brainer Artificial Intelligence Stocks to Buy Right Now - Nasdaq,https://www.nasdaq.com/articles/2-no-brainer-artificial-intelligence-stocks-buy-right-now,-0.15714285714285714,0.7678571428571428,0.2691536127103139,0.5514817942652992
Tech Shares May Weigh On Taiwan Stock Market - Nasdaq,https://www.nasdaq.com/articles/tech-shares-may-weigh-taiwan-stock-market-1,0.0,0.0,0.06485252036099493,0.3541492405899184
Consolidated Edison Stock: Is Wall Street Bullish or Bearish? - Nasdaq,https://www.nasdaq.com/articles/consolidated-edison-stock-wall-street-bullish-or-bearish,0.0,0.0,0.07490800865800865,0.4139274891774891
"Stock Market News for Feb 11, 2025 - Nasdaq",https://www.nasdaq.com/articles/stock-market-news-feb-11-2025,0.0,0.0,0.05284234686408598,0.4610998703390007
Are Wall Street Analysts Bullish on Analog Devices Stock? - Nasdaq,https://www.nasdaq.com/articles/are-wall-street-analysts-bullish-analog-devices-stock,0.0,0.0,0.06604365079365078,0.4777420634920634
XTI Aerospace Regains Compliance with Nasdaq Listing Requirements - PR Newswire,https://www.prnewswire.com/news-releases/xti-aerospace-regains-compliance-with-nasdaq-listing-requirements-302374443.html,0.0,0.0,0.011121553884711758,0.4501253132832081
Visa (V) is a Great Momentum Stock: Should You Buy? - Nasdaq,https://www.nasdaq.com/articles/visa-v-great-momentum-stock-should-you-buy,0.8,0.75,0.07391431653567573,0.4686654338110645
Why Is Upstart Stock Skyrocketing? - Nasdaq,https://www.nasdaq.com/articles/why-upstart-stock-skyrocketing,0.0,0.0,0.11050630528891398,0.39220873329568967
Is Archer Aviation Stock Worth the Hype? - Nasdaq,https://www.nasdaq.com/articles/archer-aviation-stock-worth-hype,0.3,0.1,0.2988014253320375,0.5696388079041138
KKR & Co. Stock Outlook: Is Wall Street Bullish or Bearish? - Nasdaq,https://www.nasdaq.com/articles/kkr-co-stock-outlook-wall-street-bullish-or-bearish,0.0,0.0,0.03310425685425686,0.38283297258297244
Why CRISPR Therapeutics Stock Was a Massive Winner on Wednesday - Nasdaq,https://www.nasdaq.com/articles/why-crispr-therapeutics-stock-was-massive-winner-wednesday,0.0,1.0,0.23694261294261293,0.5364029304029302
Should You Buy Bank of America While It's Below $50? - Nasdaq,https://www.nasdaq.com/articles/should-you-buy-bank-america-while-its-below-50,0.0,0.0,0.1669372605363985,0.5105572660098522
Is Wall Street Bullish or Bearish on Dow Stock? - Nasdaq,https://www.nasdaq.com/articles/wall-street-bullish-or-bearish-dow-stock,0.0,0.0,0.06964667277167276,0.3836729242979242
LKQ Stock: Analyst Estimates & Ratings - Nasdaq,https://www.nasdaq.com/articles/lkq-stock-analyst-estimates-ratings,0.0,0.0,0.052028668610301254,0.4341472303206996
Why Axsome Therapeutics Stock Is Soaring Today - Nasdaq,https://www.nasdaq.com/articles/why-axsome-therapeutics-stock-soaring-today,0.0,0.0,0.3023891203136486,0.5370799012308444
Is Endava (DAVA) Stock Worth the Hype? - Nasdaq,https://www.nasdaq.com/articles/endava-dava-stock-worth-hype,0.3,0.1,0.2906381600259151,0.5589245221898282
1 Small-Cap Stock Down 34% to Buy on the Dip - Nasdaq,https://www.nasdaq.com/articles/1-small-cap-stock-down-34-buy-dip,-0.15555555555555559,0.2888888888888889,0.2235988200589972,0.5062096310768877
Do Wall Street Analysts Like Goldman Sachs Stock? - Nasdaq,https://www.nasdaq.com/articles/do-wall-street-analysts-goldman-sachs-stock,0.0,0.0,0.1014716492657669,0.41433982683982673
NXP Semiconductors Stock Outlook: Is Wall Street Bullish or Bearish? - Nasdaq,https://www.nasdaq.com/articles/nxp-semiconductors-stock-outlook-wall-street-bullish-or-bearish,0.0,0.0,0.0711827122153209,0.4093814699792959
Is IonQ Stock a Buy Now? - Nasdaq,https://www.nasdaq.com/articles/ionq-stock-buy-now-2,0.0,0.0,0.19219936313686314,0.5364532342657342
Here's How to Play Quantum Stock Before Q3 Earnings Release - Nasdaq,https://www.nasdaq.com/articles/heres-how-play-quantum-stock-q3-earnings-release,0.0,0.0,0.11989702929920328,0.5043642167011728
Are Wall Street Analysts Predicting Corteva Stock Will Climb or Sink? - Nasdaq,https://www.nasdaq.com/articles/are-wall-street-analysts-predicting-corteva-stock-will-climb-or-sink,0.0,0.0,0.07577947845804989,0.37833049886621317
Here's Why I Just Bought the Dip on Alphabet Stock - Nasdaq,https://www.nasdaq.com/articles/heres-why-i-just-bought-dip-alphabet-stock,0.0,0.0,0.25244334097275284,0.5374876104287867
The Campbell's Company Stock Outlook: Is Wall Street Bullish or Bearish? - Nasdaq,https://www.nasdaq.com/articles/campbells-company-stock-outlook-wall-street-bullish-or-bearish,0.0,0.0,0.06451859152752008,0.42407525510204064
U.S. Stocks Finish Choppy Trading Day Narrowly Mixed - Nasdaq,https://www.nasdaq.com/articles/us-stocks-finish-choppy-trading-day-narrowly-mixed-0,-0.1,0.225,0.07242220340046428,0.367678336156597
Why Rumble Stock Is Falling Today - Nasdaq,https://www.nasdaq.com/articles/why-rumble-stock-falling-today-0,0.0,0.0,0.22308283046919408,0.5256000523045975
"Insider Sale: See Remarks of $LUNR Sells 4,528 Shares - Nasdaq",https://www.nasdaq.com/articles/insider-sale-see-remarks-lunr-sells-4528-shares,0.0,0.0,0.15167410714285715,0.46361607142857153
